,C_CODI_AGP,AGRUPACION,IMAGENAGRUPACION,PORC_AVANCE_ACTA,ACTAS_COMPUTADA,TOTAL_MESAS,TOTAL_VOTOS,NLISTA,POR_VALIDOS,POR_EMITIDOS,cod_departamento,fecha,hora,avance,ubigeo
0,00000053,MOVIMIENTO POLITICO CAMBIEMOS X HCO,,100.000,783,783,"13,835",00000053.jpg,9.460,7.997,09,10/10/2022,10:52 h, 100.0000,090100
1,00000054,MOVIMIENTO INDEPENDIENTE REGIONAL MI BUEN VECINO,,100.000,783,783,"40,888",00000054.jpg,27.957,23.634,09,10/10/2022,10:52 h, 100.0000,090100
2,00000057,MOVIMIENTO INDEPENDIENTE REGIONAL HUANUCO PRIMERO,,100.000,783,783,"37,891",00000057.jpg,25.908,21.902,09,10/10/2022,10:52 h, 100.0000,090100
3,00000056,AVANZADA REGIONAL INDEPENDIENTE UNIDOS POR HUANUCO,,100.000,783,783,"9,048",00000056.jpg,6.186,5.230,09,10/10/2022,10:52 h, 100.0000,090100
4,00000006,FUERZA POPULAR,,100.000,783,783,"1,930",00000006.jpg,1.320,1.116,09,10/10/2022,10:52 h, 100.0000,090100
5,00000003,RENOVACION POPULAR,,100.000,783,783,"1,985",00000003.jpg,1.357,1.147,09,10/10/2022,10:52 h, 100.0000,090100
6,00000007,AVANZA PAIS - PARTIDO DE INTEGRACION SOCIAL,,100.000,783,783,"28,679",00000007.jpg,19.609,16.577,09,10/10/2022,10:52 h, 100.0000,090100
7,00000008,PARTIDO POLITICO NACIONAL PERU LIBRE,,100.000,783,783,"3,978",00000008.jpg,2.720,2.299,09,10/10/2022,10:52 h, 100.0000,090100
8,00000002,PARTIDO DEMOCRATICO SOMOS PERU,,100.000,783,783,"8,020",00000002.jpg,5.484,4.636,09,10/10/2022,10:52 h, 100.0000,090100
