,idHojaVida,feNacimiento,txSexo,designado,idProcesoElectoral,numeroDocumento,nombreCompleto,estado,idOrganizacionPolitica,organizacionPolitica,numeroCandidato,rutaArchivo,postulaDepartamento,postulaProvincia,postulaDistrito,cargo,nativo,txCodExpedienteExt
0,142672.0,1970-04-02T00:00:00,M,,0.0,04080681,ANGEL GUILLERMO LOPEZ ARCOS,INSCRITO,2753.0,MOVIMIENTO REGIONAL JUVENTUD PASQUEÑA,0.0,/Assets/Fotos-HojaVida/142672.jpg,PASCO,PASCO,YANACANCHA,['ALCALDE DISTRITAL'],NO,ERM.2022006330
1,142673.0,1976-09-23T00:00:00,M,,0.0,40090648,JULIO CLAUDIO NINACO COAQUIRA,INSCRITO,2753.0,MOVIMIENTO REGIONAL JUVENTUD PASQUEÑA,1.0,/Assets/Fotos-HojaVida/142673.jpg,PASCO,PASCO,YANACANCHA,['REGIDOR DISTRITAL'],NO,ERM.2022006330
2,142674.0,1968-09-01T00:00:00,F,,0.0,04079512,MARUJA QUIRICA PONCE DE POLO,INSCRITO,2753.0,MOVIMIENTO REGIONAL JUVENTUD PASQUEÑA,2.0,/Assets/Fotos-HojaVida/142674.jpg,PASCO,PASCO,YANACANCHA,['REGIDOR DISTRITAL'],NO,ERM.2022006330
3,142675.0,1983-08-02T00:00:00,M,,0.0,41875007,LUIS ALBERT BASILIO MEZA,INSCRITO,2753.0,MOVIMIENTO REGIONAL JUVENTUD PASQUEÑA,3.0,/Assets/Fotos-HojaVida/142675.jpg,PASCO,PASCO,YANACANCHA,['REGIDOR DISTRITAL'],NO,ERM.2022006330
4,142676.0,1978-04-07T00:00:00,F,,0.0,04086420,ANA LUZ RAMIREZ MIRAVAL DE HUAMAN,INSCRITO,2753.0,MOVIMIENTO REGIONAL JUVENTUD PASQUEÑA,4.0,/Assets/Fotos-HojaVida/142676.jpg,PASCO,PASCO,YANACANCHA,['REGIDOR DISTRITAL'],NO,ERM.2022006330
5,142677.0,2002-07-09T00:00:00,M,,0.0,71239328,GEAN DIEGO SIMON AÑASCO,INSCRITO,2753.0,MOVIMIENTO REGIONAL JUVENTUD PASQUEÑA,5.0,/Assets/Fotos-HojaVida/142677.jpg,PASCO,PASCO,YANACANCHA,['REGIDOR DISTRITAL'],NO,ERM.2022006330
6,142678.0,1997-04-11T00:00:00,F,,0.0,62687198,VIVIANA LUZ VALERIO FERNANDEZ,INSCRITO,2753.0,MOVIMIENTO REGIONAL JUVENTUD PASQUEÑA,6.0,/Assets/Fotos-HojaVida/142678.jpg,PASCO,PASCO,YANACANCHA,['REGIDOR DISTRITAL'],NO,ERM.2022006330
7,142679.0,1976-12-02T00:00:00,M,,0.0,04083327,JOSE LORENZO VEGA LLANCACHAGUA,INSCRITO,2753.0,MOVIMIENTO REGIONAL JUVENTUD PASQUEÑA,7.0,/Assets/Fotos-HojaVida/142679.jpg,PASCO,PASCO,YANACANCHA,['REGIDOR DISTRITAL'],NO,ERM.2022006330
