,idHojaVida,feNacimiento,txSexo,designado,idProcesoElectoral,numeroDocumento,nombreCompleto,estado,idOrganizacionPolitica,organizacionPolitica,numeroCandidato,rutaArchivo,postulaDepartamento,postulaProvincia,postulaDistrito,cargo,nativo,txCodExpedienteExt
0,192180.0,1970-03-01T00:00:00,F,,0.0,16771602,FLOR JHOVANY REAÑO SEGURA,INSCRITO,1257.0,ALIANZA PARA EL PROGRESO,0.0,/Assets/Fotos-HojaVida/192180.jpg,LAMBAYEQUE,CHICLAYO,SAÑA,['ALCALDE DISTRITAL'],NO,ERM.2022010734
1,192181.0,1967-03-06T00:00:00,F,,0.0,16639023,MERCEDES CONSTANSA URBINA OLIVA,INSCRITO,1257.0,ALIANZA PARA EL PROGRESO,1.0,/Assets/Fotos-HojaVida/192181.jpg,LAMBAYEQUE,CHICLAYO,SAÑA,['REGIDOR DISTRITAL'],NO,ERM.2022010734
2,192182.0,1997-03-22T00:00:00,M,,0.0,72753502,ADRIAN ALFREDO TORRES HERRERA,INSCRITO,1257.0,ALIANZA PARA EL PROGRESO,2.0,/Assets/Fotos-HojaVida/192182.jpg,LAMBAYEQUE,CHICLAYO,SAÑA,['REGIDOR DISTRITAL'],NO,ERM.2022010734
3,192183.0,1989-06-19T00:00:00,F,,0.0,45861625,MARIA DEL PILAR ALVA CHUQUIMANGO,INSCRITO,1257.0,ALIANZA PARA EL PROGRESO,3.0,/Assets/Fotos-HojaVida/192183.jpg,LAMBAYEQUE,CHICLAYO,SAÑA,['REGIDOR DISTRITAL'],NO,ERM.2022010734
4,192184.0,1988-07-19T00:00:00,M,,0.0,45314788,ELVIS CHRISTIAN VASQUEZ GAONA,INSCRITO,1257.0,ALIANZA PARA EL PROGRESO,4.0,/Assets/Fotos-HojaVida/192184.jpg,LAMBAYEQUE,CHICLAYO,SAÑA,['REGIDOR DISTRITAL'],NO,ERM.2022010734
5,192185.0,1981-12-20T00:00:00,F,,0.0,41339498,SARA PATRICIA CACHAY RAMOS,INSCRITO,1257.0,ALIANZA PARA EL PROGRESO,5.0,/Assets/Fotos-HojaVida/192185.jpg,LAMBAYEQUE,CHICLAYO,SAÑA,['REGIDOR DISTRITAL'],NO,ERM.2022010734
