,idHojaVida,feNacimiento,txSexo,designado,idProcesoElectoral,numeroDocumento,nombreCompleto,estado,idOrganizacionPolitica,organizacionPolitica,numeroCandidato,rutaArchivo,postulaDepartamento,postulaProvincia,postulaDistrito,cargo,nativo,txCodExpedienteExt
0,212766.0,1967-04-21T00:00:00,M,,0.0,24882938,EDGAR MERMA SUPHO,INSCRITO,142.0,"AREQUIPA, TRADICION Y FUTURO",0.0,/Assets/Fotos-HojaVida/212766.jpg,AREQUIPA,CAYLLOMA,CABANACONDE,['ALCALDE DISTRITAL'],NO,ERM.2022015675
1,212767.0,1951-02-18T00:00:00,F,,0.0,06478795,GLADYS MAXIMIANA VILLAVICENCIO DE FERIA,INSCRITO,142.0,"AREQUIPA, TRADICION Y FUTURO",1.0,/Assets/Fotos-HojaVida/212767.jpg,AREQUIPA,CAYLLOMA,CABANACONDE,['REGIDOR DISTRITAL'],NO,ERM.2022015675
2,212768.0,1964-07-09T00:00:00,M,,0.0,29237135,SERGIO ZENON HUAMANI CHICAÑA,INSCRITO,142.0,"AREQUIPA, TRADICION Y FUTURO",2.0,/Assets/Fotos-HojaVida/212768.jpg,AREQUIPA,CAYLLOMA,CABANACONDE,['REGIDOR DISTRITAL'],NO,ERM.2022015675
3,212769.0,1996-08-09T00:00:00,F,,0.0,78006279,CAROLAY RUTH CONDORI QUISPE,INSCRITO,142.0,"AREQUIPA, TRADICION Y FUTURO",3.0,/Assets/Fotos-HojaVida/212769.jpg,AREQUIPA,CAYLLOMA,CABANACONDE,['REGIDOR DISTRITAL'],NO,ERM.2022015675
4,212770.0,1954-03-08T00:00:00,M,,0.0,30644444,JUAN DE DIOS FELIX CASTRO TINTA,INSCRITO,142.0,"AREQUIPA, TRADICION Y FUTURO",4.0,/Assets/Fotos-HojaVida/212770.jpg,AREQUIPA,CAYLLOMA,CABANACONDE,['REGIDOR DISTRITAL'],NO,ERM.2022015675
5,212771.0,1982-09-12T00:00:00,F,,0.0,41593325,LEIDY VALERIANA JUNCO PUMA,INSCRITO,142.0,"AREQUIPA, TRADICION Y FUTURO",5.0,/Assets/Fotos-HojaVida/212771.jpg,AREQUIPA,CAYLLOMA,CABANACONDE,['REGIDOR DISTRITAL'],NO,ERM.2022015675
