,idHojaVida,feNacimiento,txSexo,designado,idProcesoElectoral,numeroDocumento,nombreCompleto,estado,idOrganizacionPolitica,organizacionPolitica,numeroCandidato,rutaArchivo,postulaDepartamento,postulaProvincia,postulaDistrito,cargo,nativo,txCodExpedienteExt
0,197076.0,1966-03-27T00:00:00,M,,0.0,08285136,DAMACENO MARCOS ESPINOZA ROSARIO,IMPROCEDENTE,1264.0,JUNTOS POR EL PERU,0.0,/Assets/Fotos-HojaVida/197076.jpg,ANCASH,BOLOGNESI,ANTONIO RAIMONDI,['ALCALDE DISTRITAL'],NO,ERM.2022017284
1,197077.0,1957-05-29T00:00:00,M,,0.0,31925211,ALEJANDRO MANONGO SOLANO VIRHUEZ,IMPROCEDENTE,1264.0,JUNTOS POR EL PERU,1.0,/Assets/Fotos-HojaVida/197077.jpg,ANCASH,BOLOGNESI,ANTONIO RAIMONDI,['REGIDOR DISTRITAL'],NO,ERM.2022017284
2,197078.0,1988-05-20T00:00:00,F,,0.0,45063144,BEATRIZ MAGALI DIONICIO GAMARRA,IMPROCEDENTE,1264.0,JUNTOS POR EL PERU,2.0,/Assets/Fotos-HojaVida/197078.jpg,ANCASH,BOLOGNESI,ANTONIO RAIMONDI,['REGIDOR DISTRITAL'],NO,ERM.2022017284
3,197079.0,1997-02-25T00:00:00,M,,0.0,76459638,JEFFERZON JUAN DE DIOS CORPUS,IMPROCEDENTE,1264.0,JUNTOS POR EL PERU,3.0,/Assets/Fotos-HojaVida/197079.jpg,ANCASH,BOLOGNESI,ANTONIO RAIMONDI,['REGIDOR DISTRITAL'],NO,ERM.2022017284
4,197080.0,1989-08-05T00:00:00,F,,0.0,46065536,INES LUCIA GAMARRA RAMOS,IMPROCEDENTE,1264.0,JUNTOS POR EL PERU,4.0,/Assets/Fotos-HojaVida/197080.jpg,ANCASH,BOLOGNESI,ANTONIO RAIMONDI,['REGIDOR DISTRITAL'],NO,ERM.2022017284
5,197081.0,1999-10-15T00:00:00,M,,0.0,62319130,CARLOS ANTONIO CASTILLO BAUTISTA,IMPROCEDENTE,1264.0,JUNTOS POR EL PERU,5.0,/Assets/Fotos-HojaVida/197081.jpg,ANCASH,BOLOGNESI,ANTONIO RAIMONDI,['REGIDOR DISTRITAL'],NO,ERM.2022017284
