,idHojaVida,feNacimiento,txSexo,designado,idProcesoElectoral,numeroDocumento,nombreCompleto,estado,idOrganizacionPolitica,organizacionPolitica,numeroCandidato,rutaArchivo,postulaDepartamento,postulaProvincia,postulaDistrito,cargo,nativo,txCodExpedienteExt
0,184718.0,1981-08-14T00:00:00,M,,0.0,41525224,MATILDO CARLOS LAZARTE PAULINO,IMPROCEDENTE,360.0,MOVIMIENTO ACCION NACIONALISTA PERUANO,0.0,/Assets/Fotos-HojaVida/184718.jpg,ANCASH,HUAYLAS,YURACMARCA,['ALCALDE DISTRITAL'],NO,ERM.2022009666
1,184719.0,1986-08-18T00:00:00,M,,0.0,44839789,HUGO FERNANDEZ VILLANUEVA LOPEZ,IMPROCEDENTE,360.0,MOVIMIENTO ACCION NACIONALISTA PERUANO,1.0,/Assets/Fotos-HojaVida/184719.jpg,ANCASH,HUAYLAS,YURACMARCA,['REGIDOR DISTRITAL'],NO,ERM.2022009666
2,184720.0,1999-04-03T00:00:00,F,,0.0,78015145,JACKELIN CINDY SARMIENTO LIÑAN,IMPROCEDENTE,360.0,MOVIMIENTO ACCION NACIONALISTA PERUANO,2.0,/Assets/Fotos-HojaVida/184720.jpg,ANCASH,HUAYLAS,YURACMARCA,['REGIDOR DISTRITAL'],NO,ERM.2022009666
3,184721.0,1998-04-17T00:00:00,M,,0.0,71193776,NILTON JULIO ACUÑA DE LA CRUZ,IMPROCEDENTE,360.0,MOVIMIENTO ACCION NACIONALISTA PERUANO,3.0,/Assets/Fotos-HojaVida/184721.jpg,ANCASH,HUAYLAS,YURACMARCA,['REGIDOR DISTRITAL'],NO,ERM.2022009666
4,184722.0,1984-05-04T00:00:00,F,,0.0,42420649,JAYNI CHER PAULINO MORENO,IMPROCEDENTE,360.0,MOVIMIENTO ACCION NACIONALISTA PERUANO,4.0,/Assets/Fotos-HojaVida/184722.jpg,ANCASH,HUAYLAS,YURACMARCA,['REGIDOR DISTRITAL'],NO,ERM.2022009666
5,184723.0,1997-12-17T00:00:00,M,,0.0,77062494,JOEL DEMETRIO VALVERDE LOPEZ,IMPROCEDENTE,360.0,MOVIMIENTO ACCION NACIONALISTA PERUANO,5.0,/Assets/Fotos-HojaVida/184723.jpg,ANCASH,HUAYLAS,YURACMARCA,['REGIDOR DISTRITAL'],NO,ERM.2022009666
