,idHojaVida,feNacimiento,txSexo,designado,idProcesoElectoral,numeroDocumento,nombreCompleto,estado,idOrganizacionPolitica,organizacionPolitica,numeroCandidato,rutaArchivo,postulaDepartamento,postulaProvincia,postulaDistrito,cargo,nativo,txCodExpedienteExt
0,204526.0,1971-07-20T00:00:00,M,,0.0,31675471,ELIAS JERONIMO RODRIGUEZ DE PAZ,INSCRITO,1257.0,ALIANZA PARA EL PROGRESO,0.0,/Assets/Fotos-HojaVida/204526.jpg,ANCASH,HUARAZ,OLLEROS,['ALCALDE DISTRITAL'],NO,ERM.2022010626
1,204527.0,1958-12-04T00:00:00,M,,0.0,31621660,PEDRO BERNARDO LOLI NORABUENA,INSCRITO,1257.0,ALIANZA PARA EL PROGRESO,1.0,/Assets/Fotos-HojaVida/204527.jpg,ANCASH,HUARAZ,OLLEROS,['REGIDOR DISTRITAL'],NO,ERM.2022010626
2,204528.0,1991-10-30T00:00:00,F,,0.0,47580196,JESSICA EVELYN TINOCO ALVARADO,IMPROCEDENTE,1257.0,ALIANZA PARA EL PROGRESO,2.0,/Assets/Fotos-HojaVida/204528.jpg,ANCASH,HUARAZ,OLLEROS,['REGIDOR DISTRITAL'],NO,ERM.2022010626
3,204529.0,1979-02-24T00:00:00,M,,0.0,40109124,IMER OTTO POMA ROBLES,INSCRITO,1257.0,ALIANZA PARA EL PROGRESO,3.0,/Assets/Fotos-HojaVida/204529.jpg,ANCASH,HUARAZ,OLLEROS,['REGIDOR DISTRITAL'],NO,ERM.2022010626
4,204530.0,1986-05-26T00:00:00,F,,0.0,43568965,YENY GENOVEVA RURUSH VALDIVIANO,INSCRITO,1257.0,ALIANZA PARA EL PROGRESO,4.0,/Assets/Fotos-HojaVida/204530.jpg,ANCASH,HUARAZ,OLLEROS,['REGIDOR DISTRITAL'],NO,ERM.2022010626
5,204531.0,1996-07-23T00:00:00,M,,0.0,75224715,MICHAEL HENRY ASIS ROMERO,INSCRITO,1257.0,ALIANZA PARA EL PROGRESO,5.0,/Assets/Fotos-HojaVida/204531.jpg,ANCASH,HUARAZ,OLLEROS,['REGIDOR DISTRITAL'],NO,ERM.2022010626
