,idHojaVida,feNacimiento,txSexo,designado,idProcesoElectoral,numeroDocumento,nombreCompleto,estado,idOrganizacionPolitica,organizacionPolitica,numeroCandidato,rutaArchivo,postulaDepartamento,postulaProvincia,postulaDistrito,cargo,nativo,txCodExpedienteExt
0,238704.0,1985-03-20T00:00:00,F,,0.0,43047155,ISELA IVONNE QUILCATE ELIAS,INSCRITO,14.0,PARTIDO DEMOCRATICO SOMOS PERU,0.0,/Assets/Fotos-HojaVida/238704.jpg,LA LIBERTAD,PACASMAYO,PACASMAYO,['ALCALDE DISTRITAL'],NO,ERM.2022018055
1,238705.0,1961-07-22T00:00:00,M,,0.0,19216794,EDWARD JACINTO BERNAL VERTIZ,INSCRITO,14.0,PARTIDO DEMOCRATICO SOMOS PERU,1.0,/Assets/Fotos-HojaVida/238705.jpg,LA LIBERTAD,PACASMAYO,PACASMAYO,['REGIDOR DISTRITAL'],NO,ERM.2022018055
2,238706.0,1984-03-22T00:00:00,F,,0.0,42407378,HEYDI JACKELINE MONTERO SEMINARIO DE TORRES,IMPROCEDENTE,14.0,PARTIDO DEMOCRATICO SOMOS PERU,2.0,/Assets/Fotos-HojaVida/238706.jpg,LA LIBERTAD,PACASMAYO,PACASMAYO,['REGIDOR DISTRITAL'],NO,ERM.2022018055
3,238707.0,1965-03-29T00:00:00,M,,0.0,19231798,SEGUNDO MIGUEL TAPIA PLASENCIA,INSCRITO,14.0,PARTIDO DEMOCRATICO SOMOS PERU,3.0,/Assets/Fotos-HojaVida/238707.jpg,LA LIBERTAD,PACASMAYO,PACASMAYO,['REGIDOR DISTRITAL'],NO,ERM.2022018055
4,238708.0,1967-06-18T00:00:00,F,,0.0,19236794,IVONNE GUISELLA DIAZ HUIMAN,INSCRITO,14.0,PARTIDO DEMOCRATICO SOMOS PERU,4.0,/Assets/Fotos-HojaVida/238708.jpg,LA LIBERTAD,PACASMAYO,PACASMAYO,['REGIDOR DISTRITAL'],NO,ERM.2022018055
5,238709.0,1997-11-25T00:00:00,M,,0.0,75079015,JOSE ANDRES CORONADO PLASENCIA,INSCRITO,14.0,PARTIDO DEMOCRATICO SOMOS PERU,5.0,/Assets/Fotos-HojaVida/238709.jpg,LA LIBERTAD,PACASMAYO,PACASMAYO,['REGIDOR DISTRITAL'],NO,ERM.2022018055
6,238710.0,2000-03-06T00:00:00,F,,0.0,76918483,BRENDA NARDY ABANTO FLORES,INSCRITO,14.0,PARTIDO DEMOCRATICO SOMOS PERU,6.0,/Assets/Fotos-HojaVida/238710.jpg,LA LIBERTAD,PACASMAYO,PACASMAYO,['REGIDOR DISTRITAL'],NO,ERM.2022018055
7,238711.0,1958-01-09T00:00:00,M,,0.0,25650079,LIONEL ISIDRO GUANILO CESPEDES,INSCRITO,14.0,PARTIDO DEMOCRATICO SOMOS PERU,7.0,/Assets/Fotos-HojaVida/238711.jpg,LA LIBERTAD,PACASMAYO,PACASMAYO,['REGIDOR DISTRITAL'],NO,ERM.2022018055
