,idHojaVida,feNacimiento,txSexo,designado,idProcesoElectoral,numeroDocumento,nombreCompleto,estado,idOrganizacionPolitica,organizacionPolitica,numeroCandidato,rutaArchivo,postulaDepartamento,postulaProvincia,postulaDistrito,cargo,nativo,txCodExpedienteExt
0,236928.0,1969-06-23T00:00:00,F,,0.0,20683821,MARICELA AYDA MISARI CAMARENA,RENUNCIA,122.0,CAMINEMOS JUNTOS POR JUNIN,0.0,/Assets/Fotos-HojaVida/236928.jpg,JUNIN,JAUJA,MARCO,['ALCALDE DISTRITAL'],NO,ERM.2022016189
1,236929.0,1957-12-11T00:00:00,F,,0.0,20682630,VICTORIA ELIZABETH ARTICA GERONIMO,INSCRITO,122.0,CAMINEMOS JUNTOS POR JUNIN,1.0,/Assets/Fotos-HojaVida/236929.jpg,JUNIN,JAUJA,MARCO,['REGIDOR DISTRITAL'],NO,ERM.2022016189
2,236930.0,1945-07-09T00:00:00,M,,0.0,20682442,ABELARDO MOISES BARZOLA TICSE,INSCRITO,122.0,CAMINEMOS JUNTOS POR JUNIN,2.0,/Assets/Fotos-HojaVida/236930.jpg,JUNIN,JAUJA,MARCO,['REGIDOR DISTRITAL'],NO,ERM.2022016189
3,236931.0,1996-02-19T00:00:00,F,,0.0,70085663,KARIN MARIA DE LA CRUZ ARIAS,IMPROCEDENTE,122.0,CAMINEMOS JUNTOS POR JUNIN,3.0,/Assets/Fotos-HojaVida/236931.jpg,JUNIN,JAUJA,MARCO,['REGIDOR DISTRITAL'],NO,ERM.2022016189
4,236932.0,1952-05-28T00:00:00,M,,0.0,04322816,FELIX GONZALO FIERRO LINO,INSCRITO,122.0,CAMINEMOS JUNTOS POR JUNIN,4.0,/Assets/Fotos-HojaVida/236932.jpg,JUNIN,JAUJA,MARCO,['REGIDOR DISTRITAL'],NO,ERM.2022016189
5,236933.0,1984-08-27T00:00:00,F,,0.0,42704017,YULI YANETH ESTEBAN ROSALES,INSCRITO,122.0,CAMINEMOS JUNTOS POR JUNIN,5.0,/Assets/Fotos-HojaVida/236933.jpg,JUNIN,JAUJA,MARCO,['REGIDOR DISTRITAL'],NO,ERM.2022016189
