,idHojaVida,feNacimiento,txSexo,designado,idProcesoElectoral,numeroDocumento,nombreCompleto,estado,idOrganizacionPolitica,organizacionPolitica,numeroCandidato,rutaArchivo,postulaDepartamento,postulaProvincia,postulaDistrito,cargo,nativo,txCodExpedienteExt
0,180804.0,1955-09-13T00:00:00,M,,0.0,15401441,ARMANDO ALEJANDRO LA ROSA HUAPAYA,INSCRITO,14.0,PARTIDO DEMOCRATICO SOMOS PERU,0.0,/Assets/Fotos-HojaVida/180804.jpg,LIMA,CAÑETE,CHILCA,['ALCALDE DISTRITAL'],NO,ERM.2022036634
1,180805.0,1963-07-02T00:00:00,F,,0.0,15368602,MARIA URBANA MONTES VILCAS,INSCRITO,14.0,PARTIDO DEMOCRATICO SOMOS PERU,1.0,/Assets/Fotos-HojaVida/180805.jpg,LIMA,CAÑETE,CHILCA,['REGIDOR DISTRITAL'],NO,ERM.2022036634
2,180806.0,1981-03-18T00:00:00,M,,0.0,43193643,JOSE LUIS SANCHEZ CHUMPITAZI,INSCRITO,14.0,PARTIDO DEMOCRATICO SOMOS PERU,2.0,/Assets/Fotos-HojaVida/180806.jpg,LIMA,CAÑETE,CHILCA,['REGIDOR DISTRITAL'],NO,ERM.2022036634
3,180807.0,1991-07-19T00:00:00,F,,0.0,47367104,LISBET ANALI MORALES SANTOS,INSCRITO,14.0,PARTIDO DEMOCRATICO SOMOS PERU,3.0,/Assets/Fotos-HojaVida/180807.jpg,LIMA,CAÑETE,CHILCA,['REGIDOR DISTRITAL'],NO,ERM.2022036634
4,243059.0,1994-06-01T00:00:00,F,,0.0,48271117,KATERINE LLULEISI LOPEZ RIVA,INSCRITO,14.0,PARTIDO DEMOCRATICO SOMOS PERU,5.0,/Assets/Fotos-HojaVida/243059.jpg,LIMA,CAÑETE,CHILCA,['REGIDOR DISTRITAL'],NO,ERM.2022036634
5,180808.0,1998-03-03T00:00:00,M,,0.0,76278740,JAVIER ENRRIQUE YACTAYO ESPINOZA,INSCRITO,14.0,PARTIDO DEMOCRATICO SOMOS PERU,4.0,/Assets/Fotos-HojaVida/180808.jpg,LIMA,CAÑETE,CHILCA,['REGIDOR DISTRITAL'],NO,ERM.2022036634
