,idHojaVida,feNacimiento,txSexo,designado,idProcesoElectoral,numeroDocumento,nombreCompleto,estado,idOrganizacionPolitica,organizacionPolitica,numeroCandidato,rutaArchivo,postulaDepartamento,postulaProvincia,postulaDistrito,cargo,nativo,txCodExpedienteExt
0,201416.0,1954-08-13T00:00:00,M,,0.0,32401710,CARLOS RAUL HERNANDEZ COTTOS,EXCLUSION,2245.0,MOVIMIENTO REGIONAL EL MAICITO,0.0,/Assets/Fotos-HojaVida/201416.jpg,ANCASH,HUAYLAS,YURACMARCA,"['ALCALDE DISTRITAL', 'ALCALDE DISTRITAL']",NO,ERM.2022016615
1,201417.0,1982-10-08T00:00:00,M,,0.0,44995234,BRAYER JONAS HUIZA LOPEZ,INSCRITO,2245.0,MOVIMIENTO REGIONAL EL MAICITO,1.0,/Assets/Fotos-HojaVida/201417.jpg,ANCASH,HUAYLAS,YURACMARCA,"['REGIDOR DISTRITAL', 'REGIDOR DISTRITAL']",NO,ERM.2022016615
2,201418.0,1994-02-04T00:00:00,F,,0.0,71233492,TANIA ADELAIDA PAULINO ALBUJAR,INSCRITO,2245.0,MOVIMIENTO REGIONAL EL MAICITO,2.0,/Assets/Fotos-HojaVida/201418.jpg,ANCASH,HUAYLAS,YURACMARCA,"['REGIDOR DISTRITAL', 'REGIDOR DISTRITAL']",NO,ERM.2022016615
3,201419.0,1975-02-12T00:00:00,M,,0.0,32402558,JUAN ANICETO DE LA CRUZ LIÑAN,INSCRITO,2245.0,MOVIMIENTO REGIONAL EL MAICITO,3.0,/Assets/Fotos-HojaVida/201419.jpg,ANCASH,HUAYLAS,YURACMARCA,"['REGIDOR DISTRITAL', 'REGIDOR DISTRITAL']",NO,ERM.2022016615
4,201420.0,1994-12-07T00:00:00,F,,0.0,77385378,BEATRIZ FLORENCIA PAULINO TARAZONA,INSCRITO,2245.0,MOVIMIENTO REGIONAL EL MAICITO,4.0,/Assets/Fotos-HojaVida/201420.jpg,ANCASH,HUAYLAS,YURACMARCA,"['REGIDOR DISTRITAL', 'REGIDOR DISTRITAL']",NO,ERM.2022016615
5,201421.0,1999-03-17T00:00:00,M,,0.0,76583115,NICK CHAMOT SAAVEDRA ENRIQUEZ,INSCRITO,2245.0,MOVIMIENTO REGIONAL EL MAICITO,5.0,/Assets/Fotos-HojaVida/201421.jpg,ANCASH,HUAYLAS,YURACMARCA,"['REGIDOR DISTRITAL', 'REGIDOR DISTRITAL']",NO,ERM.2022016615
