,idHojaVida,feNacimiento,txSexo,designado,idProcesoElectoral,numeroDocumento,nombreCompleto,estado,idOrganizacionPolitica,organizacionPolitica,numeroCandidato,rutaArchivo,postulaDepartamento,postulaProvincia,postulaDistrito,cargo,nativo,txCodExpedienteExt
0,168614.0,1972-01-19T00:00:00,M,,0.0,22277295,RICHARD WILLIAM TORRES PASACHE,INSCRITO,14.0,PARTIDO DEMOCRATICO SOMOS PERU,0.0,/Assets/Fotos-HojaVida/168614.jpg,ICA,PISCO,HUMAY,['ALCALDE DISTRITAL'],NO,ERM.2022008315
1,168615.0,1997-10-11T00:00:00,F,,0.0,70252985,ZULLY MARILYN CCAHUANTICO CCASA,INSCRITO,14.0,PARTIDO DEMOCRATICO SOMOS PERU,1.0,/Assets/Fotos-HojaVida/168615.jpg,ICA,PISCO,HUMAY,['REGIDOR DISTRITAL'],NO,ERM.2022008315
2,168616.0,1972-02-21T00:00:00,M,,0.0,22277263,VICTOR HERNAN HERRERA HUAYRA,INSCRITO,14.0,PARTIDO DEMOCRATICO SOMOS PERU,2.0,/Assets/Fotos-HojaVida/168616.jpg,ICA,PISCO,HUMAY,['REGIDOR DISTRITAL'],NO,ERM.2022008315
3,168617.0,1995-04-13T00:00:00,F,,0.0,70303713,OLENKA BETZABE VALENTINA GARCIA CARDENAS,INSCRITO,14.0,PARTIDO DEMOCRATICO SOMOS PERU,3.0,/Assets/Fotos-HojaVida/168617.jpg,ICA,PISCO,HUMAY,['REGIDOR DISTRITAL'],NO,ERM.2022008315
4,168618.0,1964-01-28T00:00:00,M,,0.0,21456145,LUIS ANTONIO CARLOS AQUIJE,INSCRITO,14.0,PARTIDO DEMOCRATICO SOMOS PERU,4.0,/Assets/Fotos-HojaVida/168618.jpg,ICA,PISCO,HUMAY,['REGIDOR DISTRITAL'],NO,ERM.2022008315
5,168619.0,1980-03-23T00:00:00,F,,0.0,40465795,MARISA NELLY HUACCAYCACHACC HERRERA,INSCRITO,14.0,PARTIDO DEMOCRATICO SOMOS PERU,5.0,/Assets/Fotos-HojaVida/168619.jpg,ICA,PISCO,HUMAY,['REGIDOR DISTRITAL'],NO,ERM.2022008315
