,idHojaVida,feNacimiento,txSexo,designado,idProcesoElectoral,numeroDocumento,nombreCompleto,estado,idOrganizacionPolitica,organizacionPolitica,numeroCandidato,rutaArchivo,postulaDepartamento,postulaProvincia,postulaDistrito,cargo,nativo,txCodExpedienteExt
0,239492.0,1985-04-22T00:00:00,M,,0.0,43009028,JUAN CARLOS SANCHEZ RUIZ,INSCRITO,360.0,MOVIMIENTO ACCION NACIONALISTA PERUANO,0.0,/Assets/Fotos-HojaVida/239492.jpg,ANCASH,SANTA,CACERES DEL PERU,['ALCALDE DISTRITAL'],NO,ERM.2022013359
1,239493.0,1982-01-23T00:00:00,M,,0.0,42948797,JUAN LUIS URCIA REQUEJO,IMPROCEDENTE,360.0,MOVIMIENTO ACCION NACIONALISTA PERUANO,1.0,/Assets/Fotos-HojaVida/239493.jpg,ANCASH,SANTA,CACERES DEL PERU,['REGIDOR DISTRITAL'],NO,ERM.2022013359
2,239494.0,1996-07-01T00:00:00,F,,0.0,74739316,CANDY MARIELLE SANCHEZ LUNA,INSCRITO,360.0,MOVIMIENTO ACCION NACIONALISTA PERUANO,2.0,/Assets/Fotos-HojaVida/239494.jpg,ANCASH,SANTA,CACERES DEL PERU,['REGIDOR DISTRITAL'],NO,ERM.2022013359
3,239495.0,1962-03-22T00:00:00,M,,0.0,32877027,ABRAHAM ROBERTO ROQUE ROSAS,INSCRITO,360.0,MOVIMIENTO ACCION NACIONALISTA PERUANO,3.0,/Assets/Fotos-HojaVida/239495.jpg,ANCASH,SANTA,CACERES DEL PERU,['REGIDOR DISTRITAL'],NO,ERM.2022013359
4,239496.0,1985-02-04T00:00:00,F,,0.0,45220898,EVA ESTHER DE LA CRUZ CORONEL,INSCRITO,360.0,MOVIMIENTO ACCION NACIONALISTA PERUANO,4.0,/Assets/Fotos-HojaVida/239496.jpg,ANCASH,SANTA,CACERES DEL PERU,['REGIDOR DISTRITAL'],NO,ERM.2022013359
5,239497.0,1991-11-19T00:00:00,M,,0.0,47558309,JOEL CRISTIAN ALEGRE LUNA,INSCRITO,360.0,MOVIMIENTO ACCION NACIONALISTA PERUANO,5.0,/Assets/Fotos-HojaVida/239497.jpg,ANCASH,SANTA,CACERES DEL PERU,['REGIDOR DISTRITAL'],NO,ERM.2022013359
