,idHojaVida,feNacimiento,txSexo,designado,idProcesoElectoral,numeroDocumento,nombreCompleto,estado,idOrganizacionPolitica,organizacionPolitica,numeroCandidato,rutaArchivo,postulaDepartamento,postulaProvincia,postulaDistrito,cargo,nativo,txCodExpedienteExt
0,206390.0,1967-02-13T00:00:00,M,,0.0,19221315,JORGE LUIS MENDOZA QUIROZ,INSCRITO,14.0,PARTIDO DEMOCRATICO SOMOS PERU,0.0,/Assets/Fotos-HojaVida/206390.jpg,LA LIBERTAD,PACASMAYO,GUADALUPE,['ALCALDE DISTRITAL'],NO,ERM.2022015987
1,206391.0,1982-05-31T00:00:00,F,,0.0,43072862,MERCEDES MARGARITA LOREDO VASQUEZ,INSCRITO,14.0,PARTIDO DEMOCRATICO SOMOS PERU,1.0,/Assets/Fotos-HojaVida/206391.jpg,LA LIBERTAD,PACASMAYO,GUADALUPE,['REGIDOR DISTRITAL'],NO,ERM.2022015987
2,206392.0,1971-05-21T00:00:00,M,,0.0,19251867,WANDER DOLIMBRAN MORA RIVASPLATA,INSCRITO,14.0,PARTIDO DEMOCRATICO SOMOS PERU,2.0,/Assets/Fotos-HojaVida/206392.jpg,LA LIBERTAD,PACASMAYO,GUADALUPE,['REGIDOR DISTRITAL'],NO,ERM.2022015987
3,206393.0,1998-10-02T00:00:00,F,,0.0,75876390,ROSA ELIZABETH ABANTO VILLAVICENCIO,INSCRITO,14.0,PARTIDO DEMOCRATICO SOMOS PERU,3.0,/Assets/Fotos-HojaVida/206393.jpg,LA LIBERTAD,PACASMAYO,GUADALUPE,['REGIDOR DISTRITAL'],NO,ERM.2022015987
4,206394.0,1949-09-07T00:00:00,M,,0.0,19218056,JUAN RAMON BARBOZA CASTAÑEDA,INSCRITO,14.0,PARTIDO DEMOCRATICO SOMOS PERU,4.0,/Assets/Fotos-HojaVida/206394.jpg,LA LIBERTAD,PACASMAYO,GUADALUPE,['REGIDOR DISTRITAL'],NO,ERM.2022015987
5,206395.0,1974-05-06T00:00:00,F,,0.0,18171224,SILVIA YRENE ASMAT SIGUEÑAS,INSCRITO,14.0,PARTIDO DEMOCRATICO SOMOS PERU,5.0,/Assets/Fotos-HojaVida/206395.jpg,LA LIBERTAD,PACASMAYO,GUADALUPE,['REGIDOR DISTRITAL'],NO,ERM.2022015987
6,206396.0,1995-07-03T00:00:00,M,,0.0,73857834,LUIS MIGUEL NUÑEZ ZAPATA,INSCRITO,14.0,PARTIDO DEMOCRATICO SOMOS PERU,6.0,/Assets/Fotos-HojaVida/206396.jpg,LA LIBERTAD,PACASMAYO,GUADALUPE,['REGIDOR DISTRITAL'],NO,ERM.2022015987
7,206397.0,1953-10-24T00:00:00,F,,0.0,19217492,MARIA EULOGIA MONCADA DE QUIROZ,INSCRITO,14.0,PARTIDO DEMOCRATICO SOMOS PERU,7.0,/Assets/Fotos-HojaVida/206397.jpg,LA LIBERTAD,PACASMAYO,GUADALUPE,['REGIDOR DISTRITAL'],NO,ERM.2022015987
