,idHojaVida,feNacimiento,txSexo,designado,idProcesoElectoral,numeroDocumento,nombreCompleto,estado,idOrganizacionPolitica,organizacionPolitica,numeroCandidato,rutaArchivo,postulaDepartamento,postulaProvincia,postulaDistrito,cargo,nativo,txCodExpedienteExt
0,204888.0,1969-04-10T00:00:00,M,,0.0,29554018,HECTOR EZEQUIEL NINA HUARCAYA,EXCLUSION,1264.0,JUNTOS POR EL PERU,0.0,/Assets/Fotos-HojaVida/204888.jpg,AREQUIPA,CAYLLOMA,MACA,['ALCALDE DISTRITAL'],NO,ERM.2022017509
1,204889.0,1977-05-09T00:00:00,M,,0.0,80160558,WILLIAM ROGGER NINA CHIUCHE,INSCRITO,1264.0,JUNTOS POR EL PERU,1.0,/Assets/Fotos-HojaVida/204889.jpg,AREQUIPA,CAYLLOMA,MACA,['REGIDOR DISTRITAL'],NO,ERM.2022017509
2,204890.0,1965-03-28T00:00:00,F,,0.0,30659188,JUANA CIPRIANA NINA CHICAÑA VDA DE QUISPE,INSCRITO,1264.0,JUNTOS POR EL PERU,2.0,/Assets/Fotos-HojaVida/204890.jpg,AREQUIPA,CAYLLOMA,MACA,['REGIDOR DISTRITAL'],NO,ERM.2022017509
3,204891.0,1972-11-01T00:00:00,M,,0.0,41403609,SANTOS AQUILINO GOMEZ CASTRO,INSCRITO,1264.0,JUNTOS POR EL PERU,3.0,/Assets/Fotos-HojaVida/204891.jpg,AREQUIPA,CAYLLOMA,MACA,['REGIDOR DISTRITAL'],NO,ERM.2022017509
4,204892.0,1999-01-18T00:00:00,F,,0.0,76840343,GUADALUPE NORMA CRUZ CASTRO,INSCRITO,1264.0,JUNTOS POR EL PERU,4.0,/Assets/Fotos-HojaVida/204892.jpg,AREQUIPA,CAYLLOMA,MACA,['REGIDOR DISTRITAL'],NO,ERM.2022017509
5,204893.0,1998-10-27T00:00:00,M,,0.0,70849678,RODRIGO DANIEL CHAPI SANCHEZ,EXCLUSION,1264.0,JUNTOS POR EL PERU,5.0,/Assets/Fotos-HojaVida/204893.jpg,AREQUIPA,CAYLLOMA,MACA,['REGIDOR DISTRITAL'],NO,ERM.2022017509
