,idHojaVida,feNacimiento,txSexo,designado,idProcesoElectoral,numeroDocumento,nombreCompleto,estado,idOrganizacionPolitica,organizacionPolitica,numeroCandidato,rutaArchivo,postulaDepartamento,postulaProvincia,postulaDistrito,cargo,nativo,txCodExpedienteExt
0,191652.0,1956-10-23T00:00:00,M,,0.0,32114313,LUIS FELIPE VALDEZ INGA,INSCRITO,2245.0,MOVIMIENTO REGIONAL EL MAICITO,0.0,/Assets/Fotos-HojaVida/191652.jpg,ANCASH,CASMA,COMANDANTE NOEL,['ALCALDE DISTRITAL'],NO,ERM.2022006713
1,191653.0,1973-02-06T00:00:00,F,,0.0,32114874,ARMANDINA EROBITA CARAHUANCO LINO,INSCRITO,2245.0,MOVIMIENTO REGIONAL EL MAICITO,1.0,/Assets/Fotos-HojaVida/191653.jpg,ANCASH,CASMA,COMANDANTE NOEL,['REGIDOR DISTRITAL'],NO,ERM.2022006713
2,191654.0,1997-11-18T00:00:00,M,,0.0,73392670,LUIS ANDERS SILVA MONTERO,INSCRITO,2245.0,MOVIMIENTO REGIONAL EL MAICITO,2.0,/Assets/Fotos-HojaVida/191654.jpg,ANCASH,CASMA,COMANDANTE NOEL,['REGIDOR DISTRITAL'],NO,ERM.2022006713
3,191655.0,1974-08-29T00:00:00,F,,0.0,32115061,DELIA ROSA MENDOZA ROQUE,INSCRITO,2245.0,MOVIMIENTO REGIONAL EL MAICITO,3.0,/Assets/Fotos-HojaVida/191655.jpg,ANCASH,CASMA,COMANDANTE NOEL,['REGIDOR DISTRITAL'],NO,ERM.2022006713
4,191656.0,1990-07-28T00:00:00,M,,0.0,46848032,ALAN VICTOR HUGO RIVERO RAMOS,INSCRITO,2245.0,MOVIMIENTO REGIONAL EL MAICITO,4.0,/Assets/Fotos-HojaVida/191656.jpg,ANCASH,CASMA,COMANDANTE NOEL,['REGIDOR DISTRITAL'],NO,ERM.2022006713
5,191657.0,1969-07-11T00:00:00,F,,0.0,32114730,BERTHA TERESA CABALLERO GOMEZ,EXCLUSION,2245.0,MOVIMIENTO REGIONAL EL MAICITO,5.0,/Assets/Fotos-HojaVida/191657.jpg,ANCASH,CASMA,COMANDANTE NOEL,['REGIDOR DISTRITAL'],NO,ERM.2022006713
