,idHojaVida,feNacimiento,txSexo,designado,idProcesoElectoral,numeroDocumento,nombreCompleto,estado,idOrganizacionPolitica,organizacionPolitica,numeroCandidato,rutaArchivo,postulaDepartamento,postulaProvincia,postulaDistrito,cargo,nativo,txCodExpedienteExt
0,193554.0,1981-04-14T00:00:00,M,,0.0,43137087,SANTIAGO ALDO REYES DE LA CRUZ,INSCRITO,1264.0,JUNTOS POR EL PERU,0.0,/Assets/Fotos-HojaVida/193554.jpg,ANCASH,RECUAY,TAPACOCHA,['ALCALDE DISTRITAL'],NO,ERM.2022014638
1,193555.0,1961-11-26T00:00:00,M,,0.0,32654830,CRISONIMO MOISES CUENTAS MENA,EXCLUSION,1264.0,JUNTOS POR EL PERU,1.0,/Assets/Fotos-HojaVida/193555.jpg,ANCASH,RECUAY,TAPACOCHA,['REGIDOR DISTRITAL'],NO,ERM.2022014638
2,193556.0,2001-02-25T00:00:00,F,,0.0,70885648,YANET SHIRLEY ITA HUAMAN,INSCRITO,1264.0,JUNTOS POR EL PERU,2.0,/Assets/Fotos-HojaVida/193556.jpg,ANCASH,RECUAY,TAPACOCHA,['REGIDOR DISTRITAL'],NO,ERM.2022014638
3,193557.0,1977-02-03T00:00:00,M,,0.0,80652373,FABIO HIPOLITO ESPADA COSME,INSCRITO,1264.0,JUNTOS POR EL PERU,3.0,/Assets/Fotos-HojaVida/193557.jpg,ANCASH,RECUAY,TAPACOCHA,['REGIDOR DISTRITAL'],NO,ERM.2022014638
4,193558.0,1994-02-05T00:00:00,F,,0.0,71990594,BETSABE EDITA HUERTA RAMON,INSCRITO,1264.0,JUNTOS POR EL PERU,4.0,/Assets/Fotos-HojaVida/193558.jpg,ANCASH,RECUAY,TAPACOCHA,['REGIDOR DISTRITAL'],NO,ERM.2022014638
5,193559.0,1986-06-06T00:00:00,M,,0.0,43823027,ELMER MARADONA DE LA CRUZ ESPADA,INSCRITO,1264.0,JUNTOS POR EL PERU,5.0,/Assets/Fotos-HojaVida/193559.jpg,ANCASH,RECUAY,TAPACOCHA,['REGIDOR DISTRITAL'],NO,ERM.2022014638
