,idHojaVida,feNacimiento,txSexo,designado,idProcesoElectoral,numeroDocumento,nombreCompleto,estado,idOrganizacionPolitica,organizacionPolitica,numeroCandidato,rutaArchivo,postulaDepartamento,postulaProvincia,postulaDistrito,cargo,nativo,txCodExpedienteExt
0,176844.0,1994-07-23T00:00:00,M,,0.0,72717318,RICARDO ANTONIO SAENZ ALVAREZ,INSCRITO,360.0,MOVIMIENTO ACCION NACIONALISTA PERUANO,0.0,/Assets/Fotos-HojaVida/176844.jpg,ANCASH,HUAYLAS,SANTA CRUZ,['ALCALDE DISTRITAL'],NO,ERM.2022010743
1,176845.0,1999-07-20T00:00:00,F,,0.0,70211906,KEYLA ABIGAIL BLAS HUIZA DE CASTILLO,IMPROCEDENTE,360.0,MOVIMIENTO ACCION NACIONALISTA PERUANO,1.0,/Assets/Fotos-HojaVida/176845.jpg,ANCASH,HUAYLAS,SANTA CRUZ,['REGIDOR DISTRITAL'],NO,ERM.2022010743
2,176846.0,1994-08-06T00:00:00,M,,0.0,48330951,EBERTH FLORENTINO CIRILO LOPEZ,INSCRITO,360.0,MOVIMIENTO ACCION NACIONALISTA PERUANO,2.0,/Assets/Fotos-HojaVida/176846.jpg,ANCASH,HUAYLAS,SANTA CRUZ,['REGIDOR DISTRITAL'],NO,ERM.2022010743
3,176847.0,2002-06-04T00:00:00,F,,0.0,73223799,CINTHIA MEDELINA ALVAREZ MILLA,INSCRITO,360.0,MOVIMIENTO ACCION NACIONALISTA PERUANO,3.0,/Assets/Fotos-HojaVida/176847.jpg,ANCASH,HUAYLAS,SANTA CRUZ,['REGIDOR DISTRITAL'],NO,ERM.2022010743
4,176848.0,1987-11-30T00:00:00,M,,0.0,44658994,YONY RONAL SAENZ MILLA,INSCRITO,360.0,MOVIMIENTO ACCION NACIONALISTA PERUANO,4.0,/Assets/Fotos-HojaVida/176848.jpg,ANCASH,HUAYLAS,SANTA CRUZ,['REGIDOR DISTRITAL'],NO,ERM.2022010743
5,176849.0,1999-09-26T00:00:00,F,,0.0,76728645,YUDINA ERCILIA CANO REYES,INSCRITO,360.0,MOVIMIENTO ACCION NACIONALISTA PERUANO,5.0,/Assets/Fotos-HojaVida/176849.jpg,ANCASH,HUAYLAS,SANTA CRUZ,['REGIDOR DISTRITAL'],NO,ERM.2022010743
