,idHojaVida,feNacimiento,txSexo,designado,idProcesoElectoral,numeroDocumento,nombreCompleto,estado,idOrganizacionPolitica,organizacionPolitica,numeroCandidato,rutaArchivo,postulaDepartamento,postulaProvincia,postulaDistrito,cargo,nativo,txCodExpedienteExt
0,223878.0,1954-12-27T00:00:00,M,,0.0,08356200,JUAN EULER HIPOLITO ASCENCIO,INSCRITO,2173.0,AVANZA PAIS - PARTIDO DE INTEGRACION SOCIAL,0.0,/Assets/Fotos-HojaVida/223878.jpg,LIMA,YAUYOS,CATAHUASI,['ALCALDE DISTRITAL'],NO,ERM.2022017898
1,223879.0,1995-12-04T00:00:00,F,,0.0,70377266,YESENIA VERONICA HERVACIO LUYO,INSCRITO,2173.0,AVANZA PAIS - PARTIDO DE INTEGRACION SOCIAL,1.0,/Assets/Fotos-HojaVida/223879.jpg,LIMA,YAUYOS,CATAHUASI,['REGIDOR DISTRITAL'],NO,ERM.2022017898
2,223880.0,1993-09-11T00:00:00,M,,0.0,48195923,RONAL BARONI GUTIERREZ LUCIANI,INSCRITO,2173.0,AVANZA PAIS - PARTIDO DE INTEGRACION SOCIAL,2.0,/Assets/Fotos-HojaVida/223880.jpg,LIMA,YAUYOS,CATAHUASI,['REGIDOR DISTRITAL'],NO,ERM.2022017898
3,223881.0,1983-12-11T00:00:00,F,,0.0,42137390,ZULEMA ROXSANA ASCENCIO SILVESTRE,INSCRITO,2173.0,AVANZA PAIS - PARTIDO DE INTEGRACION SOCIAL,3.0,/Assets/Fotos-HojaVida/223881.jpg,LIMA,YAUYOS,CATAHUASI,['REGIDOR DISTRITAL'],NO,ERM.2022017898
4,223882.0,1981-07-24T00:00:00,M,,0.0,44330437,JOSUE AVELINO SIERRA ANTONIO,INSCRITO,2173.0,AVANZA PAIS - PARTIDO DE INTEGRACION SOCIAL,4.0,/Assets/Fotos-HojaVida/223882.jpg,LIMA,YAUYOS,CATAHUASI,['REGIDOR DISTRITAL'],NO,ERM.2022017898
5,223883.0,2002-12-14T00:00:00,F,,0.0,73635852,STEFANNY SUSAN DE LA CRUZ VEGA,INSCRITO,2173.0,AVANZA PAIS - PARTIDO DE INTEGRACION SOCIAL,5.0,/Assets/Fotos-HojaVida/223883.jpg,LIMA,YAUYOS,CATAHUASI,['REGIDOR DISTRITAL'],NO,ERM.2022017898
