,idHojaVida,feNacimiento,txSexo,designado,idProcesoElectoral,numeroDocumento,nombreCompleto,estado,idOrganizacionPolitica,organizacionPolitica,numeroCandidato,rutaArchivo,postulaDepartamento,postulaProvincia,postulaDistrito,cargo,nativo,txCodExpedienteExt
0,186324.0,1964-03-17T00:00:00,M,,0.0,06956078,WALTER JAIVER VASQUEZ CARRANZA,INSCRITO,2173.0,AVANZA PAIS - PARTIDO DE INTEGRACION SOCIAL,0.0,/Assets/Fotos-HojaVida/186324.jpg,LA LIBERTAD,TRUJILLO,FLORENCIA DE MORA,['ALCALDE DISTRITAL'],NO,ERM.2022006442
1,186325.0,1974-01-26T00:00:00,M,,0.0,18155319,SANTOS IVAN PAREDES CASTILLO,INSCRITO,2173.0,AVANZA PAIS - PARTIDO DE INTEGRACION SOCIAL,1.0,/Assets/Fotos-HojaVida/186325.jpg,LA LIBERTAD,TRUJILLO,FLORENCIA DE MORA,['REGIDOR DISTRITAL'],NO,ERM.2022006442
2,186326.0,1996-07-10T00:00:00,F,,0.0,70279710,RENATA STEFANY ACUÑA ORBEGOSO,INSCRITO,2173.0,AVANZA PAIS - PARTIDO DE INTEGRACION SOCIAL,2.0,/Assets/Fotos-HojaVida/186326.jpg,LA LIBERTAD,TRUJILLO,FLORENCIA DE MORA,['REGIDOR DISTRITAL'],NO,ERM.2022006442
3,186327.0,1997-11-19T00:00:00,M,,0.0,73961824,ANTHONY GIUSEPPE MORENO ALLEMANT,INSCRITO,2173.0,AVANZA PAIS - PARTIDO DE INTEGRACION SOCIAL,3.0,/Assets/Fotos-HojaVida/186327.jpg,LA LIBERTAD,TRUJILLO,FLORENCIA DE MORA,['REGIDOR DISTRITAL'],NO,ERM.2022006442
4,186328.0,1991-08-02T00:00:00,F,,0.0,70358795,JANETH ROXANA VEJARANO FERRER,INSCRITO,2173.0,AVANZA PAIS - PARTIDO DE INTEGRACION SOCIAL,4.0,/Assets/Fotos-HojaVida/186328.jpg,LA LIBERTAD,TRUJILLO,FLORENCIA DE MORA,['REGIDOR DISTRITAL'],NO,ERM.2022006442
5,186329.0,1996-09-28T00:00:00,M,,0.0,70279064,LUIS FERNANDO GUTIERREZ FLORES,INSCRITO,2173.0,AVANZA PAIS - PARTIDO DE INTEGRACION SOCIAL,5.0,/Assets/Fotos-HojaVida/186329.jpg,LA LIBERTAD,TRUJILLO,FLORENCIA DE MORA,['REGIDOR DISTRITAL'],NO,ERM.2022006442
6,186330.0,1981-11-22T00:00:00,F,,0.0,41608944,CARMEN DEL PILAR POLO SOTO,INSCRITO,2173.0,AVANZA PAIS - PARTIDO DE INTEGRACION SOCIAL,6.0,/Assets/Fotos-HojaVida/186330.jpg,LA LIBERTAD,TRUJILLO,FLORENCIA DE MORA,['REGIDOR DISTRITAL'],NO,ERM.2022006442
7,186331.0,1998-02-07T00:00:00,M,,0.0,70275885,LENIN DIEGO MOZO HEROS,INSCRITO,2173.0,AVANZA PAIS - PARTIDO DE INTEGRACION SOCIAL,7.0,/Assets/Fotos-HojaVida/186331.jpg,LA LIBERTAD,TRUJILLO,FLORENCIA DE MORA,['REGIDOR DISTRITAL'],NO,ERM.2022006442
