,idHojaVida,feNacimiento,txSexo,designado,idProcesoElectoral,numeroDocumento,nombreCompleto,estado,idOrganizacionPolitica,organizacionPolitica,numeroCandidato,rutaArchivo,postulaDepartamento,postulaProvincia,postulaDistrito,cargo,nativo,txCodExpedienteExt
0,204894.0,1985-11-22T00:00:00,M,,0.0,43328784,OSCAR ALFREDO ESTRADA AGUERO,EXCLUSION,14.0,PARTIDO DEMOCRATICO SOMOS PERU,0.0,/Assets/Fotos-HojaVida/204894.jpg,ANCASH,POMABAMBA,QUINUABAMBA,['ALCALDE DISTRITAL'],NO,ERM.2022015019
1,204895.0,1997-10-14T00:00:00,F,,0.0,72375389,YACKELIN CRIS MORENO ESTRADA,INSCRITO,14.0,PARTIDO DEMOCRATICO SOMOS PERU,1.0,/Assets/Fotos-HojaVida/204895.jpg,ANCASH,POMABAMBA,QUINUABAMBA,['REGIDOR DISTRITAL'],NO,ERM.2022015019
2,204896.0,1990-08-11T00:00:00,M,,0.0,46562582,LUCIO TOMAS AVILA VARGAS,EXCLUSION,14.0,PARTIDO DEMOCRATICO SOMOS PERU,2.0,/Assets/Fotos-HojaVida/204896.jpg,ANCASH,POMABAMBA,QUINUABAMBA,['REGIDOR DISTRITAL'],NO,ERM.2022015019
3,204897.0,1969-09-22T00:00:00,F,,0.0,09485721,ADELA VICTORIA DE LA CRUZ CHAVARRIA,INSCRITO,14.0,PARTIDO DEMOCRATICO SOMOS PERU,3.0,/Assets/Fotos-HojaVida/204897.jpg,ANCASH,POMABAMBA,QUINUABAMBA,['REGIDOR DISTRITAL'],NO,ERM.2022015019
4,204898.0,1981-01-24T00:00:00,M,,0.0,41165900,ANIBAL RAFAEL CARBAJAL QUINTO,EXCLUSION,14.0,PARTIDO DEMOCRATICO SOMOS PERU,4.0,/Assets/Fotos-HojaVida/204898.jpg,ANCASH,POMABAMBA,QUINUABAMBA,['REGIDOR DISTRITAL'],NO,ERM.2022015019
5,204899.0,2000-07-24T00:00:00,F,,0.0,70651340,TANIA MARIA MORI OSORIO,INSCRITO,14.0,PARTIDO DEMOCRATICO SOMOS PERU,5.0,/Assets/Fotos-HojaVida/204899.jpg,ANCASH,POMABAMBA,QUINUABAMBA,['REGIDOR DISTRITAL'],NO,ERM.2022015019
