,idHojaVida,feNacimiento,txSexo,designado,idProcesoElectoral,numeroDocumento,nombreCompleto,estado,idOrganizacionPolitica,organizacionPolitica,numeroCandidato,rutaArchivo,postulaDepartamento,postulaProvincia,postulaDistrito,cargo,nativo,txCodExpedienteExt
0,193496.0,1965-11-16T00:00:00,M,,0.0,19952133,EDMUNDO FELIPE RAMOS TAIPE,INSCRITO,2173.0,AVANZA PAIS - PARTIDO DE INTEGRACION SOCIAL,0.0,/Assets/Fotos-HojaVida/193496.jpg,LIMA,YAUYOS,ALIS,['ALCALDE DISTRITAL'],NO,ERM.2022006918
1,193497.0,1965-02-01T00:00:00,M,,0.0,19806411,JESUS AGLIBERTO SEGURA BEJARANO,INSCRITO,2173.0,AVANZA PAIS - PARTIDO DE INTEGRACION SOCIAL,1.0,/Assets/Fotos-HojaVida/193497.jpg,LIMA,YAUYOS,ALIS,['REGIDOR DISTRITAL'],NO,ERM.2022006918
2,193498.0,1972-06-25T00:00:00,F,,0.0,16282869,YANET LOURDES JUAN DE DIOS CASTILLO DE ORELLANA,INSCRITO,2173.0,AVANZA PAIS - PARTIDO DE INTEGRACION SOCIAL,2.0,/Assets/Fotos-HojaVida/193498.jpg,LIMA,YAUYOS,ALIS,['REGIDOR DISTRITAL'],NO,ERM.2022006918
3,193499.0,1967-09-12T00:00:00,M,,0.0,16282859,ESLAIDER YUVANI CHAVARRIA RODRIGUEZ,INSCRITO,2173.0,AVANZA PAIS - PARTIDO DE INTEGRACION SOCIAL,3.0,/Assets/Fotos-HojaVida/193499.jpg,LIMA,YAUYOS,ALIS,['REGIDOR DISTRITAL'],NO,ERM.2022006918
4,193500.0,1993-11-13T00:00:00,F,,0.0,70135979,IRIS MARGOT HUARACA ESPEJO,INSCRITO,2173.0,AVANZA PAIS - PARTIDO DE INTEGRACION SOCIAL,4.0,/Assets/Fotos-HojaVida/193500.jpg,LIMA,YAUYOS,ALIS,['REGIDOR DISTRITAL'],NO,ERM.2022006918
5,193501.0,2001-11-24T00:00:00,M,,0.0,71696062,FELIX RONAL SOTO QUISPE,INSCRITO,2173.0,AVANZA PAIS - PARTIDO DE INTEGRACION SOCIAL,5.0,/Assets/Fotos-HojaVida/193501.jpg,LIMA,YAUYOS,ALIS,['REGIDOR DISTRITAL'],NO,ERM.2022006918
