,idHojaVida,feNacimiento,txSexo,designado,idProcesoElectoral,numeroDocumento,nombreCompleto,estado,idOrganizacionPolitica,organizacionPolitica,numeroCandidato,rutaArchivo,postulaDepartamento,postulaProvincia,postulaDistrito,cargo,nativo,txCodExpedienteExt
0,191746.0,1967-04-20T00:00:00,M,,0.0,15682449,WALTER LUIS CHAVEZ QUITO,INSCRITO,2869.0,PARTIDO PATRIOTICO DEL PERU,0.0,/Assets/Fotos-HojaVida/191746.jpg,LIMA,BARRANCA,PARAMONGA,['ALCALDE DISTRITAL'],NO,ERM.2022015348
1,191747.0,1997-06-26T00:00:00,F,,0.0,71520760,ROSA KATHERINE SANCHEZ DE PAZ,INSCRITO,2869.0,PARTIDO PATRIOTICO DEL PERU,1.0,/Assets/Fotos-HojaVida/191747.jpg,LIMA,BARRANCA,PARAMONGA,['REGIDOR DISTRITAL'],NO,ERM.2022015348
2,191748.0,1965-09-02T00:00:00,M,,0.0,15679368,DIEGO AHMED BARBOZA QUIROZ,INSCRITO,2869.0,PARTIDO PATRIOTICO DEL PERU,2.0,/Assets/Fotos-HojaVida/191748.jpg,LIMA,BARRANCA,PARAMONGA,['REGIDOR DISTRITAL'],NO,ERM.2022015348
3,191749.0,1997-09-16T00:00:00,F,,0.0,74526431,SANDRA GIULIANA LUCERO CALDERON SIALAS,INSCRITO,2869.0,PARTIDO PATRIOTICO DEL PERU,3.0,/Assets/Fotos-HojaVida/191749.jpg,LIMA,BARRANCA,PARAMONGA,['REGIDOR DISTRITAL'],NO,ERM.2022015348
4,191750.0,2002-05-05T00:00:00,M,,0.0,70851563,PATRICK OWEN ARANDA CEVALLOS,INSCRITO,2869.0,PARTIDO PATRIOTICO DEL PERU,4.0,/Assets/Fotos-HojaVida/191750.jpg,LIMA,BARRANCA,PARAMONGA,['REGIDOR DISTRITAL'],NO,ERM.2022015348
5,191751.0,1996-12-13T00:00:00,F,,0.0,77335627,MISHELL ZAORI SILVA VERGARA,INSCRITO,2869.0,PARTIDO PATRIOTICO DEL PERU,5.0,/Assets/Fotos-HojaVida/191751.jpg,LIMA,BARRANCA,PARAMONGA,['REGIDOR DISTRITAL'],NO,ERM.2022015348
