,idHojaVida,feNacimiento,txSexo,designado,idProcesoElectoral,numeroDocumento,nombreCompleto,estado,idOrganizacionPolitica,organizacionPolitica,numeroCandidato,rutaArchivo,postulaDepartamento,postulaProvincia,postulaDistrito,cargo,nativo,txCodExpedienteExt
0,142982.0,1970-02-28T00:00:00,M,,0.0,20420902,HECTOR MANTARI BENDEZU,INSCRITO,122.0,CAMINEMOS JUNTOS POR JUNIN,0.0,/Assets/Fotos-HojaVida/142982.jpg,JUNIN,CONCEPCION,HEROINAS TOLEDO,['ALCALDE DISTRITAL'],NO,ERM.2022015331
1,142983.0,2001-02-18T00:00:00,F,,0.0,73961597,ANALI LILIANA LAURA DE LA CRUZ,INSCRITO,122.0,CAMINEMOS JUNTOS POR JUNIN,1.0,/Assets/Fotos-HojaVida/142983.jpg,JUNIN,CONCEPCION,HEROINAS TOLEDO,['REGIDOR DISTRITAL'],NO,ERM.2022015331
2,142984.0,1954-01-02T00:00:00,M,,0.0,20420227,NICOLAS DE LA CRUZ ALCANTARA,INSCRITO,122.0,CAMINEMOS JUNTOS POR JUNIN,2.0,/Assets/Fotos-HojaVida/142984.jpg,JUNIN,CONCEPCION,HEROINAS TOLEDO,['REGIDOR DISTRITAL'],NO,ERM.2022015331
3,142985.0,1992-07-25T00:00:00,F,,0.0,47181343,CECILIA LAUREANO DE LA CRUZ,INSCRITO,122.0,CAMINEMOS JUNTOS POR JUNIN,3.0,/Assets/Fotos-HojaVida/142985.jpg,JUNIN,CONCEPCION,HEROINAS TOLEDO,['REGIDOR DISTRITAL'],NO,ERM.2022015331
4,142986.0,1959-12-08T00:00:00,M,,0.0,20420374,CLEMENTE DOGMA TOLENTINO BASILIO,INSCRITO,122.0,CAMINEMOS JUNTOS POR JUNIN,4.0,/Assets/Fotos-HojaVida/142986.jpg,JUNIN,CONCEPCION,HEROINAS TOLEDO,['REGIDOR DISTRITAL'],NO,ERM.2022015331
5,142987.0,1993-05-30T00:00:00,F,,0.0,47764991,ARACELY DE LA CRUZ ABELARDO,INSCRITO,122.0,CAMINEMOS JUNTOS POR JUNIN,5.0,/Assets/Fotos-HojaVida/142987.jpg,JUNIN,CONCEPCION,HEROINAS TOLEDO,['REGIDOR DISTRITAL'],NO,ERM.2022015331
