,idHojaVida,feNacimiento,txSexo,designado,idProcesoElectoral,numeroDocumento,nombreCompleto,estado,idOrganizacionPolitica,organizacionPolitica,numeroCandidato,rutaArchivo,postulaDepartamento,postulaProvincia,postulaDistrito,cargo,nativo,txCodExpedienteExt
0,211634.0,1976-07-10T00:00:00,M,,0.0,29673904,RONALD NICANOR QUISPE TACO,INSCRITO,142.0,"AREQUIPA, TRADICION Y FUTURO",0.0,/Assets/Fotos-HojaVida/211634.jpg,AREQUIPA,CASTILLA,ANDAGUA,['ALCALDE DISTRITAL'],NO,ERM.2022016223
1,211635.0,1968-02-19T00:00:00,F,,0.0,30565291,CRISTINA GABY APAZA YAURI,INSCRITO,142.0,"AREQUIPA, TRADICION Y FUTURO",1.0,/Assets/Fotos-HojaVida/211635.jpg,AREQUIPA,CASTILLA,ANDAGUA,['REGIDOR DISTRITAL'],NO,ERM.2022016223
2,211636.0,1978-06-03T00:00:00,M,,0.0,40394241,PIO LUZGARDO YANCAPALLO CASTRO,INSCRITO,142.0,"AREQUIPA, TRADICION Y FUTURO",2.0,/Assets/Fotos-HojaVida/211636.jpg,AREQUIPA,CASTILLA,ANDAGUA,['REGIDOR DISTRITAL'],NO,ERM.2022016223
3,211637.0,1993-11-25T00:00:00,F,,0.0,74438704,MILAGRITO CELSA CAYLLAHUI SARAYASI,INSCRITO,142.0,"AREQUIPA, TRADICION Y FUTURO",3.0,/Assets/Fotos-HojaVida/211637.jpg,AREQUIPA,CASTILLA,ANDAGUA,['REGIDOR DISTRITAL'],NO,ERM.2022016223
4,211638.0,1983-07-16T00:00:00,M,,0.0,42542722,FREDY ANCELMO HUISACAYNA HUAMANI,INSCRITO,142.0,"AREQUIPA, TRADICION Y FUTURO",4.0,/Assets/Fotos-HojaVida/211638.jpg,AREQUIPA,CASTILLA,ANDAGUA,['REGIDOR DISTRITAL'],NO,ERM.2022016223
5,211639.0,1959-06-13T00:00:00,F,,0.0,30564766,ANTONINA ACRICIA HUAMANI DE VELASQUEZ,INSCRITO,142.0,"AREQUIPA, TRADICION Y FUTURO",5.0,/Assets/Fotos-HojaVida/211639.jpg,AREQUIPA,CASTILLA,ANDAGUA,['REGIDOR DISTRITAL'],NO,ERM.2022016223
