,idHojaVida,feNacimiento,txSexo,designado,idProcesoElectoral,numeroDocumento,nombreCompleto,estado,idOrganizacionPolitica,organizacionPolitica,numeroCandidato,rutaArchivo,postulaDepartamento,postulaProvincia,postulaDistrito,cargo,nativo,txCodExpedienteExt
0,230350.0,1973-01-12T00:00:00,M,,0.0,06783858,JIMMY HUMBERTO MONTOYA THORNTON,INSCRITO,1257.0,ALIANZA PARA EL PROGRESO,0.0,/Assets/Fotos-HojaVida/230350.jpg,AREQUIPA,CARAVELI,BELLA UNION,['ALCALDE DISTRITAL'],NO,ERM.2022011967
1,230351.0,1961-12-09T00:00:00,F,,0.0,30489318,TULA AMPARO VALENCIA SILVA DE DENEGRI,INSCRITO,1257.0,ALIANZA PARA EL PROGRESO,1.0,/Assets/Fotos-HojaVida/230351.jpg,AREQUIPA,CARAVELI,BELLA UNION,['REGIDOR DISTRITAL'],NO,ERM.2022011967
2,230352.0,1976-01-27T00:00:00,M,,0.0,10327844,JOSE ANTONIO FLORES BAO,INSCRITO,1257.0,ALIANZA PARA EL PROGRESO,2.0,/Assets/Fotos-HojaVida/230352.jpg,AREQUIPA,CARAVELI,BELLA UNION,['REGIDOR DISTRITAL'],NO,ERM.2022011967
3,230353.0,2002-01-28T00:00:00,F,,0.0,76733735,MARIA FERNANDA ZEGARRA OCHOA,INSCRITO,1257.0,ALIANZA PARA EL PROGRESO,3.0,/Assets/Fotos-HojaVida/230353.jpg,AREQUIPA,CARAVELI,BELLA UNION,['REGIDOR DISTRITAL'],NO,ERM.2022011967
4,230354.0,1998-11-21T00:00:00,M,,0.0,71392495,BENJAMIN OMAR QUICAÑO ANTAYHUA,INSCRITO,1257.0,ALIANZA PARA EL PROGRESO,4.0,/Assets/Fotos-HojaVida/230354.jpg,AREQUIPA,CARAVELI,BELLA UNION,['REGIDOR DISTRITAL'],NO,ERM.2022011967
5,230355.0,2001-09-28T00:00:00,F,,0.0,71394333,NOELIA ISABEL LOPEZ MACETAS,INSCRITO,1257.0,ALIANZA PARA EL PROGRESO,5.0,/Assets/Fotos-HojaVida/230355.jpg,AREQUIPA,CARAVELI,BELLA UNION,['REGIDOR DISTRITAL'],NO,ERM.2022011967
