,idHojaVida,feNacimiento,txSexo,designado,idProcesoElectoral,numeroDocumento,nombreCompleto,estado,idOrganizacionPolitica,organizacionPolitica,numeroCandidato,rutaArchivo,postulaDepartamento,postulaProvincia,postulaDistrito,cargo,nativo,txCodExpedienteExt
0,234174.0,1972-07-11T00:00:00,M,,0.0,30571606,BENITO EDMUNDO AMBRONCIO DE LA CRUZ,INSCRITO,1257.0,ALIANZA PARA EL PROGRESO,0.0,/Assets/Fotos-HojaVida/234174.jpg,AREQUIPA,CASTILLA,HUANCARQUI,['ALCALDE DISTRITAL'],NO,ERM.2022008968
1,234175.0,1964-09-01T00:00:00,F,,0.0,30571270,GILDA JAKELINE ZUNIGA CORNEJO,INSCRITO,1257.0,ALIANZA PARA EL PROGRESO,1.0,/Assets/Fotos-HojaVida/234175.jpg,AREQUIPA,CASTILLA,HUANCARQUI,['REGIDOR DISTRITAL'],NO,ERM.2022008968
2,234176.0,1990-08-15T00:00:00,M,,0.0,71011151,CRISTOFER JASMANI LAGUNA MARTINEZ,INSCRITO,1257.0,ALIANZA PARA EL PROGRESO,2.0,/Assets/Fotos-HojaVida/234176.jpg,AREQUIPA,CASTILLA,HUANCARQUI,['REGIDOR DISTRITAL'],NO,ERM.2022008968
3,234177.0,1997-04-27T00:00:00,F,,0.0,74047517,MARILYN KASANDRA MARROQUIN PALOMINO,INSCRITO,1257.0,ALIANZA PARA EL PROGRESO,3.0,/Assets/Fotos-HojaVida/234177.jpg,AREQUIPA,CASTILLA,HUANCARQUI,['REGIDOR DISTRITAL'],NO,ERM.2022008968
4,234178.0,1975-04-20T00:00:00,M,,0.0,29642737,DANIEL ALBERTO RIOS PEREZ,INSCRITO,1257.0,ALIANZA PARA EL PROGRESO,4.0,/Assets/Fotos-HojaVida/234178.jpg,AREQUIPA,CASTILLA,HUANCARQUI,['REGIDOR DISTRITAL'],NO,ERM.2022008968
5,234179.0,1982-01-15T00:00:00,F,,0.0,41333738,LILIANA BERTHA HUAHUACONDO DURAN,INSCRITO,1257.0,ALIANZA PARA EL PROGRESO,5.0,/Assets/Fotos-HojaVida/234179.jpg,AREQUIPA,CASTILLA,HUANCARQUI,['REGIDOR DISTRITAL'],NO,ERM.2022008968
