,idHojaVida,feNacimiento,txSexo,designado,idProcesoElectoral,numeroDocumento,nombreCompleto,estado,idOrganizacionPolitica,organizacionPolitica,numeroCandidato,rutaArchivo,postulaDepartamento,postulaProvincia,postulaDistrito,cargo,nativo,txCodExpedienteExt
0,148662.0,1979-05-24T00:00:00,M,,0.0,40603685,VICTOR JENNER CHAFLOQUE SILVA,INSCRITO,14.0,PARTIDO DEMOCRATICO SOMOS PERU,0.0,/Assets/Fotos-HojaVida/148662.jpg,LAMBAYEQUE,CHICLAYO,ETEN,['ALCALDE DISTRITAL'],NO,ERM.2022010442
1,148663.0,1984-07-07T00:00:00,M,,0.0,45391660,GUSTAVO ADOLFO GONZALEZ REQUE,INSCRITO,14.0,PARTIDO DEMOCRATICO SOMOS PERU,1.0,/Assets/Fotos-HojaVida/148663.jpg,LAMBAYEQUE,CHICLAYO,ETEN,['REGIDOR DISTRITAL'],NO,ERM.2022010442
2,148664.0,1963-09-18T00:00:00,F,,0.0,16515839,MARIA CLOTILDE OLIVOS NECIOSUP,INSCRITO,14.0,PARTIDO DEMOCRATICO SOMOS PERU,2.0,/Assets/Fotos-HojaVida/148664.jpg,LAMBAYEQUE,CHICLAYO,ETEN,['REGIDOR DISTRITAL'],NO,ERM.2022010442
3,148665.0,1963-01-26T00:00:00,M,,0.0,16594728,MIGUEL ALFONSO CARRANZA COLCHON,INSCRITO,14.0,PARTIDO DEMOCRATICO SOMOS PERU,3.0,/Assets/Fotos-HojaVida/148665.jpg,LAMBAYEQUE,CHICLAYO,ETEN,['REGIDOR DISTRITAL'],NO,ERM.2022010442
4,148666.0,1988-07-31T00:00:00,F,,0.0,45217894,LEYVI PEREZ CRUZ DE CHAFLOQUE,INSCRITO,14.0,PARTIDO DEMOCRATICO SOMOS PERU,4.0,/Assets/Fotos-HojaVida/148666.jpg,LAMBAYEQUE,CHICLAYO,ETEN,['REGIDOR DISTRITAL'],NO,ERM.2022010442
5,148667.0,1995-05-18T00:00:00,M,,0.0,74082299,BRUNO FERNANDO RUBIO REQUE,INSCRITO,14.0,PARTIDO DEMOCRATICO SOMOS PERU,5.0,/Assets/Fotos-HojaVida/148667.jpg,LAMBAYEQUE,CHICLAYO,ETEN,['REGIDOR DISTRITAL'],NO,ERM.2022010442
