,idHojaVida,feNacimiento,txSexo,designado,idProcesoElectoral,numeroDocumento,nombreCompleto,estado,idOrganizacionPolitica,organizacionPolitica,numeroCandidato,rutaArchivo,postulaDepartamento,postulaProvincia,postulaDistrito,cargo,nativo,txCodExpedienteExt
0,184920.0,1994-02-01T00:00:00,M,,0.0,70818574,ENERSON JAIME RUIZ FERNANDEZ,INSCRITO,14.0,PARTIDO DEMOCRATICO SOMOS PERU,0.0,/Assets/Fotos-HojaVida/184920.jpg,LIMA,CAÑETE,IMPERIAL,['ALCALDE DISTRITAL'],NO,ERM.2022011531
1,184921.0,1986-04-02T00:00:00,F,,0.0,43725693,LESLY GISSELLE ESPICHAN VICENTE DE VICENTE,INSCRITO,14.0,PARTIDO DEMOCRATICO SOMOS PERU,1.0,/Assets/Fotos-HojaVida/184921.jpg,LIMA,CAÑETE,IMPERIAL,['REGIDOR DISTRITAL'],NO,ERM.2022011531
2,184922.0,1951-05-01T00:00:00,M,,0.0,15372692,FELIPE GERARDO HUAMAN GUTIERREZ,INSCRITO,14.0,PARTIDO DEMOCRATICO SOMOS PERU,2.0,/Assets/Fotos-HojaVida/184922.jpg,LIMA,CAÑETE,IMPERIAL,['REGIDOR DISTRITAL'],NO,ERM.2022011531
3,184923.0,1972-01-24T00:00:00,F,,0.0,15451387,MARIA SALOME GUTIERREZ CAHUANA,INSCRITO,14.0,PARTIDO DEMOCRATICO SOMOS PERU,3.0,/Assets/Fotos-HojaVida/184923.jpg,LIMA,CAÑETE,IMPERIAL,['REGIDOR DISTRITAL'],NO,ERM.2022011531
4,184924.0,1977-10-24T00:00:00,M,,0.0,15451409,CESAR AUGUSTO QUISPE SANCHEZ,INSCRITO,14.0,PARTIDO DEMOCRATICO SOMOS PERU,4.0,/Assets/Fotos-HojaVida/184924.jpg,LIMA,CAÑETE,IMPERIAL,['REGIDOR DISTRITAL'],NO,ERM.2022011531
5,184925.0,1975-02-08T00:00:00,F,,0.0,15431021,CARMEN GLORIA SOLAR ENCISO,INSCRITO,14.0,PARTIDO DEMOCRATICO SOMOS PERU,5.0,/Assets/Fotos-HojaVida/184925.jpg,LIMA,CAÑETE,IMPERIAL,['REGIDOR DISTRITAL'],NO,ERM.2022011531
6,184926.0,1996-03-13T00:00:00,M,,0.0,70786564,MIGUEL ANGEL HUARI BONIFACIO,INSCRITO,14.0,PARTIDO DEMOCRATICO SOMOS PERU,6.0,/Assets/Fotos-HojaVida/184926.jpg,LIMA,CAÑETE,IMPERIAL,['REGIDOR DISTRITAL'],NO,ERM.2022011531
7,184927.0,1993-09-26T00:00:00,F,,0.0,73032369,RUDDY INES UNTIVEROS YANCAN,INSCRITO,14.0,PARTIDO DEMOCRATICO SOMOS PERU,7.0,/Assets/Fotos-HojaVida/184927.jpg,LIMA,CAÑETE,IMPERIAL,['REGIDOR DISTRITAL'],NO,ERM.2022011531
