,idHojaVida,feNacimiento,txSexo,designado,idProcesoElectoral,numeroDocumento,nombreCompleto,estado,idOrganizacionPolitica,organizacionPolitica,numeroCandidato,rutaArchivo,postulaDepartamento,postulaProvincia,postulaDistrito,cargo,nativo,txCodExpedienteExt
0,205432.0,1989-10-01T00:00:00,M,,0.0,45967546,ANSELMO JOSE LIZARDO FLORES BERRU,INSCRITO,1388.0,MOVIMIENTO INDEPENDIENTE FUERZA REGIONAL,0.0,/Assets/Fotos-HojaVida/205432.jpg,PIURA,AYABACA,FRIAS,['ALCALDE DISTRITAL'],NO,ERM.2022017485
1,205433.0,1985-03-23T00:00:00,M,,0.0,42913833,EDWIM DARWIM RAMIREZ GODOS,INSCRITO,1388.0,MOVIMIENTO INDEPENDIENTE FUERZA REGIONAL,1.0,/Assets/Fotos-HojaVida/205433.jpg,PIURA,AYABACA,FRIAS,['REGIDOR DISTRITAL'],NO,ERM.2022017485
2,205434.0,1981-07-13T00:00:00,F,,0.0,41406954,FLOR EPIFANIA MONTALBAN LOPEZ,INSCRITO,1388.0,MOVIMIENTO INDEPENDIENTE FUERZA REGIONAL,2.0,/Assets/Fotos-HojaVida/205434.jpg,PIURA,AYABACA,FRIAS,['REGIDOR DISTRITAL'],NO,ERM.2022017485
3,205435.0,1997-07-26T00:00:00,M,,0.0,77049564,JOSE JAMAL LOZADA MACHACUAY,INSCRITO,1388.0,MOVIMIENTO INDEPENDIENTE FUERZA REGIONAL,3.0,/Assets/Fotos-HojaVida/205435.jpg,PIURA,AYABACA,FRIAS,['REGIDOR DISTRITAL'],NO,ERM.2022017485
4,205436.0,1991-05-30T00:00:00,F,,0.0,47142375,IRIS GUISELLA CORDOVA CALLE,INSCRITO,1388.0,MOVIMIENTO INDEPENDIENTE FUERZA REGIONAL,4.0,/Assets/Fotos-HojaVida/205436.jpg,PIURA,AYABACA,FRIAS,['REGIDOR DISTRITAL'],NO,ERM.2022017485
5,205437.0,1998-11-23T00:00:00,M,,0.0,73205128,JHOAN HENRY CASTILLO AGUILAR,INSCRITO,1388.0,MOVIMIENTO INDEPENDIENTE FUERZA REGIONAL,5.0,/Assets/Fotos-HojaVida/205437.jpg,PIURA,AYABACA,FRIAS,['REGIDOR DISTRITAL'],NO,ERM.2022017485
