,idHojaVida,feNacimiento,txSexo,designado,idProcesoElectoral,numeroDocumento,nombreCompleto,estado,idOrganizacionPolitica,organizacionPolitica,numeroCandidato,rutaArchivo,postulaDepartamento,postulaProvincia,postulaDistrito,cargo,nativo,txCodExpedienteExt
0,226108.0,1973-03-13T00:00:00,M,,0.0,32040858,PEDRO ANDRES RODRIGUEZ FIGUEROA,INSCRITO,1257.0,ALIANZA PARA EL PROGRESO,0.0,/Assets/Fotos-HojaVida/226108.jpg,LIMA,BARRANCA,SUPE,['ALCALDE DISTRITAL'],NO,ERM.2022015531
1,226109.0,1957-01-11T00:00:00,M,,0.0,15705845,CESAR ALEJANDRO BUSTAMANTE TELLO,INSCRITO,1257.0,ALIANZA PARA EL PROGRESO,1.0,/Assets/Fotos-HojaVida/226109.jpg,LIMA,BARRANCA,SUPE,['REGIDOR DISTRITAL'],NO,ERM.2022015531
2,226110.0,1997-02-11T00:00:00,F,,0.0,76270446,LUZ CLARITA EURIDISI ARQUINIGO RIOJAS,INSCRITO,1257.0,ALIANZA PARA EL PROGRESO,2.0,/Assets/Fotos-HojaVida/226110.jpg,LIMA,BARRANCA,SUPE,['REGIDOR DISTRITAL'],NO,ERM.2022015531
3,226111.0,1963-07-24T00:00:00,M,,0.0,15709199,VICTOR ARMANDO ROSALES CHILET,INSCRITO,1257.0,ALIANZA PARA EL PROGRESO,3.0,/Assets/Fotos-HojaVida/226111.jpg,LIMA,BARRANCA,SUPE,['REGIDOR DISTRITAL'],NO,ERM.2022015531
4,226112.0,1992-05-21T00:00:00,F,,0.0,47768562,DEBORA GEORGETTE TENAZOA BUSTAMANTE,INSCRITO,1257.0,ALIANZA PARA EL PROGRESO,4.0,/Assets/Fotos-HojaVida/226112.jpg,LIMA,BARRANCA,SUPE,['REGIDOR DISTRITAL'],NO,ERM.2022015531
5,226113.0,1997-10-18T00:00:00,M,,0.0,76226708,JOSUE ARMANDO ZAMUDIO VILCACHAGUA,INSCRITO,1257.0,ALIANZA PARA EL PROGRESO,5.0,/Assets/Fotos-HojaVida/226113.jpg,LIMA,BARRANCA,SUPE,['REGIDOR DISTRITAL'],NO,ERM.2022015531
6,241569.0,1977-07-08T00:00:00,F,,0.0,15863446,CLAUDIA CRISTINA BAZALAR MEDINA,INSCRITO,1257.0,ALIANZA PARA EL PROGRESO,6.0,/Assets/Fotos-HojaVida/241569.jpg,LIMA,BARRANCA,SUPE,['REGIDOR DISTRITAL'],NO,ERM.2022015531
7,241570.0,1993-08-29T00:00:00,M,,0.0,73134043,JUAN EDUARDO ROSALES SUAREZ,INSCRITO,1257.0,ALIANZA PARA EL PROGRESO,7.0,/Assets/Fotos-HojaVida/241570.jpg,LIMA,BARRANCA,SUPE,['REGIDOR DISTRITAL'],NO,ERM.2022015531
