,idHojaVida,feNacimiento,txSexo,designado,idProcesoElectoral,numeroDocumento,nombreCompleto,estado,idOrganizacionPolitica,organizacionPolitica,numeroCandidato,rutaArchivo,postulaDepartamento,postulaProvincia,postulaDistrito,cargo,nativo,txCodExpedienteExt
0,160658.0,1983-02-27T00:00:00,M,,0.0,41873268,JORGE CESAR CARBAJAL PACHAS,INSCRITO,1257.0,ALIANZA PARA EL PROGRESO,0.0,/Assets/Fotos-HojaVida/160658.jpg,ICA,PISCO,SAN ANDRES,['ALCALDE DISTRITAL'],NO,ERM.2022006412
1,160659.0,1990-09-01T00:00:00,F,,0.0,71740998,BRENDA STEFANY CASTRO TORRES,EXCLUSION,1257.0,ALIANZA PARA EL PROGRESO,1.0,/Assets/Fotos-HojaVida/160659.jpg,ICA,PISCO,SAN ANDRES,['REGIDOR DISTRITAL'],NO,ERM.2022006412
2,160660.0,1958-11-03T00:00:00,M,,0.0,22286925,JULIO HUMBERTO GARCIA WONG,INSCRITO,1257.0,ALIANZA PARA EL PROGRESO,2.0,/Assets/Fotos-HojaVida/160660.jpg,ICA,PISCO,SAN ANDRES,['REGIDOR DISTRITAL'],NO,ERM.2022006412
3,160661.0,1991-09-17T00:00:00,F,,0.0,46900279,TESSIE CAROLINA VERGARA IZQUIERDO,INSCRITO,1257.0,ALIANZA PARA EL PROGRESO,3.0,/Assets/Fotos-HojaVida/160661.jpg,ICA,PISCO,SAN ANDRES,['REGIDOR DISTRITAL'],NO,ERM.2022006412
4,160662.0,1992-06-30T00:00:00,M,,0.0,71295832,LUIS EDUARDO CORONADO DE LA CRUZ,EXCLUSION,1257.0,ALIANZA PARA EL PROGRESO,4.0,/Assets/Fotos-HojaVida/160662.jpg,ICA,PISCO,SAN ANDRES,['REGIDOR DISTRITAL'],NO,ERM.2022006412
5,160663.0,1996-08-09T00:00:00,F,,0.0,70138219,ALEXANDRA CAMILA ALVARO GARCIA,INSCRITO,1257.0,ALIANZA PARA EL PROGRESO,5.0,/Assets/Fotos-HojaVida/160663.jpg,ICA,PISCO,SAN ANDRES,['REGIDOR DISTRITAL'],NO,ERM.2022006412
