,idHojaVida,feNacimiento,txSexo,designado,idProcesoElectoral,numeroDocumento,nombreCompleto,estado,idOrganizacionPolitica,organizacionPolitica,numeroCandidato,rutaArchivo,postulaDepartamento,postulaProvincia,postulaDistrito,cargo,nativo,txCodExpedienteExt
0,155786.0,1963-09-08T00:00:00,M,,0.0,17570327,CARLOS HUMBERTO FALLA CASTILLO,INSCRITO,2173.0,AVANZA PAIS - PARTIDO DE INTEGRACION SOCIAL,0.0,/Assets/Fotos-HojaVida/155786.jpg,LAMBAYEQUE,LAMBAYEQUE,MOTUPE,['ALCALDE DISTRITAL'],NO,ERM.2022006560
1,155787.0,1966-02-17T00:00:00,M,,0.0,17572873,JORGE ANTONIO ALCANTARA RODRIGUEZ,INSCRITO,2173.0,AVANZA PAIS - PARTIDO DE INTEGRACION SOCIAL,1.0,/Assets/Fotos-HojaVida/155787.jpg,LAMBAYEQUE,LAMBAYEQUE,MOTUPE,['REGIDOR DISTRITAL'],NO,ERM.2022006560
2,155788.0,1991-08-18T00:00:00,F,,0.0,47457195,KATHERINE LISSETT SANCHEZ ZAPATA,INSCRITO,2173.0,AVANZA PAIS - PARTIDO DE INTEGRACION SOCIAL,2.0,/Assets/Fotos-HojaVida/155788.jpg,LAMBAYEQUE,LAMBAYEQUE,MOTUPE,['REGIDOR DISTRITAL'],NO,ERM.2022006560
3,155789.0,1991-04-29T00:00:00,M,,0.0,47228719,JESUS MARTIN RAMON OLIVOS FAYA,INSCRITO,2173.0,AVANZA PAIS - PARTIDO DE INTEGRACION SOCIAL,3.0,/Assets/Fotos-HojaVida/155789.jpg,LAMBAYEQUE,LAMBAYEQUE,MOTUPE,['REGIDOR DISTRITAL'],NO,ERM.2022006560
4,155790.0,1960-01-02T00:00:00,F,,0.0,17576330,IRIS VICTORIA ADRIANZEN GAMARRA,INSCRITO,2173.0,AVANZA PAIS - PARTIDO DE INTEGRACION SOCIAL,4.0,/Assets/Fotos-HojaVida/155790.jpg,LAMBAYEQUE,LAMBAYEQUE,MOTUPE,['REGIDOR DISTRITAL'],NO,ERM.2022006560
5,155791.0,1999-07-25T00:00:00,M,,0.0,75703445,ALEXIS IVAN GUTIERREZ LEONARDO,INSCRITO,2173.0,AVANZA PAIS - PARTIDO DE INTEGRACION SOCIAL,5.0,/Assets/Fotos-HojaVida/155791.jpg,LAMBAYEQUE,LAMBAYEQUE,MOTUPE,['REGIDOR DISTRITAL'],NO,ERM.2022006560
6,155792.0,1995-03-16T00:00:00,F,,0.0,74246900,DANIELA THALIA MURO SANCHEZ,INSCRITO,2173.0,AVANZA PAIS - PARTIDO DE INTEGRACION SOCIAL,6.0,/Assets/Fotos-HojaVida/155792.jpg,LAMBAYEQUE,LAMBAYEQUE,MOTUPE,['REGIDOR DISTRITAL'],NO,ERM.2022006560
7,155793.0,1959-04-30T00:00:00,M,,0.0,08633384,PROSPERO GERARDO PEREZ PERALES,IMPROCEDENTE,2173.0,AVANZA PAIS - PARTIDO DE INTEGRACION SOCIAL,7.0,/Assets/Fotos-HojaVida/155793.jpg,LAMBAYEQUE,LAMBAYEQUE,MOTUPE,['REGIDOR DISTRITAL'],NO,ERM.2022006560
