,idHojaVida,feNacimiento,txSexo,designado,idProcesoElectoral,numeroDocumento,nombreCompleto,estado,idOrganizacionPolitica,organizacionPolitica,numeroCandidato,rutaArchivo,postulaDepartamento,postulaProvincia,postulaDistrito,cargo,nativo,txCodExpedienteExt
0,197332.0,1977-09-06T00:00:00,M,,0.0,80315389,PEDRO EDWARD REAÑO MARQUEZ,INSCRITO,14.0,PARTIDO DEMOCRATICO SOMOS PERU,0.0,/Assets/Fotos-HojaVida/197332.jpg,PIURA,SULLANA,QUERECOTILLO,['ALCALDE DISTRITAL'],NO,ERM.2022010126
1,197333.0,1974-05-20T00:00:00,M,,0.0,03665873,SEGUNDO DUVERLI DE LOS SANTOS CARRANZA,INSCRITO,14.0,PARTIDO DEMOCRATICO SOMOS PERU,1.0,/Assets/Fotos-HojaVida/197333.jpg,PIURA,SULLANA,QUERECOTILLO,['REGIDOR DISTRITAL'],NO,ERM.2022010126
2,197334.0,1976-12-08T00:00:00,F,,0.0,03694051,ILIANA DE LOS MILAGROS SILVA FARIAS,INSCRITO,14.0,PARTIDO DEMOCRATICO SOMOS PERU,2.0,/Assets/Fotos-HojaVida/197334.jpg,PIURA,SULLANA,QUERECOTILLO,['REGIDOR DISTRITAL'],NO,ERM.2022010126
3,197335.0,1975-07-16T00:00:00,M,,0.0,03675926,MANUEL ANTONIO CASTILLO SILUPU,INSCRITO,14.0,PARTIDO DEMOCRATICO SOMOS PERU,3.0,/Assets/Fotos-HojaVida/197335.jpg,PIURA,SULLANA,QUERECOTILLO,['REGIDOR DISTRITAL'],NO,ERM.2022010126
4,197336.0,1997-03-19T00:00:00,F,,0.0,73511316,MARITA DEL PILAR VILCHEZ ALBURQUEQUE,INSCRITO,14.0,PARTIDO DEMOCRATICO SOMOS PERU,4.0,/Assets/Fotos-HojaVida/197336.jpg,PIURA,SULLANA,QUERECOTILLO,['REGIDOR DISTRITAL'],NO,ERM.2022010126
5,197337.0,1994-09-20T00:00:00,M,,0.0,72906988,YIN DENIS ENCALADA CARREÑO,INSCRITO,14.0,PARTIDO DEMOCRATICO SOMOS PERU,5.0,/Assets/Fotos-HojaVida/197337.jpg,PIURA,SULLANA,QUERECOTILLO,['REGIDOR DISTRITAL'],NO,ERM.2022010126
6,197338.0,1990-07-30T00:00:00,F,,0.0,46446702,WILMA MILAGROS ZAPATA RIVERA,INSCRITO,14.0,PARTIDO DEMOCRATICO SOMOS PERU,6.0,/Assets/Fotos-HojaVida/197338.jpg,PIURA,SULLANA,QUERECOTILLO,['REGIDOR DISTRITAL'],NO,ERM.2022010126
7,197339.0,1973-08-24T00:00:00,M,,0.0,80598596,LUIS ALBERTO SUNCION MANRIQUE,INSCRITO,14.0,PARTIDO DEMOCRATICO SOMOS PERU,7.0,/Assets/Fotos-HojaVida/197339.jpg,PIURA,SULLANA,QUERECOTILLO,['REGIDOR DISTRITAL'],NO,ERM.2022010126
