,idHojaVida,feNacimiento,txSexo,designado,idProcesoElectoral,numeroDocumento,nombreCompleto,estado,idOrganizacionPolitica,organizacionPolitica,numeroCandidato,rutaArchivo,postulaDepartamento,postulaProvincia,postulaDistrito,cargo,nativo,txCodExpedienteExt
0,212964.0,1957-10-24T00:00:00,M,,0.0,10567721,DAVID OSCAR OYOLA ABARCA,INSCRITO,14.0,PARTIDO DEMOCRATICO SOMOS PERU,0.0,/Assets/Fotos-HojaVida/212964.jpg,LIMA,HUAURA,HUALMAY,['ALCALDE DISTRITAL'],NO,ERM.2022012945
1,212965.0,1984-06-01T00:00:00,M,,0.0,42426453,MAYCOL EDILBERTO PALOMARES RETUERTO,INSCRITO,14.0,PARTIDO DEMOCRATICO SOMOS PERU,1.0,/Assets/Fotos-HojaVida/212965.jpg,LIMA,HUAURA,HUALMAY,['REGIDOR DISTRITAL'],NO,ERM.2022012945
2,212966.0,1998-10-19T00:00:00,F,,0.0,74300531,ANGELICA MILAGROS QUIRI MEJIA,INSCRITO,14.0,PARTIDO DEMOCRATICO SOMOS PERU,2.0,/Assets/Fotos-HojaVida/212966.jpg,LIMA,HUAURA,HUALMAY,['REGIDOR DISTRITAL'],NO,ERM.2022012945
3,212969.0,1990-06-26T00:00:00,M,,0.0,48382691,ALDO JESUS VERANO RIVERA,INSCRITO,14.0,PARTIDO DEMOCRATICO SOMOS PERU,3.0,/Assets/Fotos-HojaVida/212969.jpg,LIMA,HUAURA,HUALMAY,['REGIDOR DISTRITAL'],NO,ERM.2022012945
4,212968.0,1989-11-23T00:00:00,F,,0.0,46064601,LOURDES ANA CECILIA OLIVARES CASTILLO,INSCRITO,14.0,PARTIDO DEMOCRATICO SOMOS PERU,4.0,/Assets/Fotos-HojaVida/212968.jpg,LIMA,HUAURA,HUALMAY,['REGIDOR DISTRITAL'],NO,ERM.2022012945
5,241720.0,1976-01-11T00:00:00,M,,0.0,15744263,OMAR ULISES MEDINA MEJIA,INSCRITO,14.0,PARTIDO DEMOCRATICO SOMOS PERU,5.0,/Assets/Fotos-HojaVida/241720.jpg,LIMA,HUAURA,HUALMAY,['REGIDOR DISTRITAL'],NO,ERM.2022012945
6,241718.0,1977-09-20T00:00:00,F,,0.0,80283061,ARLYNE NINA COTRINA ANAYA,INSCRITO,14.0,PARTIDO DEMOCRATICO SOMOS PERU,6.0,/Assets/Fotos-HojaVida/241718.jpg,LIMA,HUAURA,HUALMAY,['REGIDOR DISTRITAL'],NO,ERM.2022012945
7,212971.0,1999-12-10T00:00:00,M,,0.0,73324801,LUIS ANGEL JIMENEZ AYORA,INSCRITO,14.0,PARTIDO DEMOCRATICO SOMOS PERU,7.0,/Assets/Fotos-HojaVida/212971.jpg,LIMA,HUAURA,HUALMAY,['REGIDOR DISTRITAL'],NO,ERM.2022012945
