,idHojaVida,feNacimiento,txSexo,designado,idProcesoElectoral,numeroDocumento,nombreCompleto,estado,idOrganizacionPolitica,organizacionPolitica,numeroCandidato,rutaArchivo,postulaDepartamento,postulaProvincia,postulaDistrito,cargo,nativo,txCodExpedienteExt
0,155065.0,1980-06-24T00:00:00,M,,0.0,44161387,JUAN CARLOS MALCA PALACIOS,INSCRITO,2173.0,AVANZA PAIS - PARTIDO DE INTEGRACION SOCIAL,1.0,/Assets/Fotos-HojaVida/155065.jpg,AREQUIPA,CARAVELI,LOMAS,['REGIDOR DISTRITAL'],NO,ERM.2022028665
1,155068.0,1990-10-04T00:00:00,F,,0.0,46694349,ZAIRA ROSARIO RUBIO ANDRADE,INSCRITO,2173.0,AVANZA PAIS - PARTIDO DE INTEGRACION SOCIAL,4.0,/Assets/Fotos-HojaVida/155068.jpg,AREQUIPA,CARAVELI,LOMAS,['REGIDOR DISTRITAL'],NO,ERM.2022028665
2,155066.0,1991-07-30T00:00:00,F,,0.0,47206266,ABIGAIL DENISSE ACOSTA VENTURO,INSCRITO,2173.0,AVANZA PAIS - PARTIDO DE INTEGRACION SOCIAL,2.0,/Assets/Fotos-HojaVida/155066.jpg,AREQUIPA,CARAVELI,LOMAS,['REGIDOR DISTRITAL'],NO,ERM.2022028665
3,155064.0,1992-06-16T00:00:00,F,,0.0,72311957,LINDA JAEL FERIA SERVELEON,INSCRITO,2173.0,AVANZA PAIS - PARTIDO DE INTEGRACION SOCIAL,0.0,/Assets/Fotos-HojaVida/155064.jpg,AREQUIPA,CARAVELI,LOMAS,['ALCALDE DISTRITAL'],NO,ERM.2022028665
4,155067.0,1996-03-11T00:00:00,M,,0.0,77160169,RAFAEL SMITH MEJIA DE LA CRUZ,INSCRITO,2173.0,AVANZA PAIS - PARTIDO DE INTEGRACION SOCIAL,3.0,/Assets/Fotos-HojaVida/155067.jpg,AREQUIPA,CARAVELI,LOMAS,['REGIDOR DISTRITAL'],NO,ERM.2022028665
5,155069.0,1998-09-30T00:00:00,M,,0.0,78111611,LUIS MANUEL AYBAR SALCEDO,INSCRITO,2173.0,AVANZA PAIS - PARTIDO DE INTEGRACION SOCIAL,5.0,/Assets/Fotos-HojaVida/155069.jpg,AREQUIPA,CARAVELI,LOMAS,['REGIDOR DISTRITAL'],NO,ERM.2022028665
