,idHojaVida,feNacimiento,txSexo,designado,idProcesoElectoral,numeroDocumento,nombreCompleto,estado,idOrganizacionPolitica,organizacionPolitica,numeroCandidato,rutaArchivo,postulaDepartamento,postulaProvincia,postulaDistrito,cargo,nativo,txCodExpedienteExt
0,149744.0,1955-05-09T00:00:00,M,,0.0,30417390,ZOILO JOSE GILBERTO CARNERO CARNERO,INSCRITO,142.0,"AREQUIPA, TRADICION Y FUTURO",0.0,/Assets/Fotos-HojaVida/149744.jpg,AREQUIPA,CAMANA,OCOÑA,"['ALCALDE DISTRITAL', 'ALCALDE DISTRITAL']",NO,ERM.2022016934
1,149745.0,1978-02-06T00:00:00,F,,0.0,30428302,YASMINE MARLEN MONTOYA MONTOYA,INSCRITO,142.0,"AREQUIPA, TRADICION Y FUTURO",1.0,/Assets/Fotos-HojaVida/149745.jpg,AREQUIPA,CAMANA,OCOÑA,"['REGIDOR DISTRITAL', 'REGIDOR DISTRITAL']",NO,ERM.2022016934
2,149746.0,1962-12-15T00:00:00,M,,0.0,30416542,EUSEBIO FERNANDO MENDOZA PAREDES,INSCRITO,142.0,"AREQUIPA, TRADICION Y FUTURO",2.0,/Assets/Fotos-HojaVida/149746.jpg,AREQUIPA,CAMANA,OCOÑA,"['REGIDOR DISTRITAL', 'REGIDOR DISTRITAL']",NO,ERM.2022016934
3,149747.0,1962-01-17T00:00:00,F,,0.0,30416132,ANA MARIA CABALLERO DONGO,INSCRITO,142.0,"AREQUIPA, TRADICION Y FUTURO",3.0,/Assets/Fotos-HojaVida/149747.jpg,AREQUIPA,CAMANA,OCOÑA,"['REGIDOR DISTRITAL', 'REGIDOR DISTRITAL']",NO,ERM.2022016934
4,149748.0,1984-04-30T00:00:00,M,,0.0,42389141,SAIN ALASMAN CARRERA PALOMINO,INSCRITO,142.0,"AREQUIPA, TRADICION Y FUTURO",4.0,/Assets/Fotos-HojaVida/149748.jpg,AREQUIPA,CAMANA,OCOÑA,"['REGIDOR DISTRITAL', 'REGIDOR DISTRITAL']",NO,ERM.2022016934
5,149749.0,2003-03-20T00:00:00,F,,0.0,73488693,CIELO SELLEY VILLALOBOS CHAUCA,INSCRITO,142.0,"AREQUIPA, TRADICION Y FUTURO",5.0,/Assets/Fotos-HojaVida/149749.jpg,AREQUIPA,CAMANA,OCOÑA,"['REGIDOR DISTRITAL', 'REGIDOR DISTRITAL']",NO,ERM.2022016934
