,idHojaVida,feNacimiento,txSexo,designado,idProcesoElectoral,numeroDocumento,nombreCompleto,estado,idOrganizacionPolitica,organizacionPolitica,numeroCandidato,rutaArchivo,postulaDepartamento,postulaProvincia,postulaDistrito,cargo,nativo,txCodExpedienteExt
0,202980.0,1980-02-24T00:00:00,M,,0.0,41696113,JOSE MARINO SUCCHIL SALAZAR,INSCRITO,14.0,PARTIDO DEMOCRATICO SOMOS PERU,0.0,/Assets/Fotos-HojaVida/202980.jpg,LA LIBERTAD,PACASMAYO,JEQUETEPEQUE,['ALCALDE DISTRITAL'],NO,ERM.2022015957
1,202981.0,1970-09-01T00:00:00,M,,0.0,19252264,JAIME JOSE MEDINA SALDAÑA,INSCRITO,14.0,PARTIDO DEMOCRATICO SOMOS PERU,1.0,/Assets/Fotos-HojaVida/202981.jpg,LA LIBERTAD,PACASMAYO,JEQUETEPEQUE,['REGIDOR DISTRITAL'],NO,ERM.2022015957
2,202982.0,1991-07-16T00:00:00,F,,0.0,47451503,MARIA DEL CARMEN TIRADO CRUZ,INSCRITO,14.0,PARTIDO DEMOCRATICO SOMOS PERU,2.0,/Assets/Fotos-HojaVida/202982.jpg,LA LIBERTAD,PACASMAYO,JEQUETEPEQUE,['REGIDOR DISTRITAL'],NO,ERM.2022015957
3,202983.0,1983-09-08T00:00:00,M,,0.0,43392484,LEONARDO RUPERTO ARIAS MACHUCA,INSCRITO,14.0,PARTIDO DEMOCRATICO SOMOS PERU,3.0,/Assets/Fotos-HojaVida/202983.jpg,LA LIBERTAD,PACASMAYO,JEQUETEPEQUE,['REGIDOR DISTRITAL'],NO,ERM.2022015957
4,202984.0,1998-11-29T00:00:00,F,,0.0,71575091,CAMILA MARISOL MALCA VILLANUEVA,INSCRITO,14.0,PARTIDO DEMOCRATICO SOMOS PERU,4.0,/Assets/Fotos-HojaVida/202984.jpg,LA LIBERTAD,PACASMAYO,JEQUETEPEQUE,['REGIDOR DISTRITAL'],NO,ERM.2022015957
5,202985.0,2000-06-12T00:00:00,M,,0.0,71570279,JOSE MANUEL DIAZ PAIRAZAMAN,INSCRITO,14.0,PARTIDO DEMOCRATICO SOMOS PERU,5.0,/Assets/Fotos-HojaVida/202985.jpg,LA LIBERTAD,PACASMAYO,JEQUETEPEQUE,['REGIDOR DISTRITAL'],NO,ERM.2022015957
