,idHojaVida,feNacimiento,txSexo,designado,idProcesoElectoral,numeroDocumento,nombreCompleto,estado,idOrganizacionPolitica,organizacionPolitica,numeroCandidato,rutaArchivo,postulaDepartamento,postulaProvincia,postulaDistrito,cargo,nativo,txCodExpedienteExt
0,218440.0,1984-02-13T00:00:00,M,,0.0,42303012,MOISES RAFAEL PORTILLA CHAHUAYO,INSCRITO,2307.0,MOVIMIENTO REGIONAL AREQUIPA AVANCEMOS,0.0,/Assets/Fotos-HojaVida/218440.jpg,AREQUIPA,CASTILLA,VIRACO,['ALCALDE DISTRITAL'],NO,ERM.2022017152
1,218441.0,2000-04-01T00:00:00,F,,0.0,76759172,BRICEYDA ELIZABETH DEL CARPIO GAMERO,IMPROCEDENTE,2307.0,MOVIMIENTO REGIONAL AREQUIPA AVANCEMOS,1.0,/Assets/Fotos-HojaVida/218441.jpg,AREQUIPA,CASTILLA,VIRACO,['REGIDOR DISTRITAL'],NO,ERM.2022017152
2,218442.0,1975-09-12T00:00:00,M,,0.0,30584754,VICTOR RAUL LEONCIO CASAS RANILLA,INSCRITO,2307.0,MOVIMIENTO REGIONAL AREQUIPA AVANCEMOS,2.0,/Assets/Fotos-HojaVida/218442.jpg,AREQUIPA,CASTILLA,VIRACO,['REGIDOR DISTRITAL'],NO,ERM.2022017152
3,218443.0,2002-07-08T00:00:00,F,,0.0,76759165,PAMELA SHIRLEY FLORES CALACHUA,INSCRITO,2307.0,MOVIMIENTO REGIONAL AREQUIPA AVANCEMOS,3.0,/Assets/Fotos-HojaVida/218443.jpg,AREQUIPA,CASTILLA,VIRACO,['REGIDOR DISTRITAL'],NO,ERM.2022017152
4,218444.0,1969-08-28T00:00:00,M,,0.0,29642301,AGUSTIN EDUARDO YAULLI PUMA,INSCRITO,2307.0,MOVIMIENTO REGIONAL AREQUIPA AVANCEMOS,4.0,/Assets/Fotos-HojaVida/218444.jpg,AREQUIPA,CASTILLA,VIRACO,['REGIDOR DISTRITAL'],NO,ERM.2022017152
5,218445.0,1958-08-24T00:00:00,F,,0.0,30572719,LUISA NELLY FLORES RAMOS,INSCRITO,2307.0,MOVIMIENTO REGIONAL AREQUIPA AVANCEMOS,5.0,/Assets/Fotos-HojaVida/218445.jpg,AREQUIPA,CASTILLA,VIRACO,['REGIDOR DISTRITAL'],NO,ERM.2022017152
