,idHojaVida,feNacimiento,txSexo,designado,idProcesoElectoral,numeroDocumento,nombreCompleto,estado,idOrganizacionPolitica,organizacionPolitica,numeroCandidato,rutaArchivo,postulaDepartamento,postulaProvincia,postulaDistrito,cargo,nativo,txCodExpedienteExt
0,236014.0,1970-06-05T00:00:00,F,,0.0,32925291,LUZ MARIA LOPEZ MENDEZ,IMPROCEDENTE,14.0,PARTIDO DEMOCRATICO SOMOS PERU,0.0,/Assets/Fotos-HojaVida/236014.jpg,ANCASH,SANTA,NEPEÑA,['ALCALDE DISTRITAL'],NO,ERM.2022012935
1,236015.0,1963-10-20T00:00:00,F,,0.0,32857902,JUANA MILAGROS GERVACIO MANRIQUE DE CARRANZA,INSCRITO,14.0,PARTIDO DEMOCRATICO SOMOS PERU,1.0,/Assets/Fotos-HojaVida/236015.jpg,ANCASH,SANTA,NEPEÑA,['REGIDOR DISTRITAL'],NO,ERM.2022012935
2,236016.0,1961-06-02T00:00:00,M,,0.0,32882607,MARCELINO ALEJANDRO ROMERO ROMERO,IMPROCEDENTE,14.0,PARTIDO DEMOCRATICO SOMOS PERU,2.0,/Assets/Fotos-HojaVida/236016.jpg,ANCASH,SANTA,NEPEÑA,['REGIDOR DISTRITAL'],NO,ERM.2022012935
3,236017.0,1961-01-20T00:00:00,F,,0.0,32950792,FLOR ESTHER GONZALES BACA,INSCRITO,14.0,PARTIDO DEMOCRATICO SOMOS PERU,3.0,/Assets/Fotos-HojaVida/236017.jpg,ANCASH,SANTA,NEPEÑA,['REGIDOR DISTRITAL'],NO,ERM.2022012935
4,236018.0,1999-05-07T00:00:00,M,,0.0,70150396,DAVID CALEB RODRIGUEZ ROMERO,INSCRITO,14.0,PARTIDO DEMOCRATICO SOMOS PERU,4.0,/Assets/Fotos-HojaVida/236018.jpg,ANCASH,SANTA,NEPEÑA,['REGIDOR DISTRITAL'],NO,ERM.2022012935
5,236019.0,1961-06-18T00:00:00,F,,0.0,32877877,PAULA MARIA VIDAL HUAMAN,INSCRITO,14.0,PARTIDO DEMOCRATICO SOMOS PERU,5.0,/Assets/Fotos-HojaVida/236019.jpg,ANCASH,SANTA,NEPEÑA,['REGIDOR DISTRITAL'],NO,ERM.2022012935
