,idHojaVida,feNacimiento,txSexo,designado,idProcesoElectoral,numeroDocumento,nombreCompleto,estado,idOrganizacionPolitica,organizacionPolitica,numeroCandidato,rutaArchivo,postulaDepartamento,postulaProvincia,postulaDistrito,cargo,nativo,txCodExpedienteExt
0,233414.0,1961-07-16T00:00:00,M,,0.0,07786796,CARLOS ALBERTO GONZALES SIFUENTES,INSCRITO,2173.0,AVANZA PAIS - PARTIDO DE INTEGRACION SOCIAL,0.0,/Assets/Fotos-HojaVida/233414.jpg,LIMA,OYON,PACHANGARA,['ALCALDE DISTRITAL'],NO,ERM.2022012952
1,233415.0,1960-08-24T00:00:00,M,,0.0,08556134,TIMOTEO NONATO ESTRADA ROSALES,INSCRITO,2173.0,AVANZA PAIS - PARTIDO DE INTEGRACION SOCIAL,1.0,/Assets/Fotos-HojaVida/233415.jpg,LIMA,OYON,PACHANGARA,['REGIDOR DISTRITAL'],NO,ERM.2022012952
2,233416.0,2000-06-09T00:00:00,F,,0.0,74083326,NIEVES IMELDA LEON FUENTES RIVERA,INSCRITO,2173.0,AVANZA PAIS - PARTIDO DE INTEGRACION SOCIAL,2.0,/Assets/Fotos-HojaVida/233416.jpg,LIMA,OYON,PACHANGARA,['REGIDOR DISTRITAL'],NO,ERM.2022012952
3,233417.0,1973-08-24T00:00:00,M,,0.0,15218071,JUAN NINO CANO LOPEZ,INSCRITO,2173.0,AVANZA PAIS - PARTIDO DE INTEGRACION SOCIAL,3.0,/Assets/Fotos-HojaVida/233417.jpg,LIMA,OYON,PACHANGARA,['REGIDOR DISTRITAL'],NO,ERM.2022012952
4,233418.0,1997-09-27T00:00:00,F,,0.0,70785764,CELIA MERCEDES CARDENAS EGUIZABAL,INSCRITO,2173.0,AVANZA PAIS - PARTIDO DE INTEGRACION SOCIAL,4.0,/Assets/Fotos-HojaVida/233418.jpg,LIMA,OYON,PACHANGARA,['REGIDOR DISTRITAL'],NO,ERM.2022012952
5,233419.0,1991-03-29T00:00:00,M,,0.0,70784012,JOSE ALEXSANDER GAMARRA CARMEN,INSCRITO,2173.0,AVANZA PAIS - PARTIDO DE INTEGRACION SOCIAL,5.0,/Assets/Fotos-HojaVida/233419.jpg,LIMA,OYON,PACHANGARA,['REGIDOR DISTRITAL'],NO,ERM.2022012952
