,idHojaVida,feNacimiento,txSexo,designado,idProcesoElectoral,numeroDocumento,nombreCompleto,estado,idOrganizacionPolitica,organizacionPolitica,numeroCandidato,rutaArchivo,postulaDepartamento,postulaProvincia,postulaDistrito,cargo,nativo,txCodExpedienteExt
0,184472.0,1991-04-08T00:00:00,F,,0.0,47186525,MARILIA NORMA YUCRA MAMANI,INSCRITO,2173.0,AVANZA PAIS - PARTIDO DE INTEGRACION SOCIAL,0.0,/Assets/Fotos-HojaVida/184472.jpg,AREQUIPA,AREQUIPA,SACHACA,['ALCALDE DISTRITAL'],NO,ERM.2022017999
1,184473.0,1979-06-17T00:00:00,M,,0.0,40189525,FRANCISCO JAVIER ZUÑIGA BUSTAMANTE,INSCRITO,2173.0,AVANZA PAIS - PARTIDO DE INTEGRACION SOCIAL,1.0,/Assets/Fotos-HojaVida/184473.jpg,AREQUIPA,AREQUIPA,SACHACA,['REGIDOR DISTRITAL'],NO,ERM.2022017999
2,184474.0,1961-07-05T00:00:00,F,,0.0,29507520,BEATRIZ VILCA CALCINA DE ALVAREZ,INSCRITO,2173.0,AVANZA PAIS - PARTIDO DE INTEGRACION SOCIAL,2.0,/Assets/Fotos-HojaVida/184474.jpg,AREQUIPA,AREQUIPA,SACHACA,['REGIDOR DISTRITAL'],NO,ERM.2022017999
3,184475.0,1990-06-08T00:00:00,M,,0.0,70678471,RONALD JUNIOR ESPINOZA VILLANUEVA,INSCRITO,2173.0,AVANZA PAIS - PARTIDO DE INTEGRACION SOCIAL,3.0,/Assets/Fotos-HojaVida/184475.jpg,AREQUIPA,AREQUIPA,SACHACA,['REGIDOR DISTRITAL'],NO,ERM.2022017999
4,184476.0,1966-10-19T00:00:00,F,,0.0,29478660,VICENTINA ISABEL NINAQUISPE PAUCARA,INSCRITO,2173.0,AVANZA PAIS - PARTIDO DE INTEGRACION SOCIAL,4.0,/Assets/Fotos-HojaVida/184476.jpg,AREQUIPA,AREQUIPA,SACHACA,['REGIDOR DISTRITAL'],NO,ERM.2022017999
5,184477.0,1987-06-06T00:00:00,M,,0.0,44280733,FRANCHESKOLY JESUS MOLLEDA HUERTA,INSCRITO,2173.0,AVANZA PAIS - PARTIDO DE INTEGRACION SOCIAL,5.0,/Assets/Fotos-HojaVida/184477.jpg,AREQUIPA,AREQUIPA,SACHACA,['REGIDOR DISTRITAL'],NO,ERM.2022017999
6,184478.0,2000-06-01T00:00:00,F,,0.0,72433253,GABRIELA KARIN YRIGOYEN CHAVEZ,INSCRITO,2173.0,AVANZA PAIS - PARTIDO DE INTEGRACION SOCIAL,6.0,/Assets/Fotos-HojaVida/184478.jpg,AREQUIPA,AREQUIPA,SACHACA,['REGIDOR DISTRITAL'],NO,ERM.2022017999
7,184479.0,1995-08-14T00:00:00,M,,0.0,71637475,JUAN FERNANDO VALDIVIA OSORIO,INSCRITO,2173.0,AVANZA PAIS - PARTIDO DE INTEGRACION SOCIAL,7.0,/Assets/Fotos-HojaVida/184479.jpg,AREQUIPA,AREQUIPA,SACHACA,['REGIDOR DISTRITAL'],NO,ERM.2022017999
