,idHojaVida,feNacimiento,txSexo,designado,idProcesoElectoral,numeroDocumento,nombreCompleto,estado,idOrganizacionPolitica,organizacionPolitica,numeroCandidato,rutaArchivo,postulaDepartamento,postulaProvincia,postulaDistrito,cargo,nativo,txCodExpedienteExt
0,196928.0,1982-05-18T00:00:00,M,,0.0,43502313,EDINSON ROSARIO ROJAS QUISPE,INSCRITO,1388.0,MOVIMIENTO INDEPENDIENTE FUERZA REGIONAL,0.0,/Assets/Fotos-HojaVida/196928.jpg,PIURA,MORROPON,CHALACO,"['ALCALDE DISTRITAL', 'ALCALDE DISTRITAL']",NO,ERM.2022016632
1,196929.0,1976-08-31T00:00:00,M,,0.0,03365968,VICTOR RAMON CORDOVA RAMIREZ,INSCRITO,1388.0,MOVIMIENTO INDEPENDIENTE FUERZA REGIONAL,1.0,/Assets/Fotos-HojaVida/196929.jpg,PIURA,MORROPON,CHALACO,"['REGIDOR DISTRITAL', 'REGIDOR DISTRITAL']",NO,ERM.2022016632
2,196930.0,1985-11-01T00:00:00,F,,0.0,43256891,MILLIE DEL CARMEN ATOCHE ALEMAN DE GARCIA,INSCRITO,1388.0,MOVIMIENTO INDEPENDIENTE FUERZA REGIONAL,2.0,/Assets/Fotos-HojaVida/196930.jpg,PIURA,MORROPON,CHALACO,"['REGIDOR DISTRITAL', 'REGIDOR DISTRITAL']",NO,ERM.2022016632
3,196931.0,1989-05-27T00:00:00,M,,0.0,45864805,FRANK LENNER PEÑA CORDOVA,INSCRITO,1388.0,MOVIMIENTO INDEPENDIENTE FUERZA REGIONAL,3.0,/Assets/Fotos-HojaVida/196931.jpg,PIURA,MORROPON,CHALACO,"['REGIDOR DISTRITAL', 'REGIDOR DISTRITAL']",NO,ERM.2022016632
4,196932.0,1971-03-15T00:00:00,F,,0.0,03359521,MARIA SILVIA BERMEO RAMIREZ,INSCRITO,1388.0,MOVIMIENTO INDEPENDIENTE FUERZA REGIONAL,4.0,/Assets/Fotos-HojaVida/196932.jpg,PIURA,MORROPON,CHALACO,"['REGIDOR DISTRITAL', 'REGIDOR DISTRITAL']",NO,ERM.2022016632
5,196933.0,1995-05-10T00:00:00,M,,0.0,70409353,LUIS JENNER CORDOVA CORDOVA,INSCRITO,1388.0,MOVIMIENTO INDEPENDIENTE FUERZA REGIONAL,5.0,/Assets/Fotos-HojaVida/196933.jpg,PIURA,MORROPON,CHALACO,"['REGIDOR DISTRITAL', 'REGIDOR DISTRITAL']",NO,ERM.2022016632
