,idHojaVida,feNacimiento,txSexo,designado,idProcesoElectoral,numeroDocumento,nombreCompleto,estado,idOrganizacionPolitica,organizacionPolitica,numeroCandidato,rutaArchivo,postulaDepartamento,postulaProvincia,postulaDistrito,cargo,nativo,txCodExpedienteExt
0,170154.0,1959-06-17T00:00:00,M,,0.0,21507611,ISMAEL FRANCISCO CARPIO SOLIS,INSCRITO,1257.0,ALIANZA PARA EL PROGRESO,0.0,/Assets/Fotos-HojaVida/170154.jpg,ICA,ICA,SANTIAGO,['ALCALDE DISTRITAL'],NO,ERM.2022009420
1,170155.0,1969-01-04T00:00:00,F,,0.0,21512180,ORIELE ANA ASCENCIO CCENCHO DE FARFAN,INSCRITO,1257.0,ALIANZA PARA EL PROGRESO,1.0,/Assets/Fotos-HojaVida/170155.jpg,ICA,ICA,SANTIAGO,['REGIDOR DISTRITAL'],NO,ERM.2022009420
2,170156.0,1971-10-10T00:00:00,M,,0.0,21513149,JORGE LUIS PRADA ROBLES,INSCRITO,1257.0,ALIANZA PARA EL PROGRESO,2.0,/Assets/Fotos-HojaVida/170156.jpg,ICA,ICA,SANTIAGO,['REGIDOR DISTRITAL'],NO,ERM.2022009420
3,170157.0,1977-05-16T00:00:00,F,,0.0,21570984,YANINA MARGARITA RAMOS UCHUYA,INSCRITO,1257.0,ALIANZA PARA EL PROGRESO,3.0,/Assets/Fotos-HojaVida/170157.jpg,ICA,ICA,SANTIAGO,['REGIDOR DISTRITAL'],NO,ERM.2022009420
4,170158.0,1966-05-26T00:00:00,M,,0.0,21511890,JOSE JUVENAL BAUTISTA AROTINCO,INSCRITO,1257.0,ALIANZA PARA EL PROGRESO,4.0,/Assets/Fotos-HojaVida/170158.jpg,ICA,ICA,SANTIAGO,['REGIDOR DISTRITAL'],NO,ERM.2022009420
5,170159.0,1999-01-23T00:00:00,F,,0.0,70046979,KAREEN GERALDINE LUJAN PACHECO,INSCRITO,1257.0,ALIANZA PARA EL PROGRESO,5.0,/Assets/Fotos-HojaVida/170159.jpg,ICA,ICA,SANTIAGO,['REGIDOR DISTRITAL'],NO,ERM.2022009420
6,170160.0,1999-07-25T00:00:00,M,,0.0,62091796,JUAN CARLOS RIVERA FERNANDEZ,INSCRITO,1257.0,ALIANZA PARA EL PROGRESO,6.0,/Assets/Fotos-HojaVida/170160.jpg,ICA,ICA,SANTIAGO,['REGIDOR DISTRITAL'],NO,ERM.2022009420
7,170161.0,2001-11-02T00:00:00,F,,0.0,75959056,CARLA ESTELA RAMIREZ CUADROS,INSCRITO,1257.0,ALIANZA PARA EL PROGRESO,7.0,/Assets/Fotos-HojaVida/170161.jpg,ICA,ICA,SANTIAGO,['REGIDOR DISTRITAL'],NO,ERM.2022009420
