,idHojaVida,feNacimiento,txSexo,designado,idProcesoElectoral,numeroDocumento,nombreCompleto,estado,idOrganizacionPolitica,organizacionPolitica,numeroCandidato,rutaArchivo,postulaDepartamento,postulaProvincia,postulaDistrito,cargo,nativo,txCodExpedienteExt
0,196706.0,1981-11-22T00:00:00,M,,0.0,42039558,GELACIO ROBERTO REYES GAVINO,INSCRITO,1257.0,ALIANZA PARA EL PROGRESO,0.0,/Assets/Fotos-HojaVida/196706.jpg,ANCASH,OCROS,CARHUAPAMPA,"['ALCALDE DISTRITAL', 'ALCALDE DISTRITAL']",NO,ERM.2022016669
1,196707.0,1958-07-10T00:00:00,F,,0.0,31930289,AMELIA ESTEFANIA ANASTACIO LEONARDO DE CHAVEZ,INSCRITO,1257.0,ALIANZA PARA EL PROGRESO,1.0,/Assets/Fotos-HojaVida/196707.jpg,ANCASH,OCROS,CARHUAPAMPA,"['REGIDOR DISTRITAL', 'REGIDOR DISTRITAL']",NO,ERM.2022016669
2,196708.0,1961-10-30T00:00:00,M,,0.0,31930032,ZENON ERLES CALDAS ESTEBAN,INSCRITO,1257.0,ALIANZA PARA EL PROGRESO,2.0,/Assets/Fotos-HojaVida/196708.jpg,ANCASH,OCROS,CARHUAPAMPA,"['REGIDOR DISTRITAL', 'REGIDOR DISTRITAL']",NO,ERM.2022016669
3,196709.0,1985-08-23T00:00:00,F,,0.0,43114061,FANIA DIOLINDA MARTINEZ VELASQUEZ,INSCRITO,1257.0,ALIANZA PARA EL PROGRESO,3.0,/Assets/Fotos-HojaVida/196709.jpg,ANCASH,OCROS,CARHUAPAMPA,"['REGIDOR DISTRITAL', 'REGIDOR DISTRITAL']",NO,ERM.2022016669
4,196710.0,1979-08-17T00:00:00,M,,0.0,80635321,JULIO CESAR LOLI RAFAEL,INSCRITO,1257.0,ALIANZA PARA EL PROGRESO,4.0,/Assets/Fotos-HojaVida/196710.jpg,ANCASH,OCROS,CARHUAPAMPA,"['REGIDOR DISTRITAL', 'REGIDOR DISTRITAL']",NO,ERM.2022016669
5,196711.0,1997-04-21T00:00:00,F,,0.0,76685706,MARISELLA HILDA GREMIOS ESPINOZA,INSCRITO,1257.0,ALIANZA PARA EL PROGRESO,5.0,/Assets/Fotos-HojaVida/196711.jpg,ANCASH,OCROS,CARHUAPAMPA,"['REGIDOR DISTRITAL', 'REGIDOR DISTRITAL']",NO,ERM.2022016669
