,idHojaVida,feNacimiento,txSexo,designado,idProcesoElectoral,numeroDocumento,nombreCompleto,estado,idOrganizacionPolitica,organizacionPolitica,numeroCandidato,rutaArchivo,postulaDepartamento,postulaProvincia,postulaDistrito,cargo,nativo,txCodExpedienteExt
0,229652.0,1950-01-16T00:00:00,M,,0.0,03896838,SEGUNDO MANUEL AGUILAR SEMINARIO,INSCRITO,1257.0,ALIANZA PARA EL PROGRESO,0.0,/Assets/Fotos-HojaVida/229652.jpg,PIURA,SULLANA,BELLAVISTA,['ALCALDE DISTRITAL'],NO,ERM.2022012996
1,229653.0,2000-09-25T00:00:00,F,,0.0,76882228,KIARA PRIXY CARDOZA POZO,INSCRITO,1257.0,ALIANZA PARA EL PROGRESO,1.0,/Assets/Fotos-HojaVida/229653.jpg,PIURA,SULLANA,BELLAVISTA,['REGIDOR DISTRITAL'],NO,ERM.2022012996
2,229654.0,1958-05-13T00:00:00,M,,0.0,03604210,MANUEL ANTONIO PAZ NEIRA,INSCRITO,1257.0,ALIANZA PARA EL PROGRESO,2.0,/Assets/Fotos-HojaVida/229654.jpg,PIURA,SULLANA,BELLAVISTA,['REGIDOR DISTRITAL'],NO,ERM.2022012996
3,229655.0,1994-07-16T00:00:00,F,,0.0,48754228,YESSENIA ANAIS PACHERREZ MENDOZA,INSCRITO,1257.0,ALIANZA PARA EL PROGRESO,3.0,/Assets/Fotos-HojaVida/229655.jpg,PIURA,SULLANA,BELLAVISTA,['REGIDOR DISTRITAL'],NO,ERM.2022012996
4,229656.0,1996-10-09T00:00:00,M,,0.0,76941426,ALONSO ANTONIO CHAMBA ATOCHE,IMPROCEDENTE,1257.0,ALIANZA PARA EL PROGRESO,4.0,/Assets/Fotos-HojaVida/229656.jpg,PIURA,SULLANA,BELLAVISTA,['REGIDOR DISTRITAL'],NO,ERM.2022012996
5,229657.0,1992-07-18T00:00:00,F,,0.0,48039113,LELIBETH DEL PILAR RIVAS RUIZ,INSCRITO,1257.0,ALIANZA PARA EL PROGRESO,5.0,/Assets/Fotos-HojaVida/229657.jpg,PIURA,SULLANA,BELLAVISTA,['REGIDOR DISTRITAL'],NO,ERM.2022012996
6,229658.0,1993-05-20T00:00:00,M,,0.0,48351698,LUIS FELIPE GOMEZ MENDOZA,INSCRITO,1257.0,ALIANZA PARA EL PROGRESO,6.0,/Assets/Fotos-HojaVida/229658.jpg,PIURA,SULLANA,BELLAVISTA,['REGIDOR DISTRITAL'],NO,ERM.2022012996
7,229659.0,1985-07-20T00:00:00,F,,0.0,43094765,JUANA MARIA LOPEZ SAUCEDO DE ZAPATA,INSCRITO,1257.0,ALIANZA PARA EL PROGRESO,7.0,/Assets/Fotos-HojaVida/229659.jpg,PIURA,SULLANA,BELLAVISTA,['REGIDOR DISTRITAL'],NO,ERM.2022012996
