,C_CODI_AGP,AGRUPACION,IMAGENAGRUPACION,PORC_AVANCE_ACTA,ACTAS_COMPUTADA,TOTAL_MESAS,TOTAL_VOTOS,NLISTA,POR_VALIDOS,POR_EMITIDOS,fecha,hora,avance,ubigeo,nulos_y_blancos
4,00000005,JUNTOS POR EL PERU,,100.000,10,10,49,00000005.jpg,2.578,2.379,12/10/2022,16:00 h,  27.7778,010603,159
7,00000008,PARTIDO POLITICO NACIONAL PERU LIBRE,,100.000,10,10,110,00000008.jpg,5.786,5.340,12/10/2022,16:00 h,  27.7778,010603,159
2,00000015,MOVIMIENTO REGIONAL AMAZONENSE UNIDOS AL CAMPO,,100.000,10,10,132,00000015.jpg,6.944,6.408,12/10/2022,16:00 h,  27.7778,010603,159
0,00000016,SENTIMIENTO AMAZONENSE REGIONAL,,100.000,10,10,183,00000016.jpg,9.627,8.883,12/10/2022,16:00 h,  27.7778,010603,159
3,00000014,MOVIMIENTO POLITICO REGIONAL ENERGIA COMUNAL AMAZONICA,,100.000,10,10,194,00000014.jpg,10.205,9.417,12/10/2022,16:00 h,  27.7778,010603,159
1,00000017,MOVIMIENTO REGIONAL VICTORIA AMAZONENSE,,100.000,10,10,221,00000017.jpg,11.625,10.728,12/10/2022,16:00 h,  27.7778,010603,159
6,00000004,ALIANZA PARA EL PROGRESO,,100.000,10,10,264,00000004.jpg,13.887,12.816,12/10/2022,16:00 h,  27.7778,010603,159
5,00000003,RENOVACION POPULAR,,100.000,10,10,748,00000003.jpg,39.348,36.311,12/10/2022,16:00 h,  27.7778,010603,159
