,C_CODI_AGP,AGRUPACION,IMAGENAGRUPACION,PORC_AVANCE_ACTA,ACTAS_COMPUTADA,TOTAL_MESAS,TOTAL_VOTOS,NLISTA,POR_VALIDOS,POR_EMITIDOS,fecha,hora,avance,ubigeo,nulos_y_blancos
4,00000005,JUNTOS POR EL PERU,,100.000,72,72,64,00000005.jpg,0.541,0.455,12/10/2022,16:00 h, 100.0000,010702,2248
7,00000008,PARTIDO POLITICO NACIONAL PERU LIBRE,,100.000,72,72,149,00000008.jpg,1.260,1.059,12/10/2022,16:00 h, 100.0000,010702,2248
3,00000014,MOVIMIENTO POLITICO REGIONAL ENERGIA COMUNAL AMAZONICA,,100.000,72,72,562,00000014.jpg,4.752,3.993,12/10/2022,16:00 h, 100.0000,010702,2248
5,00000003,RENOVACION POPULAR,,100.000,72,72,810,00000003.jpg,6.849,5.755,12/10/2022,16:00 h, 100.0000,010702,2248
2,00000015,MOVIMIENTO REGIONAL AMAZONENSE UNIDOS AL CAMPO,,100.000,72,72,1179,00000015.jpg,9.970,8.377,12/10/2022,16:00 h, 100.0000,010702,2248
6,00000004,ALIANZA PARA EL PROGRESO,,100.000,72,72,1911,00000004.jpg,16.159,13.578,12/10/2022,16:00 h, 100.0000,010702,2248
0,00000016,SENTIMIENTO AMAZONENSE REGIONAL,,100.000,72,72,2223,00000016.jpg,18.798,15.795,12/10/2022,16:00 h, 100.0000,010702,2248
1,00000017,MOVIMIENTO REGIONAL VICTORIA AMAZONENSE,,100.000,72,72,4928,00000017.jpg,41.671,35.015,12/10/2022,16:00 h, 100.0000,010702,2248
