,C_CODI_AGP,AGRUPACION,IMAGENAGRUPACION,PORC_AVANCE_ACTA,ACTAS_COMPUTADA,TOTAL_MESAS,TOTAL_VOTOS,NLISTA,POR_VALIDOS,POR_EMITIDOS,fecha,hora,avance,ubigeo
0,00000020,MOVIMIENTO REGIONAL EL MAICITO,,100.000,6,6,43,00000020.jpg,3.755,3.454,10/10/2022,10:52 h, 100.0000,020815
1,00000019,SOCIOS POR ANCASH,,100.000,6,6,590,00000019.jpg,51.528,47.390,10/10/2022,10:52 h, 100.0000,020815
2,00000018,MOVIMIENTO ACCION NACIONALISTA PERUANO,,100.000,6,6,8,00000018.jpg,0.699,0.643,10/10/2022,10:52 h, 100.0000,020815
3,00000021,ALIANZA GOBIERNO UNIDAD Y ACCION - AGUA,,100.000,6,6,353,00000021.jpg,30.830,28.353,10/10/2022,10:52 h, 100.0000,020815
4,00000005,JUNTOS POR EL PERU,,100.000,6,6,6,00000005.jpg,0.524,0.482,10/10/2022,10:52 h, 100.0000,020815
5,00000004,ALIANZA PARA EL PROGRESO,,100.000,6,6,8,00000004.jpg,0.699,0.643,10/10/2022,10:52 h, 100.0000,020815
6,00000002,PARTIDO DEMOCRATICO SOMOS PERU,,100.000,6,6,137,00000002.jpg,11.965,11.004,10/10/2022,10:52 h, 100.0000,020815
