,C_CODI_AGP,AGRUPACION,IMAGENAGRUPACION,PORC_AVANCE_ACTA,ACTAS_COMPUTADA,TOTAL_MESAS,TOTAL_VOTOS,NLISTA,POR_VALIDOS,POR_EMITIDOS,fecha,hora,avance,ubigeo
0,00000020,MOVIMIENTO REGIONAL EL MAICITO,,100.000,21,21,562,00000020.jpg,14.943,13.343,06/10/2022,17:50 h,  95.4545,020801
1,00000019,SOCIOS POR ANCASH,,100.000,21,21,409,00000019.jpg,10.875,9.710,06/10/2022,17:50 h,  95.4545,020801
2,00000018,MOVIMIENTO ACCION NACIONALISTA PERUANO,,100.000,21,21,89,00000018.jpg,2.366,2.113,06/10/2022,17:50 h,  95.4545,020801
3,00000021,ALIANZA GOBIERNO UNIDAD Y ACCION - AGUA,,100.000,21,21,939,00000021.jpg,24.967,22.293,06/10/2022,17:50 h,  95.4545,020801
4,00000005,JUNTOS POR EL PERU,,100.000,21,21,120,00000005.jpg,3.191,2.849,06/10/2022,17:50 h,  95.4545,020801
5,00000004,ALIANZA PARA EL PROGRESO,,100.000,21,21,40,00000004.jpg,1.064,0.950,06/10/2022,17:50 h,  95.4545,020801
6,00000002,PARTIDO DEMOCRATICO SOMOS PERU,,100.000,21,21,"1,602",00000002.jpg,42.595,38.034,06/10/2022,17:50 h,  95.4545,020801
