,C_CODI_AGP,AGRUPACION,IMAGENAGRUPACION,PORC_AVANCE_ACTA,ACTAS_COMPUTADA,TOTAL_MESAS,TOTAL_VOTOS,NLISTA,POR_VALIDOS,POR_EMITIDOS,fecha,hora,avance,ubigeo
0,00000020,MOVIMIENTO REGIONAL EL MAICITO,,100.000,23,23,927,00000020.jpg,22.946,17.570,10/10/2022,10:52 h, 100.0000,020803
1,00000019,SOCIOS POR ANCASH,,100.000,23,23,901,00000019.jpg,22.302,17.077,10/10/2022,10:52 h, 100.0000,020803
2,00000018,MOVIMIENTO ACCION NACIONALISTA PERUANO,,100.000,23,23,43,00000018.jpg,1.064,0.815,10/10/2022,10:52 h, 100.0000,020803
3,00000021,ALIANZA GOBIERNO UNIDAD Y ACCION - AGUA,,100.000,23,23,414,00000021.jpg,10.248,7.847,10/10/2022,10:52 h, 100.0000,020803
4,00000005,JUNTOS POR EL PERU,,100.000,23,23,25,00000005.jpg,0.619,0.474,10/10/2022,10:52 h, 100.0000,020803
5,00000004,ALIANZA PARA EL PROGRESO,,100.000,23,23,346,00000004.jpg,8.564,6.558,10/10/2022,10:52 h, 100.0000,020803
6,00000002,PARTIDO DEMOCRATICO SOMOS PERU,,100.000,23,23,"1,384",00000002.jpg,34.257,26.232,10/10/2022,10:52 h, 100.0000,020803
