,C_CODI_AGP,AGRUPACION,IMAGENAGRUPACION,PORC_AVANCE_ACTA,ACTAS_COMPUTADA,TOTAL_MESAS,TOTAL_VOTOS,NLISTA,POR_VALIDOS,POR_EMITIDOS,fecha,hora,avance,ubigeo
0,00000020,MOVIMIENTO REGIONAL EL MAICITO,,100.000,8,8,72,00000020.jpg,5.564,4.469,06/10/2022,17:50 h, 100.0000,020809
1,00000019,SOCIOS POR ANCASH,,100.000,8,8,539,00000019.jpg,41.654,33.457,06/10/2022,17:50 h, 100.0000,020809
2,00000018,MOVIMIENTO ACCION NACIONALISTA PERUANO,,100.000,8,8,87,00000018.jpg,6.723,5.400,06/10/2022,17:50 h, 100.0000,020809
3,00000021,ALIANZA GOBIERNO UNIDAD Y ACCION - AGUA,,100.000,8,8,201,00000021.jpg,15.533,12.477,06/10/2022,17:50 h, 100.0000,020809
4,00000005,JUNTOS POR EL PERU,,100.000,8,8,5,00000005.jpg,0.386,0.310,06/10/2022,17:50 h, 100.0000,020809
5,00000004,ALIANZA PARA EL PROGRESO,,100.000,8,8,5,00000004.jpg,0.386,0.310,06/10/2022,17:50 h, 100.0000,020809
6,00000002,PARTIDO DEMOCRATICO SOMOS PERU,,100.000,8,8,385,00000002.jpg,29.753,23.898,06/10/2022,17:50 h, 100.0000,020809
