,C_CODI_AGP,AGRUPACION,IMAGENAGRUPACION,PORC_AVANCE_ACTA,ACTAS_COMPUTADA,TOTAL_MESAS,TOTAL_VOTOS,NLISTA,POR_VALIDOS,POR_EMITIDOS,fecha,hora,avance,ubigeo
0,00000020,MOVIMIENTO REGIONAL EL MAICITO,,100.000,22,22,879,00000020.jpg,22.625,17.307,06/10/2022,17:50 h,  95.6522,020803
1,00000019,SOCIOS POR ANCASH,,100.000,22,22,866,00000019.jpg,22.291,17.051,06/10/2022,17:50 h,  95.6522,020803
2,00000018,MOVIMIENTO ACCION NACIONALISTA PERUANO,,100.000,22,22,41,00000018.jpg,1.055,0.807,06/10/2022,17:50 h,  95.6522,020803
3,00000021,ALIANZA GOBIERNO UNIDAD Y ACCION - AGUA,,100.000,22,22,400,00000021.jpg,10.296,7.876,06/10/2022,17:50 h,  95.6522,020803
4,00000005,JUNTOS POR EL PERU,,100.000,22,22,24,00000005.jpg,0.618,0.473,06/10/2022,17:50 h,  95.6522,020803
5,00000004,ALIANZA PARA EL PROGRESO,,100.000,22,22,334,00000004.jpg,8.597,6.576,06/10/2022,17:50 h,  95.6522,020803
6,00000002,PARTIDO DEMOCRATICO SOMOS PERU,,100.000,22,22,"1,341",00000002.jpg,34.517,26.403,06/10/2022,17:50 h,  95.6522,020803
