,C_CODI_AGP,AGRUPACION,IMAGENAGRUPACION,PORC_AVANCE_ACTA,ACTAS_COMPUTADA,TOTAL_MESAS,TOTAL_VOTOS,NLISTA,POR_VALIDOS,POR_EMITIDOS,fecha,hora,avance,ubigeo
0,00000020,MOVIMIENTO REGIONAL EL MAICITO,,100.000,3,3,94,00000020.jpg,14.921,13.803,10/10/2022,10:52 h, 100.0000,020811
1,00000019,SOCIOS POR ANCASH,,100.000,3,3,61,00000019.jpg,9.683,8.957,10/10/2022,10:52 h, 100.0000,020811
2,00000018,MOVIMIENTO ACCION NACIONALISTA PERUANO,,100.000,3,3,62,00000018.jpg,9.841,9.104,10/10/2022,10:52 h, 100.0000,020811
3,00000021,ALIANZA GOBIERNO UNIDAD Y ACCION - AGUA,,100.000,3,3,247,00000021.jpg,39.206,36.270,10/10/2022,10:52 h, 100.0000,020811
4,00000005,JUNTOS POR EL PERU,,100.000,3,3,2,00000005.jpg,0.317,0.294,10/10/2022,10:52 h, 100.0000,020811
5,00000004,ALIANZA PARA EL PROGRESO,,100.000,3,3,4,00000004.jpg,0.635,0.587,10/10/2022,10:52 h, 100.0000,020811
6,00000002,PARTIDO DEMOCRATICO SOMOS PERU,,100.000,3,3,160,00000002.jpg,25.397,23.495,10/10/2022,10:52 h, 100.0000,020811
