,C_CODI_AGP,AGRUPACION,IMAGENAGRUPACION,PORC_AVANCE_ACTA,ACTAS_COMPUTADA,TOTAL_MESAS,TOTAL_VOTOS,NLISTA,POR_VALIDOS,POR_EMITIDOS,fecha,hora,avance,ubigeo,nulos_y_blancos
3,00000008,PARTIDO POLITICO NACIONAL PERU LIBRE,,100.000,7,7,32,00000008.jpg,2.355,2.109,12/10/2022,16:00 h, 100.0000,021008,158
1,00000018,MOVIMIENTO ACCION NACIONALISTA PERUANO,,100.000,7,7,227,00000018.jpg,16.703,14.964,12/10/2022,16:00 h, 100.0000,021008,158
4,00000002,PARTIDO DEMOCRATICO SOMOS PERU,,100.000,7,7,314,00000002.jpg,23.105,20.699,12/10/2022,16:00 h, 100.0000,021008,158
0,00000020,MOVIMIENTO REGIONAL EL MAICITO,,100.000,7,7,324,00000020.jpg,23.841,21.358,12/10/2022,16:00 h, 100.0000,021008,158
2,00000009,PODEMOS PERU,,100.000,7,7,462,00000009.jpg,33.996,30.455,12/10/2022,16:00 h, 100.0000,021008,158
