,C_CODI_AGP,AGRUPACION,IMAGENAGRUPACION,PORC_AVANCE_ACTA,ACTAS_COMPUTADA,TOTAL_MESAS,TOTAL_VOTOS,NLISTA,POR_VALIDOS,POR_EMITIDOS,fecha,hora,avance,ubigeo,nulos_y_blancos
2,00000182,MOVIMIENTO INDEPENDIENTE REGIONAL ANCASH A LA OBRA,,100.000,5,5,2,00000182.jpg,0.237,0.196,12/10/2022,12:30 h, 100.0000,021206,177
1,00000019,SOCIOS POR ANCASH,,100.000,5,5,9,00000019.jpg,1.066,0.881,12/10/2022,12:30 h, 100.0000,021206,177
6,00000008,PARTIDO POLITICO NACIONAL PERU LIBRE,,100.000,5,5,71,00000008.jpg,8.412,6.954,12/10/2022,12:30 h, 100.0000,021206,177
0,00000020,MOVIMIENTO REGIONAL EL MAICITO,,100.000,5,5,140,00000020.jpg,16.588,13.712,12/10/2022,12:30 h, 100.0000,021206,177
3,00000021,ALIANZA GOBIERNO UNIDAD Y ACCION - AGUA,,100.000,5,5,154,00000021.jpg,18.246,15.083,12/10/2022,12:30 h, 100.0000,021206,177
5,00000004,ALIANZA PARA EL PROGRESO,,100.000,5,5,167,00000004.jpg,19.787,16.357,12/10/2022,12:30 h, 100.0000,021206,177
4,00000005,JUNTOS POR EL PERU,,100.000,5,5,301,00000005.jpg,35.664,29.481,12/10/2022,12:30 h, 100.0000,021206,177
