,C_CODI_AGP,AGRUPACION,IMAGENAGRUPACION,PORC_AVANCE_ACTA,ACTAS_COMPUTADA,TOTAL_MESAS,TOTAL_VOTOS,NLISTA,POR_VALIDOS,POR_EMITIDOS,fecha,hora,avance,ubigeo
0,00000020,MOVIMIENTO REGIONAL EL MAICITO,,100.000,4,4,179,00000020.jpg,26.246,22.573,10/10/2022,10:52 h, 100.0000,021205
1,00000019,SOCIOS POR ANCASH,,100.000,4,4,9,00000019.jpg,1.320,1.135,10/10/2022,10:52 h, 100.0000,021205
2,00000182,MOVIMIENTO INDEPENDIENTE REGIONAL ANCASH A LA OBRA,,100.000,4,4,0,00000182.jpg,0.000,0.000,10/10/2022,10:52 h, 100.0000,021205
3,00000021,ALIANZA GOBIERNO UNIDAD Y ACCION - AGUA,,100.000,4,4,170,00000021.jpg,24.927,21.438,10/10/2022,10:52 h, 100.0000,021205
4,00000005,JUNTOS POR EL PERU,,100.000,4,4,15,00000005.jpg,2.199,1.892,10/10/2022,10:52 h, 100.0000,021205
5,00000004,ALIANZA PARA EL PROGRESO,,100.000,4,4,26,00000004.jpg,3.812,3.279,10/10/2022,10:52 h, 100.0000,021205
6,00000008,PARTIDO POLITICO NACIONAL PERU LIBRE,,100.000,4,4,283,00000008.jpg,41.496,35.687,10/10/2022,10:52 h, 100.0000,021205
