,C_CODI_AGP,AGRUPACION,IMAGENAGRUPACION,PORC_AVANCE_ACTA,ACTAS_COMPUTADA,TOTAL_MESAS,TOTAL_VOTOS,NLISTA,POR_VALIDOS,POR_EMITIDOS,fecha,hora,avance,ubigeo
0,00000020,MOVIMIENTO REGIONAL EL MAICITO,,100.000,5,5,481,00000020.jpg,52.169,47.577,10/10/2022,10:52 h, 100.0000,021204
1,00000019,SOCIOS POR ANCASH,,100.000,5,5,4,00000019.jpg,0.434,0.396,10/10/2022,10:52 h, 100.0000,021204
2,00000182,MOVIMIENTO INDEPENDIENTE REGIONAL ANCASH A LA OBRA,,100.000,5,5,0,00000182.jpg,0.000,0.000,10/10/2022,10:52 h, 100.0000,021204
3,00000021,ALIANZA GOBIERNO UNIDAD Y ACCION - AGUA,,100.000,5,5,338,00000021.jpg,36.659,33.432,10/10/2022,10:52 h, 100.0000,021204
4,00000005,JUNTOS POR EL PERU,,100.000,5,5,81,00000005.jpg,8.785,8.012,10/10/2022,10:52 h, 100.0000,021204
5,00000004,ALIANZA PARA EL PROGRESO,,100.000,5,5,5,00000004.jpg,0.542,0.495,10/10/2022,10:52 h, 100.0000,021204
6,00000008,PARTIDO POLITICO NACIONAL PERU LIBRE,,100.000,5,5,13,00000008.jpg,1.410,1.286,10/10/2022,10:52 h, 100.0000,021204
