,C_CODI_AGP,AGRUPACION,IMAGENAGRUPACION,PORC_AVANCE_ACTA,ACTAS_COMPUTADA,TOTAL_MESAS,TOTAL_VOTOS,NLISTA,POR_VALIDOS,POR_EMITIDOS,fecha,hora,avance,ubigeo,nulos_y_blancos
2,00000182,MOVIMIENTO INDEPENDIENTE REGIONAL ANCASH A LA OBRA,,100.000,3,3,2,00000182.jpg,0.647,0.401,12/10/2022,12:30 h, 100.0000,021203,190
1,00000019,SOCIOS POR ANCASH,,100.000,3,3,4,00000019.jpg,1.294,0.802,12/10/2022,12:30 h, 100.0000,021203,190
5,00000004,ALIANZA PARA EL PROGRESO,,100.000,3,3,6,00000004.jpg,1.942,1.202,12/10/2022,12:30 h, 100.0000,021203,190
4,00000005,JUNTOS POR EL PERU,,100.000,3,3,14,00000005.jpg,4.531,2.806,12/10/2022,12:30 h, 100.0000,021203,190
6,00000008,PARTIDO POLITICO NACIONAL PERU LIBRE,,100.000,3,3,14,00000008.jpg,4.531,2.806,12/10/2022,12:30 h, 100.0000,021203,190
0,00000020,MOVIMIENTO REGIONAL EL MAICITO,,100.000,3,3,57,00000020.jpg,18.447,11.423,12/10/2022,12:30 h, 100.0000,021203,190
3,00000021,ALIANZA GOBIERNO UNIDAD Y ACCION - AGUA,,100.000,3,3,212,00000021.jpg,68.608,42.485,12/10/2022,12:30 h, 100.0000,021203,190
