,C_CODI_AGP,AGRUPACION,IMAGENAGRUPACION,PORC_AVANCE_ACTA,ACTAS_COMPUTADA,TOTAL_MESAS,TOTAL_VOTOS,NLISTA,POR_VALIDOS,POR_EMITIDOS,fecha,hora,avance,ubigeo
0,00000020,MOVIMIENTO REGIONAL EL MAICITO,,100.000,13,13,235,00000020.jpg,11.821,9.829,06/10/2022,17:50 h, 100.0000,021401
1,00000018,MOVIMIENTO ACCION NACIONALISTA PERUANO,,100.000,13,13,553,00000018.jpg,27.817,23.128,06/10/2022,17:50 h, 100.0000,021401
2,00000021,ALIANZA GOBIERNO UNIDAD Y ACCION - AGUA,,100.000,13,13,353,00000021.jpg,17.757,14.764,06/10/2022,17:50 h, 100.0000,021401
3,00000005,JUNTOS POR EL PERU,,100.000,13,13,282,00000005.jpg,14.185,11.794,06/10/2022,17:50 h, 100.0000,021401
4,00000004,ALIANZA PARA EL PROGRESO,,100.000,13,13,565,00000004.jpg,28.421,23.630,06/10/2022,17:50 h, 100.0000,021401
