,C_CODI_AGP,AGRUPACION,IMAGENAGRUPACION,PORC_AVANCE_ACTA,ACTAS_COMPUTADA,TOTAL_MESAS,TOTAL_VOTOS,NLISTA,POR_VALIDOS,POR_EMITIDOS,fecha,hora,avance,ubigeo,nulos_y_blancos
1,00000182,MOVIMIENTO INDEPENDIENTE REGIONAL ANCASH A LA OBRA,,100.000,10,10,90,00000182.jpg,5.190,4.433,12/10/2022,16:00 h, 100.0000,021404,296
5,00000004,ALIANZA PARA EL PROGRESO,,100.000,10,10,110,00000004.jpg,6.344,5.419,12/10/2022,16:00 h, 100.0000,021404,296
4,00000005,JUNTOS POR EL PERU,,100.000,10,10,253,00000005.jpg,14.591,12.463,12/10/2022,16:00 h, 100.0000,021404,296
2,00000018,MOVIMIENTO ACCION NACIONALISTA PERUANO,,100.000,10,10,258,00000018.jpg,14.879,12.709,12/10/2022,16:00 h, 100.0000,021404,296
3,00000021,ALIANZA GOBIERNO UNIDAD Y ACCION - AGUA,,100.000,10,10,480,00000021.jpg,27.682,23.645,12/10/2022,16:00 h, 100.0000,021404,296
0,00000020,MOVIMIENTO REGIONAL EL MAICITO,,100.000,10,10,543,00000020.jpg,31.315,26.749,12/10/2022,16:00 h, 100.0000,021404,296
