,C_CODI_AGP,AGRUPACION,IMAGENAGRUPACION,PORC_AVANCE_ACTA,ACTAS_COMPUTADA,TOTAL_MESAS,TOTAL_VOTOS,NLISTA,POR_VALIDOS,POR_EMITIDOS,fecha,hora,avance,ubigeo,nulos_y_blancos
1,00000021,ALIANZA GOBIERNO UNIDAD Y ACCION - AGUA,,100.000,8,8,74,00000021.jpg,5.804,4.827,12/10/2022,16:00 h, 100.0000,021507,258
4,00000008,PARTIDO POLITICO NACIONAL PERU LIBRE,,100.000,8,8,210,00000008.jpg,16.471,13.699,12/10/2022,16:00 h, 100.0000,021507,258
0,00000020,MOVIMIENTO REGIONAL EL MAICITO,,100.000,8,8,221,00000020.jpg,17.333,14.416,12/10/2022,16:00 h, 100.0000,021507,258
2,00000005,JUNTOS POR EL PERU,,100.000,8,8,353,00000005.jpg,27.686,23.027,12/10/2022,16:00 h, 100.0000,021507,258
3,00000004,ALIANZA PARA EL PROGRESO,,100.000,8,8,417,00000004.jpg,32.706,27.202,12/10/2022,16:00 h, 100.0000,021507,258
