,C_CODI_AGP,AGRUPACION,IMAGENAGRUPACION,PORC_AVANCE_ACTA,ACTAS_COMPUTADA,TOTAL_MESAS,TOTAL_VOTOS,NLISTA,POR_VALIDOS,POR_EMITIDOS,fecha,hora,avance,ubigeo,nulos_y_blancos
4,00000008,PARTIDO POLITICO NACIONAL PERU LIBRE,,100.000,30,30,82,00000008.jpg,1.746,1.439,12/10/2022,12:30 h, 100.0000,021701,1003
2,00000018,MOVIMIENTO ACCION NACIONALISTA PERUANO,,100.000,30,30,138,00000018.jpg,2.939,2.421,12/10/2022,12:30 h, 100.0000,021701,1003
0,00000020,MOVIMIENTO REGIONAL EL MAICITO,,100.000,30,30,310,00000020.jpg,6.601,5.440,12/10/2022,12:30 h, 100.0000,021701,1003
3,00000021,ALIANZA GOBIERNO UNIDAD Y ACCION - AGUA,,100.000,30,30,442,00000021.jpg,9.412,7.756,12/10/2022,12:30 h, 100.0000,021701,1003
1,00000019,SOCIOS POR ANCASH,,100.000,30,30,1756,00000019.jpg,37.394,30.812,12/10/2022,12:30 h, 100.0000,021701,1003
5,00000002,PARTIDO DEMOCRATICO SOMOS PERU,,100.000,30,30,1968,00000002.jpg,41.908,34.532,12/10/2022,12:30 h, 100.0000,021701,1003
