,C_CODI_AGP,AGRUPACION,IMAGENAGRUPACION,PORC_AVANCE_ACTA,ACTAS_COMPUTADA,TOTAL_MESAS,TOTAL_VOTOS,NLISTA,POR_VALIDOS,POR_EMITIDOS,fecha,hora,avance,ubigeo,nulos_y_blancos
2,00000018,MOVIMIENTO ACCION NACIONALISTA PERUANO,,100.000,11,11,7,00000018.jpg,0.448,0.351,12/10/2022,16:00 h, 100.0000,021703,431
1,00000019,SOCIOS POR ANCASH,,100.000,11,11,71,00000019.jpg,4.545,3.562,12/10/2022,16:00 h, 100.0000,021703,431
4,00000004,ALIANZA PARA EL PROGRESO,,100.000,11,11,223,00000004.jpg,14.277,11.189,12/10/2022,16:00 h, 100.0000,021703,431
3,00000021,ALIANZA GOBIERNO UNIDAD Y ACCION - AGUA,,100.000,11,11,273,00000021.jpg,17.478,13.698,12/10/2022,16:00 h, 100.0000,021703,431
0,00000020,MOVIMIENTO REGIONAL EL MAICITO,,100.000,11,11,357,00000020.jpg,22.855,17.913,12/10/2022,16:00 h, 100.0000,021703,431
5,00000002,PARTIDO DEMOCRATICO SOMOS PERU,,100.000,11,11,631,00000002.jpg,40.397,31.661,12/10/2022,16:00 h, 100.0000,021703,431
