,C_CODI_AGP,AGRUPACION,IMAGENAGRUPACION,PORC_AVANCE_ACTA,ACTAS_COMPUTADA,TOTAL_MESAS,TOTAL_VOTOS,NLISTA,POR_VALIDOS,POR_EMITIDOS,fecha,hora,avance,ubigeo,nulos_y_blancos
4,00000008,PARTIDO POLITICO NACIONAL PERU LIBRE,,100.000,4,4,4,00000008.jpg,0.733,0.481,12/10/2022,12:30 h, 100.0000,030303,285
0,00000025,PROGRESISTA DE APURIMAC,,100.000,4,4,47,00000025.jpg,8.608,5.656,12/10/2022,12:30 h, 100.0000,030303,285
3,00000004,ALIANZA PARA EL PROGRESO,,100.000,4,4,80,00000004.jpg,14.652,9.627,12/10/2022,12:30 h, 100.0000,030303,285
5,00000002,PARTIDO DEMOCRATICO SOMOS PERU,,100.000,4,4,102,00000002.jpg,18.681,12.274,12/10/2022,12:30 h, 100.0000,030303,285
1,00000024,MOVIMIENTO REGIONAL HATARIY APURIMAC,,100.000,4,4,134,00000024.jpg,24.542,16.125,12/10/2022,12:30 h, 100.0000,030303,285
2,00000011,PARTIDO FRENTE DE LA ESPERANZA 2021,,100.000,4,4,179,00000011.jpg,32.784,21.540,12/10/2022,12:30 h, 100.0000,030303,285
