,C_CODI_AGP,AGRUPACION,IMAGENAGRUPACION,PORC_AVANCE_ACTA,ACTAS_COMPUTADA,TOTAL_MESAS,TOTAL_VOTOS,NLISTA,POR_VALIDOS,POR_EMITIDOS,fecha,hora,avance,ubigeo
0,00000025,PROGRESISTA DE APURIMAC,,100.000,3,3,24,00000025.jpg,4.589,4.138,10/10/2022,10:52 h, 100.0000,030314
1,00000024,MOVIMIENTO REGIONAL HATARIY APURIMAC,,100.000,3,3,15,00000024.jpg,2.868,2.586,10/10/2022,10:52 h, 100.0000,030314
2,00000011,PARTIDO FRENTE DE LA ESPERANZA 2021,,100.000,3,3,299,00000011.jpg,57.170,51.552,10/10/2022,10:52 h, 100.0000,030314
3,00000004,ALIANZA PARA EL PROGRESO,,100.000,3,3,181,00000004.jpg,34.608,31.207,10/10/2022,10:52 h, 100.0000,030314
4,00000008,PARTIDO POLITICO NACIONAL PERU LIBRE,,100.000,3,3,4,00000008.jpg,0.765,0.690,10/10/2022,10:52 h, 100.0000,030314
5,00000002,PARTIDO DEMOCRATICO SOMOS PERU,,100.000,3,3,0,00000002.jpg,0.000,0.000,10/10/2022,10:52 h, 100.0000,030314
