,C_CODI_AGP,AGRUPACION,IMAGENAGRUPACION,PORC_AVANCE_ACTA,ACTAS_COMPUTADA,TOTAL_MESAS,TOTAL_VOTOS,NLISTA,POR_VALIDOS,POR_EMITIDOS,fecha,hora,avance,ubigeo,nulos_y_blancos
2,00000001,ACCION POPULAR,,100.000,57,57,177,00000001.jpg,1.603,1.385,12/10/2022,16:00 h, 100.0000,030310,1737
3,00000004,ALIANZA PARA EL PROGRESO,,100.000,57,57,379,00000004.jpg,3.432,2.965,12/10/2022,16:00 h, 100.0000,030310,1737
4,00000008,PARTIDO POLITICO NACIONAL PERU LIBRE,,100.000,57,57,398,00000008.jpg,3.604,3.114,12/10/2022,16:00 h, 100.0000,030310,1737
0,00000024,MOVIMIENTO REGIONAL HATARIY APURIMAC,,100.000,57,57,2806,00000024.jpg,25.407,21.954,12/10/2022,16:00 h, 100.0000,030310,1737
5,00000002,PARTIDO DEMOCRATICO SOMOS PERU,,100.000,57,57,3543,00000002.jpg,32.081,27.721,12/10/2022,16:00 h, 100.0000,030310,1737
1,00000011,PARTIDO FRENTE DE LA ESPERANZA 2021,,100.000,57,57,3741,00000011.jpg,33.874,29.270,12/10/2022,16:00 h, 100.0000,030310,1737
