,C_CODI_AGP,AGRUPACION,IMAGENAGRUPACION,PORC_AVANCE_ACTA,ACTAS_COMPUTADA,TOTAL_MESAS,TOTAL_VOTOS,NLISTA,POR_VALIDOS,POR_EMITIDOS,fecha,hora,avance,ubigeo,nulos_y_blancos
3,00000004,ALIANZA PARA EL PROGRESO,,100.000,7,7,21,00000004.jpg,1.551,1.336,12/10/2022,12:30 h, 100.0000,030319,218
1,00000024,MOVIMIENTO REGIONAL HATARIY APURIMAC,,100.000,7,7,73,00000024.jpg,5.391,4.644,12/10/2022,12:30 h, 100.0000,030319,218
0,00000025,PROGRESISTA DE APURIMAC,,100.000,7,7,200,00000025.jpg,14.771,12.723,12/10/2022,12:30 h, 100.0000,030319,218
5,00000002,PARTIDO DEMOCRATICO SOMOS PERU,,100.000,7,7,286,00000002.jpg,21.123,18.193,12/10/2022,12:30 h, 100.0000,030319,218
4,00000008,PARTIDO POLITICO NACIONAL PERU LIBRE,,100.000,7,7,336,00000008.jpg,24.815,21.374,12/10/2022,12:30 h, 100.0000,030319,218
2,00000011,PARTIDO FRENTE DE LA ESPERANZA 2021,,100.000,7,7,438,00000011.jpg,32.349,27.863,12/10/2022,12:30 h, 100.0000,030319,218
