,C_CODI_AGP,AGRUPACION,IMAGENAGRUPACION,PORC_AVANCE_ACTA,ACTAS_COMPUTADA,TOTAL_MESAS,TOTAL_VOTOS,NLISTA,POR_VALIDOS,POR_EMITIDOS,fecha,hora,avance,ubigeo,nulos_y_blancos
5,00000002,PARTIDO DEMOCRATICO SOMOS PERU,,100.000,14,14,7,00000002.jpg,0.299,0.265,12/10/2022,16:00 h, 100.0000,030503,296
1,00000011,PARTIDO FRENTE DE LA ESPERANZA 2021,,100.000,14,14,133,00000011.jpg,5.676,5.040,12/10/2022,16:00 h, 100.0000,030503,296
0,00000024,MOVIMIENTO REGIONAL HATARIY APURIMAC,,100.000,14,14,215,00000024.jpg,9.176,8.147,12/10/2022,16:00 h, 100.0000,030503,296
2,00000001,ACCION POPULAR,,100.000,14,14,552,00000001.jpg,23.560,20.917,12/10/2022,16:00 h, 100.0000,030503,296
4,00000008,PARTIDO POLITICO NACIONAL PERU LIBRE,,100.000,14,14,634,00000008.jpg,27.059,24.024,12/10/2022,16:00 h, 100.0000,030503,296
3,00000004,ALIANZA PARA EL PROGRESO,,100.000,14,14,802,00000004.jpg,34.230,30.390,12/10/2022,16:00 h, 100.0000,030503,296
