,C_CODI_AGP,AGRUPACION,IMAGENAGRUPACION,PORC_AVANCE_ACTA,ACTAS_COMPUTADA,TOTAL_MESAS,TOTAL_VOTOS,NLISTA,POR_VALIDOS,POR_EMITIDOS,fecha,hora,avance,ubigeo
0,00000025,PROGRESISTA DE APURIMAC,,100.000,5,5,2,00000025.jpg,0.198,0.187,06/10/2022,17:50 h, 100.0000,030710
1,00000024,MOVIMIENTO REGIONAL HATARIY APURIMAC,,100.000,5,5,185,00000024.jpg,18.353,17.257,06/10/2022,17:50 h, 100.0000,030710
2,00000011,PARTIDO FRENTE DE LA ESPERANZA 2021,,100.000,5,5,370,00000011.jpg,36.706,34.515,06/10/2022,17:50 h, 100.0000,030710
3,00000004,ALIANZA PARA EL PROGRESO,,100.000,5,5,46,00000004.jpg,4.563,4.291,06/10/2022,17:50 h, 100.0000,030710
4,00000002,PARTIDO DEMOCRATICO SOMOS PERU,,100.000,5,5,405,00000002.jpg,40.179,37.780,06/10/2022,17:50 h, 100.0000,030710
