,C_CODI_AGP,AGRUPACION,IMAGENAGRUPACION,PORC_AVANCE_ACTA,ACTAS_COMPUTADA,TOTAL_MESAS,TOTAL_VOTOS,NLISTA,POR_VALIDOS,POR_EMITIDOS,fecha,hora,avance,ubigeo
0,00000025,PROGRESISTA DE APURIMAC,,100.000,6,6,4,00000025.jpg,0.417,0.297,10/10/2022,10:52 h, 100.0000,030704
1,00000024,MOVIMIENTO REGIONAL HATARIY APURIMAC,,100.000,6,6,44,00000024.jpg,4.588,3.262,10/10/2022,10:52 h, 100.0000,030704
2,00000011,PARTIDO FRENTE DE LA ESPERANZA 2021,,100.000,6,6,348,00000011.jpg,36.288,25.797,10/10/2022,10:52 h, 100.0000,030704
3,00000004,ALIANZA PARA EL PROGRESO,,100.000,6,6,319,00000004.jpg,33.264,23.647,10/10/2022,10:52 h, 100.0000,030704
4,00000002,PARTIDO DEMOCRATICO SOMOS PERU,,100.000,6,6,244,00000002.jpg,25.443,18.087,10/10/2022,10:52 h, 100.0000,030704
