,C_CODI_AGP,AGRUPACION,IMAGENAGRUPACION,PORC_AVANCE_ACTA,ACTAS_COMPUTADA,TOTAL_MESAS,TOTAL_VOTOS,NLISTA,POR_VALIDOS,POR_EMITIDOS,fecha,hora,avance,ubigeo
0,00000025,PROGRESISTA DE APURIMAC,,100.000,4,4,3,00000025.jpg,0.368,0.306,06/10/2022,17:50 h, 100.0000,030711
1,00000024,MOVIMIENTO REGIONAL HATARIY APURIMAC,,100.000,4,4,26,00000024.jpg,3.186,2.650,06/10/2022,17:50 h, 100.0000,030711
2,00000011,PARTIDO FRENTE DE LA ESPERANZA 2021,,100.000,4,4,229,00000011.jpg,28.064,23.344,06/10/2022,17:50 h, 100.0000,030711
3,00000004,ALIANZA PARA EL PROGRESO,,100.000,4,4,404,00000004.jpg,49.510,41.182,06/10/2022,17:50 h, 100.0000,030711
4,00000002,PARTIDO DEMOCRATICO SOMOS PERU,,100.000,4,4,154,00000002.jpg,18.873,15.698,06/10/2022,17:50 h, 100.0000,030711
