,C_CODI_AGP,AGRUPACION,IMAGENAGRUPACION,PORC_AVANCE_ACTA,ACTAS_COMPUTADA,TOTAL_MESAS,TOTAL_VOTOS,NLISTA,POR_VALIDOS,POR_EMITIDOS,fecha,hora,avance,ubigeo
0,00000025,PROGRESISTA DE APURIMAC,,100.000,6,6,4,00000025.jpg,0.305,0.286,10/10/2022,16:51 h,  75.0000,030709
1,00000024,MOVIMIENTO REGIONAL HATARIY APURIMAC,,100.000,6,6,30,00000024.jpg,2.288,2.147,10/10/2022,16:51 h,  75.0000,030709
2,00000011,PARTIDO FRENTE DE LA ESPERANZA 2021,,100.000,6,6,482,00000011.jpg,36.766,34.503,10/10/2022,16:51 h,  75.0000,030709
3,00000004,ALIANZA PARA EL PROGRESO,,100.000,6,6,161,00000004.jpg,12.281,11.525,10/10/2022,16:51 h,  75.0000,030709
4,00000002,PARTIDO DEMOCRATICO SOMOS PERU,,100.000,6,6,634,00000002.jpg,48.360,45.383,10/10/2022,16:51 h,  75.0000,030709
