,C_CODI_AGP,AGRUPACION,IMAGENAGRUPACION,PORC_AVANCE_ACTA,ACTAS_COMPUTADA,TOTAL_MESAS,TOTAL_VOTOS,NLISTA,POR_VALIDOS,POR_EMITIDOS,fecha,hora,avance,ubigeo,nulos_y_blancos
2,00000027,MOVIMIENTO REGIONAL AREQUIPA AVANCEMOS,,100.000,4,4,53,00000027.jpg,7.958,6.511,12/10/2022,16:00 h, 100.0000,040206,148
3,00000004,ALIANZA PARA EL PROGRESO,,100.000,4,4,64,00000004.jpg,9.610,7.862,12/10/2022,16:00 h, 100.0000,040206,148
0,00000029,FUERZA AREQUIPEÑA,,100.000,4,4,78,00000029.jpg,11.712,9.582,12/10/2022,16:00 h, 100.0000,040206,148
5,00000002,PARTIDO DEMOCRATICO SOMOS PERU,,100.000,4,4,84,00000002.jpg,12.613,10.319,12/10/2022,16:00 h, 100.0000,040206,148
4,00000008,PARTIDO POLITICO NACIONAL PERU LIBRE,,100.000,4,4,132,00000008.jpg,19.820,16.216,12/10/2022,16:00 h, 100.0000,040206,148
1,00000032,JUNTOS POR EL DESARROLLO DE AREQUIPA,,100.000,4,4,255,00000032.jpg,38.288,31.327,12/10/2022,16:00 h, 100.0000,040206,148
