,C_CODI_AGP,AGRUPACION,IMAGENAGRUPACION,PORC_AVANCE_ACTA,ACTAS_COMPUTADA,TOTAL_MESAS,TOTAL_VOTOS,NLISTA,POR_VALIDOS,POR_EMITIDOS,fecha,hora,avance,ubigeo
0,00000028,YO AREQUIPA,,100.000,9,9,611,00000028.jpg,36.478,31.707,10/10/2022,16:51 h, 100.0000,040601
1,00000032,JUNTOS POR EL DESARROLLO DE AREQUIPA,,100.000,9,9,261,00000032.jpg,15.582,13.544,10/10/2022,16:51 h, 100.0000,040601
2,00000027,MOVIMIENTO REGIONAL AREQUIPA AVANCEMOS,,100.000,9,9,312,00000027.jpg,18.627,16.191,10/10/2022,16:51 h, 100.0000,040601
3,00000031,"AREQUIPA, TRADICION Y FUTURO",,100.000,9,9,415,00000031.jpg,24.776,21.536,10/10/2022,16:51 h, 100.0000,040601
4,00000002,PARTIDO DEMOCRATICO SOMOS PERU,,100.000,9,9,76,00000002.jpg,4.537,3.944,10/10/2022,16:51 h, 100.0000,040601
