,C_CODI_AGP,AGRUPACION,IMAGENAGRUPACION,PORC_AVANCE_ACTA,ACTAS_COMPUTADA,TOTAL_MESAS,TOTAL_VOTOS,NLISTA,POR_VALIDOS,POR_EMITIDOS,fecha,hora,avance,ubigeo,nulos_y_blancos
4,00000002,PARTIDO DEMOCRATICO SOMOS PERU,,100.000,3,3,8,00000002.jpg,2.036,1.713,12/10/2022,12:30 h, 100.0000,040602,74
0,00000028,YO AREQUIPA,,100.000,3,3,41,00000028.jpg,10.433,8.779,12/10/2022,12:30 h, 100.0000,040602,74
1,00000032,JUNTOS POR EL DESARROLLO DE AREQUIPA,,100.000,3,3,88,00000032.jpg,22.392,18.844,12/10/2022,12:30 h, 100.0000,040602,74
2,00000027,MOVIMIENTO REGIONAL AREQUIPA AVANCEMOS,,100.000,3,3,123,00000027.jpg,31.298,26.338,12/10/2022,12:30 h, 100.0000,040602,74
3,00000031,"AREQUIPA, TRADICION Y FUTURO",,100.000,3,3,133,00000031.jpg,33.842,28.480,12/10/2022,12:30 h, 100.0000,040602,74
