,C_CODI_AGP,AGRUPACION,IMAGENAGRUPACION,PORC_AVANCE_ACTA,ACTAS_COMPUTADA,TOTAL_MESAS,TOTAL_VOTOS,NLISTA,POR_VALIDOS,POR_EMITIDOS,fecha,hora,avance,ubigeo
0,00000036,MOVIMIENTO REGIONAL AGUA,,100.000,11,11,"1,102",00000036.jpg,45.594,40.366,06/10/2022,17:50 h,  78.5714,050102
1,00000037,MOVIMIENTO REGIONAL WARI LLAQTA,,100.000,11,11,573,00000037.jpg,23.707,20.989,06/10/2022,17:50 h,  78.5714,050102
2,00000034,MOVIMIENTO REGIONAL GANA AYACUCHO,,100.000,11,11,496,00000034.jpg,20.521,18.168,06/10/2022,17:50 h,  78.5714,050102
3,00000035,ALIANZA POR NUESTRO DESARROLLO,,100.000,11,11,193,00000035.jpg,7.985,7.070,06/10/2022,17:50 h,  78.5714,050102
4,00000011,PARTIDO FRENTE DE LA ESPERANZA 2021,,100.000,11,11,17,00000011.jpg,0.703,0.623,06/10/2022,17:50 h,  78.5714,050102
5,00000004,ALIANZA PARA EL PROGRESO,,100.000,11,11,24,00000004.jpg,0.993,0.879,06/10/2022,17:50 h,  78.5714,050102
6,00000008,PARTIDO POLITICO NACIONAL PERU LIBRE,,100.000,11,11,8,00000008.jpg,0.331,0.293,06/10/2022,17:50 h,  78.5714,050102
7,00000002,PARTIDO DEMOCRATICO SOMOS PERU,,100.000,11,11,4,00000002.jpg,0.165,0.147,06/10/2022,17:50 h,  78.5714,050102
