,C_CODI_AGP,AGRUPACION,IMAGENAGRUPACION,PORC_AVANCE_ACTA,ACTAS_COMPUTADA,TOTAL_MESAS,TOTAL_VOTOS,NLISTA,POR_VALIDOS,POR_EMITIDOS,fecha,hora,avance,ubigeo,nulos_y_blancos
7,00000002,PARTIDO DEMOCRATICO SOMOS PERU,,100.000,9,9,4,00000002.jpg,0.207,0.188,12/10/2022,12:30 h, 100.0000,050114,197
6,00000008,PARTIDO POLITICO NACIONAL PERU LIBRE,,100.000,9,9,11,00000008.jpg,0.569,0.517,12/10/2022,12:30 h, 100.0000,050114,197
5,00000004,ALIANZA PARA EL PROGRESO,,100.000,9,9,13,00000004.jpg,0.673,0.611,12/10/2022,12:30 h, 100.0000,050114,197
4,00000011,PARTIDO FRENTE DE LA ESPERANZA 2021,,100.000,9,9,15,00000011.jpg,0.776,0.705,12/10/2022,12:30 h, 100.0000,050114,197
3,00000035,ALIANZA POR NUESTRO DESARROLLO,,100.000,9,9,54,00000035.jpg,2.795,2.536,12/10/2022,12:30 h, 100.0000,050114,197
1,00000037,MOVIMIENTO REGIONAL WARI LLAQTA,,100.000,9,9,435,00000037.jpg,22.516,20.432,12/10/2022,12:30 h, 100.0000,050114,197
2,00000034,MOVIMIENTO REGIONAL GANA AYACUCHO,,100.000,9,9,568,00000034.jpg,29.400,26.679,12/10/2022,12:30 h, 100.0000,050114,197
0,00000036,MOVIMIENTO REGIONAL AGUA,,100.000,9,9,832,00000036.jpg,43.064,39.079,12/10/2022,12:30 h, 100.0000,050114,197
