,C_CODI_AGP,AGRUPACION,IMAGENAGRUPACION,PORC_AVANCE_ACTA,ACTAS_COMPUTADA,TOTAL_MESAS,TOTAL_VOTOS,NLISTA,POR_VALIDOS,POR_EMITIDOS,fecha,hora,avance,ubigeo,nulos_y_blancos
6,00000008,PARTIDO POLITICO NACIONAL PERU LIBRE,,100.000,20,20,22,00000008.jpg,0.578,0.497,12/10/2022,12:30 h, 100.0000,050104,618
7,00000002,PARTIDO DEMOCRATICO SOMOS PERU,,100.000,20,20,22,00000002.jpg,0.578,0.497,12/10/2022,12:30 h, 100.0000,050104,618
4,00000011,PARTIDO FRENTE DE LA ESPERANZA 2021,,100.000,20,20,26,00000011.jpg,0.683,0.587,12/10/2022,12:30 h, 100.0000,050104,618
3,00000035,ALIANZA POR NUESTRO DESARROLLO,,100.000,20,20,120,00000035.jpg,3.151,2.711,12/10/2022,12:30 h, 100.0000,050104,618
0,00000036,MOVIMIENTO REGIONAL AGUA,,100.000,20,20,341,00000036.jpg,8.955,7.704,12/10/2022,12:30 h, 100.0000,050104,618
5,00000004,ALIANZA PARA EL PROGRESO,,100.000,20,20,468,00000004.jpg,12.290,10.574,12/10/2022,12:30 h, 100.0000,050104,618
2,00000034,MOVIMIENTO REGIONAL GANA AYACUCHO,,100.000,20,20,1127,00000034.jpg,29.596,25.463,12/10/2022,12:30 h, 100.0000,050104,618
1,00000037,MOVIMIENTO REGIONAL WARI LLAQTA,,100.000,20,20,1682,00000037.jpg,44.170,38.003,12/10/2022,12:30 h, 100.0000,050104,618
