,C_CODI_AGP,AGRUPACION,IMAGENAGRUPACION,PORC_AVANCE_ACTA,ACTAS_COMPUTADA,TOTAL_MESAS,TOTAL_VOTOS,NLISTA,POR_VALIDOS,POR_EMITIDOS,fecha,hora,avance,ubigeo
0,00000036,MOVIMIENTO REGIONAL AGUA,,100.000,17,17,"1,166",00000036.jpg,33.362,27.072,10/10/2022,16:51 h, 100.0000,050110
1,00000037,MOVIMIENTO REGIONAL WARI LLAQTA,,100.000,17,17,532,00000037.jpg,15.222,12.352,10/10/2022,16:51 h, 100.0000,050110
2,00000034,MOVIMIENTO REGIONAL GANA AYACUCHO,,100.000,17,17,"1,246",00000034.jpg,35.651,28.930,10/10/2022,16:51 h, 100.0000,050110
3,00000035,ALIANZA POR NUESTRO DESARROLLO,,100.000,17,17,499,00000035.jpg,14.278,11.586,10/10/2022,16:51 h, 100.0000,050110
4,00000011,PARTIDO FRENTE DE LA ESPERANZA 2021,,100.000,17,17,20,00000011.jpg,0.572,0.464,10/10/2022,16:51 h, 100.0000,050110
5,00000004,ALIANZA PARA EL PROGRESO,,100.000,17,17,11,00000004.jpg,0.315,0.255,10/10/2022,16:51 h, 100.0000,050110
6,00000008,PARTIDO POLITICO NACIONAL PERU LIBRE,,100.000,17,17,13,00000008.jpg,0.372,0.302,10/10/2022,16:51 h, 100.0000,050110
7,00000002,PARTIDO DEMOCRATICO SOMOS PERU,,100.000,17,17,8,00000002.jpg,0.229,0.186,10/10/2022,16:51 h, 100.0000,050110
