,C_CODI_AGP,AGRUPACION,IMAGENAGRUPACION,PORC_AVANCE_ACTA,ACTAS_COMPUTADA,TOTAL_MESAS,TOTAL_VOTOS,NLISTA,POR_VALIDOS,POR_EMITIDOS,fecha,hora,avance,ubigeo,nulos_y_blancos
4,00000011,PARTIDO FRENTE DE LA ESPERANZA 2021,,100.000,4,4,1,00000011.jpg,0.128,0.115,12/10/2022,12:30 h, 100.0000,050415,87
5,00000008,PARTIDO POLITICO NACIONAL PERU LIBRE,,100.000,4,4,1,00000008.jpg,0.128,0.115,12/10/2022,12:30 h, 100.0000,050415,87
6,00000002,PARTIDO DEMOCRATICO SOMOS PERU,,100.000,4,4,1,00000002.jpg,0.128,0.115,12/10/2022,12:30 h, 100.0000,050415,87
2,00000034,MOVIMIENTO REGIONAL GANA AYACUCHO,,100.000,4,4,34,00000034.jpg,4.337,3.904,12/10/2022,12:30 h, 100.0000,050415,87
3,00000035,ALIANZA POR NUESTRO DESARROLLO,,100.000,4,4,115,00000035.jpg,14.668,13.203,12/10/2022,12:30 h, 100.0000,050415,87
0,00000036,MOVIMIENTO REGIONAL AGUA,,100.000,4,4,225,00000036.jpg,28.699,25.832,12/10/2022,12:30 h, 100.0000,050415,87
1,00000037,MOVIMIENTO REGIONAL WARI LLAQTA,,100.000,4,4,407,00000037.jpg,51.913,46.728,12/10/2022,12:30 h, 100.0000,050415,87
