,C_CODI_AGP,AGRUPACION,IMAGENAGRUPACION,PORC_AVANCE_ACTA,ACTAS_COMPUTADA,TOTAL_MESAS,TOTAL_VOTOS,NLISTA,POR_VALIDOS,POR_EMITIDOS,fecha,hora,avance,ubigeo
0,00000036,MOVIMIENTO REGIONAL AGUA,,100.000,20,20,"1,491",00000036.jpg,39.930,36.145,06/10/2022,17:50 h, 100.0000,050409
1,00000037,MOVIMIENTO REGIONAL WARI LLAQTA,,100.000,20,20,"1,911",00000037.jpg,51.178,46.327,06/10/2022,17:50 h, 100.0000,050409
2,00000034,MOVIMIENTO REGIONAL GANA AYACUCHO,,100.000,20,20,179,00000034.jpg,4.794,4.339,06/10/2022,17:50 h, 100.0000,050409
3,00000035,ALIANZA POR NUESTRO DESARROLLO,,100.000,20,20,132,00000035.jpg,3.535,3.200,06/10/2022,17:50 h, 100.0000,050409
4,00000011,PARTIDO FRENTE DE LA ESPERANZA 2021,,100.000,20,20,9,00000011.jpg,0.241,0.218,06/10/2022,17:50 h, 100.0000,050409
5,00000008,PARTIDO POLITICO NACIONAL PERU LIBRE,,100.000,20,20,6,00000008.jpg,0.161,0.145,06/10/2022,17:50 h, 100.0000,050409
6,00000002,PARTIDO DEMOCRATICO SOMOS PERU,,100.000,20,20,6,00000002.jpg,0.161,0.145,06/10/2022,17:50 h, 100.0000,050409
