,C_CODI_AGP,AGRUPACION,IMAGENAGRUPACION,PORC_AVANCE_ACTA,ACTAS_COMPUTADA,TOTAL_MESAS,TOTAL_VOTOS,NLISTA,POR_VALIDOS,POR_EMITIDOS,fecha,hora,avance,ubigeo,nulos_y_blancos
6,00000002,PARTIDO DEMOCRATICO SOMOS PERU,,100.000,24,24,1,00000002.jpg,0.030,0.027,12/10/2022,12:30 h, 100.0000,050402,455
4,00000011,PARTIDO FRENTE DE LA ESPERANZA 2021,,100.000,24,24,3,00000011.jpg,0.091,0.080,12/10/2022,12:30 h, 100.0000,050402,455
5,00000008,PARTIDO POLITICO NACIONAL PERU LIBRE,,100.000,24,24,10,00000008.jpg,0.302,0.266,12/10/2022,12:30 h, 100.0000,050402,455
3,00000035,ALIANZA POR NUESTRO DESARROLLO,,100.000,24,24,319,00000035.jpg,9.646,8.480,12/10/2022,12:30 h, 100.0000,050402,455
2,00000034,MOVIMIENTO REGIONAL GANA AYACUCHO,,100.000,24,24,631,00000034.jpg,19.081,16.773,12/10/2022,12:30 h, 100.0000,050402,455
1,00000037,MOVIMIENTO REGIONAL WARI LLAQTA,,100.000,24,24,676,00000037.jpg,20.441,17.969,12/10/2022,12:30 h, 100.0000,050402,455
0,00000036,MOVIMIENTO REGIONAL AGUA,,100.000,24,24,1667,00000036.jpg,50.408,44.312,12/10/2022,12:30 h, 100.0000,050402,455
