,C_CODI_AGP,AGRUPACION,IMAGENAGRUPACION,PORC_AVANCE_ACTA,ACTAS_COMPUTADA,TOTAL_MESAS,TOTAL_VOTOS,NLISTA,POR_VALIDOS,POR_EMITIDOS,fecha,hora,avance,ubigeo
0,00000036,MOVIMIENTO REGIONAL AGUA,,100.000,10,10,284,00000036.jpg,30.181,20.625,10/10/2022,16:51 h, 100.0000,050502
1,00000037,MOVIMIENTO REGIONAL WARI LLAQTA,,100.000,10,10,104,00000037.jpg,11.052,7.553,10/10/2022,16:51 h, 100.0000,050502
2,00000035,ALIANZA POR NUESTRO DESARROLLO,,100.000,10,10,11,00000035.jpg,1.169,0.799,10/10/2022,16:51 h, 100.0000,050502
3,00000005,JUNTOS POR EL PERU,,100.000,10,10,6,00000005.jpg,0.638,0.436,10/10/2022,16:51 h, 100.0000,050502
4,00000008,PARTIDO POLITICO NACIONAL PERU LIBRE,,100.000,10,10,14,00000008.jpg,1.488,1.017,10/10/2022,16:51 h, 100.0000,050502
5,00000002,PARTIDO DEMOCRATICO SOMOS PERU,,100.000,10,10,522,00000002.jpg,55.473,37.908,10/10/2022,16:51 h, 100.0000,050502
