,C_CODI_AGP,AGRUPACION,IMAGENAGRUPACION,PORC_AVANCE_ACTA,ACTAS_COMPUTADA,TOTAL_MESAS,TOTAL_VOTOS,NLISTA,POR_VALIDOS,POR_EMITIDOS,fecha,hora,avance,ubigeo
0,00000036,MOVIMIENTO REGIONAL AGUA,,100.000,9,9,36,00000036.jpg,2.824,2.367,10/10/2022,10:52 h, 100.0000,050516
1,00000037,MOVIMIENTO REGIONAL WARI LLAQTA,,100.000,9,9,722,00000037.jpg,56.627,47.469,10/10/2022,10:52 h, 100.0000,050516
2,00000035,ALIANZA POR NUESTRO DESARROLLO,,100.000,9,9,455,00000035.jpg,35.686,29.915,10/10/2022,10:52 h, 100.0000,050516
3,00000005,JUNTOS POR EL PERU,,100.000,9,9,37,00000005.jpg,2.902,2.433,10/10/2022,10:52 h, 100.0000,050516
4,00000008,PARTIDO POLITICO NACIONAL PERU LIBRE,,100.000,9,9,4,00000008.jpg,0.314,0.263,10/10/2022,10:52 h, 100.0000,050516
5,00000002,PARTIDO DEMOCRATICO SOMOS PERU,,100.000,9,9,21,00000002.jpg,1.647,1.381,10/10/2022,10:52 h, 100.0000,050516
