,C_CODI_AGP,AGRUPACION,IMAGENAGRUPACION,PORC_AVANCE_ACTA,ACTAS_COMPUTADA,TOTAL_MESAS,TOTAL_VOTOS,NLISTA,POR_VALIDOS,POR_EMITIDOS,fecha,hora,avance,ubigeo
0,00000036,MOVIMIENTO REGIONAL AGUA,,100.000,4,4,121,00000036.jpg,25.527,15.375,06/10/2022,17:50 h, 100.0000,050514
1,00000037,MOVIMIENTO REGIONAL WARI LLAQTA,,100.000,4,4,44,00000037.jpg,9.283,5.591,06/10/2022,17:50 h, 100.0000,050514
2,00000035,ALIANZA POR NUESTRO DESARROLLO,,100.000,4,4,57,00000035.jpg,12.025,7.243,06/10/2022,17:50 h, 100.0000,050514
3,00000005,JUNTOS POR EL PERU,,100.000,4,4,94,00000005.jpg,19.831,11.944,06/10/2022,17:50 h, 100.0000,050514
4,00000008,PARTIDO POLITICO NACIONAL PERU LIBRE,,100.000,4,4,2,00000008.jpg,0.422,0.254,06/10/2022,17:50 h, 100.0000,050514
5,00000002,PARTIDO DEMOCRATICO SOMOS PERU,,100.000,4,4,156,00000002.jpg,32.911,19.822,06/10/2022,17:50 h, 100.0000,050514
