,C_CODI_AGP,AGRUPACION,IMAGENAGRUPACION,PORC_AVANCE_ACTA,ACTAS_COMPUTADA,TOTAL_MESAS,TOTAL_VOTOS,NLISTA,POR_VALIDOS,POR_EMITIDOS,fecha,hora,avance,ubigeo,nulos_y_blancos
4,00000008,PARTIDO POLITICO NACIONAL PERU LIBRE,,100.000,6,6,22,00000008.jpg,2.031,1.741,12/10/2022,16:00 h, 100.0000,050612,181
2,00000034,MOVIMIENTO REGIONAL GANA AYACUCHO,,100.000,6,6,211,00000034.jpg,19.483,16.693,12/10/2022,16:00 h, 100.0000,050612,181
3,00000035,ALIANZA POR NUESTRO DESARROLLO,,100.000,6,6,251,00000035.jpg,23.176,19.858,12/10/2022,16:00 h, 100.0000,050612,181
0,00000036,MOVIMIENTO REGIONAL AGUA,,100.000,6,6,270,00000036.jpg,24.931,21.361,12/10/2022,16:00 h, 100.0000,050612,181
1,00000037,MOVIMIENTO REGIONAL WARI LLAQTA,,100.000,6,6,329,00000037.jpg,30.379,26.028,12/10/2022,16:00 h, 100.0000,050612,181
