,C_CODI_AGP,AGRUPACION,IMAGENAGRUPACION,PORC_AVANCE_ACTA,ACTAS_COMPUTADA,TOTAL_MESAS,TOTAL_VOTOS,NLISTA,POR_VALIDOS,POR_EMITIDOS,fecha,hora,avance,ubigeo,nulos_y_blancos
4,00000002,PARTIDO DEMOCRATICO SOMOS PERU,,100.000,3,3,18,00000002.jpg,3.789,3.315,12/10/2022,16:00 h, 100.0000,050703,68
3,00000035,ALIANZA POR NUESTRO DESARROLLO,,100.000,3,3,55,00000035.jpg,11.579,10.129,12/10/2022,16:00 h, 100.0000,050703,68
2,00000034,MOVIMIENTO REGIONAL GANA AYACUCHO,,100.000,3,3,87,00000034.jpg,18.316,16.022,12/10/2022,16:00 h, 100.0000,050703,68
1,00000037,MOVIMIENTO REGIONAL WARI LLAQTA,,100.000,3,3,99,00000037.jpg,20.842,18.232,12/10/2022,16:00 h, 100.0000,050703,68
0,00000036,MOVIMIENTO REGIONAL AGUA,,100.000,3,3,216,00000036.jpg,45.474,39.779,12/10/2022,16:00 h, 100.0000,050703,68
