,C_CODI_AGP,AGRUPACION,IMAGENAGRUPACION,PORC_AVANCE_ACTA,ACTAS_COMPUTADA,TOTAL_MESAS,TOTAL_VOTOS,NLISTA,POR_VALIDOS,POR_EMITIDOS,fecha,hora,avance,ubigeo
0,00000036,MOVIMIENTO REGIONAL AGUA,,100.000,4,4,166,00000036.jpg,22.222,19.191,06/10/2022,17:50 h, 100.0000,050706
1,00000037,MOVIMIENTO REGIONAL WARI LLAQTA,,100.000,4,4,138,00000037.jpg,18.474,15.954,06/10/2022,17:50 h, 100.0000,050706
2,00000034,MOVIMIENTO REGIONAL GANA AYACUCHO,,100.000,4,4,240,00000034.jpg,32.129,27.746,06/10/2022,17:50 h, 100.0000,050706
3,00000035,ALIANZA POR NUESTRO DESARROLLO,,100.000,4,4,61,00000035.jpg,8.166,7.052,06/10/2022,17:50 h, 100.0000,050706
4,00000004,ALIANZA PARA EL PROGRESO,,100.000,4,4,6,00000004.jpg,0.803,0.694,06/10/2022,17:50 h, 100.0000,050706
5,00000008,PARTIDO POLITICO NACIONAL PERU LIBRE,,100.000,4,4,136,00000008.jpg,18.206,15.723,06/10/2022,17:50 h, 100.0000,050706
