,C_CODI_AGP,AGRUPACION,IMAGENAGRUPACION,PORC_AVANCE_ACTA,ACTAS_COMPUTADA,TOTAL_MESAS,TOTAL_VOTOS,NLISTA,POR_VALIDOS,POR_EMITIDOS,fecha,hora,avance,ubigeo
0,00000036,MOVIMIENTO REGIONAL AGUA,,100.000,9,9,317,00000036.jpg,21.923,18.260,10/10/2022,16:51 h, 100.0000,050713
1,00000037,MOVIMIENTO REGIONAL WARI LLAQTA,,100.000,9,9,315,00000037.jpg,21.784,18.145,10/10/2022,16:51 h, 100.0000,050713
2,00000034,MOVIMIENTO REGIONAL GANA AYACUCHO,,100.000,9,9,266,00000034.jpg,18.396,15.323,10/10/2022,16:51 h, 100.0000,050713
3,00000035,ALIANZA POR NUESTRO DESARROLLO,,100.000,9,9,29,00000035.jpg,2.006,1.671,10/10/2022,16:51 h, 100.0000,050713
4,00000004,ALIANZA PARA EL PROGRESO,,100.000,9,9,18,00000004.jpg,1.245,1.037,10/10/2022,16:51 h, 100.0000,050713
5,00000008,PARTIDO POLITICO NACIONAL PERU LIBRE,,100.000,9,9,501,00000008.jpg,34.647,28.859,10/10/2022,16:51 h, 100.0000,050713
