,C_CODI_AGP,AGRUPACION,IMAGENAGRUPACION,PORC_AVANCE_ACTA,ACTAS_COMPUTADA,TOTAL_MESAS,TOTAL_VOTOS,NLISTA,POR_VALIDOS,POR_EMITIDOS,fecha,hora,avance,ubigeo
0,00000036,MOVIMIENTO REGIONAL AGUA,,100.000,8,8,155,00000036.jpg,12.510,10.624,06/10/2022,17:50 h, 100.0000,050704
1,00000037,MOVIMIENTO REGIONAL WARI LLAQTA,,100.000,8,8,258,00000037.jpg,20.823,17.683,06/10/2022,17:50 h, 100.0000,050704
2,00000034,MOVIMIENTO REGIONAL GANA AYACUCHO,,100.000,8,8,356,00000034.jpg,28.733,24.400,06/10/2022,17:50 h, 100.0000,050704
3,00000035,ALIANZA POR NUESTRO DESARROLLO,,100.000,8,8,52,00000035.jpg,4.197,3.564,06/10/2022,17:50 h, 100.0000,050704
4,00000004,ALIANZA PARA EL PROGRESO,,100.000,8,8,22,00000004.jpg,1.776,1.508,06/10/2022,17:50 h, 100.0000,050704
5,00000008,PARTIDO POLITICO NACIONAL PERU LIBRE,,100.000,8,8,396,00000008.jpg,31.961,27.142,06/10/2022,17:50 h, 100.0000,050704
