,C_CODI_AGP,AGRUPACION,IMAGENAGRUPACION,PORC_AVANCE_ACTA,ACTAS_COMPUTADA,TOTAL_MESAS,TOTAL_VOTOS,NLISTA,POR_VALIDOS,POR_EMITIDOS,fecha,hora,avance,ubigeo
0,00000036,MOVIMIENTO REGIONAL AGUA,,100.000,3,3,186,00000036.jpg,39.914,34.254,06/10/2022,17:50 h, 100.0000,050703
1,00000037,MOVIMIENTO REGIONAL WARI LLAQTA,,100.000,3,3,113,00000037.jpg,24.249,20.810,06/10/2022,17:50 h, 100.0000,050703
2,00000034,MOVIMIENTO REGIONAL GANA AYACUCHO,,100.000,3,3,94,00000034.jpg,20.172,17.311,06/10/2022,17:50 h, 100.0000,050703
3,00000035,ALIANZA POR NUESTRO DESARROLLO,,100.000,3,3,49,00000035.jpg,10.515,9.024,06/10/2022,17:50 h, 100.0000,050703
4,00000004,ALIANZA PARA EL PROGRESO,,100.000,3,3,12,00000004.jpg,2.575,2.210,06/10/2022,17:50 h, 100.0000,050703
5,00000008,PARTIDO POLITICO NACIONAL PERU LIBRE,,100.000,3,3,12,00000008.jpg,2.575,2.210,06/10/2022,17:50 h, 100.0000,050703
