,C_CODI_AGP,AGRUPACION,IMAGENAGRUPACION,PORC_AVANCE_ACTA,ACTAS_COMPUTADA,TOTAL_MESAS,TOTAL_VOTOS,NLISTA,POR_VALIDOS,POR_EMITIDOS,fecha,hora,avance,ubigeo
0,00000036,MOVIMIENTO REGIONAL AGUA,,100.000,7,7,177,00000036.jpg,18.342,14.987,10/10/2022,10:52 h, 100.0000,050708
1,00000037,MOVIMIENTO REGIONAL WARI LLAQTA,,100.000,7,7,398,00000037.jpg,41.244,33.700,10/10/2022,10:52 h, 100.0000,050708
2,00000034,MOVIMIENTO REGIONAL GANA AYACUCHO,,100.000,7,7,191,00000034.jpg,19.793,16.173,10/10/2022,10:52 h, 100.0000,050708
3,00000035,ALIANZA POR NUESTRO DESARROLLO,,100.000,7,7,73,00000035.jpg,7.565,6.181,10/10/2022,10:52 h, 100.0000,050708
4,00000004,ALIANZA PARA EL PROGRESO,,100.000,7,7,8,00000004.jpg,0.829,0.677,10/10/2022,10:52 h, 100.0000,050708
5,00000008,PARTIDO POLITICO NACIONAL PERU LIBRE,,100.000,7,7,118,00000008.jpg,12.228,9.992,10/10/2022,10:52 h, 100.0000,050708
