,C_CODI_AGP,AGRUPACION,IMAGENAGRUPACION,PORC_AVANCE_ACTA,ACTAS_COMPUTADA,TOTAL_MESAS,TOTAL_VOTOS,NLISTA,POR_VALIDOS,POR_EMITIDOS,fecha,hora,avance,ubigeo,nulos_y_blancos
5,00000002,PARTIDO DEMOCRATICO SOMOS PERU,,100.000,7,7,22,00000002.jpg,2.245,1.863,12/10/2022,16:00 h, 100.0000,050708,201
3,00000035,ALIANZA POR NUESTRO DESARROLLO,,100.000,7,7,109,00000035.jpg,11.122,9.229,12/10/2022,16:00 h, 100.0000,050708,201
4,00000008,PARTIDO POLITICO NACIONAL PERU LIBRE,,100.000,7,7,150,00000008.jpg,15.306,12.701,12/10/2022,16:00 h, 100.0000,050708,201
0,00000036,MOVIMIENTO REGIONAL AGUA,,100.000,7,7,171,00000036.jpg,17.449,14.479,12/10/2022,16:00 h, 100.0000,050708,201
2,00000034,MOVIMIENTO REGIONAL GANA AYACUCHO,,100.000,7,7,212,00000034.jpg,21.633,17.951,12/10/2022,16:00 h, 100.0000,050708,201
1,00000037,MOVIMIENTO REGIONAL WARI LLAQTA,,100.000,7,7,316,00000037.jpg,32.245,26.757,12/10/2022,16:00 h, 100.0000,050708,201
