,C_CODI_AGP,AGRUPACION,IMAGENAGRUPACION,PORC_AVANCE_ACTA,ACTAS_COMPUTADA,TOTAL_MESAS,TOTAL_VOTOS,NLISTA,POR_VALIDOS,POR_EMITIDOS,fecha,hora,avance,ubigeo
0,00000036,MOVIMIENTO REGIONAL AGUA,,100.000,4,4,340,00000036.jpg,50.222,43.871,10/10/2022,16:51 h, 100.0000,050709
1,00000037,MOVIMIENTO REGIONAL WARI LLAQTA,,100.000,4,4,80,00000037.jpg,11.817,10.323,10/10/2022,16:51 h, 100.0000,050709
2,00000034,MOVIMIENTO REGIONAL GANA AYACUCHO,,100.000,4,4,230,00000034.jpg,33.973,29.677,10/10/2022,16:51 h, 100.0000,050709
3,00000035,ALIANZA POR NUESTRO DESARROLLO,,100.000,4,4,7,00000035.jpg,1.034,0.903,10/10/2022,16:51 h, 100.0000,050709
4,00000004,ALIANZA PARA EL PROGRESO,,100.000,4,4,4,00000004.jpg,0.591,0.516,10/10/2022,16:51 h, 100.0000,050709
5,00000008,PARTIDO POLITICO NACIONAL PERU LIBRE,,100.000,4,4,16,00000008.jpg,2.363,2.065,10/10/2022,16:51 h, 100.0000,050709
