,C_CODI_AGP,AGRUPACION,IMAGENAGRUPACION,PORC_AVANCE_ACTA,ACTAS_COMPUTADA,TOTAL_MESAS,TOTAL_VOTOS,NLISTA,POR_VALIDOS,POR_EMITIDOS,fecha,hora,avance,ubigeo,nulos_y_blancos
3,00000011,PARTIDO FRENTE DE LA ESPERANZA 2021,,100.000,9,9,94,00000011.jpg,6.096,5.415,12/10/2022,16:00 h, 100.0000,050713,194
2,00000034,MOVIMIENTO REGIONAL GANA AYACUCHO,,100.000,9,9,290,00000034.jpg,18.807,16.705,12/10/2022,16:00 h, 100.0000,050713,194
1,00000037,MOVIMIENTO REGIONAL WARI LLAQTA,,100.000,9,9,309,00000037.jpg,20.039,17.800,12/10/2022,16:00 h, 100.0000,050713,194
0,00000036,MOVIMIENTO REGIONAL AGUA,,100.000,9,9,391,00000036.jpg,25.357,22.523,12/10/2022,16:00 h, 100.0000,050713,194
4,00000008,PARTIDO POLITICO NACIONAL PERU LIBRE,,100.000,9,9,458,00000008.jpg,29.702,26.382,12/10/2022,16:00 h, 100.0000,050713,194
