,C_CODI_AGP,AGRUPACION,IMAGENAGRUPACION,PORC_AVANCE_ACTA,ACTAS_COMPUTADA,TOTAL_MESAS,TOTAL_VOTOS,NLISTA,POR_VALIDOS,POR_EMITIDOS,fecha,hora,avance,ubigeo
0,00000036,MOVIMIENTO REGIONAL AGUA,,100.000,6,6,354,00000036.jpg,46.094,36.196,10/10/2022,16:51 h, 100.0000,050802
1,00000037,MOVIMIENTO REGIONAL WARI LLAQTA,,100.000,6,6,35,00000037.jpg,4.557,3.579,10/10/2022,16:51 h, 100.0000,050802
2,00000034,MOVIMIENTO REGIONAL GANA AYACUCHO,,100.000,6,6,96,00000034.jpg,12.500,9.816,10/10/2022,16:51 h, 100.0000,050802
3,00000035,ALIANZA POR NUESTRO DESARROLLO,,100.000,6,6,169,00000035.jpg,22.005,17.280,10/10/2022,16:51 h, 100.0000,050802
4,00000008,PARTIDO POLITICO NACIONAL PERU LIBRE,,100.000,6,6,114,00000008.jpg,14.844,11.656,10/10/2022,16:51 h, 100.0000,050802
