,C_CODI_AGP,AGRUPACION,IMAGENAGRUPACION,PORC_AVANCE_ACTA,ACTAS_COMPUTADA,TOTAL_MESAS,TOTAL_VOTOS,NLISTA,POR_VALIDOS,POR_EMITIDOS,fecha,hora,avance,ubigeo,nulos_y_blancos
0,00000036,MOVIMIENTO REGIONAL AGUA,,100.000,9,9,89,00000036.jpg,6.820,6.092,12/10/2022,16:00 h, 100.0000,050804,156
2,00000035,ALIANZA POR NUESTRO DESARROLLO,,100.000,9,9,234,00000035.jpg,17.931,16.016,12/10/2022,16:00 h, 100.0000,050804,156
4,00000002,PARTIDO DEMOCRATICO SOMOS PERU,,100.000,9,9,247,00000002.jpg,18.927,16.906,12/10/2022,16:00 h, 100.0000,050804,156
1,00000034,MOVIMIENTO REGIONAL GANA AYACUCHO,,100.000,9,9,352,00000034.jpg,26.973,24.093,12/10/2022,16:00 h, 100.0000,050804,156
3,00000008,PARTIDO POLITICO NACIONAL PERU LIBRE,,100.000,9,9,383,00000008.jpg,29.349,26.215,12/10/2022,16:00 h, 100.0000,050804,156
