,C_CODI_AGP,AGRUPACION,IMAGENAGRUPACION,PORC_AVANCE_ACTA,ACTAS_COMPUTADA,TOTAL_MESAS,TOTAL_VOTOS,NLISTA,POR_VALIDOS,POR_EMITIDOS,fecha,hora,avance,ubigeo
0,00000036,MOVIMIENTO REGIONAL AGUA,,100.000,9,9,259,00000036.jpg,14.928,13.448,06/10/2022,17:50 h, 100.0000,050801
1,00000037,MOVIMIENTO REGIONAL WARI LLAQTA,,100.000,9,9,126,00000037.jpg,7.262,6.542,06/10/2022,17:50 h, 100.0000,050801
2,00000034,MOVIMIENTO REGIONAL GANA AYACUCHO,,100.000,9,9,179,00000034.jpg,10.317,9.294,06/10/2022,17:50 h, 100.0000,050801
3,00000035,ALIANZA POR NUESTRO DESARROLLO,,100.000,9,9,738,00000035.jpg,42.536,38.318,06/10/2022,17:50 h, 100.0000,050801
4,00000008,PARTIDO POLITICO NACIONAL PERU LIBRE,,100.000,9,9,433,00000008.jpg,24.957,22.482,06/10/2022,17:50 h, 100.0000,050801
