,C_CODI_AGP,AGRUPACION,IMAGENAGRUPACION,PORC_AVANCE_ACTA,ACTAS_COMPUTADA,TOTAL_MESAS,TOTAL_VOTOS,NLISTA,POR_VALIDOS,POR_EMITIDOS,fecha,hora,avance,ubigeo
0,00000036,MOVIMIENTO REGIONAL AGUA,,100.000,4,4,298,00000036.jpg,38.205,34.571,06/10/2022,17:50 h, 100.0000,050907
1,00000037,MOVIMIENTO REGIONAL WARI LLAQTA,,100.000,4,4,140,00000037.jpg,17.949,16.241,06/10/2022,17:50 h, 100.0000,050907
2,00000034,MOVIMIENTO REGIONAL GANA AYACUCHO,,100.000,4,4,2,00000034.jpg,0.256,0.232,06/10/2022,17:50 h, 100.0000,050907
3,00000035,ALIANZA POR NUESTRO DESARROLLO,,100.000,4,4,338,00000035.jpg,43.333,39.211,06/10/2022,17:50 h, 100.0000,050907
4,00000011,PARTIDO FRENTE DE LA ESPERANZA 2021,,100.000,4,4,0,00000011.jpg,0.000,0.000,06/10/2022,17:50 h, 100.0000,050907
5,00000002,PARTIDO DEMOCRATICO SOMOS PERU,,100.000,4,4,2,00000002.jpg,0.256,0.232,06/10/2022,17:50 h, 100.0000,050907
