,C_CODI_AGP,AGRUPACION,IMAGENAGRUPACION,PORC_AVANCE_ACTA,ACTAS_COMPUTADA,TOTAL_MESAS,TOTAL_VOTOS,NLISTA,POR_VALIDOS,POR_EMITIDOS,fecha,hora,avance,ubigeo
0,00000036,MOVIMIENTO REGIONAL AGUA,,100.000,13,13,823,00000036.jpg,35.597,31.484,06/10/2022,17:50 h, 100.0000,050902
1,00000037,MOVIMIENTO REGIONAL WARI LLAQTA,,100.000,13,13,622,00000037.jpg,26.903,23.795,06/10/2022,17:50 h, 100.0000,050902
2,00000034,MOVIMIENTO REGIONAL GANA AYACUCHO,,100.000,13,13,10,00000034.jpg,0.433,0.383,06/10/2022,17:50 h, 100.0000,050902
3,00000035,ALIANZA POR NUESTRO DESARROLLO,,100.000,13,13,664,00000035.jpg,28.720,25.402,06/10/2022,17:50 h, 100.0000,050902
4,00000011,PARTIDO FRENTE DE LA ESPERANZA 2021,,100.000,13,13,6,00000011.jpg,0.260,0.230,06/10/2022,17:50 h, 100.0000,050902
5,00000002,PARTIDO DEMOCRATICO SOMOS PERU,,100.000,13,13,187,00000002.jpg,8.088,7.154,06/10/2022,17:50 h, 100.0000,050902
