,C_CODI_AGP,AGRUPACION,IMAGENAGRUPACION,PORC_AVANCE_ACTA,ACTAS_COMPUTADA,TOTAL_MESAS,TOTAL_VOTOS,NLISTA,POR_VALIDOS,POR_EMITIDOS,fecha,hora,avance,ubigeo
0,00000036,MOVIMIENTO REGIONAL AGUA,,100.000,7,7,245,00000036.jpg,24.574,21.817,10/10/2022,16:51 h, 100.0000,050906
1,00000037,MOVIMIENTO REGIONAL WARI LLAQTA,,100.000,7,7,487,00000037.jpg,48.847,43.366,10/10/2022,16:51 h, 100.0000,050906
2,00000034,MOVIMIENTO REGIONAL GANA AYACUCHO,,100.000,7,7,14,00000034.jpg,1.404,1.247,10/10/2022,16:51 h, 100.0000,050906
3,00000035,ALIANZA POR NUESTRO DESARROLLO,,100.000,7,7,233,00000035.jpg,23.370,20.748,10/10/2022,16:51 h, 100.0000,050906
4,00000011,PARTIDO FRENTE DE LA ESPERANZA 2021,,100.000,7,7,3,00000011.jpg,0.301,0.267,10/10/2022,16:51 h, 100.0000,050906
5,00000002,PARTIDO DEMOCRATICO SOMOS PERU,,100.000,7,7,15,00000002.jpg,1.505,1.336,10/10/2022,16:51 h, 100.0000,050906
