,C_CODI_AGP,AGRUPACION,IMAGENAGRUPACION,PORC_AVANCE_ACTA,ACTAS_COMPUTADA,TOTAL_MESAS,TOTAL_VOTOS,NLISTA,POR_VALIDOS,POR_EMITIDOS,fecha,hora,avance,ubigeo
0,00000036,MOVIMIENTO REGIONAL AGUA,,100.000,5,5,256,00000036.jpg,31.605,28.009,10/10/2022,10:52 h, 100.0000,050903
1,00000037,MOVIMIENTO REGIONAL WARI LLAQTA,,100.000,5,5,153,00000037.jpg,18.889,16.740,10/10/2022,10:52 h, 100.0000,050903
2,00000034,MOVIMIENTO REGIONAL GANA AYACUCHO,,100.000,5,5,31,00000034.jpg,3.827,3.392,10/10/2022,10:52 h, 100.0000,050903
3,00000035,ALIANZA POR NUESTRO DESARROLLO,,100.000,5,5,278,00000035.jpg,34.321,30.416,10/10/2022,10:52 h, 100.0000,050903
4,00000011,PARTIDO FRENTE DE LA ESPERANZA 2021,,100.000,5,5,3,00000011.jpg,0.370,0.328,10/10/2022,10:52 h, 100.0000,050903
5,00000002,PARTIDO DEMOCRATICO SOMOS PERU,,100.000,5,5,89,00000002.jpg,10.988,9.737,10/10/2022,10:52 h, 100.0000,050903
