,C_CODI_AGP,AGRUPACION,IMAGENAGRUPACION,PORC_AVANCE_ACTA,ACTAS_COMPUTADA,TOTAL_MESAS,TOTAL_VOTOS,NLISTA,POR_VALIDOS,POR_EMITIDOS,fecha,hora,avance,ubigeo
0,00000036,MOVIMIENTO REGIONAL AGUA,,100.000,2,2,89,00000036.jpg,35.743,32.721,10/10/2022,10:52 h, 100.0000,051109
1,00000037,MOVIMIENTO REGIONAL WARI LLAQTA,,100.000,2,2,93,00000037.jpg,37.349,34.191,10/10/2022,10:52 h, 100.0000,051109
2,00000034,MOVIMIENTO REGIONAL GANA AYACUCHO,,100.000,2,2,6,00000034.jpg,2.410,2.206,10/10/2022,10:52 h, 100.0000,051109
3,00000035,ALIANZA POR NUESTRO DESARROLLO,,100.000,2,2,22,00000035.jpg,8.835,8.088,10/10/2022,10:52 h, 100.0000,051109
4,00000008,PARTIDO POLITICO NACIONAL PERU LIBRE,,100.000,2,2,39,00000008.jpg,15.663,14.338,10/10/2022,10:52 h, 100.0000,051109
