,C_CODI_AGP,AGRUPACION,IMAGENAGRUPACION,PORC_AVANCE_ACTA,ACTAS_COMPUTADA,TOTAL_MESAS,TOTAL_VOTOS,NLISTA,POR_VALIDOS,POR_EMITIDOS,fecha,hora,avance,ubigeo
0,00000036,MOVIMIENTO REGIONAL AGUA,,100.000,4,4,113,00000036.jpg,17.095,14.656,10/10/2022,10:52 h, 100.0000,051104
1,00000037,MOVIMIENTO REGIONAL WARI LLAQTA,,100.000,4,4,140,00000037.jpg,21.180,18.158,10/10/2022,10:52 h, 100.0000,051104
2,00000034,MOVIMIENTO REGIONAL GANA AYACUCHO,,100.000,4,4,44,00000034.jpg,6.657,5.707,10/10/2022,10:52 h, 100.0000,051104
3,00000035,ALIANZA POR NUESTRO DESARROLLO,,100.000,4,4,244,00000035.jpg,36.914,31.647,10/10/2022,10:52 h, 100.0000,051104
4,00000008,PARTIDO POLITICO NACIONAL PERU LIBRE,,100.000,4,4,120,00000008.jpg,18.154,15.564,10/10/2022,10:52 h, 100.0000,051104
