,C_CODI_AGP,AGRUPACION,IMAGENAGRUPACION,PORC_AVANCE_ACTA,ACTAS_COMPUTADA,TOTAL_MESAS,TOTAL_VOTOS,NLISTA,POR_VALIDOS,POR_EMITIDOS,fecha,hora,avance,ubigeo
0,00000036,MOVIMIENTO REGIONAL AGUA,,100.000,2,2,102,00000036.jpg,30.909,26.702,10/10/2022,16:51 h, 100.0000,051103
1,00000037,MOVIMIENTO REGIONAL WARI LLAQTA,,100.000,2,2,22,00000037.jpg,6.667,5.759,10/10/2022,16:51 h, 100.0000,051103
2,00000034,MOVIMIENTO REGIONAL GANA AYACUCHO,,100.000,2,2,9,00000034.jpg,2.727,2.356,10/10/2022,16:51 h, 100.0000,051103
3,00000035,ALIANZA POR NUESTRO DESARROLLO,,100.000,2,2,92,00000035.jpg,27.879,24.084,10/10/2022,16:51 h, 100.0000,051103
4,00000008,PARTIDO POLITICO NACIONAL PERU LIBRE,,100.000,2,2,105,00000008.jpg,31.818,27.487,10/10/2022,16:51 h, 100.0000,051103
