,C_CODI_AGP,AGRUPACION,IMAGENAGRUPACION,PORC_AVANCE_ACTA,ACTAS_COMPUTADA,TOTAL_MESAS,TOTAL_VOTOS,NLISTA,POR_VALIDOS,POR_EMITIDOS,fecha,hora,avance,ubigeo,nulos_y_blancos
2,00000007,AVANZA PAIS - PARTIDO DE INTEGRACION SOCIAL,,100.000,29,29,172,00000007.jpg,2.992,2.645,12/10/2022,16:00 h, 100.0000,060619,754
4,00000002,PARTIDO DEMOCRATICO SOMOS PERU,,100.000,29,29,465,00000002.jpg,8.090,7.152,12/10/2022,16:00 h, 100.0000,060619,754
1,00000004,ALIANZA PARA EL PROGRESO,,100.000,29,29,1440,00000004.jpg,25.052,22.147,12/10/2022,16:00 h, 100.0000,060619,754
3,00000008,PARTIDO POLITICO NACIONAL PERU LIBRE,,100.000,29,29,1510,00000008.jpg,26.270,23.224,12/10/2022,16:00 h, 100.0000,060619,754
0,00000039,FRENTE REGIONAL DE CAJAMARCA,,100.000,29,29,2161,00000039.jpg,37.596,33.236,12/10/2022,16:00 h, 100.0000,060619,754
