,C_CODI_AGP,AGRUPACION,IMAGENAGRUPACION,PORC_AVANCE_ACTA,ACTAS_COMPUTADA,TOTAL_MESAS,TOTAL_VOTOS,NLISTA,POR_VALIDOS,POR_EMITIDOS,fecha,hora,avance,ubigeo,nulos_y_blancos
3,00000007,AVANZA PAIS - PARTIDO DE INTEGRACION SOCIAL,,100.000,4,4,2,00000007.jpg,0.604,0.202,12/10/2022,12:30 h, 100.0000,061005,657
1,00000011,PARTIDO FRENTE DE LA ESPERANZA 2021,,100.000,4,4,12,00000011.jpg,3.625,1.215,12/10/2022,12:30 h, 100.0000,061005,657
2,00000004,ALIANZA PARA EL PROGRESO,,100.000,4,4,19,00000004.jpg,5.740,1.923,12/10/2022,12:30 h, 100.0000,061005,657
0,00000039,FRENTE REGIONAL DE CAJAMARCA,,100.000,4,4,68,00000039.jpg,20.544,6.883,12/10/2022,12:30 h, 100.0000,061005,657
4,00000002,PARTIDO DEMOCRATICO SOMOS PERU,,100.000,4,4,230,00000002.jpg,69.486,23.279,12/10/2022,12:30 h, 100.0000,061005,657
