,C_CODI_AGP,AGRUPACION,IMAGENAGRUPACION,PORC_AVANCE_ACTA,ACTAS_COMPUTADA,TOTAL_MESAS,TOTAL_VOTOS,NLISTA,POR_VALIDOS,POR_EMITIDOS,fecha,hora,avance,ubigeo
0,00000038,CAJAMARCA SIEMPRE VERDE,,100.000,14,14,414,00000038.jpg,16.714,14.385,06/10/2022,17:50 h,  93.3333,061302
1,00000039,FRENTE REGIONAL DE CAJAMARCA,,100.000,14,14,10,00000039.jpg,0.404,0.347,06/10/2022,17:50 h,  93.3333,061302
2,00000011,PARTIDO FRENTE DE LA ESPERANZA 2021,,100.000,14,14,9,00000011.jpg,0.363,0.313,06/10/2022,17:50 h,  93.3333,061302
3,00000004,ALIANZA PARA EL PROGRESO,,100.000,14,14,"1,000",00000004.jpg,40.371,34.746,06/10/2022,17:50 h,  93.3333,061302
4,00000007,AVANZA PAIS - PARTIDO DE INTEGRACION SOCIAL,,100.000,14,14,120,00000007.jpg,4.845,4.170,06/10/2022,17:50 h,  93.3333,061302
5,00000008,PARTIDO POLITICO NACIONAL PERU LIBRE,,100.000,14,14,125,00000008.jpg,5.046,4.343,06/10/2022,17:50 h,  93.3333,061302
6,00000002,PARTIDO DEMOCRATICO SOMOS PERU,,100.000,14,14,799,00000002.jpg,32.257,27.762,06/10/2022,17:50 h,  93.3333,061302
