,C_CODI_AGP,AGRUPACION,IMAGENAGRUPACION,PORC_AVANCE_ACTA,ACTAS_COMPUTADA,TOTAL_MESAS,TOTAL_VOTOS,NLISTA,POR_VALIDOS,POR_EMITIDOS,fecha,hora,avance,ubigeo,nulos_y_blancos
3,00000004,ALIANZA PARA EL PROGRESO,,100.000,26,26,102,00000004.jpg,2.301,1.927,12/10/2022,16:00 h, 100.0000,070408,860
0,00000049,MOVIMIENTO REGIONAL INKA PACHAKUTEQ,,100.000,26,26,204,00000049.jpg,4.603,3.855,12/10/2022,16:00 h, 100.0000,070408,860
1,00000011,PARTIDO FRENTE DE LA ESPERANZA 2021,,100.000,26,26,977,00000011.jpg,22.044,18.462,12/10/2022,16:00 h, 100.0000,070408,860
2,00000005,JUNTOS POR EL PERU,,100.000,26,26,1404,00000005.jpg,31.679,26.531,12/10/2022,16:00 h, 100.0000,070408,860
4,00000002,PARTIDO DEMOCRATICO SOMOS PERU,,100.000,26,26,1745,00000002.jpg,39.373,32.974,12/10/2022,16:00 h, 100.0000,070408,860
