,C_CODI_AGP,AGRUPACION,IMAGENAGRUPACION,PORC_AVANCE_ACTA,ACTAS_COMPUTADA,TOTAL_MESAS,TOTAL_VOTOS,NLISTA,POR_VALIDOS,POR_EMITIDOS,fecha,hora,avance,ubigeo
0,00000049,MOVIMIENTO REGIONAL INKA PACHAKUTEQ,,100.000,28,28,137,00000049.jpg,2.694,2.322,06/10/2022,17:50 h, 100.0000,070703
1,00000011,PARTIDO FRENTE DE LA ESPERANZA 2021,,100.000,28,28,50,00000011.jpg,0.983,0.847,06/10/2022,17:50 h, 100.0000,070703
2,00000005,JUNTOS POR EL PERU,,100.000,28,28,93,00000005.jpg,1.829,1.576,06/10/2022,17:50 h, 100.0000,070703
3,00000009,PODEMOS PERU,,100.000,28,28,878,00000009.jpg,17.266,14.879,06/10/2022,17:50 h, 100.0000,070703
4,00000004,ALIANZA PARA EL PROGRESO,,100.000,28,28,"1,340",00000004.jpg,26.352,22.708,06/10/2022,17:50 h, 100.0000,070703
5,00000008,PARTIDO POLITICO NACIONAL PERU LIBRE,,100.000,28,28,"1,179",00000008.jpg,23.186,19.980,06/10/2022,17:50 h, 100.0000,070703
6,00000002,PARTIDO DEMOCRATICO SOMOS PERU,,100.000,28,28,"1,408",00000002.jpg,27.689,23.860,06/10/2022,17:50 h, 100.0000,070703
