,C_CODI_AGP,AGRUPACION,IMAGENAGRUPACION,PORC_AVANCE_ACTA,ACTAS_COMPUTADA,TOTAL_MESAS,TOTAL_VOTOS,NLISTA,POR_VALIDOS,POR_EMITIDOS,fecha,hora,avance,ubigeo
0,00000047,AUTOGOBIERNO AYLLU,,100.000,43,43,"2,085",00000047.jpg,22.666,20.050,06/10/2022,17:50 h, 100.0000,070803
1,00000049,MOVIMIENTO REGIONAL INKA PACHAKUTEQ,,100.000,43,43,51,00000049.jpg,0.554,0.490,06/10/2022,17:50 h, 100.0000,070803
2,00000011,PARTIDO FRENTE DE LA ESPERANZA 2021,,100.000,43,43,"2,187",00000011.jpg,23.774,21.031,06/10/2022,17:50 h, 100.0000,070803
3,00000005,JUNTOS POR EL PERU,,100.000,43,43,822,00000005.jpg,8.936,7.905,06/10/2022,17:50 h, 100.0000,070803
4,00000004,ALIANZA PARA EL PROGRESO,,100.000,43,43,240,00000004.jpg,2.609,2.308,06/10/2022,17:50 h, 100.0000,070803
5,00000008,PARTIDO POLITICO NACIONAL PERU LIBRE,,100.000,43,43,418,00000008.jpg,4.544,4.020,06/10/2022,17:50 h, 100.0000,070803
6,00000002,PARTIDO DEMOCRATICO SOMOS PERU,,100.000,43,43,"3,396",00000002.jpg,36.917,32.657,06/10/2022,17:50 h, 100.0000,070803
