,C_CODI_AGP,AGRUPACION,IMAGENAGRUPACION,PORC_AVANCE_ACTA,ACTAS_COMPUTADA,TOTAL_MESAS,TOTAL_VOTOS,NLISTA,POR_VALIDOS,POR_EMITIDOS,fecha,hora,avance,ubigeo
0,00000047,AUTOGOBIERNO AYLLU,,100.000,41,41,52,00000047.jpg,0.693,0.626,10/10/2022,16:51 h, 100.0000,070909
1,00000049,MOVIMIENTO REGIONAL INKA PACHAKUTEQ,,100.000,41,41,"2,926",00000049.jpg,39.003,35.228,10/10/2022,16:51 h, 100.0000,070909
2,00000011,PARTIDO FRENTE DE LA ESPERANZA 2021,,100.000,41,41,45,00000011.jpg,0.600,0.542,10/10/2022,16:51 h, 100.0000,070909
3,00000005,JUNTOS POR EL PERU,,100.000,41,41,"1,652",00000005.jpg,22.021,19.889,10/10/2022,16:51 h, 100.0000,070909
4,00000004,ALIANZA PARA EL PROGRESO,,100.000,41,41,573,00000004.jpg,7.638,6.899,10/10/2022,16:51 h, 100.0000,070909
5,00000008,PARTIDO POLITICO NACIONAL PERU LIBRE,,100.000,41,41,52,00000008.jpg,0.693,0.626,10/10/2022,16:51 h, 100.0000,070909
6,00000002,PARTIDO DEMOCRATICO SOMOS PERU,,100.000,41,41,"2,202",00000002.jpg,29.352,26.511,10/10/2022,16:51 h, 100.0000,070909
