,C_CODI_AGP,AGRUPACION,IMAGENAGRUPACION,PORC_AVANCE_ACTA,ACTAS_COMPUTADA,TOTAL_MESAS,TOTAL_VOTOS,NLISTA,POR_VALIDOS,POR_EMITIDOS,fecha,hora,avance,ubigeo
0,00000047,AUTOGOBIERNO AYLLU,,100.000,9,9,553,00000047.jpg,38.999,24.064,10/10/2022,16:51 h, 100.0000,070916
1,00000049,MOVIMIENTO REGIONAL INKA PACHAKUTEQ,,100.000,9,9,64,00000049.jpg,4.513,2.785,10/10/2022,16:51 h, 100.0000,070916
2,00000011,PARTIDO FRENTE DE LA ESPERANZA 2021,,100.000,9,9,19,00000011.jpg,1.340,0.827,10/10/2022,16:51 h, 100.0000,070916
3,00000005,JUNTOS POR EL PERU,,100.000,9,9,378,00000005.jpg,26.657,16.449,10/10/2022,16:51 h, 100.0000,070916
4,00000004,ALIANZA PARA EL PROGRESO,,100.000,9,9,346,00000004.jpg,24.401,15.057,10/10/2022,16:51 h, 100.0000,070916
5,00000008,PARTIDO POLITICO NACIONAL PERU LIBRE,,100.000,9,9,40,00000008.jpg,2.821,1.741,10/10/2022,16:51 h, 100.0000,070916
6,00000002,PARTIDO DEMOCRATICO SOMOS PERU,,100.000,9,9,18,00000002.jpg,1.269,0.783,10/10/2022,16:51 h, 100.0000,070916
