,C_CODI_AGP,AGRUPACION,IMAGENAGRUPACION,PORC_AVANCE_ACTA,ACTAS_COMPUTADA,TOTAL_MESAS,TOTAL_VOTOS,NLISTA,POR_VALIDOS,POR_EMITIDOS,fecha,hora,avance,ubigeo
0,00000047,AUTOGOBIERNO AYLLU,,0.000,0,0,0,00000047.jpg,0.0,0,06/10/2022,17:50 h,    .0000,070918
1,00000049,MOVIMIENTO REGIONAL INKA PACHAKUTEQ,,0.000,0,0,0,00000049.jpg,0.0,0,06/10/2022,17:50 h,    .0000,070918
2,00000011,PARTIDO FRENTE DE LA ESPERANZA 2021,,0.000,0,0,0,00000011.jpg,0.0,0,06/10/2022,17:50 h,    .0000,070918
3,00000005,JUNTOS POR EL PERU,,0.000,0,0,0,00000005.jpg,0.0,0,06/10/2022,17:50 h,    .0000,070918
4,00000004,ALIANZA PARA EL PROGRESO,,0.000,0,0,0,00000004.jpg,0.0,0,06/10/2022,17:50 h,    .0000,070918
5,00000008,PARTIDO POLITICO NACIONAL PERU LIBRE,,0.000,0,0,0,00000008.jpg,0.0,0,06/10/2022,17:50 h,    .0000,070918
6,00000002,PARTIDO DEMOCRATICO SOMOS PERU,,0.000,0,0,0,00000002.jpg,0.0,0,06/10/2022,17:50 h,    .0000,070918
