,C_CODI_AGP,AGRUPACION,IMAGENAGRUPACION,PORC_AVANCE_ACTA,ACTAS_COMPUTADA,TOTAL_MESAS,TOTAL_VOTOS,NLISTA,POR_VALIDOS,POR_EMITIDOS,fecha,hora,avance,ubigeo
0,00000047,AUTOGOBIERNO AYLLU,,100.000,5,5,4,00000047.jpg,0.397,0.303,10/10/2022,16:51 h, 100.0000,070919
1,00000049,MOVIMIENTO REGIONAL INKA PACHAKUTEQ,,100.000,5,5,383,00000049.jpg,37.996,29.015,10/10/2022,16:51 h, 100.0000,070919
2,00000011,PARTIDO FRENTE DE LA ESPERANZA 2021,,100.000,5,5,8,00000011.jpg,0.794,0.606,10/10/2022,16:51 h, 100.0000,070919
3,00000005,JUNTOS POR EL PERU,,100.000,5,5,285,00000005.jpg,28.274,21.591,10/10/2022,16:51 h, 100.0000,070919
4,00000004,ALIANZA PARA EL PROGRESO,,100.000,5,5,40,00000004.jpg,3.968,3.030,10/10/2022,16:51 h, 100.0000,070919
5,00000008,PARTIDO POLITICO NACIONAL PERU LIBRE,,100.000,5,5,6,00000008.jpg,0.595,0.455,10/10/2022,16:51 h, 100.0000,070919
6,00000002,PARTIDO DEMOCRATICO SOMOS PERU,,100.000,5,5,282,00000002.jpg,27.976,21.364,10/10/2022,16:51 h, 100.0000,070919
