,C_CODI_AGP,AGRUPACION,IMAGENAGRUPACION,PORC_AVANCE_ACTA,ACTAS_COMPUTADA,TOTAL_MESAS,TOTAL_VOTOS,NLISTA,POR_VALIDOS,POR_EMITIDOS,fecha,hora,avance,ubigeo
0,00000047,AUTOGOBIERNO AYLLU,,100.000,31,31,18,00000047.jpg,0.368,0.331,10/10/2022,10:52 h, 100.0000,070915
1,00000049,MOVIMIENTO REGIONAL INKA PACHAKUTEQ,,100.000,31,31,416,00000049.jpg,8.504,7.643,10/10/2022,10:52 h, 100.0000,070915
2,00000011,PARTIDO FRENTE DE LA ESPERANZA 2021,,100.000,31,31,124,00000011.jpg,2.535,2.278,10/10/2022,10:52 h, 100.0000,070915
3,00000005,JUNTOS POR EL PERU,,100.000,31,31,"2,375",00000005.jpg,48.549,43.634,10/10/2022,10:52 h, 100.0000,070915
4,00000004,ALIANZA PARA EL PROGRESO,,100.000,31,31,242,00000004.jpg,4.947,4.446,10/10/2022,10:52 h, 100.0000,070915
5,00000008,PARTIDO POLITICO NACIONAL PERU LIBRE,,100.000,31,31,"1,659",00000008.jpg,33.913,30.480,10/10/2022,10:52 h, 100.0000,070915
6,00000002,PARTIDO DEMOCRATICO SOMOS PERU,,100.000,31,31,58,00000002.jpg,1.186,1.066,10/10/2022,10:52 h, 100.0000,070915
