,C_CODI_AGP,AGRUPACION,IMAGENAGRUPACION,PORC_AVANCE_ACTA,ACTAS_COMPUTADA,TOTAL_MESAS,TOTAL_VOTOS,NLISTA,POR_VALIDOS,POR_EMITIDOS,fecha,hora,avance,ubigeo
0,00000049,MOVIMIENTO REGIONAL INKA PACHAKUTEQ,,100.000,8,8,339,00000049.jpg,24.266,19.918,06/10/2022,17:50 h, 100.0000,071008
1,00000011,PARTIDO FRENTE DE LA ESPERANZA 2021,,100.000,8,8,76,00000011.jpg,5.440,4.465,06/10/2022,17:50 h, 100.0000,071008
2,00000005,JUNTOS POR EL PERU,,100.000,8,8,13,00000005.jpg,0.931,0.764,06/10/2022,17:50 h, 100.0000,071008
3,00000001,ACCION POPULAR,,100.000,8,8,22,00000001.jpg,1.575,1.293,06/10/2022,17:50 h, 100.0000,071008
4,00000004,ALIANZA PARA EL PROGRESO,,100.000,8,8,198,00000004.jpg,14.173,11.633,06/10/2022,17:50 h, 100.0000,071008
5,00000008,PARTIDO POLITICO NACIONAL PERU LIBRE,,100.000,8,8,213,00000008.jpg,15.247,12.515,06/10/2022,17:50 h, 100.0000,071008
6,00000002,PARTIDO DEMOCRATICO SOMOS PERU,,100.000,8,8,536,00000002.jpg,38.368,31.492,06/10/2022,17:50 h, 100.0000,071008
