,C_CODI_AGP,AGRUPACION,IMAGENAGRUPACION,PORC_AVANCE_ACTA,ACTAS_COMPUTADA,TOTAL_MESAS,TOTAL_VOTOS,NLISTA,POR_VALIDOS,POR_EMITIDOS,fecha,hora,avance,ubigeo
0,00000049,MOVIMIENTO REGIONAL INKA PACHAKUTEQ,,100.000,9,9,563,00000049.jpg,35.364,28.564,10/10/2022,10:52 h,  90.0000,071002
1,00000011,PARTIDO FRENTE DE LA ESPERANZA 2021,,100.000,9,9,26,00000011.jpg,1.633,1.319,10/10/2022,10:52 h,  90.0000,071002
2,00000005,JUNTOS POR EL PERU,,100.000,9,9,18,00000005.jpg,1.131,0.913,10/10/2022,10:52 h,  90.0000,071002
3,00000001,ACCION POPULAR,,100.000,9,9,23,00000001.jpg,1.445,1.167,10/10/2022,10:52 h,  90.0000,071002
4,00000004,ALIANZA PARA EL PROGRESO,,100.000,9,9,50,00000004.jpg,3.141,2.537,10/10/2022,10:52 h,  90.0000,071002
5,00000008,PARTIDO POLITICO NACIONAL PERU LIBRE,,100.000,9,9,561,00000008.jpg,35.239,28.463,10/10/2022,10:52 h,  90.0000,071002
6,00000002,PARTIDO DEMOCRATICO SOMOS PERU,,100.000,9,9,351,00000002.jpg,22.048,17.808,10/10/2022,10:52 h,  90.0000,071002
