,C_CODI_AGP,AGRUPACION,IMAGENAGRUPACION,PORC_AVANCE_ACTA,ACTAS_COMPUTADA,TOTAL_MESAS,TOTAL_VOTOS,NLISTA,POR_VALIDOS,POR_EMITIDOS,fecha,hora,avance,ubigeo,nulos_y_blancos
2,00000011,PARTIDO FRENTE DE LA ESPERANZA 2021,,100.000,18,18,13,00000011.jpg,0.358,0.320,12/10/2022,16:00 h, 100.0000,071005,425
0,00000047,AUTOGOBIERNO AYLLU,,100.000,18,18,148,00000047.jpg,4.072,3.645,12/10/2022,16:00 h, 100.0000,071005,425
4,00000008,PARTIDO POLITICO NACIONAL PERU LIBRE,,100.000,18,18,253,00000008.jpg,6.960,6.232,12/10/2022,16:00 h, 100.0000,071005,425
3,00000004,ALIANZA PARA EL PROGRESO,,100.000,18,18,254,00000004.jpg,6.988,6.256,12/10/2022,16:00 h, 100.0000,071005,425
1,00000049,MOVIMIENTO REGIONAL INKA PACHAKUTEQ,,100.000,18,18,1300,00000049.jpg,35.763,32.020,12/10/2022,16:00 h, 100.0000,071005,425
5,00000002,PARTIDO DEMOCRATICO SOMOS PERU,,100.000,18,18,1667,00000002.jpg,45.860,41.059,12/10/2022,16:00 h, 100.0000,071005,425
