,C_CODI_AGP,AGRUPACION,IMAGENAGRUPACION,PORC_AVANCE_ACTA,ACTAS_COMPUTADA,TOTAL_MESAS,TOTAL_VOTOS,NLISTA,POR_VALIDOS,POR_EMITIDOS,fecha,hora,avance,ubigeo
0,00000049,MOVIMIENTO REGIONAL INKA PACHAKUTEQ,,100.000,41,41,748,00000049.jpg,8.883,7.752,06/10/2022,17:50 h,  97.6190,071210
1,00000011,PARTIDO FRENTE DE LA ESPERANZA 2021,,100.000,41,41,224,00000011.jpg,2.660,2.321,06/10/2022,17:50 h,  97.6190,071210
2,00000005,JUNTOS POR EL PERU,,100.000,41,41,"2,423",00000005.jpg,28.773,25.111,06/10/2022,17:50 h,  97.6190,071210
3,00000009,PODEMOS PERU,,100.000,41,41,575,00000009.jpg,6.828,5.959,06/10/2022,17:50 h,  97.6190,071210
4,00000004,ALIANZA PARA EL PROGRESO,,100.000,41,41,100,00000004.jpg,1.188,1.036,06/10/2022,17:50 h,  97.6190,071210
5,00000008,PARTIDO POLITICO NACIONAL PERU LIBRE,,100.000,41,41,"1,501",00000008.jpg,17.824,15.556,06/10/2022,17:50 h,  97.6190,071210
6,00000002,PARTIDO DEMOCRATICO SOMOS PERU,,100.000,41,41,"2,850",00000002.jpg,33.844,29.537,06/10/2022,17:50 h,  97.6190,071210
