,C_CODI_AGP,AGRUPACION,IMAGENAGRUPACION,PORC_AVANCE_ACTA,ACTAS_COMPUTADA,TOTAL_MESAS,TOTAL_VOTOS,NLISTA,POR_VALIDOS,POR_EMITIDOS,fecha,hora,avance,ubigeo,nulos_y_blancos
4,00000007,AVANZA PAIS - PARTIDO DE INTEGRACION SOCIAL,,100.000,24,24,17,00000007.jpg,0.383,0.352,12/10/2022,16:00 h, 100.0000,071304,390
2,00000011,PARTIDO FRENTE DE LA ESPERANZA 2021,,100.000,24,24,90,00000011.jpg,2.028,1.864,12/10/2022,16:00 h, 100.0000,071304,390
0,00000047,AUTOGOBIERNO AYLLU,,100.000,24,24,198,00000047.jpg,4.461,4.101,12/10/2022,16:00 h, 100.0000,071304,390
1,00000049,MOVIMIENTO REGIONAL INKA PACHAKUTEQ,,100.000,24,24,207,00000049.jpg,4.664,4.287,12/10/2022,16:00 h, 100.0000,071304,390
5,00000008,PARTIDO POLITICO NACIONAL PERU LIBRE,,100.000,24,24,332,00000008.jpg,7.481,6.877,12/10/2022,16:00 h, 100.0000,071304,390
3,00000004,ALIANZA PARA EL PROGRESO,,100.000,24,24,1497,00000004.jpg,33.731,31.007,12/10/2022,16:00 h, 100.0000,071304,390
6,00000002,PARTIDO DEMOCRATICO SOMOS PERU,,100.000,24,24,2097,00000002.jpg,47.251,43.434,12/10/2022,16:00 h, 100.0000,071304,390
