,C_CODI_AGP,AGRUPACION,IMAGENAGRUPACION,PORC_AVANCE_ACTA,ACTAS_COMPUTADA,TOTAL_MESAS,TOTAL_VOTOS,NLISTA,POR_VALIDOS,POR_EMITIDOS,fecha,hora,avance,ubigeo,nulos_y_blancos
5,00000003,RENOVACION POPULAR,,100.000,55,55,32,00000003.jpg,0.325,0.273,12/10/2022,13:00 h, 100.0000,090103,1884
4,00000006,FUERZA POPULAR,,100.000,55,55,50,00000006.jpg,0.508,0.426,12/10/2022,13:00 h, 100.0000,090103,1884
8,00000002,PARTIDO DEMOCRATICO SOMOS PERU,,100.000,55,55,56,00000002.jpg,0.569,0.477,12/10/2022,13:00 h, 100.0000,090103,1884
0,00000053,MOVIMIENTO POLITICO CAMBIEMOS X HCO,,100.000,55,55,235,00000053.jpg,2.386,2.003,12/10/2022,13:00 h, 100.0000,090103,1884
1,00000054,MOVIMIENTO INDEPENDIENTE REGIONAL MI BUEN VECINO,,100.000,55,55,504,00000054.jpg,5.118,4.296,12/10/2022,13:00 h, 100.0000,090103,1884
7,00000008,PARTIDO POLITICO NACIONAL PERU LIBRE,,100.000,55,55,1742,00000008.jpg,17.689,14.848,12/10/2022,13:00 h, 100.0000,090103,1884
3,00000056,AVANZADA REGIONAL INDEPENDIENTE UNIDOS POR HUANUCO,,100.000,55,55,1973,00000056.jpg,20.035,16.817,12/10/2022,13:00 h, 100.0000,090103,1884
2,00000057,MOVIMIENTO INDEPENDIENTE REGIONAL HUANUCO PRIMERO,,100.000,55,55,2356,00000057.jpg,23.924,20.082,12/10/2022,13:00 h, 100.0000,090103,1884
6,00000007,AVANZA PAIS - PARTIDO DE INTEGRACION SOCIAL,,100.000,55,55,2900,00000007.jpg,29.448,24.719,12/10/2022,13:00 h, 100.0000,090103,1884
