,C_CODI_AGP,AGRUPACION,IMAGENAGRUPACION,PORC_AVANCE_ACTA,ACTAS_COMPUTADA,TOTAL_MESAS,TOTAL_VOTOS,NLISTA,POR_VALIDOS,POR_EMITIDOS,fecha,hora,avance,ubigeo
0,00000053,MOVIMIENTO POLITICO CAMBIEMOS X HCO,,100.000,220,220,"4,045",00000053.jpg,9.405,8.275,06/10/2022,17:50 h,  99.0991,090101
1,00000054,MOVIMIENTO INDEPENDIENTE REGIONAL MI BUEN VECINO,,100.000,220,220,"15,243",00000054.jpg,35.441,31.182,06/10/2022,17:50 h,  99.0991,090101
2,00000057,MOVIMIENTO INDEPENDIENTE REGIONAL HUANUCO PRIMERO,,100.000,220,220,"12,030",00000057.jpg,27.970,24.609,06/10/2022,17:50 h,  99.0991,090101
3,00000056,AVANZADA REGIONAL INDEPENDIENTE UNIDOS POR HUANUCO,,100.000,220,220,673,00000056.jpg,1.565,1.377,06/10/2022,17:50 h,  99.0991,090101
4,00000006,FUERZA POPULAR,,100.000,220,220,709,00000006.jpg,1.648,1.450,06/10/2022,17:50 h,  99.0991,090101
5,00000003,RENOVACION POPULAR,,100.000,220,220,478,00000003.jpg,1.111,0.978,06/10/2022,17:50 h,  99.0991,090101
6,00000007,AVANZA PAIS - PARTIDO DE INTEGRACION SOCIAL,,100.000,220,220,"6,222",00000007.jpg,14.466,12.728,06/10/2022,17:50 h,  99.0991,090101
7,00000008,PARTIDO POLITICO NACIONAL PERU LIBRE,,100.000,220,220,769,00000008.jpg,1.788,1.573,06/10/2022,17:50 h,  99.0991,090101
8,00000002,PARTIDO DEMOCRATICO SOMOS PERU,,100.000,220,220,"2,841",00000002.jpg,6.605,5.812,06/10/2022,17:50 h,  99.0991,090101
