,C_CODI_AGP,AGRUPACION,IMAGENAGRUPACION,PORC_AVANCE_ACTA,ACTAS_COMPUTADA,TOTAL_MESAS,TOTAL_VOTOS,NLISTA,POR_VALIDOS,POR_EMITIDOS,fecha,hora,avance,ubigeo,nulos_y_blancos
7,00000008,PARTIDO POLITICO NACIONAL PERU LIBRE,,100.000,22,22,5,00000008.jpg,0.121,0.099,12/10/2022,13:00 h, 100.0000,090113,886
5,00000003,RENOVACION POPULAR,,100.000,22,22,10,00000003.jpg,0.241,0.199,12/10/2022,13:00 h, 100.0000,090113,886
4,00000006,FUERZA POPULAR,,100.000,22,22,12,00000006.jpg,0.289,0.238,12/10/2022,13:00 h, 100.0000,090113,886
1,00000054,MOVIMIENTO INDEPENDIENTE REGIONAL MI BUEN VECINO,,100.000,22,22,198,00000054.jpg,4.776,3.935,12/10/2022,13:00 h, 100.0000,090113,886
0,00000053,MOVIMIENTO POLITICO CAMBIEMOS X HCO,,100.000,22,22,243,00000053.jpg,5.861,4.829,12/10/2022,13:00 h, 100.0000,090113,886
6,00000007,AVANZA PAIS - PARTIDO DE INTEGRACION SOCIAL,,100.000,22,22,673,00000007.jpg,16.233,13.374,12/10/2022,13:00 h, 100.0000,090113,886
8,00000002,PARTIDO DEMOCRATICO SOMOS PERU,,100.000,22,22,732,00000002.jpg,17.656,14.547,12/10/2022,13:00 h, 100.0000,090113,886
2,00000057,MOVIMIENTO INDEPENDIENTE REGIONAL HUANUCO PRIMERO,,100.000,22,22,1112,00000057.jpg,26.821,22.099,12/10/2022,13:00 h, 100.0000,090113,886
3,00000056,AVANZADA REGIONAL INDEPENDIENTE UNIDOS POR HUANUCO,,100.000,22,22,1161,00000056.jpg,28.003,23.072,12/10/2022,13:00 h, 100.0000,090113,886
