,C_CODI_AGP,AGRUPACION,IMAGENAGRUPACION,PORC_AVANCE_ACTA,ACTAS_COMPUTADA,TOTAL_MESAS,TOTAL_VOTOS,NLISTA,POR_VALIDOS,POR_EMITIDOS,fecha,hora,avance,ubigeo
0,00000053,MOVIMIENTO POLITICO CAMBIEMOS X HCO,,100.000,18,18,171,00000053.jpg,4.659,4.089,10/10/2022,10:52 h, 100.0000,090204
1,00000054,MOVIMIENTO INDEPENDIENTE REGIONAL MI BUEN VECINO,,100.000,18,18,495,00000054.jpg,13.488,11.836,10/10/2022,10:52 h, 100.0000,090204
2,00000055,TODOS POR EL GRAN CAMBIO,,100.000,18,18,175,00000055.jpg,4.768,4.185,10/10/2022,10:52 h, 100.0000,090204
3,00000057,MOVIMIENTO INDEPENDIENTE REGIONAL HUANUCO PRIMERO,,100.000,18,18,"1,270",00000057.jpg,34.605,30.368,10/10/2022,10:52 h, 100.0000,090204
4,00000056,AVANZADA REGIONAL INDEPENDIENTE UNIDOS POR HUANUCO,,100.000,18,18,300,00000056.jpg,8.174,7.174,10/10/2022,10:52 h, 100.0000,090204
5,00000007,AVANZA PAIS - PARTIDO DE INTEGRACION SOCIAL,,100.000,18,18,955,00000007.jpg,26.022,22.836,10/10/2022,10:52 h, 100.0000,090204
6,00000010,PARTIDO MORADO,,100.000,18,18,47,00000010.jpg,1.281,1.124,10/10/2022,10:52 h, 100.0000,090204
7,00000002,PARTIDO DEMOCRATICO SOMOS PERU,,100.000,18,18,257,00000002.jpg,7.003,6.145,10/10/2022,10:52 h, 100.0000,090204
