,C_CODI_AGP,AGRUPACION,IMAGENAGRUPACION,PORC_AVANCE_ACTA,ACTAS_COMPUTADA,TOTAL_MESAS,TOTAL_VOTOS,NLISTA,POR_VALIDOS,POR_EMITIDOS,fecha,hora,avance,ubigeo,nulos_y_blancos
5,00000011,PARTIDO FRENTE DE LA ESPERANZA 2021,,100.000,25,25,8,00000011.jpg,0.181,0.153,12/10/2022,16:00 h, 100.0000,090205,800
4,00000056,AVANZADA REGIONAL INDEPENDIENTE UNIDOS POR HUANUCO,,100.000,25,25,48,00000056.jpg,1.087,0.920,12/10/2022,16:00 h, 100.0000,090205,800
0,00000053,MOVIMIENTO POLITICO CAMBIEMOS X HCO,,100.000,25,25,63,00000053.jpg,1.427,1.208,12/10/2022,16:00 h, 100.0000,090205,800
7,00000002,PARTIDO DEMOCRATICO SOMOS PERU,,100.000,25,25,93,00000002.jpg,2.106,1.783,12/10/2022,16:00 h, 100.0000,090205,800
6,00000008,PARTIDO POLITICO NACIONAL PERU LIBRE,,100.000,25,25,166,00000008.jpg,3.759,3.183,12/10/2022,16:00 h, 100.0000,090205,800
1,00000054,MOVIMIENTO INDEPENDIENTE REGIONAL MI BUEN VECINO,,100.000,25,25,566,00000054.jpg,12.817,10.851,12/10/2022,16:00 h, 100.0000,090205,800
2,00000055,TODOS POR EL GRAN CAMBIO,,100.000,25,25,1707,00000055.jpg,38.655,32.726,12/10/2022,16:00 h, 100.0000,090205,800
3,00000057,MOVIMIENTO INDEPENDIENTE REGIONAL HUANUCO PRIMERO,,100.000,25,25,1765,00000057.jpg,39.968,33.838,12/10/2022,16:00 h, 100.0000,090205,800
