,C_CODI_AGP,AGRUPACION,IMAGENAGRUPACION,PORC_AVANCE_ACTA,ACTAS_COMPUTADA,TOTAL_MESAS,TOTAL_VOTOS,NLISTA,POR_VALIDOS,POR_EMITIDOS,fecha,hora,avance,ubigeo
0,00000053,MOVIMIENTO POLITICO CAMBIEMOS X HCO,,100.000,9,9,13,00000053.jpg,0.837,0.747,10/10/2022,16:51 h, 100.0000,090203
1,00000054,MOVIMIENTO INDEPENDIENTE REGIONAL MI BUEN VECINO,,100.000,9,9,95,00000054.jpg,6.113,5.460,10/10/2022,16:51 h, 100.0000,090203
2,00000055,TODOS POR EL GRAN CAMBIO,,100.000,9,9,397,00000055.jpg,25.547,22.816,10/10/2022,16:51 h, 100.0000,090203
3,00000057,MOVIMIENTO INDEPENDIENTE REGIONAL HUANUCO PRIMERO,,100.000,9,9,554,00000057.jpg,35.650,31.839,10/10/2022,16:51 h, 100.0000,090203
4,00000056,AVANZADA REGIONAL INDEPENDIENTE UNIDOS POR HUANUCO,,100.000,9,9,27,00000056.jpg,1.737,1.552,10/10/2022,16:51 h, 100.0000,090203
5,00000007,AVANZA PAIS - PARTIDO DE INTEGRACION SOCIAL,,100.000,9,9,453,00000007.jpg,29.151,26.034,10/10/2022,16:51 h, 100.0000,090203
6,00000010,PARTIDO MORADO,,100.000,9,9,3,00000010.jpg,0.193,0.172,10/10/2022,16:51 h, 100.0000,090203
7,00000002,PARTIDO DEMOCRATICO SOMOS PERU,,100.000,9,9,12,00000002.jpg,0.772,0.690,10/10/2022,16:51 h, 100.0000,090203
