,C_CODI_AGP,AGRUPACION,IMAGENAGRUPACION,PORC_AVANCE_ACTA,ACTAS_COMPUTADA,TOTAL_MESAS,TOTAL_VOTOS,NLISTA,POR_VALIDOS,POR_EMITIDOS,fecha,hora,avance,ubigeo
0,00000053,MOVIMIENTO POLITICO CAMBIEMOS X HCO,,100.000,30,30,35,00000053.jpg,0.627,0.555,10/10/2022,16:51 h, 100.0000,090207
1,00000054,MOVIMIENTO INDEPENDIENTE REGIONAL MI BUEN VECINO,,100.000,30,30,419,00000054.jpg,7.501,6.642,10/10/2022,16:51 h, 100.0000,090207
2,00000055,TODOS POR EL GRAN CAMBIO,,100.000,30,30,240,00000055.jpg,4.296,3.805,10/10/2022,16:51 h, 100.0000,090207
3,00000057,MOVIMIENTO INDEPENDIENTE REGIONAL HUANUCO PRIMERO,,100.000,30,30,"2,259",00000057.jpg,40.440,35.812,10/10/2022,16:51 h, 100.0000,090207
4,00000056,AVANZADA REGIONAL INDEPENDIENTE UNIDOS POR HUANUCO,,100.000,30,30,"1,029",00000056.jpg,18.421,16.313,10/10/2022,16:51 h, 100.0000,090207
5,00000007,AVANZA PAIS - PARTIDO DE INTEGRACION SOCIAL,,100.000,30,30,"1,546",00000007.jpg,27.676,24.509,10/10/2022,16:51 h, 100.0000,090207
6,00000010,PARTIDO MORADO,,100.000,30,30,9,00000010.jpg,0.161,0.143,10/10/2022,16:51 h, 100.0000,090207
7,00000002,PARTIDO DEMOCRATICO SOMOS PERU,,100.000,30,30,49,00000002.jpg,0.877,0.777,10/10/2022,16:51 h, 100.0000,090207
