,C_CODI_AGP,AGRUPACION,IMAGENAGRUPACION,PORC_AVANCE_ACTA,ACTAS_COMPUTADA,TOTAL_MESAS,TOTAL_VOTOS,NLISTA,POR_VALIDOS,POR_EMITIDOS,fecha,hora,avance,ubigeo,nulos_y_blancos
5,00000002,PARTIDO DEMOCRATICO SOMOS PERU,,100.000,18,18,18,00000002.jpg,0.552,0.478,12/10/2022,16:00 h, 100.0000,090314,504
3,00000004,ALIANZA PARA EL PROGRESO,,100.000,18,18,182,00000004.jpg,5.578,4.831,12/10/2022,16:00 h, 100.0000,090314,504
0,00000053,MOVIMIENTO POLITICO CAMBIEMOS X HCO,,100.000,18,18,267,00000053.jpg,8.183,7.088,12/10/2022,16:00 h, 100.0000,090314,504
4,00000007,AVANZA PAIS - PARTIDO DE INTEGRACION SOCIAL,,100.000,18,18,891,00000007.jpg,27.306,23.653,12/10/2022,16:00 h, 100.0000,090314,504
1,00000054,MOVIMIENTO INDEPENDIENTE REGIONAL MI BUEN VECINO,,100.000,18,18,904,00000054.jpg,27.705,23.998,12/10/2022,16:00 h, 100.0000,090314,504
2,00000057,MOVIMIENTO INDEPENDIENTE REGIONAL HUANUCO PRIMERO,,100.000,18,18,1001,00000057.jpg,30.677,26.573,12/10/2022,16:00 h, 100.0000,090314,504
