,C_CODI_AGP,AGRUPACION,IMAGENAGRUPACION,PORC_AVANCE_ACTA,ACTAS_COMPUTADA,TOTAL_MESAS,TOTAL_VOTOS,NLISTA,POR_VALIDOS,POR_EMITIDOS,fecha,hora,avance,ubigeo,nulos_y_blancos
4,00000008,PARTIDO POLITICO NACIONAL PERU LIBRE,,100.000,18,18,9,00000008.jpg,0.286,0.239,12/10/2022,13:00 h, 100.0000,090314,618
5,00000002,PARTIDO DEMOCRATICO SOMOS PERU,,100.000,18,18,26,00000002.jpg,0.826,0.690,12/10/2022,13:00 h, 100.0000,090314,618
0,00000053,MOVIMIENTO POLITICO CAMBIEMOS X HCO,,100.000,18,18,260,00000053.jpg,8.257,6.902,12/10/2022,13:00 h, 100.0000,090314,618
3,00000007,AVANZA PAIS - PARTIDO DE INTEGRACION SOCIAL,,100.000,18,18,664,00000007.jpg,21.086,17.627,12/10/2022,13:00 h, 100.0000,090314,618
2,00000057,MOVIMIENTO INDEPENDIENTE REGIONAL HUANUCO PRIMERO,,100.000,18,18,822,00000057.jpg,26.104,21.821,12/10/2022,13:00 h, 100.0000,090314,618
1,00000054,MOVIMIENTO INDEPENDIENTE REGIONAL MI BUEN VECINO,,100.000,18,18,1368,00000054.jpg,43.442,36.315,12/10/2022,13:00 h, 100.0000,090314,618
