,C_CODI_AGP,AGRUPACION,IMAGENAGRUPACION,PORC_AVANCE_ACTA,ACTAS_COMPUTADA,TOTAL_MESAS,TOTAL_VOTOS,NLISTA,POR_VALIDOS,POR_EMITIDOS,fecha,hora,avance,ubigeo,nulos_y_blancos
2,00000057,MOVIMIENTO INDEPENDIENTE REGIONAL HUANUCO PRIMERO,,100.000,9,9,20,00000057.jpg,1.173,1.048,12/10/2022,16:00 h, 100.0000,090323,204
3,00000056,AVANZADA REGIONAL INDEPENDIENTE UNIDOS POR HUANUCO,,100.000,9,9,26,00000056.jpg,1.525,1.362,12/10/2022,16:00 h, 100.0000,090323,204
6,00000002,PARTIDO DEMOCRATICO SOMOS PERU,,100.000,9,9,30,00000002.jpg,1.760,1.572,12/10/2022,16:00 h, 100.0000,090323,204
4,00000004,ALIANZA PARA EL PROGRESO,,100.000,9,9,185,00000004.jpg,10.850,9.691,12/10/2022,16:00 h, 100.0000,090323,204
0,00000053,MOVIMIENTO POLITICO CAMBIEMOS X HCO,,100.000,9,9,448,00000053.jpg,26.276,23.468,12/10/2022,16:00 h, 100.0000,090323,204
1,00000054,MOVIMIENTO INDEPENDIENTE REGIONAL MI BUEN VECINO,,100.000,9,9,482,00000054.jpg,28.270,25.249,12/10/2022,16:00 h, 100.0000,090323,204
5,00000007,AVANZA PAIS - PARTIDO DE INTEGRACION SOCIAL,,100.000,9,9,514,00000007.jpg,30.147,26.925,12/10/2022,16:00 h, 100.0000,090323,204
