,C_CODI_AGP,AGRUPACION,IMAGENAGRUPACION,PORC_AVANCE_ACTA,ACTAS_COMPUTADA,TOTAL_MESAS,TOTAL_VOTOS,NLISTA,POR_VALIDOS,POR_EMITIDOS,fecha,hora,avance,ubigeo
0,00000053,MOVIMIENTO POLITICO CAMBIEMOS X HCO,,100.000,10,10,379,00000053.jpg,21.009,18.212,06/10/2022,17:50 h, 100.0000,090406
1,00000054,MOVIMIENTO INDEPENDIENTE REGIONAL MI BUEN VECINO,,100.000,10,10,441,00000054.jpg,24.446,21.192,06/10/2022,17:50 h, 100.0000,090406
2,00000057,MOVIMIENTO INDEPENDIENTE REGIONAL HUANUCO PRIMERO,,100.000,10,10,33,00000057.jpg,1.829,1.586,06/10/2022,17:50 h, 100.0000,090406
3,00000056,AVANZADA REGIONAL INDEPENDIENTE UNIDOS POR HUANUCO,,100.000,10,10,55,00000056.jpg,3.049,2.643,06/10/2022,17:50 h, 100.0000,090406
4,00000007,AVANZA PAIS - PARTIDO DE INTEGRACION SOCIAL,,100.000,10,10,860,00000007.jpg,47.672,41.326,06/10/2022,17:50 h, 100.0000,090406
5,00000008,PARTIDO POLITICO NACIONAL PERU LIBRE,,100.000,10,10,20,00000008.jpg,1.109,0.961,06/10/2022,17:50 h, 100.0000,090406
6,00000002,PARTIDO DEMOCRATICO SOMOS PERU,,100.000,10,10,16,00000002.jpg,0.887,0.769,06/10/2022,17:50 h, 100.0000,090406
