,C_CODI_AGP,AGRUPACION,IMAGENAGRUPACION,PORC_AVANCE_ACTA,ACTAS_COMPUTADA,TOTAL_MESAS,TOTAL_VOTOS,NLISTA,POR_VALIDOS,POR_EMITIDOS,fecha,hora,avance,ubigeo
0,00000053,MOVIMIENTO POLITICO CAMBIEMOS X HCO,,100.000,10,10,7,00000053.jpg,0.403,0.352,10/10/2022,10:52 h,  71.4286,090409
1,00000054,MOVIMIENTO INDEPENDIENTE REGIONAL MI BUEN VECINO,,100.000,10,10,521,00000054.jpg,30.012,26.168,10/10/2022,10:52 h,  71.4286,090409
2,00000057,MOVIMIENTO INDEPENDIENTE REGIONAL HUANUCO PRIMERO,,100.000,10,10,651,00000057.jpg,37.500,32.697,10/10/2022,10:52 h,  71.4286,090409
3,00000056,AVANZADA REGIONAL INDEPENDIENTE UNIDOS POR HUANUCO,,100.000,10,10,118,00000056.jpg,6.797,5.927,10/10/2022,10:52 h,  71.4286,090409
4,00000007,AVANZA PAIS - PARTIDO DE INTEGRACION SOCIAL,,100.000,10,10,414,00000007.jpg,23.848,20.794,10/10/2022,10:52 h,  71.4286,090409
5,00000008,PARTIDO POLITICO NACIONAL PERU LIBRE,,100.000,10,10,13,00000008.jpg,0.749,0.653,10/10/2022,10:52 h,  71.4286,090409
6,00000002,PARTIDO DEMOCRATICO SOMOS PERU,,100.000,10,10,12,00000002.jpg,0.691,0.603,10/10/2022,10:52 h,  71.4286,090409
