,C_CODI_AGP,AGRUPACION,IMAGENAGRUPACION,PORC_AVANCE_ACTA,ACTAS_COMPUTADA,TOTAL_MESAS,TOTAL_VOTOS,NLISTA,POR_VALIDOS,POR_EMITIDOS,fecha,hora,avance,ubigeo
0,00000053,MOVIMIENTO POLITICO CAMBIEMOS X HCO,,100.000,20,20,210,00000053.jpg,6.981,4.897,06/10/2022,17:50 h,  95.2381,090602
1,00000054,MOVIMIENTO INDEPENDIENTE REGIONAL MI BUEN VECINO,,100.000,20,20,470,00000054.jpg,15.625,10.961,06/10/2022,17:50 h,  95.2381,090602
2,00000055,TODOS POR EL GRAN CAMBIO,,100.000,20,20,88,00000055.jpg,2.926,2.052,06/10/2022,17:50 h,  95.2381,090602
3,00000057,MOVIMIENTO INDEPENDIENTE REGIONAL HUANUCO PRIMERO,,100.000,20,20,"1,228",00000057.jpg,40.824,28.638,06/10/2022,17:50 h,  95.2381,090602
4,00000006,FUERZA POPULAR,,100.000,20,20,50,00000006.jpg,1.662,1.166,06/10/2022,17:50 h,  95.2381,090602
5,00000007,AVANZA PAIS - PARTIDO DE INTEGRACION SOCIAL,,100.000,20,20,962,00000007.jpg,31.981,22.435,06/10/2022,17:50 h,  95.2381,090602
