,C_CODI_AGP,AGRUPACION,IMAGENAGRUPACION,PORC_AVANCE_ACTA,ACTAS_COMPUTADA,TOTAL_MESAS,TOTAL_VOTOS,NLISTA,POR_VALIDOS,POR_EMITIDOS,fecha,hora,avance,ubigeo,nulos_y_blancos
2,00000055,TODOS POR EL GRAN CAMBIO,,100.000,148,148,1110,00000055.jpg,4.044,3.638,12/10/2022,13:00 h, 100.0000,090601,3062
4,00000006,FUERZA POPULAR,,100.000,148,148,2026,00000006.jpg,7.381,6.640,12/10/2022,13:00 h, 100.0000,090601,3062
0,00000053,MOVIMIENTO POLITICO CAMBIEMOS X HCO,,100.000,148,148,3554,00000053.jpg,12.947,11.648,12/10/2022,13:00 h, 100.0000,090601,3062
3,00000057,MOVIMIENTO INDEPENDIENTE REGIONAL HUANUCO PRIMERO,,100.000,148,148,4181,00000057.jpg,15.231,13.703,12/10/2022,13:00 h, 100.0000,090601,3062
5,00000007,AVANZA PAIS - PARTIDO DE INTEGRACION SOCIAL,,100.000,148,148,7379,00000007.jpg,26.882,24.184,12/10/2022,13:00 h, 100.0000,090601,3062
1,00000054,MOVIMIENTO INDEPENDIENTE REGIONAL MI BUEN VECINO,,100.000,148,148,9200,00000054.jpg,33.515,30.152,12/10/2022,13:00 h, 100.0000,090601,3062
