,C_CODI_AGP,AGRUPACION,IMAGENAGRUPACION,PORC_AVANCE_ACTA,ACTAS_COMPUTADA,TOTAL_MESAS,TOTAL_VOTOS,NLISTA,POR_VALIDOS,POR_EMITIDOS,fecha,hora,avance,ubigeo,nulos_y_blancos
4,00000006,FUERZA POPULAR,,100.000,12,12,18,00000006.jpg,0.923,0.680,12/10/2022,13:00 h, 100.0000,090603,698
0,00000053,MOVIMIENTO POLITICO CAMBIEMOS X HCO,,100.000,12,12,82,00000053.jpg,4.205,3.097,12/10/2022,13:00 h, 100.0000,090603,698
2,00000055,TODOS POR EL GRAN CAMBIO,,100.000,12,12,238,00000055.jpg,12.205,8.988,12/10/2022,13:00 h, 100.0000,090603,698
3,00000057,MOVIMIENTO INDEPENDIENTE REGIONAL HUANUCO PRIMERO,,100.000,12,12,348,00000057.jpg,17.846,13.142,12/10/2022,13:00 h, 100.0000,090603,698
5,00000007,AVANZA PAIS - PARTIDO DE INTEGRACION SOCIAL,,100.000,12,12,621,00000007.jpg,31.846,23.452,12/10/2022,13:00 h, 100.0000,090603,698
1,00000054,MOVIMIENTO INDEPENDIENTE REGIONAL MI BUEN VECINO,,100.000,12,12,643,00000054.jpg,32.974,24.282,12/10/2022,13:00 h, 100.0000,090603,698
