,C_CODI_AGP,AGRUPACION,IMAGENAGRUPACION,PORC_AVANCE_ACTA,ACTAS_COMPUTADA,TOTAL_MESAS,TOTAL_VOTOS,NLISTA,POR_VALIDOS,POR_EMITIDOS,fecha,hora,avance,ubigeo,nulos_y_blancos
4,00000006,FUERZA POPULAR,,100.000,63,63,247,00000006.jpg,2.269,1.857,12/10/2022,13:00 h, 100.0000,090606,2415
1,00000054,MOVIMIENTO INDEPENDIENTE REGIONAL MI BUEN VECINO,,100.000,63,63,1065,00000054.jpg,9.781,8.006,12/10/2022,13:00 h, 100.0000,090606,2415
2,00000055,TODOS POR EL GRAN CAMBIO,,100.000,63,63,1563,00000055.jpg,14.355,11.749,12/10/2022,13:00 h, 100.0000,090606,2415
0,00000053,MOVIMIENTO POLITICO CAMBIEMOS X HCO,,100.000,63,63,1768,00000053.jpg,16.238,13.290,12/10/2022,13:00 h, 100.0000,090606,2415
3,00000057,MOVIMIENTO INDEPENDIENTE REGIONAL HUANUCO PRIMERO,,100.000,63,63,2431,00000057.jpg,22.327,18.274,12/10/2022,13:00 h, 100.0000,090606,2415
5,00000007,AVANZA PAIS - PARTIDO DE INTEGRACION SOCIAL,,100.000,63,63,3814,00000007.jpg,35.029,28.670,12/10/2022,13:00 h, 100.0000,090606,2415
