,C_CODI_AGP,AGRUPACION,IMAGENAGRUPACION,PORC_AVANCE_ACTA,ACTAS_COMPUTADA,TOTAL_MESAS,TOTAL_VOTOS,NLISTA,POR_VALIDOS,POR_EMITIDOS,fecha,hora,avance,ubigeo,nulos_y_blancos
0,00000054,MOVIMIENTO INDEPENDIENTE REGIONAL MI BUEN VECINO,,100.000,19,19,423,00000054.jpg,14.114,12.204,12/10/2022,16:00 h, 100.0000,090902,469
2,00000005,JUNTOS POR EL PERU,,100.000,19,19,474,00000005.jpg,15.816,13.676,12/10/2022,16:00 h, 100.0000,090902,469
3,00000004,ALIANZA PARA EL PROGRESO,,100.000,19,19,574,00000004.jpg,19.152,16.561,12/10/2022,16:00 h, 100.0000,090902,469
4,00000007,AVANZA PAIS - PARTIDO DE INTEGRACION SOCIAL,,100.000,19,19,632,00000007.jpg,21.088,18.234,12/10/2022,16:00 h, 100.0000,090902,469
1,00000057,MOVIMIENTO INDEPENDIENTE REGIONAL HUANUCO PRIMERO,,100.000,19,19,894,00000057.jpg,29.830,25.793,12/10/2022,16:00 h, 100.0000,090902,469
