,C_CODI_AGP,AGRUPACION,IMAGENAGRUPACION,PORC_AVANCE_ACTA,ACTAS_COMPUTADA,TOTAL_MESAS,TOTAL_VOTOS,NLISTA,POR_VALIDOS,POR_EMITIDOS,fecha,hora,avance,ubigeo,nulos_y_blancos
7,00000008,PARTIDO POLITICO NACIONAL PERU LIBRE,,100.000,18,18,52,00000008.jpg,1.712,1.467,12/10/2022,16:00 h, 100.0000,091106,508
3,00000056,AVANZADA REGIONAL INDEPENDIENTE UNIDOS POR HUANUCO,,100.000,18,18,89,00000056.jpg,2.931,2.511,12/10/2022,16:00 h, 100.0000,091106,508
4,00000005,JUNTOS POR EL PERU,,100.000,18,18,89,00000005.jpg,2.931,2.511,12/10/2022,16:00 h, 100.0000,091106,508
0,00000053,MOVIMIENTO POLITICO CAMBIEMOS X HCO,,100.000,18,18,140,00000053.jpg,4.610,3.949,12/10/2022,16:00 h, 100.0000,091106,508
8,00000002,PARTIDO DEMOCRATICO SOMOS PERU,,100.000,18,18,368,00000002.jpg,12.117,10.381,12/10/2022,16:00 h, 100.0000,091106,508
6,00000007,AVANZA PAIS - PARTIDO DE INTEGRACION SOCIAL,,100.000,18,18,386,00000007.jpg,12.710,10.889,12/10/2022,16:00 h, 100.0000,091106,508
1,00000054,MOVIMIENTO INDEPENDIENTE REGIONAL MI BUEN VECINO,,100.000,18,18,453,00000054.jpg,14.916,12.779,12/10/2022,16:00 h, 100.0000,091106,508
2,00000057,MOVIMIENTO INDEPENDIENTE REGIONAL HUANUCO PRIMERO,,100.000,18,18,621,00000057.jpg,20.448,17.518,12/10/2022,16:00 h, 100.0000,091106,508
5,00000004,ALIANZA PARA EL PROGRESO,,100.000,18,18,839,00000004.jpg,27.626,23.667,12/10/2022,16:00 h, 100.0000,091106,508
