,C_CODI_AGP,AGRUPACION,IMAGENAGRUPACION,PORC_AVANCE_ACTA,ACTAS_COMPUTADA,TOTAL_MESAS,TOTAL_VOTOS,NLISTA,POR_VALIDOS,POR_EMITIDOS,fecha,hora,avance,ubigeo,nulos_y_blancos
6,00000002,PARTIDO DEMOCRATICO SOMOS PERU,,100.000,13,13,55,00000002.jpg,2.156,1.912,12/10/2022,16:00 h, 100.0000,110126,325
4,00000004,ALIANZA PARA EL PROGRESO,,100.000,13,13,150,00000004.jpg,5.880,5.216,12/10/2022,16:00 h, 100.0000,110126,325
1,00000062,JUNIN RENACE,,100.000,13,13,208,00000062.jpg,8.154,7.232,12/10/2022,16:00 h, 100.0000,110126,325
5,00000008,PARTIDO POLITICO NACIONAL PERU LIBRE,,100.000,13,13,209,00000008.jpg,8.193,7.267,12/10/2022,16:00 h, 100.0000,110126,325
2,00000065,MOVIMIENTO REGIONAL BLOQUE POPULAR JUNIN,,100.000,13,13,504,00000065.jpg,19.757,17.524,12/10/2022,16:00 h, 100.0000,110126,325
0,00000061,MOVIMIENTO REGIONAL SIERRA Y SELVA CONTIGO JUNIN,,100.000,13,13,684,00000061.jpg,26.813,23.783,12/10/2022,16:00 h, 100.0000,110126,325
3,00000060,CAMINEMOS JUNTOS POR JUNIN,,100.000,13,13,741,00000060.jpg,29.047,25.765,12/10/2022,16:00 h, 100.0000,110126,325
