,C_CODI_AGP,AGRUPACION,IMAGENAGRUPACION,PORC_AVANCE_ACTA,ACTAS_COMPUTADA,TOTAL_MESAS,TOTAL_VOTOS,NLISTA,POR_VALIDOS,POR_EMITIDOS,fecha,hora,avance,ubigeo,nulos_y_blancos
3,00000065,MOVIMIENTO REGIONAL BLOQUE POPULAR JUNIN,,100.000,17,17,95,00000065.jpg,3.569,2.856,12/10/2022,16:00 h, 100.0000,110215,664
5,00000004,ALIANZA PARA EL PROGRESO,,100.000,17,17,177,00000004.jpg,6.649,5.322,12/10/2022,16:00 h, 100.0000,110215,664
0,00000064,CORAZON PATRIOTA,,100.000,17,17,267,00000064.jpg,10.030,8.028,12/10/2022,16:00 h, 100.0000,110215,664
1,00000063,JUNIN SOSTENIBLE CON SU GENTE,,100.000,17,17,350,00000063.jpg,13.148,10.523,12/10/2022,16:00 h, 100.0000,110215,664
2,00000061,MOVIMIENTO REGIONAL SIERRA Y SELVA CONTIGO JUNIN,,100.000,17,17,533,00000061.jpg,20.023,16.025,12/10/2022,16:00 h, 100.0000,110215,664
4,00000060,CAMINEMOS JUNTOS POR JUNIN,,100.000,17,17,1240,00000060.jpg,46.582,37.282,12/10/2022,16:00 h, 100.0000,110215,664
