,C_CODI_AGP,AGRUPACION,IMAGENAGRUPACION,PORC_AVANCE_ACTA,ACTAS_COMPUTADA,TOTAL_MESAS,TOTAL_VOTOS,NLISTA,POR_VALIDOS,POR_EMITIDOS,fecha,hora,avance,ubigeo,nulos_y_blancos
0,00000064,CORAZON PATRIOTA,,100.000,27,27,50,00000064.jpg,0.989,0.827,12/10/2022,16:00 h, 100.0000,110504,989
4,00000060,CAMINEMOS JUNTOS POR JUNIN,,100.000,27,27,421,00000060.jpg,8.327,6.964,12/10/2022,16:00 h, 100.0000,110504,989
2,00000062,JUNIN RENACE,,100.000,27,27,455,00000062.jpg,8.999,7.527,12/10/2022,16:00 h, 100.0000,110504,989
3,00000065,MOVIMIENTO REGIONAL BLOQUE POPULAR JUNIN,,100.000,27,27,459,00000065.jpg,9.078,7.593,12/10/2022,16:00 h, 100.0000,110504,989
6,00000002,PARTIDO DEMOCRATICO SOMOS PERU,,100.000,27,27,1144,00000002.jpg,22.627,18.925,12/10/2022,16:00 h, 100.0000,110504,989
1,00000061,MOVIMIENTO REGIONAL SIERRA Y SELVA CONTIGO JUNIN,,100.000,27,27,1213,00000061.jpg,23.991,20.066,12/10/2022,16:00 h, 100.0000,110504,989
5,00000008,PARTIDO POLITICO NACIONAL PERU LIBRE,,100.000,27,27,1314,00000008.jpg,25.989,21.737,12/10/2022,16:00 h, 100.0000,110504,989
