,C_CODI_AGP,AGRUPACION,IMAGENAGRUPACION,PORC_AVANCE_ACTA,ACTAS_COMPUTADA,TOTAL_MESAS,TOTAL_VOTOS,NLISTA,POR_VALIDOS,POR_EMITIDOS,fecha,hora,avance,ubigeo
0,00000063,JUNIN SOSTENIBLE CON SU GENTE,,100.000,9,9,116,00000063.jpg,6.353,5.561,10/10/2022,16:51 h, 100.0000,110505
1,00000061,MOVIMIENTO REGIONAL SIERRA Y SELVA CONTIGO JUNIN,,100.000,9,9,263,00000061.jpg,14.403,12.608,10/10/2022,16:51 h, 100.0000,110505
2,00000062,JUNIN RENACE,,100.000,9,9,480,00000062.jpg,26.287,23.011,10/10/2022,16:51 h, 100.0000,110505
3,00000065,MOVIMIENTO REGIONAL BLOQUE POPULAR JUNIN,,100.000,9,9,16,00000065.jpg,0.876,0.767,10/10/2022,16:51 h, 100.0000,110505
4,00000060,CAMINEMOS JUNTOS POR JUNIN,,100.000,9,9,536,00000060.jpg,29.354,25.695,10/10/2022,16:51 h, 100.0000,110505
5,00000003,RENOVACION POPULAR,,100.000,9,9,194,00000003.jpg,10.624,9.300,10/10/2022,16:51 h, 100.0000,110505
6,00000002,PARTIDO DEMOCRATICO SOMOS PERU,,100.000,9,9,221,00000002.jpg,12.103,10.594,10/10/2022,16:51 h, 100.0000,110505
