,C_CODI_AGP,AGRUPACION,IMAGENAGRUPACION,PORC_AVANCE_ACTA,ACTAS_COMPUTADA,TOTAL_MESAS,TOTAL_VOTOS,NLISTA,POR_VALIDOS,POR_EMITIDOS,fecha,hora,avance,ubigeo
0,00000063,JUNIN SOSTENIBLE CON SU GENTE,,100.000,18,18,38,00000063.jpg,1.218,0.976,10/10/2022,16:51 h, 100.0000,110506
1,00000061,MOVIMIENTO REGIONAL SIERRA Y SELVA CONTIGO JUNIN,,100.000,18,18,474,00000061.jpg,15.197,12.169,10/10/2022,16:51 h, 100.0000,110506
2,00000062,JUNIN RENACE,,100.000,18,18,"1,101",00000062.jpg,35.300,28.267,10/10/2022,16:51 h, 100.0000,110506
3,00000065,MOVIMIENTO REGIONAL BLOQUE POPULAR JUNIN,,100.000,18,18,270,00000065.jpg,8.657,6.932,10/10/2022,16:51 h, 100.0000,110506
4,00000060,CAMINEMOS JUNTOS POR JUNIN,,100.000,18,18,"1,006",00000060.jpg,32.254,25.828,10/10/2022,16:51 h, 100.0000,110506
5,00000003,RENOVACION POPULAR,,100.000,18,18,124,00000003.jpg,3.976,3.184,10/10/2022,16:51 h, 100.0000,110506
6,00000002,PARTIDO DEMOCRATICO SOMOS PERU,,100.000,18,18,106,00000002.jpg,3.399,2.721,10/10/2022,16:51 h, 100.0000,110506
