,C_CODI_AGP,AGRUPACION,IMAGENAGRUPACION,PORC_AVANCE_ACTA,ACTAS_COMPUTADA,TOTAL_MESAS,TOTAL_VOTOS,NLISTA,POR_VALIDOS,POR_EMITIDOS,fecha,hora,avance,ubigeo,nulos_y_blancos
4,00000011,PARTIDO FRENTE DE LA ESPERANZA 2021,,100.000,10,10,6,00000011.jpg,0.356,0.301,12/10/2022,13:00 h, 100.0000,110907,310
0,00000063,JUNIN SOSTENIBLE CON SU GENTE,,100.000,10,10,9,00000063.jpg,0.534,0.451,12/10/2022,13:00 h, 100.0000,110907,310
5,00000005,JUNTOS POR EL PERU,,100.000,10,10,18,00000005.jpg,1.069,0.903,12/10/2022,13:00 h, 100.0000,110907,310
3,00000060,CAMINEMOS JUNTOS POR JUNIN,,100.000,10,10,173,00000060.jpg,10.273,8.676,12/10/2022,13:00 h, 100.0000,110907,310
7,00000008,PARTIDO POLITICO NACIONAL PERU LIBRE,,100.000,10,10,173,00000008.jpg,10.273,8.676,12/10/2022,13:00 h, 100.0000,110907,310
2,00000062,JUNIN RENACE,,100.000,10,10,394,00000062.jpg,23.397,19.759,12/10/2022,13:00 h, 100.0000,110907,310
6,00000004,ALIANZA PARA EL PROGRESO,,100.000,10,10,405,00000004.jpg,24.050,20.311,12/10/2022,13:00 h, 100.0000,110907,310
1,00000061,MOVIMIENTO REGIONAL SIERRA Y SELVA CONTIGO JUNIN,,100.000,10,10,506,00000061.jpg,30.048,25.376,12/10/2022,13:00 h, 100.0000,110907,310
