,C_CODI_AGP,AGRUPACION,IMAGENAGRUPACION,PORC_AVANCE_ACTA,ACTAS_COMPUTADA,TOTAL_MESAS,TOTAL_VOTOS,NLISTA,POR_VALIDOS,POR_EMITIDOS,fecha,hora,avance,ubigeo
0,00000068,MOVIMIENTO REGIONAL FORTALEZA PERU,,100.000,6,6,443,00000068.jpg,43.861,35.755,06/10/2022,17:50 h,  54.5455,120413
1,00000069,MOVIMIENTO REGIONAL TRABAJO MAS TRABAJO,,100.000,6,6,396,00000069.jpg,39.208,31.961,06/10/2022,17:50 h,  54.5455,120413
2,00000004,ALIANZA PARA EL PROGRESO,,100.000,6,6,40,00000004.jpg,3.960,3.228,06/10/2022,17:50 h,  54.5455,120413
3,00000008,PARTIDO POLITICO NACIONAL PERU LIBRE,,100.000,6,6,6,00000008.jpg,0.594,0.484,06/10/2022,17:50 h,  54.5455,120413
4,00000002,PARTIDO DEMOCRATICO SOMOS PERU,,100.000,6,6,125,00000002.jpg,12.376,10.089,06/10/2022,17:50 h,  54.5455,120413
