,C_CODI_AGP,AGRUPACION,IMAGENAGRUPACION,PORC_AVANCE_ACTA,ACTAS_COMPUTADA,TOTAL_MESAS,TOTAL_VOTOS,NLISTA,POR_VALIDOS,POR_EMITIDOS,fecha,hora,avance,ubigeo,nulos_y_blancos
3,00000008,PARTIDO POLITICO NACIONAL PERU LIBRE,,100.000,9,9,40,00000008.jpg,2.316,2.130,12/10/2022,13:00 h, 100.0000,120403,151
2,00000004,ALIANZA PARA EL PROGRESO,,100.000,9,9,196,00000004.jpg,11.349,10.437,12/10/2022,13:00 h, 100.0000,120403,151
1,00000069,MOVIMIENTO REGIONAL TRABAJO MAS TRABAJO,,100.000,9,9,423,00000069.jpg,24.493,22.524,12/10/2022,13:00 h, 100.0000,120403,151
4,00000002,PARTIDO DEMOCRATICO SOMOS PERU,,100.000,9,9,424,00000002.jpg,24.551,22.577,12/10/2022,13:00 h, 100.0000,120403,151
0,00000068,MOVIMIENTO REGIONAL FORTALEZA PERU,,100.000,9,9,644,00000068.jpg,37.290,34.292,12/10/2022,13:00 h, 100.0000,120403,151
