,C_CODI_AGP,AGRUPACION,IMAGENAGRUPACION,PORC_AVANCE_ACTA,ACTAS_COMPUTADA,TOTAL_MESAS,TOTAL_VOTOS,NLISTA,POR_VALIDOS,POR_EMITIDOS,fecha,hora,avance,ubigeo,nulos_y_blancos
0,00000068,MOVIMIENTO REGIONAL FORTALEZA PERU,,100.000,36,36,46,00000068.jpg,0.850,0.666,12/10/2022,16:00 h, 100.0000,120608,1498
6,00000008,PARTIDO POLITICO NACIONAL PERU LIBRE,,100.000,36,36,150,00000008.jpg,2.771,2.170,12/10/2022,16:00 h, 100.0000,120608,1498
3,00000011,PARTIDO FRENTE DE LA ESPERANZA 2021,,100.000,36,36,246,00000011.jpg,4.544,3.559,12/10/2022,16:00 h, 100.0000,120608,1498
2,00000067,SUMATE,,100.000,36,36,282,00000067.jpg,5.209,4.080,12/10/2022,16:00 h, 100.0000,120608,1498
1,00000069,MOVIMIENTO REGIONAL TRABAJO MAS TRABAJO,,100.000,36,36,1089,00000069.jpg,20.115,15.755,12/10/2022,16:00 h, 100.0000,120608,1498
5,00000007,AVANZA PAIS - PARTIDO DE INTEGRACION SOCIAL,,100.000,36,36,1449,00000007.jpg,26.764,20.964,12/10/2022,16:00 h, 100.0000,120608,1498
4,00000004,ALIANZA PARA EL PROGRESO,,100.000,36,36,2152,00000004.jpg,39.749,31.134,12/10/2022,16:00 h, 100.0000,120608,1498
