,C_CODI_AGP,AGRUPACION,IMAGENAGRUPACION,PORC_AVANCE_ACTA,ACTAS_COMPUTADA,TOTAL_MESAS,TOTAL_VOTOS,NLISTA,POR_VALIDOS,POR_EMITIDOS,fecha,hora,avance,ubigeo,nulos_y_blancos
4,00000002,PARTIDO DEMOCRATICO SOMOS PERU,,100.000,36,36,138,00000002.jpg,2.215,1.915,12/10/2022,13:00 h, 100.0000,121001,976
0,00000068,MOVIMIENTO REGIONAL FORTALEZA PERU,,100.000,36,36,1019,00000068.jpg,16.359,14.143,12/10/2022,13:00 h, 100.0000,121001,976
2,00000066,NUEVA LIBERTAD,,100.000,36,36,1281,00000066.jpg,20.565,17.779,12/10/2022,13:00 h, 100.0000,121001,976
3,00000004,ALIANZA PARA EL PROGRESO,,100.000,36,36,1397,00000004.jpg,22.427,19.389,12/10/2022,13:00 h, 100.0000,121001,976
1,00000069,MOVIMIENTO REGIONAL TRABAJO MAS TRABAJO,,100.000,36,36,2394,00000069.jpg,38.433,33.227,12/10/2022,13:00 h, 100.0000,121001,976
