,C_CODI_AGP,AGRUPACION,IMAGENAGRUPACION,PORC_AVANCE_ACTA,ACTAS_COMPUTADA,TOTAL_MESAS,TOTAL_VOTOS,NLISTA,POR_VALIDOS,POR_EMITIDOS,fecha,hora,avance,ubigeo
0,00000068,MOVIMIENTO REGIONAL FORTALEZA PERU,,100.000,18,18,164,00000068.jpg,5.822,4.618,10/10/2022,16:51 h,  94.7368,121003
1,00000069,MOVIMIENTO REGIONAL TRABAJO MAS TRABAJO,,100.000,18,18,"1,302",00000069.jpg,46.219,36.666,10/10/2022,16:51 h,  94.7368,121003
2,00000066,NUEVA LIBERTAD,,100.000,18,18,"1,039",00000066.jpg,36.883,29.259,10/10/2022,16:51 h,  94.7368,121003
3,00000004,ALIANZA PARA EL PROGRESO,,100.000,18,18,275,00000004.jpg,9.762,7.744,10/10/2022,16:51 h,  94.7368,121003
4,00000002,PARTIDO DEMOCRATICO SOMOS PERU,,100.000,18,18,37,00000002.jpg,1.313,1.042,10/10/2022,16:51 h,  94.7368,121003
