,C_CODI_AGP,AGRUPACION,IMAGENAGRUPACION,PORC_AVANCE_ACTA,ACTAS_COMPUTADA,TOTAL_MESAS,TOTAL_VOTOS,NLISTA,POR_VALIDOS,POR_EMITIDOS,fecha,hora,avance,ubigeo
0,00000072,PATRIA JOVEN,,100.000,6,6,43,00000072.jpg,4.762,4.034,06/10/2022,17:50 h, 100.0000,140201
1,00000074,MOVIMIENTO REGIONAL UNIDAD CIVICA LIMA,,100.000,6,6,46,00000074.jpg,5.094,4.315,06/10/2022,17:50 h, 100.0000,140201
2,00000073,CONCERTACION PARA EL DESARROLLO REGIONAL - LIMA,,100.000,6,6,416,00000073.jpg,46.069,39.024,06/10/2022,17:50 h, 100.0000,140201
3,00000004,ALIANZA PARA EL PROGRESO,,100.000,6,6,318,00000004.jpg,35.216,29.831,06/10/2022,17:50 h, 100.0000,140201
4,00000007,AVANZA PAIS - PARTIDO DE INTEGRACION SOCIAL,,100.000,6,6,80,00000007.jpg,8.859,7.505,06/10/2022,17:50 h, 100.0000,140201
