,C_CODI_AGP,AGRUPACION,IMAGENAGRUPACION,PORC_AVANCE_ACTA,ACTAS_COMPUTADA,TOTAL_MESAS,TOTAL_VOTOS,NLISTA,POR_VALIDOS,POR_EMITIDOS,fecha,hora,avance,ubigeo,nulos_y_blancos
3,00000004,ALIANZA PARA EL PROGRESO,,100.000,6,6,30,00000004.jpg,2.439,2.204,12/10/2022,16:00 h, 100.0000,140629,131
5,00000002,PARTIDO DEMOCRATICO SOMOS PERU,,100.000,6,6,117,00000002.jpg,9.512,8.597,12/10/2022,16:00 h, 100.0000,140629,131
0,00000072,PATRIA JOVEN,,100.000,6,6,161,00000072.jpg,13.089,11.830,12/10/2022,16:00 h, 100.0000,140629,131
4,00000007,AVANZA PAIS - PARTIDO DE INTEGRACION SOCIAL,,100.000,6,6,264,00000007.jpg,21.463,19.398,12/10/2022,16:00 h, 100.0000,140629,131
1,00000074,MOVIMIENTO REGIONAL UNIDAD CIVICA LIMA,,100.000,6,6,325,00000074.jpg,26.423,23.880,12/10/2022,16:00 h, 100.0000,140629,131
2,00000073,CONCERTACION PARA EL DESARROLLO REGIONAL - LIMA,,100.000,6,6,333,00000073.jpg,27.073,24.467,12/10/2022,16:00 h, 100.0000,140629,131
