,C_CODI_AGP,AGRUPACION,IMAGENAGRUPACION,PORC_AVANCE_ACTA,ACTAS_COMPUTADA,TOTAL_MESAS,TOTAL_VOTOS,NLISTA,POR_VALIDOS,POR_EMITIDOS,fecha,hora,avance,ubigeo,nulos_y_blancos
5,00000004,ALIANZA PARA EL PROGRESO,,100.000,35,35,14,00000004.jpg,0.286,0.254,12/10/2022,16:00 h,  89.7436,150106,604
4,00000077,MOVIMIENTO INDEPENDIENTE POLITICO VOLUNTAD GENERAL AMAZONICA - VOGA,,100.000,35,35,90,00000077.jpg,1.837,1.635,12/10/2022,16:00 h,  89.7436,150106,604
0,00000075,MOVIMIENTO INDEPENDIENTE LORETO - MI LORETO,,100.000,35,35,163,00000075.jpg,3.327,2.961,12/10/2022,16:00 h,  89.7436,150106,604
1,00000184,FUERZA LORETANA,,100.000,35,35,418,00000184.jpg,8.531,7.594,12/10/2022,16:00 h,  89.7436,150106,604
3,00000078,MOVIMIENTO ESPERANZA REGION AMAZONICA,,100.000,35,35,658,00000078.jpg,13.429,11.955,12/10/2022,16:00 h,  89.7436,150106,604
2,00000079,MOVIMIENTO INDEPENDIENTE REIVINDIQUEMOS LORETO,,100.000,35,35,1406,00000079.jpg,28.694,25.545,12/10/2022,16:00 h,  89.7436,150106,604
6,00000002,PARTIDO DEMOCRATICO SOMOS PERU,,100.000,35,35,2151,00000002.jpg,43.898,39.081,12/10/2022,16:00 h,  89.7436,150106,604
