,C_CODI_AGP,AGRUPACION,IMAGENAGRUPACION,PORC_AVANCE_ACTA,ACTAS_COMPUTADA,TOTAL_MESAS,TOTAL_VOTOS,NLISTA,POR_VALIDOS,POR_EMITIDOS,fecha,hora,avance,ubigeo,nulos_y_blancos
5,00000007,AVANZA PAIS - PARTIDO DE INTEGRACION SOCIAL,,100.000,10,10,1,00000007.jpg,0.054,0.052,12/10/2022,16:00 h, 100.0000,150407,66
3,00000076,JUNTOS POR LORETO,,100.000,10,10,2,00000076.jpg,0.107,0.104,12/10/2022,16:00 h, 100.0000,150407,66
2,00000077,MOVIMIENTO INDEPENDIENTE POLITICO VOLUNTAD GENERAL AMAZONICA - VOGA,,100.000,10,10,39,00000077.jpg,2.090,2.019,12/10/2022,16:00 h, 100.0000,150407,66
6,00000002,PARTIDO DEMOCRATICO SOMOS PERU,,100.000,10,10,332,00000002.jpg,17.792,17.184,12/10/2022,16:00 h, 100.0000,150407,66
1,00000078,MOVIMIENTO ESPERANZA REGION AMAZONICA,,100.000,10,10,390,00000078.jpg,20.900,20.186,12/10/2022,16:00 h, 100.0000,150407,66
4,00000004,ALIANZA PARA EL PROGRESO,,100.000,10,10,536,00000004.jpg,28.725,27.743,12/10/2022,16:00 h, 100.0000,150407,66
0,00000079,MOVIMIENTO INDEPENDIENTE REIVINDIQUEMOS LORETO,,100.000,10,10,566,00000079.jpg,30.332,29.296,12/10/2022,16:00 h, 100.0000,150407,66
