,C_CODI_AGP,AGRUPACION,IMAGENAGRUPACION,PORC_AVANCE_ACTA,ACTAS_COMPUTADA,TOTAL_MESAS,TOTAL_VOTOS,NLISTA,POR_VALIDOS,POR_EMITIDOS,fecha,hora,avance,ubigeo,nulos_y_blancos
5,00000008,PARTIDO POLITICO NACIONAL PERU LIBRE,,100.000,18,18,32,00000008.jpg,1.014,0.947,12/10/2022,16:00 h, 100.0000,150503,223
1,00000079,MOVIMIENTO INDEPENDIENTE REIVINDIQUEMOS LORETO,,100.000,18,18,124,00000079.jpg,3.929,3.670,12/10/2022,16:00 h, 100.0000,150503,223
3,00000077,MOVIMIENTO INDEPENDIENTE POLITICO VOLUNTAD GENERAL AMAZONICA - VOGA,,100.000,18,18,202,00000077.jpg,6.401,5.978,12/10/2022,16:00 h, 100.0000,150503,223
2,00000078,MOVIMIENTO ESPERANZA REGION AMAZONICA,,100.000,18,18,259,00000078.jpg,8.207,7.665,12/10/2022,16:00 h, 100.0000,150503,223
6,00000002,PARTIDO DEMOCRATICO SOMOS PERU,,100.000,18,18,570,00000002.jpg,18.061,16.869,12/10/2022,16:00 h, 100.0000,150503,223
0,00000075,MOVIMIENTO INDEPENDIENTE LORETO - MI LORETO,,100.000,18,18,741,00000075.jpg,23.479,21.930,12/10/2022,16:00 h, 100.0000,150503,223
4,00000004,ALIANZA PARA EL PROGRESO,,100.000,18,18,1228,00000004.jpg,38.910,36.342,12/10/2022,16:00 h, 100.0000,150503,223
