,C_CODI_AGP,AGRUPACION,IMAGENAGRUPACION,PORC_AVANCE_ACTA,ACTAS_COMPUTADA,TOTAL_MESAS,TOTAL_VOTOS,NLISTA,POR_VALIDOS,POR_EMITIDOS,fecha,hora,avance,ubigeo,nulos_y_blancos
0,00000184,FUERZA LORETANA,,100.000,36,36,51,00000184.jpg,0.909,0.826,12/10/2022,13:00 h,  97.2973,150505,561
6,00000004,ALIANZA PARA EL PROGRESO,,100.000,36,36,338,00000004.jpg,6.024,5.476,12/10/2022,13:00 h,  97.2973,150505,561
7,00000008,PARTIDO POLITICO NACIONAL PERU LIBRE,,100.000,36,36,510,00000008.jpg,9.089,8.263,12/10/2022,13:00 h,  97.2973,150505,561
5,00000161,LORETO PARA TODOS,,100.000,36,36,553,00000161.jpg,9.856,8.960,12/10/2022,13:00 h,  97.2973,150505,561
4,00000076,JUNTOS POR LORETO,,100.000,36,36,589,00000076.jpg,10.497,9.543,12/10/2022,13:00 h,  97.2973,150505,561
1,00000079,MOVIMIENTO INDEPENDIENTE REIVINDIQUEMOS LORETO,,100.000,36,36,602,00000079.jpg,10.729,9.754,12/10/2022,13:00 h,  97.2973,150505,561
8,00000002,PARTIDO DEMOCRATICO SOMOS PERU,,100.000,36,36,715,00000002.jpg,12.743,11.585,12/10/2022,13:00 h,  97.2973,150505,561
2,00000078,MOVIMIENTO ESPERANZA REGION AMAZONICA,,100.000,36,36,985,00000078.jpg,17.555,15.959,12/10/2022,13:00 h,  97.2973,150505,561
3,00000077,MOVIMIENTO INDEPENDIENTE POLITICO VOLUNTAD GENERAL AMAZONICA - VOGA,,100.000,36,36,1268,00000077.jpg,22.598,20.544,12/10/2022,13:00 h,  97.2973,150505,561
