,C_CODI_AGP,AGRUPACION,IMAGENAGRUPACION,PORC_AVANCE_ACTA,ACTAS_COMPUTADA,TOTAL_MESAS,TOTAL_VOTOS,NLISTA,POR_VALIDOS,POR_EMITIDOS,fecha,hora,avance,ubigeo,nulos_y_blancos
0,00000089,MOVIMIENTO POLITICO REGIONAL SUMATE AL CAMBIO,,100.000,3,3,14,00000089.jpg,2.426,2.056,12/10/2022,13:00 h, 100.0000,170211,104
2,00000009,PODEMOS PERU,,100.000,3,3,71,00000009.jpg,12.305,10.426,12/10/2022,13:00 h, 100.0000,170211,104
1,00000005,JUNTOS POR EL PERU,,100.000,3,3,89,00000005.jpg,15.425,13.069,12/10/2022,13:00 h, 100.0000,170211,104
5,00000002,PARTIDO DEMOCRATICO SOMOS PERU,,100.000,3,3,110,00000002.jpg,19.064,16.153,12/10/2022,13:00 h, 100.0000,170211,104
3,00000004,ALIANZA PARA EL PROGRESO,,100.000,3,3,126,00000004.jpg,21.837,18.502,12/10/2022,13:00 h, 100.0000,170211,104
4,00000008,PARTIDO POLITICO NACIONAL PERU LIBRE,,100.000,3,3,167,00000008.jpg,28.943,24.523,12/10/2022,13:00 h, 100.0000,170211,104
