,C_CODI_AGP,AGRUPACION,IMAGENAGRUPACION,PORC_AVANCE_ACTA,ACTAS_COMPUTADA,TOTAL_MESAS,TOTAL_VOTOS,NLISTA,POR_VALIDOS,POR_EMITIDOS,fecha,hora,avance,ubigeo,nulos_y_blancos
3,00000004,ALIANZA PARA EL PROGRESO,,100.000,4,4,9,00000004.jpg,1.867,1.339,12/10/2022,13:00 h, 100.0000,170203,190
0,00000089,MOVIMIENTO POLITICO REGIONAL SUMATE AL CAMBIO,,100.000,4,4,11,00000089.jpg,2.282,1.637,12/10/2022,13:00 h, 100.0000,170203,190
1,00000005,JUNTOS POR EL PERU,,100.000,4,4,49,00000005.jpg,10.166,7.292,12/10/2022,13:00 h, 100.0000,170203,190
5,00000002,PARTIDO DEMOCRATICO SOMOS PERU,,100.000,4,4,57,00000002.jpg,11.826,8.482,12/10/2022,13:00 h, 100.0000,170203,190
2,00000009,PODEMOS PERU,,100.000,4,4,147,00000009.jpg,30.498,21.875,12/10/2022,13:00 h, 100.0000,170203,190
4,00000008,PARTIDO POLITICO NACIONAL PERU LIBRE,,100.000,4,4,209,00000008.jpg,43.361,31.101,12/10/2022,13:00 h, 100.0000,170203,190
