,C_CODI_AGP,AGRUPACION,IMAGENAGRUPACION,PORC_AVANCE_ACTA,ACTAS_COMPUTADA,TOTAL_MESAS,TOTAL_VOTOS,NLISTA,POR_VALIDOS,POR_EMITIDOS,fecha,hora,avance,ubigeo,nulos_y_blancos
3,00000004,ALIANZA PARA EL PROGRESO,,100.000,7,7,16,00000004.jpg,1.225,1.098,12/10/2022,16:00 h, 100.0000,190207,151
5,00000002,PARTIDO DEMOCRATICO SOMOS PERU,,100.000,7,7,98,00000002.jpg,7.504,6.726,12/10/2022,16:00 h, 100.0000,190207,151
1,00000095,MOVIMIENTO INDEPENDIENTE FUERZA REGIONAL,,100.000,7,7,168,00000095.jpg,12.864,11.531,12/10/2022,16:00 h, 100.0000,190207,151
0,00000098,ORGANIZACION POLITICA UNIDAD REGIONAL,,100.000,7,7,199,00000098.jpg,15.237,13.658,12/10/2022,16:00 h, 100.0000,190207,151
4,00000008,PARTIDO POLITICO NACIONAL PERU LIBRE,,100.000,7,7,220,00000008.jpg,16.845,15.100,12/10/2022,16:00 h, 100.0000,190207,151
2,00000096,CONTIGO REGION,,100.000,7,7,605,00000096.jpg,46.325,41.524,12/10/2022,16:00 h, 100.0000,190207,151
