,C_CODI_AGP,AGRUPACION,IMAGENAGRUPACION,PORC_AVANCE_ACTA,ACTAS_COMPUTADA,TOTAL_MESAS,TOTAL_VOTOS,NLISTA,POR_VALIDOS,POR_EMITIDOS,fecha,hora,avance,ubigeo,nulos_y_blancos
0,00000101,PODER ANDINO,,100.000,28,28,206,00000101.jpg,3.621,3.011,12/10/2022,16:00 h,  96.5517,200104,1152
1,00000100,FRENTE AMPLIO PARA EL DESARROLLO DEL PUEBLO,,100.000,28,28,353,00000100.jpg,6.205,5.160,12/10/2022,16:00 h,  96.5517,200104,1152
3,00000102,MOVIMIENTO DE INTEGRACION Y REVOLUCION ANDINA,,100.000,28,28,1339,00000102.jpg,23.537,19.573,12/10/2022,16:00 h,  96.5517,200104,1152
4,00000109,POR LAS COMUNIDADES FUENTE DE INTEGRACION ANDINA DE PUNO - CONFIA - PUNO,,100.000,28,28,1751,00000109.jpg,30.779,25.596,12/10/2022,16:00 h,  96.5517,200104,1152
2,00000105,REFORMA Y HONRADEZ POR MAS OBRAS,,100.000,28,28,2040,00000105.jpg,35.859,29.820,12/10/2022,16:00 h,  96.5517,200104,1152
