,C_CODI_AGP,AGRUPACION,IMAGENAGRUPACION,PORC_AVANCE_ACTA,ACTAS_COMPUTADA,TOTAL_MESAS,TOTAL_VOTOS,NLISTA,POR_VALIDOS,POR_EMITIDOS,fecha,hora,avance,ubigeo,nulos_y_blancos
5,00000104,SOMOS PUEBLO,,100.000,21,21,46,00000104.jpg,1.069,0.905,12/10/2022,16:00 h,  95.4545,200114,781
4,00000109,POR LAS COMUNIDADES FUENTE DE INTEGRACION ANDINA DE PUNO - CONFIA - PUNO,,100.000,21,21,254,00000109.jpg,5.903,4.996,12/10/2022,16:00 h,  95.4545,200114,781
0,00000101,PODER ANDINO,,100.000,21,21,336,00000101.jpg,7.809,6.609,12/10/2022,16:00 h,  95.4545,200114,781
1,00000100,FRENTE AMPLIO PARA EL DESARROLLO DEL PUEBLO,,100.000,21,21,424,00000100.jpg,9.854,8.340,12/10/2022,16:00 h,  95.4545,200114,781
3,00000102,MOVIMIENTO DE INTEGRACION Y REVOLUCION ANDINA,,100.000,21,21,1034,00000102.jpg,24.030,20.338,12/10/2022,16:00 h,  95.4545,200114,781
2,00000105,REFORMA Y HONRADEZ POR MAS OBRAS,,100.000,21,21,2209,00000105.jpg,51.336,43.450,12/10/2022,16:00 h,  95.4545,200114,781
