,C_CODI_AGP,AGRUPACION,IMAGENAGRUPACION,PORC_AVANCE_ACTA,ACTAS_COMPUTADA,TOTAL_MESAS,TOTAL_VOTOS,NLISTA,POR_VALIDOS,POR_EMITIDOS,fecha,hora,avance,ubigeo,nulos_y_blancos
1,00000100,FRENTE AMPLIO PARA EL DESARROLLO DEL PUEBLO,,100.000,8,8,19,00000100.jpg,1.055,0.964,12/10/2022,13:00 h, 100.0000,200217,170
0,00000101,PODER ANDINO,,100.000,8,8,23,00000101.jpg,1.277,1.167,12/10/2022,13:00 h, 100.0000,200217,170
5,00000008,PARTIDO POLITICO NACIONAL PERU LIBRE,,100.000,8,8,53,00000008.jpg,2.943,2.689,12/10/2022,13:00 h, 100.0000,200217,170
4,00000109,POR LAS COMUNIDADES FUENTE DE INTEGRACION ANDINA DE PUNO - CONFIA - PUNO,,100.000,8,8,54,00000109.jpg,2.998,2.740,12/10/2022,13:00 h, 100.0000,200217,170
2,00000105,REFORMA Y HONRADEZ POR MAS OBRAS,,100.000,8,8,756,00000105.jpg,41.977,38.356,12/10/2022,13:00 h, 100.0000,200217,170
3,00000102,MOVIMIENTO DE INTEGRACION Y REVOLUCION ANDINA,,100.000,8,8,896,00000102.jpg,49.750,45.459,12/10/2022,13:00 h, 100.0000,200217,170
