,C_CODI_AGP,AGRUPACION,IMAGENAGRUPACION,PORC_AVANCE_ACTA,ACTAS_COMPUTADA,TOTAL_MESAS,TOTAL_VOTOS,NLISTA,POR_VALIDOS,POR_EMITIDOS,fecha,hora,avance,ubigeo,nulos_y_blancos
4,00000109,POR LAS COMUNIDADES FUENTE DE INTEGRACION ANDINA DE PUNO - CONFIA - PUNO,,100.000,23,23,474,00000109.jpg,8.901,8.104,12/10/2022,16:00 h, 100.0000,200203,524
0,00000100,FRENTE AMPLIO PARA EL DESARROLLO DEL PUEBLO,,100.000,23,23,940,00000100.jpg,17.653,16.071,12/10/2022,16:00 h, 100.0000,200203,524
3,00000103,MORAL Y DESARROLLO,,100.000,23,23,1114,00000103.jpg,20.920,19.046,12/10/2022,16:00 h, 100.0000,200203,524
1,00000105,REFORMA Y HONRADEZ POR MAS OBRAS,,100.000,23,23,1280,00000105.jpg,24.038,21.884,12/10/2022,16:00 h, 100.0000,200203,524
2,00000102,MOVIMIENTO DE INTEGRACION Y REVOLUCION ANDINA,,100.000,23,23,1517,00000102.jpg,28.488,25.936,12/10/2022,16:00 h, 100.0000,200203,524
