,C_CODI_AGP,AGRUPACION,IMAGENAGRUPACION,PORC_AVANCE_ACTA,ACTAS_COMPUTADA,TOTAL_MESAS,TOTAL_VOTOS,NLISTA,POR_VALIDOS,POR_EMITIDOS,fecha,hora,avance,ubigeo,nulos_y_blancos
0,00000101,PODER ANDINO,,100.000,12,12,42,00000101.jpg,1.849,1.377,12/10/2022,13:00 h, 100.0000,200202,779
5,00000008,PARTIDO POLITICO NACIONAL PERU LIBRE,,100.000,12,12,55,00000008.jpg,2.421,1.803,12/10/2022,13:00 h, 100.0000,200202,779
1,00000100,FRENTE AMPLIO PARA EL DESARROLLO DEL PUEBLO,,100.000,12,12,61,00000100.jpg,2.685,1.999,12/10/2022,13:00 h, 100.0000,200202,779
4,00000109,POR LAS COMUNIDADES FUENTE DE INTEGRACION ANDINA DE PUNO - CONFIA - PUNO,,100.000,12,12,99,00000109.jpg,4.357,3.245,12/10/2022,13:00 h, 100.0000,200202,779
3,00000102,MOVIMIENTO DE INTEGRACION Y REVOLUCION ANDINA,,100.000,12,12,436,00000102.jpg,19.190,14.290,12/10/2022,13:00 h, 100.0000,200202,779
2,00000105,REFORMA Y HONRADEZ POR MAS OBRAS,,100.000,12,12,1579,00000105.jpg,69.498,51.754,12/10/2022,13:00 h, 100.0000,200202,779
