,C_CODI_AGP,AGRUPACION,IMAGENAGRUPACION,PORC_AVANCE_ACTA,ACTAS_COMPUTADA,TOTAL_MESAS,TOTAL_VOTOS,NLISTA,POR_VALIDOS,POR_EMITIDOS,fecha,hora,avance,ubigeo,nulos_y_blancos
5,00000008,PARTIDO POLITICO NACIONAL PERU LIBRE,,100.000,17,17,32,00000008.jpg,1.058,0.900,12/10/2022,13:00 h, 100.0000,200303,532
2,00000102,MOVIMIENTO DE INTEGRACION Y REVOLUCION ANDINA,,100.000,17,17,130,00000102.jpg,4.299,3.656,12/10/2022,13:00 h, 100.0000,200303,532
0,00000100,FRENTE AMPLIO PARA EL DESARROLLO DEL PUEBLO,,100.000,17,17,163,00000100.jpg,5.390,4.584,12/10/2022,13:00 h, 100.0000,200303,532
1,00000105,REFORMA Y HONRADEZ POR MAS OBRAS,,100.000,17,17,560,00000105.jpg,18.519,15.748,12/10/2022,13:00 h, 100.0000,200303,532
4,00000104,SOMOS PUEBLO,,100.000,17,17,593,00000104.jpg,19.610,16.676,12/10/2022,13:00 h, 100.0000,200303,532
3,00000103,MORAL Y DESARROLLO,,100.000,17,17,1546,00000103.jpg,51.124,43.476,12/10/2022,13:00 h, 100.0000,200303,532
