,C_CODI_AGP,AGRUPACION,IMAGENAGRUPACION,PORC_AVANCE_ACTA,ACTAS_COMPUTADA,TOTAL_MESAS,TOTAL_VOTOS,NLISTA,POR_VALIDOS,POR_EMITIDOS,fecha,hora,avance,ubigeo,nulos_y_blancos
5,00000008,PARTIDO POLITICO NACIONAL PERU LIBRE,,100.000,10,10,23,00000008.jpg,1.240,0.950,12/10/2022,13:00 h, 100.0000,200504,565
0,00000100,FRENTE AMPLIO PARA EL DESARROLLO DEL PUEBLO,,100.000,10,10,36,00000100.jpg,1.941,1.488,12/10/2022,13:00 h, 100.0000,200504,565
2,00000102,MOVIMIENTO DE INTEGRACION Y REVOLUCION ANDINA,,100.000,10,10,52,00000102.jpg,2.803,2.149,12/10/2022,13:00 h, 100.0000,200504,565
4,00000104,SOMOS PUEBLO,,100.000,10,10,460,00000104.jpg,24.798,19.008,12/10/2022,13:00 h, 100.0000,200504,565
3,00000109,POR LAS COMUNIDADES FUENTE DE INTEGRACION ANDINA DE PUNO - CONFIA - PUNO,,100.000,10,10,550,00000109.jpg,29.650,22.727,12/10/2022,13:00 h, 100.0000,200504,565
1,00000105,REFORMA Y HONRADEZ POR MAS OBRAS,,100.000,10,10,734,00000105.jpg,39.569,30.331,12/10/2022,13:00 h, 100.0000,200504,565
