,C_CODI_AGP,AGRUPACION,IMAGENAGRUPACION,PORC_AVANCE_ACTA,ACTAS_COMPUTADA,TOTAL_MESAS,TOTAL_VOTOS,NLISTA,POR_VALIDOS,POR_EMITIDOS,fecha,hora,avance,ubigeo,nulos_y_blancos
2,00000103,MORAL Y DESARROLLO,,100.000,6,6,56,00000103.jpg,4.037,3.726,12/10/2022,16:00 h, 100.0000,200703,116
5,00000008,PARTIDO POLITICO NACIONAL PERU LIBRE,,100.000,6,6,159,00000008.jpg,11.464,10.579,12/10/2022,16:00 h, 100.0000,200703,116
3,00000109,POR LAS COMUNIDADES FUENTE DE INTEGRACION ANDINA DE PUNO - CONFIA - PUNO,,100.000,6,6,187,00000109.jpg,13.482,12.442,12/10/2022,16:00 h, 100.0000,200703,116
4,00000104,SOMOS PUEBLO,,100.000,6,6,278,00000104.jpg,20.043,18.496,12/10/2022,16:00 h, 100.0000,200703,116
0,00000110,MOVIMIENTO DE INTEGRACION POR EL DESARROLLO REGIONAL (MI CASITA),,100.000,6,6,343,00000110.jpg,24.730,22.821,12/10/2022,16:00 h, 100.0000,200703,116
1,00000105,REFORMA Y HONRADEZ POR MAS OBRAS,,100.000,6,6,364,00000105.jpg,26.244,24.218,12/10/2022,16:00 h, 100.0000,200703,116
