,C_CODI_AGP,AGRUPACION,IMAGENAGRUPACION,PORC_AVANCE_ACTA,ACTAS_COMPUTADA,TOTAL_MESAS,TOTAL_VOTOS,NLISTA,POR_VALIDOS,POR_EMITIDOS,fecha,hora,avance,ubigeo,nulos_y_blancos
0,00000107,GESTIONANDO OBRAS Y OPORTUNIDADES CON LIDERAZGO,,100.000,71,71,889,00000107.jpg,6.450,5.763,12/10/2022,13:00 h, 100.0000,201001,1644
5,00000008,PARTIDO POLITICO NACIONAL PERU LIBRE,,100.000,71,71,1145,00000008.jpg,8.307,7.422,12/10/2022,13:00 h, 100.0000,201001,1644
3,00000103,MORAL Y DESARROLLO,,100.000,71,71,1348,00000103.jpg,9.780,8.738,12/10/2022,13:00 h, 100.0000,201001,1644
2,00000105,REFORMA Y HONRADEZ POR MAS OBRAS,,100.000,71,71,1362,00000105.jpg,9.882,8.829,12/10/2022,13:00 h, 100.0000,201001,1644
1,00000100,FRENTE AMPLIO PARA EL DESARROLLO DEL PUEBLO,,100.000,71,71,3952,00000100.jpg,28.673,25.617,12/10/2022,13:00 h, 100.0000,201001,1644
4,00000109,POR LAS COMUNIDADES FUENTE DE INTEGRACION ANDINA DE PUNO - CONFIA - PUNO,,100.000,71,71,5087,00000109.jpg,36.908,32.975,12/10/2022,13:00 h, 100.0000,201001,1644
