,C_CODI_AGP,AGRUPACION,IMAGENAGRUPACION,PORC_AVANCE_ACTA,ACTAS_COMPUTADA,TOTAL_MESAS,TOTAL_VOTOS,NLISTA,POR_VALIDOS,POR_EMITIDOS,fecha,hora,avance,ubigeo,nulos_y_blancos
1,00000105,REFORMA Y HONRADEZ POR MAS OBRAS,,100.000,8,8,11,00000105.jpg,0.767,0.688,12/10/2022,16:00 h, 100.0000,201006,165
0,00000100,FRENTE AMPLIO PARA EL DESARROLLO DEL PUEBLO,,100.000,8,8,113,00000100.jpg,7.880,7.067,12/10/2022,16:00 h, 100.0000,201006,165
3,00000109,POR LAS COMUNIDADES FUENTE DE INTEGRACION ANDINA DE PUNO - CONFIA - PUNO,,100.000,8,8,247,00000109.jpg,17.225,15.447,12/10/2022,16:00 h, 100.0000,201006,165
2,00000103,MORAL Y DESARROLLO,,100.000,8,8,497,00000103.jpg,34.658,31.082,12/10/2022,16:00 h, 100.0000,201006,165
4,00000008,PARTIDO POLITICO NACIONAL PERU LIBRE,,100.000,8,8,566,00000008.jpg,39.470,35.397,12/10/2022,16:00 h, 100.0000,201006,165
