,C_CODI_AGP,AGRUPACION,IMAGENAGRUPACION,PORC_AVANCE_ACTA,ACTAS_COMPUTADA,TOTAL_MESAS,TOTAL_VOTOS,NLISTA,POR_VALIDOS,POR_EMITIDOS,fecha,hora,avance,ubigeo,nulos_y_blancos
0,00000107,GESTIONANDO OBRAS Y OPORTUNIDADES CON LIDERAZGO,,100.000,4,4,8,00000107.jpg,1.125,1.027,12/10/2022,13:00 h, 100.0000,201003,68
5,00000008,PARTIDO POLITICO NACIONAL PERU LIBRE,,100.000,4,4,17,00000008.jpg,2.391,2.182,12/10/2022,13:00 h, 100.0000,201003,68
1,00000100,FRENTE AMPLIO PARA EL DESARROLLO DEL PUEBLO,,100.000,4,4,26,00000100.jpg,3.657,3.338,12/10/2022,13:00 h, 100.0000,201003,68
2,00000105,REFORMA Y HONRADEZ POR MAS OBRAS,,100.000,4,4,163,00000105.jpg,22.925,20.924,12/10/2022,13:00 h, 100.0000,201003,68
4,00000109,POR LAS COMUNIDADES FUENTE DE INTEGRACION ANDINA DE PUNO - CONFIA - PUNO,,100.000,4,4,225,00000109.jpg,31.646,28.883,12/10/2022,13:00 h, 100.0000,201003,68
3,00000103,MORAL Y DESARROLLO,,100.000,4,4,272,00000103.jpg,38.256,34.917,12/10/2022,13:00 h, 100.0000,201003,68
