,C_CODI_AGP,AGRUPACION,IMAGENAGRUPACION,PORC_AVANCE_ACTA,ACTAS_COMPUTADA,TOTAL_MESAS,TOTAL_VOTOS,NLISTA,POR_VALIDOS,POR_EMITIDOS,fecha,hora,avance,ubigeo,nulos_y_blancos
0,00000107,GESTIONANDO OBRAS Y OPORTUNIDADES CON LIDERAZGO,,100.000,14,14,92,00000107.jpg,3.350,2.610,12/10/2022,13:00 h, 100.0000,201103,779
1,00000100,FRENTE AMPLIO PARA EL DESARROLLO DEL PUEBLO,,100.000,14,14,177,00000100.jpg,6.446,5.021,12/10/2022,13:00 h, 100.0000,201103,779
2,00000105,REFORMA Y HONRADEZ POR MAS OBRAS,,100.000,14,14,360,00000105.jpg,13.110,10.213,12/10/2022,13:00 h, 100.0000,201103,779
4,00000104,SOMOS PUEBLO,,100.000,14,14,703,00000104.jpg,25.601,19.943,12/10/2022,13:00 h, 100.0000,201103,779
3,00000109,POR LAS COMUNIDADES FUENTE DE INTEGRACION ANDINA DE PUNO - CONFIA - PUNO,,100.000,14,14,1414,00000109.jpg,51.493,40.113,12/10/2022,13:00 h, 100.0000,201103,779
