,C_CODI_AGP,AGRUPACION,IMAGENAGRUPACION,PORC_AVANCE_ACTA,ACTAS_COMPUTADA,TOTAL_MESAS,TOTAL_VOTOS,NLISTA,POR_VALIDOS,POR_EMITIDOS,fecha,hora,avance,ubigeo,nulos_y_blancos
1,00000129,MOVIMIENTO INDEPENDIENTE REGIONAL CAMBIO UCAYALINO,,100.000,29,29,312,00000129.jpg,5.532,4.995,12/10/2022,16:00 h, 100.0000,250203,606
5,00000002,PARTIDO DEMOCRATICO SOMOS PERU,,100.000,29,29,393,00000002.jpg,6.968,6.292,12/10/2022,16:00 h, 100.0000,250203,606
4,00000008,PARTIDO POLITICO NACIONAL PERU LIBRE,,100.000,29,29,897,00000008.jpg,15.904,14.361,12/10/2022,16:00 h, 100.0000,250203,606
0,00000131,UCAYALI REGION CON FUTURO,,100.000,29,29,912,00000131.jpg,16.170,14.601,12/10/2022,16:00 h, 100.0000,250203,606
2,00000130,TODOS SOMOS UCAYALI,,100.000,29,29,1435,00000130.jpg,25.443,22.975,12/10/2022,16:00 h, 100.0000,250203,606
3,00000004,ALIANZA PARA EL PROGRESO,,100.000,29,29,1691,00000004.jpg,29.982,27.073,12/10/2022,16:00 h, 100.0000,250203,606
