,idHojaVida,feNacimiento,txSexo,designado,idProcesoElectoral,numeroDocumento,nombreCompleto,estado,idOrganizacionPolitica,organizacionPolitica,numeroCandidato,rutaArchivo,postulaDepartamento,postulaProvincia,postulaDistrito,cargo,txCodExpedienteExt
0,227392.0,1957-11-03T00:00:00,F,,0.0,04412930,TEOFILA FRANCISCA ROMERO MAMANI,INSCRITO,1257.0,ALIANZA PARA EL PROGRESO,0.0,/Assets/Fotos-HojaVida/227392.jpg,MOQUEGUA,,,['GOBERNADOR REGIONAL'],ERM.2022010061
1,227393.0,1971-08-04T00:00:00,M,,0.0,30766480,JUAN ANTONIO CABANA ZUÑIGA,INSCRITO,1257.0,ALIANZA PARA EL PROGRESO,0.0,/Assets/Fotos-HojaVida/227393.jpg,MOQUEGUA,,,['VICEGOBERNADOR REGIONAL'],ERM.2022010061
2,227394.0,1982-11-18T00:00:00,M,,0.0,41548111,ALONSO JOANN QUISPE ROMERO,INSCRITO,1257.0,ALIANZA PARA EL PROGRESO,1.0,/Assets/Fotos-HojaVida/227394.jpg,MOQUEGUA,,,['CONSEJERO REGIONAL'],ERM.2022010061
3,227395.0,1979-01-06T00:00:00,M,,0.0,80212225,CARLOS ENRIQUE ZELA SALAZAR,INSCRITO,1257.0,ALIANZA PARA EL PROGRESO,1.0,/Assets/Fotos-HojaVida/227395.jpg,MOQUEGUA,,,['ACCESITARIO'],ERM.2022010061
4,227396.0,1977-03-16T00:00:00,F,,0.0,04437620,KARLA CECILIA DANCE COLOMA,INSCRITO,1257.0,ALIANZA PARA EL PROGRESO,2.0,/Assets/Fotos-HojaVida/227396.jpg,MOQUEGUA,,,['CONSEJERO REGIONAL'],ERM.2022010061
5,227397.0,1977-02-11T00:00:00,F,,0.0,04437825,CLAUDIA LOURDES BADOINO ZEBALLOS,INSCRITO,1257.0,ALIANZA PARA EL PROGRESO,2.0,/Assets/Fotos-HojaVida/227397.jpg,MOQUEGUA,,,['ACCESITARIO'],ERM.2022010061
6,227398.0,1997-12-25T00:00:00,M,,0.0,71029869,CRISTHIAN MANUEL EVARISTO CENTENO BUSTOS,INSCRITO,1257.0,ALIANZA PARA EL PROGRESO,3.0,/Assets/Fotos-HojaVida/227398.jpg,MOQUEGUA,,,['CONSEJERO REGIONAL'],ERM.2022010061
7,227399.0,1992-09-29T00:00:00,M,,0.0,47720240,FRANCISCO ELOY HUMIRE MAMANI,INSCRITO,1257.0,ALIANZA PARA EL PROGRESO,3.0,/Assets/Fotos-HojaVida/227399.jpg,MOQUEGUA,,,['ACCESITARIO'],ERM.2022010061
8,227400.0,1969-01-28T00:00:00,F,,0.0,04417859,RUTH LIDIA CALLE BRACAMONTE  ,INSCRITO,1257.0,ALIANZA PARA EL PROGRESO,4.0,/Assets/Fotos-HojaVida/227400.jpg,MOQUEGUA,,,['CONSEJERO REGIONAL'],ERM.2022010061
9,227401.0,1982-07-25T00:00:00,F,,0.0,42186761,MELISA ANA MAMANI LAZO DE SIMICH,INSCRITO,1257.0,ALIANZA PARA EL PROGRESO,4.0,/Assets/Fotos-HojaVida/227401.jpg,MOQUEGUA,,,['ACCESITARIO'],ERM.2022010061
10,227402.0,1970-09-23T00:00:00,M,,0.0,29561125,LINO FELIPE GOMEZ OLIN,INSCRITO,1257.0,ALIANZA PARA EL PROGRESO,1.0,/Assets/Fotos-HojaVida/227402.jpg,MOQUEGUA,,,['CONSEJERO REGIONAL'],ERM.2022010061
11,227403.0,1972-01-06T00:00:00,M,,0.0,29579879,JORGE CARCAUSTO MAYTA,INSCRITO,1257.0,ALIANZA PARA EL PROGRESO,1.0,/Assets/Fotos-HojaVida/227403.jpg,MOQUEGUA,,,['ACCESITARIO'],ERM.2022010061
12,227404.0,2000-07-26T00:00:00,F,,0.0,60063481,KARLA ROMINA VASQUEZ COAGUILA,INSCRITO,1257.0,ALIANZA PARA EL PROGRESO,2.0,/Assets/Fotos-HojaVida/227404.jpg,MOQUEGUA,,,['CONSEJERO REGIONAL'],ERM.2022010061
13,227405.0,2002-06-11T00:00:00,F,,0.0,74166849,LISETH NELVA TITO MAMANI,INSCRITO,1257.0,ALIANZA PARA EL PROGRESO,2.0,/Assets/Fotos-HojaVida/227405.jpg,MOQUEGUA,,,['ACCESITARIO'],ERM.2022010061
14,227406.0,1975-12-10T00:00:00,M,,0.0,02171689,JULIO HALANOCA HUAYTA,INSCRITO,1257.0,ALIANZA PARA EL PROGRESO,3.0,/Assets/Fotos-HojaVida/227406.jpg,MOQUEGUA,,,['CONSEJERO REGIONAL'],ERM.2022010061
15,227407.0,1967-01-24T00:00:00,M,,0.0,04730462,CELIO CLAUDE QUISPE ROJAS,EXCLUSION,1257.0,ALIANZA PARA EL PROGRESO,3.0,/Assets/Fotos-HojaVida/227407.jpg,MOQUEGUA,,,['ACCESITARIO'],ERM.2022010061
16,227408.0,1995-11-26T00:00:00,F,,0.0,73330979,MARYCIELO LUDGARDA GAMARRA ROSALES,INSCRITO,1257.0,ALIANZA PARA EL PROGRESO,1.0,/Assets/Fotos-HojaVida/227408.jpg,MOQUEGUA,,,['CONSEJERO REGIONAL'],ERM.2022010061
17,227409.0,2001-02-21T00:00:00,F,,0.0,70619241,ELIAN DENISSE VELASQUEZ RAMIREZ,INSCRITO,1257.0,ALIANZA PARA EL PROGRESO,1.0,/Assets/Fotos-HojaVida/227409.jpg,MOQUEGUA,,,['ACCESITARIO'],ERM.2022010061
18,227410.0,1973-10-13T00:00:00,M,,0.0,04648250,KLEBER ANTONIO CABANA MENDOZA,INSCRITO,1257.0,ALIANZA PARA EL PROGRESO,2.0,/Assets/Fotos-HojaVida/227410.jpg,MOQUEGUA,,,['CONSEJERO REGIONAL'],ERM.2022010061
19,227411.0,1979-10-25T00:00:00,M,,0.0,80368409,EDWIN NESTOR AJROTA PARI,INSCRITO,1257.0,ALIANZA PARA EL PROGRESO,2.0,/Assets/Fotos-HojaVida/227411.jpg,MOQUEGUA,,,['ACCESITARIO'],ERM.2022010061
20,227412.0,1983-07-06T00:00:00,F,,0.0,42156570,ARACELLY ANGELITA CORAL ALPONTE,INSCRITO,1257.0,ALIANZA PARA EL PROGRESO,3.0,/Assets/Fotos-HojaVida/227412.jpg,MOQUEGUA,,,['CONSEJERO REGIONAL'],ERM.2022010061
21,227413.0,1969-09-09T00:00:00,F,,0.0,04644426,SOFIA CORINA ROJAS BOLIVAR DE PERALTA,INSCRITO,1257.0,ALIANZA PARA EL PROGRESO,3.0,/Assets/Fotos-HojaVida/227413.jpg,MOQUEGUA,,,['ACCESITARIO'],ERM.2022010061
