,idHojaVida,feNacimiento,txSexo,designado,idProcesoElectoral,numeroDocumento,nombreCompleto,estado,idOrganizacionPolitica,organizacionPolitica,numeroCandidato,rutaArchivo,postulaDepartamento,postulaProvincia,postulaDistrito,cargo,nativo,txCodExpedienteExt
0,174212.0,1965-10-15T00:00:00,M,,0.0,32220951,ALFREDO EFRAIN SALINAS GONZALES,INSCRITO,2245.0,MOVIMIENTO REGIONAL EL MAICITO,0.0,/Assets/Fotos-HojaVida/174212.jpg,ANCASH,CORONGO,,['ALCALDE PROVINCIAL'],NO,ERM.2022010747
1,174213.0,1992-06-23T00:00:00,F,,0.0,47127945,OLINDA DE LA CRUZ LOPEZ,INSCRITO,2245.0,MOVIMIENTO REGIONAL EL MAICITO,1.0,/Assets/Fotos-HojaVida/174213.jpg,ANCASH,CORONGO,,['REGIDOR PROVINCIAL'],NO,ERM.2022010747
2,174214.0,1980-07-19T00:00:00,M,,0.0,40686530,DENIS ROGER VILLAVICENCIO MORENO,INSCRITO,2245.0,MOVIMIENTO REGIONAL EL MAICITO,2.0,/Assets/Fotos-HojaVida/174214.jpg,ANCASH,CORONGO,,['REGIDOR PROVINCIAL'],NO,ERM.2022010747
3,174215.0,1998-07-31T00:00:00,F,,0.0,71698347,SHARON SKARLIET SALAZAR SALINAS,INSCRITO,2245.0,MOVIMIENTO REGIONAL EL MAICITO,3.0,/Assets/Fotos-HojaVida/174215.jpg,ANCASH,CORONGO,,['REGIDOR PROVINCIAL'],NO,ERM.2022010747
4,174216.0,1985-12-14T00:00:00,M,,0.0,43440121,ALAN HERNAN CARDENAS MEDRANO,INSCRITO,2245.0,MOVIMIENTO REGIONAL EL MAICITO,4.0,/Assets/Fotos-HojaVida/174216.jpg,ANCASH,CORONGO,,['REGIDOR PROVINCIAL'],SI,ERM.2022010747
5,174217.0,2003-12-22T00:00:00,F,,0.0,75188885,ANAI CARMEN BEDON MORENO,INSCRITO,2245.0,MOVIMIENTO REGIONAL EL MAICITO,5.0,/Assets/Fotos-HojaVida/174217.jpg,ANCASH,CORONGO,,['REGIDOR PROVINCIAL'],NO,ERM.2022010747
