,idHojaVida,feNacimiento,txSexo,designado,idProcesoElectoral,numeroDocumento,nombreCompleto,estado,idOrganizacionPolitica,organizacionPolitica,numeroCandidato,rutaArchivo,postulaDepartamento,postulaProvincia,postulaDistrito,cargo,nativo,txCodExpedienteExt
0,227158.0,1971-06-16T00:00:00,M,,0.0,28993055,OLGER ALEXANDER CHAPARRO LOPEZ,INSCRITO,2694.0,MOVIMIENTO REGIONAL GANA AYACUCHO,0.0,/Assets/Fotos-HojaVida/227158.jpg,AYACUCHO,PARINACOCHAS, ,['ALCALDE PROVINCIAL'],NO,ERM.2022012223
1,227159.0,1973-11-08T00:00:00,F,,0.0,28999771,LURINA SERIANA LUJAN DE LA TORRE,INSCRITO,2694.0,MOVIMIENTO REGIONAL GANA AYACUCHO,1.0,/Assets/Fotos-HojaVida/227159.jpg,AYACUCHO,PARINACOCHAS, ,['REGIDOR PROVINCIAL'],NO,ERM.2022012223
2,227160.0,1975-09-17T00:00:00,M,,0.0,28996552,WILSON WALTER JIMENEZ CHOCHOCA,INSCRITO,2694.0,MOVIMIENTO REGIONAL GANA AYACUCHO,2.0,/Assets/Fotos-HojaVida/227160.jpg,AYACUCHO,PARINACOCHAS, ,['REGIDOR PROVINCIAL'],NO,ERM.2022012223
3,227161.0,1997-05-20T00:00:00,F,,0.0,70434706,EMILY GRACE BUSTAMANTE LOPEZ,INSCRITO,2694.0,MOVIMIENTO REGIONAL GANA AYACUCHO,3.0,/Assets/Fotos-HojaVida/227161.jpg,AYACUCHO,PARINACOCHAS, ,['REGIDOR PROVINCIAL'],NO,ERM.2022012223
4,227162.0,1991-05-03T00:00:00,M,,0.0,71092584,JOEL KENNETH COLLAO CHOCCE,INSCRITO,2694.0,MOVIMIENTO REGIONAL GANA AYACUCHO,4.0,/Assets/Fotos-HojaVida/227162.jpg,AYACUCHO,PARINACOCHAS, ,['REGIDOR PROVINCIAL'],NO,ERM.2022012223
5,227163.0,2003-03-27T00:00:00,F,,0.0,71631002,GLADYS CAROLINA CCELLCCARO TORRES,INSCRITO,2694.0,MOVIMIENTO REGIONAL GANA AYACUCHO,5.0,/Assets/Fotos-HojaVida/227163.jpg,AYACUCHO,PARINACOCHAS,,['REGIDOR PROVINCIAL'],NO,ERM.2022012223
6,227164.0,1970-06-10T00:00:00,M,,0.0,28970580,CRISOLOGO GILBERTO DURAN CASTAÑEDA,INSCRITO,2694.0,MOVIMIENTO REGIONAL GANA AYACUCHO,6.0,/Assets/Fotos-HojaVida/227164.jpg,AYACUCHO,PARINACOCHAS, ,['REGIDOR PROVINCIAL'],SI,ERM.2022012223
7,227165.0,1987-07-29T00:00:00,F,,0.0,44420551,VILMA ROSA QUISPE CALLE,INSCRITO,2694.0,MOVIMIENTO REGIONAL GANA AYACUCHO,7.0,/Assets/Fotos-HojaVida/227165.jpg,AYACUCHO,PARINACOCHAS, ,['REGIDOR PROVINCIAL'],SI,ERM.2022012223
