,idHojaVida,feNacimiento,txSexo,designado,idProcesoElectoral,numeroDocumento,nombreCompleto,estado,idOrganizacionPolitica,organizacionPolitica,numeroCandidato,rutaArchivo,postulaDepartamento,postulaProvincia,postulaDistrito,cargo,txCodExpedienteExt
0,145128.0,1964-10-29T00:00:00,M,,0.0,08661405,MARTIN TEOFILO ESPINAL REYES,TACHADO,2245.0,MOVIMIENTO REGIONAL EL MAICITO,0.0,/Assets/Fotos-HojaVida/145128.jpg,ANCASH,PALLASCA, ,['ALCALDE PROVINCIAL'],ERM.2022006533
1,145129.0,1984-06-11T00:00:00,F,,0.0,42490980,TANIA PETRONILA REYES NIZAMA,INSCRITO,2245.0,MOVIMIENTO REGIONAL EL MAICITO,1.0,/Assets/Fotos-HojaVida/145129.jpg,ANCASH,PALLASCA, ,['REGIDOR PROVINCIAL'],ERM.2022006533
2,145130.0,1976-11-04T00:00:00,M,,0.0,32522133,CARLOS ALBERTO VASQUEZ DOMINGUEZ,INSCRITO,2245.0,MOVIMIENTO REGIONAL EL MAICITO,2.0,/Assets/Fotos-HojaVida/145130.jpg,ANCASH,PALLASCA, ,['REGIDOR PROVINCIAL'],ERM.2022006533
3,145131.0,1983-12-23T00:00:00,F,,0.0,42241849,MEI LING DE LA CRUZ CAÑARI,INSCRITO,2245.0,MOVIMIENTO REGIONAL EL MAICITO,3.0,/Assets/Fotos-HojaVida/145131.jpg,ANCASH,PALLASCA, ,['REGIDOR PROVINCIAL'],ERM.2022006533
4,145132.0,1953-06-11T00:00:00,M,,0.0,32524066,SANTOS BENIGNO MIÑANO QUEZADA,INSCRITO,2245.0,MOVIMIENTO REGIONAL EL MAICITO,4.0,/Assets/Fotos-HojaVida/145132.jpg,ANCASH,PALLASCA, ,['REGIDOR PROVINCIAL'],ERM.2022006533
5,145133.0,1998-06-04T00:00:00,F,,0.0,71959592,SHEYLA ESLITH MANRIQUE ALVA,INSCRITO,2245.0,MOVIMIENTO REGIONAL EL MAICITO,5.0,/Assets/Fotos-HojaVida/145133.jpg,ANCASH,PALLASCA, ,['REGIDOR PROVINCIAL'],ERM.2022006533
6,145134.0,1983-11-04T00:00:00,M,,0.0,42213733,ANDRES CARLOS GARCIA CUEVA,INSCRITO,2245.0,MOVIMIENTO REGIONAL EL MAICITO,6.0,/Assets/Fotos-HojaVida/145134.jpg,ANCASH,PALLASCA, ,['REGIDOR PROVINCIAL'],ERM.2022006533
7,145135.0,2002-07-23T00:00:00,F,,0.0,73504251,SARAHI DAYANA VELASQUEZ CAMACHO,INSCRITO,2245.0,MOVIMIENTO REGIONAL EL MAICITO,7.0,/Assets/Fotos-HojaVida/145135.jpg,ANCASH,PALLASCA, ,['REGIDOR PROVINCIAL'],ERM.2022006533
