,C_CODI_AGP,AGRUPACION,IMAGENAGRUPACION,PORC_AVANCE_ACTA,ACTAS_COMPUTADA,TOTAL_MESAS,TOTAL_VOTOS,NLISTA,POR_VALIDOS,POR_EMITIDOS,cod_departamento,fecha,hora,avance
0,00000053,MOVIMIENTO POLITICO CAMBIEMOS X HCO,,100.000,"1,938","1,938","54,646",00000053.jpg,16.304,13.309,09,03/10/2022,12:11 h,  90.8154
1,00000054,MOVIMIENTO INDEPENDIENTE REGIONAL MI BUEN VECINO,,100.000,"1,938","1,938","108,665",00000054.jpg,32.422,26.465,09,03/10/2022,12:11 h,  90.8154
2,00000057,MOVIMIENTO INDEPENDIENTE REGIONAL HUANUCO PRIMERO,,100.000,"1,938","1,938","77,325",00000057.jpg,23.071,18.832,09,03/10/2022,12:11 h,  90.8154
3,00000011,PARTIDO FRENTE DE LA ESPERANZA 2021,,100.000,"1,938","1,938","4,056",00000011.jpg,1.210,0.988,09,03/10/2022,12:11 h,  90.8154
4,00000007,AVANZA PAIS - PARTIDO DE INTEGRACION SOCIAL,,100.000,"1,938","1,938","90,470",00000007.jpg,26.993,22.034,09,03/10/2022,12:11 h,  90.8154
