,C_CODI_AGP,AGRUPACION,IMAGENAGRUPACION,PORC_AVANCE_ACTA,ACTAS_COMPUTADA,TOTAL_MESAS,TOTAL_VOTOS,NLISTA,POR_VALIDOS,POR_EMITIDOS,departamento,fecha,hora,avance
0,00000053,MOVIMIENTO POLITICO CAMBIEMOS X HCO,,100.000,"1,807","1,807","52,115",00000053.jpg,16.553,13.554,09,03/10/2022,08:46 h,  84.6767
1,00000054,MOVIMIENTO INDEPENDIENTE REGIONAL MI BUEN VECINO,,100.000,"1,807","1,807","102,896",00000054.jpg,32.683,26.761,09,03/10/2022,08:46 h,  84.6767
2,00000057,MOVIMIENTO INDEPENDIENTE REGIONAL HUANUCO PRIMERO,,100.000,"1,807","1,807","71,692",00000057.jpg,22.772,18.645,09,03/10/2022,08:46 h,  84.6767
3,00000011,PARTIDO FRENTE DE LA ESPERANZA 2021,,100.000,"1,807","1,807","3,921",00000011.jpg,1.245,1.020,09,03/10/2022,08:46 h,  84.6767
4,00000007,AVANZA PAIS - PARTIDO DE INTEGRACION SOCIAL,,100.000,"1,807","1,807","84,208",00000007.jpg,26.747,21.901,09,03/10/2022,08:46 h,  84.6767
