,C_CODI_AGP,AGRUPACION,IMAGENAGRUPACION,PORC_AVANCE_ACTA,ACTAS_COMPUTADA,TOTAL_MESAS,TOTAL_VOTOS,NLISTA,POR_VALIDOS,POR_EMITIDOS,cod_departamento,fecha,hora,avance
0,10000082,ALIANZA LIBERTAD MADREDIOSENSE,,100.000,415,415,"6,712",10000082.jpg,8.744,7.469,16,05/10/2022,12:31 h,  98.5748
1,00000083,MOVIMIENTO REGIONAL FUERZA POR MADRE DE DIOS - MR FMDD,,100.000,415,415,"10,176",00000083.jpg,13.257,11.323,16,05/10/2022,12:31 h,  98.5748
2,10000081,MOVIMIENTO INDEPENDIENTE AMOR POR MADRE DE DIOS,,100.000,415,415,"20,525",10000081.jpg,26.740,22.839,16,05/10/2022,12:31 h,  98.5748
3,00000009,PODEMOS PERU,,100.000,415,415,"4,858",00000009.jpg,6.329,5.406,16,05/10/2022,12:31 h,  98.5748
4,00000004,ALIANZA PARA EL PROGRESO,,100.000,415,415,"2,337",00000004.jpg,3.045,2.600,16,05/10/2022,12:31 h,  98.5748
5,00000007,AVANZA PAIS - PARTIDO DE INTEGRACION SOCIAL,,100.000,415,415,"24,380",00000007.jpg,31.762,27.129,16,05/10/2022,12:31 h,  98.5748
6,00000008,PARTIDO POLITICO NACIONAL PERU LIBRE,,100.000,415,415,"6,000",00000008.jpg,7.817,6.676,16,05/10/2022,12:31 h,  98.5748
7,00000002,PARTIDO DEMOCRATICO SOMOS PERU,,100.000,415,415,"1,771",00000002.jpg,2.307,1.971,16,05/10/2022,12:31 h,  98.5748
