,C_CODI_AGP,AGRUPACION,IMAGENAGRUPACION,PORC_AVANCE_ACTA,ACTAS_COMPUTADA,TOTAL_MESAS,TOTAL_VOTOS,NLISTA,POR_VALIDOS,POR_EMITIDOS,cod_departamento,fecha,hora,avance
0,00000107,GESTIONANDO OBRAS Y OPORTUNIDADES CON LIDERAZGO,,100.000,"3,008","3,008","43,088",00000107.jpg,7.330,5.954,20,03/10/2022,12:11 h,  93.2424
1,00000100,FRENTE AMPLIO PARA EL DESARROLLO DEL PUEBLO,,100.000,"3,008","3,008","44,061",00000100.jpg,7.496,6.089,20,03/10/2022,12:11 h,  93.2424
2,00000105,REFORMA Y HONRADEZ POR MAS OBRAS,,100.000,"3,008","3,008","198,913",00000105.jpg,33.839,27.487,20,03/10/2022,12:11 h,  93.2424
3,00000102,MOVIMIENTO DE INTEGRACION Y REVOLUCION ANDINA,,100.000,"3,008","3,008","102,148",00000102.jpg,17.377,14.116,20,03/10/2022,12:11 h,  93.2424
4,00000103,MORAL Y DESARROLLO,,100.000,"3,008","3,008","85,427",00000103.jpg,14.533,11.805,20,03/10/2022,12:11 h,  93.2424
5,00000104,SOMOS PUEBLO,,100.000,"3,008","3,008","53,952",00000104.jpg,9.178,7.456,20,03/10/2022,12:11 h,  93.2424
6,00000011,PARTIDO FRENTE DE LA ESPERANZA 2021,,100.000,"3,008","3,008","18,702",00000011.jpg,3.182,2.584,20,03/10/2022,12:11 h,  93.2424
7,00000004,ALIANZA PARA EL PROGRESO,,100.000,"3,008","3,008","10,548",00000004.jpg,1.794,1.458,20,03/10/2022,12:11 h,  93.2424
8,00000008,PARTIDO POLITICO NACIONAL PERU LIBRE,,100.000,"3,008","3,008","30,982",00000008.jpg,5.271,4.281,20,03/10/2022,12:11 h,  93.2424
