,C_CODI_AGP,AGRUPACION,IMAGENAGRUPACION,PORC_AVANCE_ACTA,ACTAS_COMPUTADA,TOTAL_MESAS,TOTAL_VOTOS,NLISTA,POR_VALIDOS,POR_EMITIDOS,cod_departamento,fecha,hora,avance
0,00000107,GESTIONANDO OBRAS Y OPORTUNIDADES CON LIDERAZGO,,100.000,"3,191","3,191","48,743",00000107.jpg,7.830,6.366,20,03/10/2022,23:32 h,  98.9151
1,00000100,FRENTE AMPLIO PARA EL DESARROLLO DEL PUEBLO,,100.000,"3,191","3,191","45,208",00000100.jpg,7.262,5.905,20,03/10/2022,23:32 h,  98.9151
2,00000105,REFORMA Y HONRADEZ POR MAS OBRAS,,100.000,"3,191","3,191","211,062",00000105.jpg,33.904,27.567,20,03/10/2022,23:32 h,  98.9151
3,00000102,MOVIMIENTO DE INTEGRACION Y REVOLUCION ANDINA,,100.000,"3,191","3,191","111,132",00000102.jpg,17.852,14.515,20,03/10/2022,23:32 h,  98.9151
4,00000103,MORAL Y DESARROLLO,,100.000,"3,191","3,191","88,831",00000103.jpg,14.270,11.602,20,03/10/2022,23:32 h,  98.9151
5,00000104,SOMOS PUEBLO,,100.000,"3,191","3,191","55,276",00000104.jpg,8.879,7.220,20,03/10/2022,23:32 h,  98.9151
6,00000011,PARTIDO FRENTE DE LA ESPERANZA 2021,,100.000,"3,191","3,191","19,043",00000011.jpg,3.059,2.487,20,03/10/2022,23:32 h,  98.9151
7,00000004,ALIANZA PARA EL PROGRESO,,100.000,"3,191","3,191","10,880",00000004.jpg,1.748,1.421,20,03/10/2022,23:32 h,  98.9151
8,00000008,PARTIDO POLITICO NACIONAL PERU LIBRE,,100.000,"3,191","3,191","32,347",00000008.jpg,5.196,4.225,20,03/10/2022,23:32 h,  98.9151
