,C_CODI_AGP,AGRUPACION,IMAGENAGRUPACION,PORC_AVANCE_ACTA,ACTAS_COMPUTADA,TOTAL_MESAS,TOTAL_VOTOS,NLISTA,POR_VALIDOS,POR_EMITIDOS,cod_departamento,fecha,hora,avance
0,00000129,MOVIMIENTO INDEPENDIENTE REGIONAL CAMBIO UCAYALINO,,100.000,"1,304","1,304","68,688",00000129.jpg,37.735,25.501,25,04/10/2022,09:03 h,  94.4928
1,00000011,PARTIDO FRENTE DE LA ESPERANZA 2021,,100.000,"1,304","1,304","11,291",00000011.jpg,6.203,4.192,25,04/10/2022,09:03 h,  94.4928
2,00000001,ACCION POPULAR,,100.000,"1,304","1,304","43,495",00000001.jpg,23.895,16.148,25,04/10/2022,09:03 h,  94.4928
3,00000004,ALIANZA PARA EL PROGRESO,,100.000,"1,304","1,304","6,038",00000004.jpg,3.317,2.242,25,04/10/2022,09:03 h,  94.4928
4,00000007,AVANZA PAIS - PARTIDO DE INTEGRACION SOCIAL,,100.000,"1,304","1,304","15,060",00000007.jpg,8.273,5.591,25,04/10/2022,09:03 h,  94.4928
5,00000008,PARTIDO POLITICO NACIONAL PERU LIBRE,,100.000,"1,304","1,304","29,063",00000008.jpg,15.966,10.790,25,04/10/2022,09:03 h,  94.4928
6,00000002,PARTIDO DEMOCRATICO SOMOS PERU,,100.000,"1,304","1,304","8,392",00000002.jpg,4.610,3.116,25,04/10/2022,09:03 h,  94.4928
