,C_CODI_AGP,AGRUPACION,IMAGENAGRUPACION,PORC_AVANCE_ACTA,ACTAS_COMPUTADA,TOTAL_MESAS,TOTAL_VOTOS,NLISTA,POR_VALIDOS,POR_EMITIDOS,departamento,fecha,hora,avance
0,00000129,MOVIMIENTO INDEPENDIENTE REGIONAL CAMBIO UCAYALINO,,100.000,"1,027","1,027","52,263",00000129.jpg,34.882,24.112,25,03/10/2022,08:46 h,  74.4203
1,00000011,PARTIDO FRENTE DE LA ESPERANZA 2021,,100.000,"1,027","1,027","10,809",00000011.jpg,7.214,4.987,25,03/10/2022,08:46 h,  74.4203
2,00000001,ACCION POPULAR,,100.000,"1,027","1,027","38,115",00000001.jpg,25.439,17.585,25,03/10/2022,08:46 h,  74.4203
3,00000004,ALIANZA PARA EL PROGRESO,,100.000,"1,027","1,027","3,082",00000004.jpg,2.057,1.422,25,03/10/2022,08:46 h,  74.4203
4,00000007,AVANZA PAIS - PARTIDO DE INTEGRACION SOCIAL,,100.000,"1,027","1,027","13,693",00000007.jpg,9.139,6.317,25,03/10/2022,08:46 h,  74.4203
5,00000008,PARTIDO POLITICO NACIONAL PERU LIBRE,,100.000,"1,027","1,027","25,009",00000008.jpg,16.692,11.538,25,03/10/2022,08:46 h,  74.4203
6,00000002,PARTIDO DEMOCRATICO SOMOS PERU,,100.000,"1,027","1,027","6,857",00000002.jpg,4.577,3.164,25,03/10/2022,08:46 h,  74.4203
