,C_CODI_AGP,AGRUPACION,IMAGENAGRUPACION,PORC_AVANCE_ACTA,ACTAS_COMPUTADA,TOTAL_MESAS,TOTAL_VOTOS,NLISTA,POR_VALIDOS,POR_EMITIDOS,cod_departamento,fecha,hora,avance
0,00000129,MOVIMIENTO INDEPENDIENTE REGIONAL CAMBIO UCAYALINO,,100.000,"1,348","1,348","70,554",00000129.jpg,37.795,25.372,25,11/10/2022,09:21 h,  97.6812
1,00000011,PARTIDO FRENTE DE LA ESPERANZA 2021,,100.000,"1,348","1,348","11,529",00000011.jpg,6.176,4.146,25,11/10/2022,09:21 h,  97.6812
2,00000001,ACCION POPULAR,,100.000,"1,348","1,348","44,678",00000001.jpg,23.933,16.066,25,11/10/2022,09:21 h,  97.6812
3,00000004,ALIANZA PARA EL PROGRESO,,100.000,"1,348","1,348","6,159",00000004.jpg,3.299,2.215,25,11/10/2022,09:21 h,  97.6812
4,00000007,AVANZA PAIS - PARTIDO DE INTEGRACION SOCIAL,,100.000,"1,348","1,348","15,345",00000007.jpg,8.220,5.518,25,11/10/2022,09:21 h,  97.6812
5,00000008,PARTIDO POLITICO NACIONAL PERU LIBRE,,100.000,"1,348","1,348","29,784",00000008.jpg,15.955,10.711,25,11/10/2022,09:21 h,  97.6812
6,00000002,PARTIDO DEMOCRATICO SOMOS PERU,,100.000,"1,348","1,348","8,627",00000002.jpg,4.621,3.102,25,11/10/2022,09:21 h,  97.6812
