,C_CODI_AGP,AGRUPACION,IMAGENAGRUPACION,PORC_AVANCE_ACTA,ACTAS_COMPUTADA,TOTAL_MESAS,TOTAL_VOTOS,NLISTA,POR_VALIDOS,POR_EMITIDOS,cod_departamento,fecha,hora,avance,departamento,postulaDepartamento,organizacionPolitica,nombreCompleto
0,6,FUERZA POPULAR,,100.0,"1,066","1,066","1,547",00000006.jpg,0.869,0.738,01,03/10/2022,23:32 h,93.0192,AMAZONAS,AMAZONAS,FUERZA POPULAR,GILDA DORIS SABA DIAZ
1,14,MOVIMIENTO POLITICO REGIONAL ENERGIA COMUNAL AMAZONICA,,100.0,"1,066","1,066","8,198",00000014.jpg,4.603,3.91,01,03/10/2022,23:32 h,93.0192,AMAZONAS,AMAZONAS,MOVIMIENTO POLITICO REGIONAL ENERGIA COMUNAL AMAZONICA,WILSON NORVIL BARRANZUELA CAMPOS
2,5,JUNTOS POR EL PERU,,100.0,"1,066","1,066","13,421",00000005.jpg,7.535,6.401,01,03/10/2022,23:32 h,93.0192,AMAZONAS,AMAZONAS,JUNTOS POR EL PERU,ABSALON MONTOYA GUIVIN
3,4,ALIANZA PARA EL PROGRESO,,100.0,"1,066","1,066","14,034",00000004.jpg,7.879,6.694,01,03/10/2022,23:32 h,93.0192,AMAZONAS,AMAZONAS,ALIANZA PARA EL PROGRESO,GISELLA JOHANA PEREZ PEREZ
4,3,RENOVACION POPULAR,,100.0,"1,066","1,066","29,207",00000003.jpg,16.398,13.93,01,03/10/2022,23:32 h,93.0192,AMAZONAS,AMAZONAS,RENOVACION POPULAR,ROGER ERCILIO GUEVARA GOÑAS
5,15,MOVIMIENTO REGIONAL AMAZONENSE UNIDOS AL CAMPO,,100.0,"1,066","1,066","29,232",00000015.jpg,16.412,13.942,01,03/10/2022,23:32 h,93.0192,AMAZONAS,AMAZONAS,MOVIMIENTO REGIONAL AMAZONENSE UNIDOS AL CAMPO,SEGUNDO QUITERIO HERNANDEZ VASQUEZ
6,17,MOVIMIENTO REGIONAL VICTORIA AMAZONENSE,,100.0,"1,066","1,066","39,393",00000017.jpg,22.117,18.789,01,03/10/2022,23:32 h,93.0192,AMAZONAS,AMAZONAS,MOVIMIENTO REGIONAL VICTORIA AMAZONENSE,GRIMALDO VASQUEZ TAN
7,16,SENTIMIENTO AMAZONENSE REGIONAL,,100.0,"1,066","1,066","43,083",00000016.jpg,24.188,20.549,01,03/10/2022,23:32 h,93.0192,AMAZONAS,AMAZONAS,SENTIMIENTO AMAZONENSE REGIONAL,GILMER WILSON HORNA CORRALES
8,6,FUERZA POPULAR,,100.0,"3,105","3,105","14,510",00000006.jpg,3.096,2.121,02,03/10/2022,23:32 h,97.3659,ÁNCASH,ÁNCASH,FUERZA POPULAR,MAY JANETH COLCHADO LAGUNA
9,7,AVANZA PAIS - PARTIDO DE INTEGRACION SOCIAL,,100.0,"3,105","3,105","16,730",00000007.jpg,3.57,2.446,02,03/10/2022,23:32 h,97.3659,ÁNCASH,ÁNCASH,AVANZA PAIS - PARTIDO DE INTEGRACION SOCIAL,JULIETA URBANA PEREZ REYES
10,11,PARTIDO FRENTE DE LA ESPERANZA 2021,,100.0,"3,105","3,105","22,789",00000011.jpg,4.863,3.331,02,03/10/2022,23:32 h,97.3659,ÁNCASH,ÁNCASH,PARTIDO FRENTE DE LA ESPERANZA 2021,JUAN DEL CARMEN VASQUEZ CRUZADO
11,18,MOVIMIENTO ACCION NACIONALISTA PERUANO,,100.0,"3,105","3,105","53,080",00000018.jpg,11.327,7.76,02,03/10/2022,23:32 h,97.3659,ÁNCASH,ÁNCASH,MOVIMIENTO ACCION NACIONALISTA PERUANO,LUIS ROGELIO GONZALES CANO
12,5,JUNTOS POR EL PERU,,100.0,"3,105","3,105","94,811",00000005.jpg,20.233,13.86,02,03/10/2022,23:32 h,97.3659,ÁNCASH,ÁNCASH,JUNTOS POR EL PERU,BETTO BARRIONUEVO ROMERO
13,19,SOCIOS POR ANCASH,,100.0,"3,105","3,105","102,295",00000019.jpg,21.83,14.954,02,03/10/2022,23:32 h,97.3659,ÁNCASH,ÁNCASH,SOCIOS POR ANCASH,ENRIQUE VALOIS ALEJANDRO OCROSPOMA
14,21,ALIANZA GOBIERNO UNIDAD Y ACCION - AGUA,,100.0,"3,105","3,105","164,388",00000021.jpg,35.08,24.031,02,03/10/2022,23:32 h,97.3659,ÁNCASH,ÁNCASH,ALIANZA GOBIERNO UNIDAD Y ACCION - AGUA,FABIAN KOKI NORIEGA BRITO
15,1,ACCION POPULAR,,100.0,"1,168","1,168","11,006",00000001.jpg,5.46,4.385,03,03/10/2022,23:32 h,98.8156,APURÍMAC,APURÍMAC,ACCION POPULAR,MARIZOL PECEROS PAIRA
16,25,PROGRESISTA DE APURIMAC,,100.0,"1,168","1,168","19,398",00000025.jpg,9.623,7.728,03,03/10/2022,23:32 h,98.8156,APURÍMAC,APURÍMAC,PROGRESISTA DE APURIMAC,CHRISTIAN ANDERSON ZEGARRA PALOMINO
17,4,ALIANZA PARA EL PROGRESO,,100.0,"1,168","1,168","26,490",00000004.jpg,13.141,10.554,03,03/10/2022,23:32 h,98.8156,APURÍMAC,APURÍMAC,ALIANZA PARA EL PROGRESO,OMAR MERINO LOPEZ
18,24,MOVIMIENTO REGIONAL HATARIY APURIMAC,,100.0,"1,168","1,168","63,234",00000024.jpg,31.369,25.193,03,03/10/2022,23:32 h,98.8156,APURÍMAC,APURÍMAC,MOVIMIENTO REGIONAL HATARIY APURIMAC,ELVYN SAMUEL DIAZ TELLO
19,11,PARTIDO FRENTE DE LA ESPERANZA 2021,,100.0,"1,168","1,168","81,452",00000011.jpg,40.407,32.451,03,03/10/2022,23:32 h,98.8156,APURÍMAC,APURÍMAC,PARTIDO FRENTE DE LA ESPERANZA 2021,PERCY GODOY MEDINA
20,10,PARTIDO MORADO,,100.0,"3,888","3,888","4,584",00000010.jpg,0.608,0.497,04,03/10/2022,23:32 h,98.4055,AREQUIPA,AREQUIPA,PARTIDO MORADO,JOSE FABRIZZIO DIAZ CONTRERAS
21,3,RENOVACION POPULAR,,100.0,"3,888","3,888","9,457",00000003.jpg,1.255,1.025,04,03/10/2022,23:32 h,98.4055,AREQUIPA,AREQUIPA,RENOVACION POPULAR,MILDRED SHIRLEY FOLLANA ALVAREZ
22,11,PARTIDO FRENTE DE LA ESPERANZA 2021,,100.0,"3,888","3,888","11,538",00000011.jpg,1.531,1.25,04,03/10/2022,23:32 h,98.4055,AREQUIPA,AREQUIPA,PARTIDO FRENTE DE LA ESPERANZA 2021,MARIA ALEJANDRA VASQUEZ SANCHEZ
23,2,PARTIDO DEMOCRATICO SOMOS PERU,,100.0,"3,888","3,888","12,630",00000002.jpg,1.676,1.369,04,03/10/2022,23:32 h,98.4055,AREQUIPA,AREQUIPA,PARTIDO DEMOCRATICO SOMOS PERU,ROSARIO PAREDES EYZAGUIRRE
24,7,AVANZA PAIS - PARTIDO DE INTEGRACION SOCIAL,,100.0,"3,888","3,888","13,053",00000007.jpg,1.732,1.415,04,03/10/2022,23:32 h,98.4055,AREQUIPA,AREQUIPA,AVANZA PAIS - PARTIDO DE INTEGRACION SOCIAL,DOLORES MARLENE CORIMANYA SICHA
25,5,JUNTOS POR EL PERU,,100.0,"3,888","3,888","14,720",00000005.jpg,1.954,1.595,04,03/10/2022,23:32 h,98.4055,AREQUIPA,AREQUIPA,JUNTOS POR EL PERU,FERNANDO ZEBALLOS PATRON
26,30,AREQUIPA - UNIDOS POR EL GRAN CAMBIO,,100.0,"3,888","3,888","16,085",00000030.jpg,2.135,1.743,04,03/10/2022,23:32 h,98.4055,AREQUIPA,AREQUIPA,AREQUIPA - UNIDOS POR EL GRAN CAMBIO,JORGE LUIS SUCLLA MEDINA
27,4,ALIANZA PARA EL PROGRESO,,100.0,"3,888","3,888","22,775",00000004.jpg,3.023,2.468,04,03/10/2022,23:32 h,98.4055,AREQUIPA,AREQUIPA,ALIANZA PARA EL PROGRESO,LILY MARGOTH JUAREZ SALAZAR
28,26,MOVIMIENTO REGIONAL REVALORA,,100.0,"3,888","3,888","22,849",00000026.jpg,3.032,2.476,04,03/10/2022,23:32 h,98.4055,AREQUIPA,AREQUIPA,MOVIMIENTO REGIONAL REVALORA,MILUSKA OLIVERA MOGROVEJO
29,8,PARTIDO POLITICO NACIONAL PERU LIBRE,,100.0,"3,888","3,888","28,069",00000008.jpg,3.725,3.042,04,03/10/2022,23:32 h,98.4055,AREQUIPA,AREQUIPA,PARTIDO POLITICO NACIONAL PERU LIBRE,VLADIMIR JUSTO HUARANCA TEJADA
30,29,FUERZA AREQUIPEÑA,,100.0,"3,888","3,888","56,406",00000029.jpg,7.486,6.113,04,03/10/2022,23:32 h,98.4055,AREQUIPA,AREQUIPA,FUERZA AREQUIPEÑA,MARCO TULIO FALCONI PICARDO
31,27,MOVIMIENTO REGIONAL AREQUIPA AVANCEMOS,,100.0,"3,888","3,888","113,979",00000027.jpg,15.127,12.352,04,03/10/2022,23:32 h,98.4055,AREQUIPA,AREQUIPA,MOVIMIENTO REGIONAL AREQUIPA AVANCEMOS,HECTOR HUGO HERRERA HERRERA
32,31,"AREQUIPA, TRADICION Y FUTURO",,100.0,"3,888","3,888","137,783",00000031.jpg,18.286,14.932,04,03/10/2022,23:32 h,98.4055,AREQUIPA,AREQUIPA,"AREQUIPA, TRADICION Y FUTURO",JAVIER ENRIQUE ISMODES TALAVERA
33,28,YO AREQUIPA,,100.0,"3,888","3,888","289,574",00000028.jpg,38.43,31.382,04,03/10/2022,23:32 h,98.4055,AREQUIPA,AREQUIPA,YO AREQUIPA,ROHEL SANCHEZ SANCHEZ
34,4,ALIANZA PARA EL PROGRESO,,100.0,"1,547","1,547","4,786",00000004.jpg,1.837,1.481,05,03/10/2022,23:32 h,87.4011,AYACUCHO,AYACUCHO,ALIANZA PARA EL PROGRESO,ZONIA GARCIA BENDEZU
35,11,PARTIDO FRENTE DE LA ESPERANZA 2021,,100.0,"1,547","1,547","5,259",00000011.jpg,2.018,1.628,05,03/10/2022,23:32 h,87.4011,AYACUCHO,AYACUCHO,PARTIDO FRENTE DE LA ESPERANZA 2021,RICHARD GERMAN ORTEGA QUISPE
36,2,PARTIDO DEMOCRATICO SOMOS PERU,,100.0,"1,547","1,547","6,679",00000002.jpg,2.563,2.067,05,03/10/2022,23:32 h,87.4011,AYACUCHO,AYACUCHO,PARTIDO DEMOCRATICO SOMOS PERU,NILDA VILLAVICENCIO FLORES
37,34,MOVIMIENTO REGIONAL GANA AYACUCHO,,100.0,"1,547","1,547","29,651",00000034.jpg,11.379,9.176,05,03/10/2022,23:32 h,87.4011,AYACUCHO,AYACUCHO,MOVIMIENTO REGIONAL GANA AYACUCHO,RICHARD PRADO RAMOS
38,36,MOVIMIENTO REGIONAL AGUA,,100.0,"1,547","1,547","90,770",00000036.jpg,34.836,28.091,05,03/10/2022,23:32 h,87.4011,AYACUCHO,AYACUCHO,MOVIMIENTO REGIONAL AGUA,PABEL NESTOR BELLIDO MIRANDA
39,37,MOVIMIENTO REGIONAL WARI LLAQTA,,100.0,"1,547","1,547","123,421",00000037.jpg,47.367,38.195,05,03/10/2022,23:32 h,87.4011,AYACUCHO,AYACUCHO,MOVIMIENTO REGIONAL WARI LLAQTA,WILFREDO OSCORIMA NUÑEZ
40,3,RENOVACION POPULAR,,100.0,"3,805","3,805","7,771",00000003.jpg,1.185,0.948,06,03/10/2022,23:32 h,97.0416,CAJAMARCA,CAJAMARCA,RENOVACION POPULAR,MARIA DE LOS ANGELES ARCE BENITES
41,38,CAJAMARCA SIEMPRE VERDE,,100.0,"3,805","3,805","79,508",00000038.jpg,12.127,9.704,06,03/10/2022,23:32 h,97.0416,CAJAMARCA,CAJAMARCA,CAJAMARCA SIEMPRE VERDE,SEGUNDO RAUL PINEDO VASQUEZ
42,11,PARTIDO FRENTE DE LA ESPERANZA 2021,,100.0,"3,805","3,805","82,774",00000011.jpg,12.625,10.103,06,03/10/2022,23:32 h,97.0416,CAJAMARCA,CAJAMARCA,PARTIDO FRENTE DE LA ESPERANZA 2021,FELICITA MADALEINE TOCTO GUERRERO
43,4,ALIANZA PARA EL PROGRESO,,100.0,"3,805","3,805","114,087",00000004.jpg,17.401,13.925,06,03/10/2022,23:32 h,97.0416,CAJAMARCA,CAJAMARCA,ALIANZA PARA EL PROGRESO,CESAR HENRY VASQUEZ SANCHEZ
44,7,AVANZA PAIS - PARTIDO DE INTEGRACION SOCIAL,,100.0,"3,805","3,805","117,938",00000007.jpg,17.988,14.395,06,03/10/2022,23:32 h,97.0416,CAJAMARCA,CAJAMARCA,AVANZA PAIS - PARTIDO DE INTEGRACION SOCIAL,WALTER BENAVIDES GAVIDIA
45,39,FRENTE REGIONAL DE CAJAMARCA,,100.0,"3,805","3,805","123,327",00000039.jpg,18.81,15.053,06,03/10/2022,23:32 h,97.0416,CAJAMARCA,CAJAMARCA,FRENTE REGIONAL DE CAJAMARCA,VICTOR ANDRES VILLAR NARRO
46,2,PARTIDO DEMOCRATICO SOMOS PERU,,100.0,"3,805","3,805","130,230",00000002.jpg,19.863,15.895,06,03/10/2022,23:32 h,97.0416,CAJAMARCA,CAJAMARCA,PARTIDO DEMOCRATICO SOMOS PERU,ROGER GUEVARA RODRIGUEZ
47,9,PODEMOS PERU,,100.0,"3,269","3,269","28,495",00000009.jpg,4.772,3.828,07,03/10/2022,23:32 h,90.5540,CUSCO,CUSCO,PODEMOS PERU,YULET LUNA HILARES
48,5,JUNTOS POR EL PERU,,100.0,"3,269","3,269","43,726",00000005.jpg,7.323,5.874,07,03/10/2022,23:32 h,90.5540,CUSCO,CUSCO,JUNTOS POR EL PERU,RAUL DEL CASTILLO ALATRISTA
49,47,AUTOGOBIERNO AYLLU,,100.0,"3,269","3,269","44,796",00000047.jpg,7.503,6.018,07,03/10/2022,23:32 h,90.5540,CUSCO,CUSCO,AUTOGOBIERNO AYLLU,ROSMI RIVAS HURTADO
50,8,PARTIDO POLITICO NACIONAL PERU LIBRE,,100.0,"3,269","3,269","50,745",00000008.jpg,8.499,6.817,07,03/10/2022,23:32 h,90.5540,CUSCO,CUSCO,PARTIDO POLITICO NACIONAL PERU LIBRE,SAUL SANCHEZ SANTOS
51,11,PARTIDO FRENTE DE LA ESPERANZA 2021,,100.0,"3,269","3,269","62,152",00000011.jpg,10.409,8.349,07,03/10/2022,23:32 h,90.5540,CUSCO,CUSCO,PARTIDO FRENTE DE LA ESPERANZA 2021,CARLOS RICARDO CUARESMA SANCHEZ
52,4,ALIANZA PARA EL PROGRESO,,100.0,"3,269","3,269","80,942",00000004.jpg,13.556,10.874,07,03/10/2022,23:32 h,90.5540,CUSCO,CUSCO,ALIANZA PARA EL PROGRESO,BORIS GERMAIN MUJICA PAREDES
53,49,MOVIMIENTO REGIONAL INKA PACHAKUTEQ,,100.0,"3,269","3,269","114,627",00000049.jpg,19.198,15.399,07,03/10/2022,23:32 h,90.5540,CUSCO,CUSCO,MOVIMIENTO REGIONAL INKA PACHAKUTEQ,EDY EDWARD CUELLAR MARGHOLT
54,2,PARTIDO DEMOCRATICO SOMOS PERU,,100.0,"3,269","3,269","171,590",00000002.jpg,28.739,23.051,07,03/10/2022,23:32 h,90.5540,CUSCO,CUSCO,PARTIDO DEMOCRATICO SOMOS PERU,WERNER MAXIMO SALCEDO ALVAREZ
55,1,ACCION POPULAR,,100.0,"1,102","1,102","7,661",00000001.jpg,4.072,3.327,08,03/10/2022,23:32 h,93.8671,HUANCAVELICA,HUANCAVELICA,ACCION POPULAR,KENYON EDUARDO DURAND BUSTAMANTE
56,2,PARTIDO DEMOCRATICO SOMOS PERU,,100.0,"1,102","1,102","8,147",00000002.jpg,4.331,3.538,08,03/10/2022,23:32 h,93.8671,HUANCAVELICA,HUANCAVELICA,PARTIDO DEMOCRATICO SOMOS PERU,YOVANA RAMOS GASPAR
57,50,MOVIMIENTO REGIONAL AGUA,,100.0,"1,102","1,102","84,875",00000050.jpg,45.118,36.856,08,03/10/2022,23:32 h,93.8671,HUANCAVELICA,HUANCAVELICA,MOVIMIENTO REGIONAL AGUA,SAMUEL MORAN CARDENAS
58,51,MOVIMIENTO REGIONAL AYNI,,100.0,"1,102","1,102","87,434",00000051.jpg,46.479,37.967,08,03/10/2022,23:32 h,93.8671,HUANCAVELICA,HUANCAVELICA,MOVIMIENTO REGIONAL AYNI,LEONCIO HUAYLLANI TAYPE
59,11,PARTIDO FRENTE DE LA ESPERANZA 2021,,100.0,"2,010","2,010","4,100",00000011.jpg,1.185,0.968,09,03/10/2022,23:32 h,94.1893,HUÁNUCO,HUÁNUCO,PARTIDO FRENTE DE LA ESPERANZA 2021,YENNY MIRIAM NAUPAY GONZALEZ
60,53,MOVIMIENTO POLITICO CAMBIEMOS X HCO,,100.0,"2,010","2,010","55,804",00000053.jpg,16.128,13.171,09,03/10/2022,23:32 h,94.1893,HUÁNUCO,HUÁNUCO,MOVIMIENTO POLITICO CAMBIEMOS X HCO,GLADYS MARLENI VENANCIO JORGE
61,57,MOVIMIENTO INDEPENDIENTE REGIONAL HUANUCO PRIMERO,,100.0,"2,010","2,010","80,987",00000057.jpg,23.406,19.115,09,03/10/2022,23:32 h,94.1893,HUÁNUCO,HUÁNUCO,MOVIMIENTO INDEPENDIENTE REGIONAL HUANUCO PRIMERO,EDISON EUFRACIO DIAZ ESQUIVEL
62,7,AVANZA PAIS - PARTIDO DE INTEGRACION SOCIAL,,100.0,"2,010","2,010","93,144",00000007.jpg,26.919,21.985,09,03/10/2022,23:32 h,94.1893,HUÁNUCO,HUÁNUCO,AVANZA PAIS - PARTIDO DE INTEGRACION SOCIAL,ROSALI LEANDRO TARAZONA
63,54,MOVIMIENTO INDEPENDIENTE REGIONAL MI BUEN VECINO,,100.0,"2,010","2,010","111,978",00000054.jpg,32.362,26.43,09,03/10/2022,23:32 h,94.1893,HUÁNUCO,HUÁNUCO,MOVIMIENTO INDEPENDIENTE REGIONAL MI BUEN VECINO,ANTONIO LEONIDAS PULGAR LUCAS
64,6,FUERZA POPULAR,,100.0,"2,198","2,198","15,989",00000006.jpg,3.702,3.02,10,03/10/2022,23:32 h,98.0812,ICA,ICA,FUERZA POPULAR,JOSE ANTONIO YAMASHIRO ORE
65,2,PARTIDO DEMOCRATICO SOMOS PERU,,100.0,"2,198","2,198","51,402",00000002.jpg,11.901,9.708,10,03/10/2022,23:32 h,98.0812,ICA,ICA,PARTIDO DEMOCRATICO SOMOS PERU,ALBERTO EUGENIO OLIVA CORRALES
66,58,MOVIMIENTO REGIONAL OBRAS POR LA MODERNIDAD,,100.0,"2,198","2,198","60,721",00000058.jpg,14.058,11.468,10,03/10/2022,23:32 h,98.0812,ICA,ICA,MOVIMIENTO REGIONAL OBRAS POR LA MODERNIDAD,JAVIER HERMOGENES CORNEJO VENTURA
67,4,ALIANZA PARA EL PROGRESO,,100.0,"2,198","2,198","144,518",00000004.jpg,33.459,27.294,10,03/10/2022,23:32 h,98.0812,ICA,ICA,ALIANZA PARA EL PROGRESO,JUAN ENRIQUE MENDOZA URIBE
68,59,UNO POR ICA,,100.0,"2,198","2,198","159,297",00000059.jpg,36.881,30.086,10,03/10/2022,23:32 h,98.0812,ICA,ICA,UNO POR ICA,JORGE CARLOS HURTADO HERRERA
69,2,PARTIDO DEMOCRATICO SOMOS PERU,,100.0,"3,160","3,160","9,194",00000002.jpg,1.66,1.328,11,03/10/2022,23:32 h,91.9674,JUNÍN,JUNÍN,PARTIDO DEMOCRATICO SOMOS PERU,MARIVEL YANINA POMA GIACCARINI
70,10,PARTIDO MORADO,,100.0,"3,160","3,160","10,790",00000010.jpg,1.948,1.558,11,03/10/2022,23:32 h,91.9674,JUNÍN,JUNÍN,PARTIDO MORADO,EDISON OMAR ORDOÑEZ ROJAS
71,65,MOVIMIENTO REGIONAL BLOQUE POPULAR JUNIN,,100.0,"3,160","3,160","14,311",00000065.jpg,2.583,2.067,11,03/10/2022,23:32 h,91.9674,JUNÍN,JUNÍN,MOVIMIENTO REGIONAL BLOQUE POPULAR JUNIN,JORGE ANTONIO RODRIGUEZ SILVA
72,3,RENOVACION POPULAR,,100.0,"3,160","3,160","23,334",00000003.jpg,4.212,3.37,11,03/10/2022,23:32 h,91.9674,JUNÍN,JUNÍN,RENOVACION POPULAR,JACKELYN STEFANY LIZARRAGA ALANIA
73,64,CORAZON PATRIOTA,,100.0,"3,160","3,160","26,640",00000064.jpg,4.809,3.847,11,03/10/2022,23:32 h,91.9674,JUNÍN,JUNÍN,CORAZON PATRIOTA,ALDRIN ZARATE BERNUY
74,4,ALIANZA PARA EL PROGRESO,,100.0,"3,160","3,160","38,542",00000004.jpg,6.958,5.566,11,03/10/2022,23:32 h,91.9674,JUNÍN,JUNÍN,ALIANZA PARA EL PROGRESO,MIRIAM MILAGROS VALENZUELA USCUVILCA
75,62,JUNIN RENACE,,100.0,"3,160","3,160","110,140",00000062.jpg,19.882,15.907,11,03/10/2022,23:32 h,91.9674,JUNÍN,JUNÍN,JUNIN RENACE,ARNOLDO DANTE MALLMA AUQUI
76,60,CAMINEMOS JUNTOS POR JUNIN,,100.0,"3,160","3,160","131,716",00000060.jpg,23.777,19.023,11,03/10/2022,23:32 h,91.9674,JUNÍN,JUNÍN,CAMINEMOS JUNTOS POR JUNIN,DIMAS RUDY ALIAGA CASTRO
77,61,MOVIMIENTO REGIONAL SIERRA Y SELVA CONTIGO JUNIN,,100.0,"3,160","3,160","189,294",00000061.jpg,34.171,27.338,11,03/10/2022,23:32 h,91.9674,JUNÍN,JUNÍN,MOVIMIENTO REGIONAL SIERRA Y SELVA CONTIGO JUNIN,ZOSIMO CARDENAS MUJE
78,1,ACCION POPULAR,,100.0,"4,745","4,745","22,059",00000001.jpg,2.509,2.08,12,03/10/2022,23:32 h,95.9555,LA LIBERTAD,LA LIBERTAD,ACCION POPULAR,ALFONSO PAUL IBAÑEZ CARRANZA
79,6,FUERZA POPULAR,,100.0,"4,745","4,745","30,061",00000006.jpg,3.419,2.834,12,03/10/2022,23:32 h,95.9555,LA LIBERTAD,LA LIBERTAD,FUERZA POPULAR,MIGUEL ANGEL VIVANCO REYES
80,67,SUMATE,,100.0,"4,745","4,745","52,655",00000067.jpg,5.989,4.965,12,03/10/2022,23:32 h,95.9555,LA LIBERTAD,LA LIBERTAD,SUMATE,MARINO TEOFILO LAVADO VALDIVIA
81,66,NUEVA LIBERTAD,,100.0,"4,745","4,745","61,637",00000066.jpg,7.01,5.811,12,03/10/2022,23:32 h,95.9555,LA LIBERTAD,LA LIBERTAD,NUEVA LIBERTAD,MARIANO ANDRES YUPANQUI MIÑANO
82,68,MOVIMIENTO REGIONAL FORTALEZA PERU,,100.0,"4,745","4,745","83,567",00000068.jpg,9.504,7.879,12,03/10/2022,23:32 h,95.9555,LA LIBERTAD,LA LIBERTAD,MOVIMIENTO REGIONAL FORTALEZA PERU,MONICA PAOLA SANCHEZ MINCHOLA
83,2,PARTIDO DEMOCRATICO SOMOS PERU,,100.0,"4,745","4,745","105,039",00000002.jpg,11.946,9.904,12,03/10/2022,23:32 h,95.9555,LA LIBERTAD,LA LIBERTAD,PARTIDO DEMOCRATICO SOMOS PERU,JOHANNA GABRIELA LOZADA BALDWIN
84,69,MOVIMIENTO REGIONAL TRABAJO MAS TRABAJO,,100.0,"4,745","4,745","220,591",00000069.jpg,25.089,20.798,12,03/10/2022,23:32 h,95.9555,LA LIBERTAD,LA LIBERTAD,MOVIMIENTO REGIONAL TRABAJO MAS TRABAJO,ELIAS NICOLAS RODRIGUEZ ZAVALETA
85,4,ALIANZA PARA EL PROGRESO,,100.0,"4,745","4,745","303,640",00000004.jpg,34.534,28.629,12,03/10/2022,23:32 h,95.9555,LA LIBERTAD,LA LIBERTAD,ALIANZA PARA EL PROGRESO,CESAR ACUÑA PERALTA
86,8,PARTIDO POLITICO NACIONAL PERU LIBRE,,100.0,"3,281","3,281","32,574",00000008.jpg,5.906,4.308,13,03/10/2022,23:32 h,97.5617,LAMBAYEQUE,LAMBAYEQUE,PARTIDO POLITICO NACIONAL PERU LIBRE,MAVILA ESTHER VASQUEZ DIAZ
87,11,PARTIDO FRENTE DE LA ESPERANZA 2021,,100.0,"3,281","3,281","49,133",00000011.jpg,8.908,6.498,13,03/10/2022,23:32 h,97.5617,LAMBAYEQUE,LAMBAYEQUE,PARTIDO FRENTE DE LA ESPERANZA 2021,FELIPE JOSE GRANADOS CARRANZA
88,7,AVANZA PAIS - PARTIDO DE INTEGRACION SOCIAL,,100.0,"3,281","3,281","76,205",00000007.jpg,13.816,10.079,13,03/10/2022,23:32 h,97.5617,LAMBAYEQUE,LAMBAYEQUE,AVANZA PAIS - PARTIDO DE INTEGRACION SOCIAL,SOLINKA CASSANDRA MOLINA GONZALES
89,70,MOVIMIENTO REGIONAL CONSTRUYENDO,,100.0,"3,281","3,281","78,722",00000070.jpg,14.273,10.412,13,03/10/2022,23:32 h,97.5617,LAMBAYEQUE,LAMBAYEQUE,MOVIMIENTO REGIONAL CONSTRUYENDO,CLEMENTE FLORES VILCHEZ
90,6,FUERZA POPULAR,,100.0,"3,281","3,281","90,905",00000006.jpg,16.481,12.023,13,03/10/2022,23:32 h,97.5617,LAMBAYEQUE,LAMBAYEQUE,FUERZA POPULAR,JOSE MARVIN PALMA MENDOZA
91,2,PARTIDO DEMOCRATICO SOMOS PERU,,100.0,"3,281","3,281","109,628",00000002.jpg,19.876,14.499,13,03/10/2022,23:32 h,97.5617,LAMBAYEQUE,LAMBAYEQUE,PARTIDO DEMOCRATICO SOMOS PERU,JORGE LUIS PEREZ FLORES
92,4,ALIANZA PARA EL PROGRESO,,100.0,"3,281","3,281","114,396",00000004.jpg,20.74,15.13,13,03/10/2022,23:32 h,97.5617,LAMBAYEQUE,LAMBAYEQUE,ALIANZA PARA EL PROGRESO,ALEXANDER RODRIGUEZ ALVARADO
93,11,PARTIDO FRENTE DE LA ESPERANZA 2021,,100.0,"2,608","2,608","14,480",00000011.jpg,2.905,2.397,14,03/10/2022,23:32 h,98.1558,LIMA,LIMA,PARTIDO FRENTE DE LA ESPERANZA 2021,MARLENE ISMAELDA LUYO LUDEÑA
94,7,AVANZA PAIS - PARTIDO DE INTEGRACION SOCIAL,,100.0,"2,608","2,608","16,486",00000007.jpg,3.307,2.729,14,03/10/2022,23:32 h,98.1558,LIMA,LIMA,AVANZA PAIS - PARTIDO DE INTEGRACION SOCIAL,SANTOS TOMAS QUISPE MURGA
95,8,PARTIDO POLITICO NACIONAL PERU LIBRE,,100.0,"2,608","2,608","16,526",00000008.jpg,3.315,2.735,14,03/10/2022,23:32 h,98.1558,LIMA,LIMA,PARTIDO POLITICO NACIONAL PERU LIBRE,MARIELA CATHERINE PRADO LINARES
96,4,ALIANZA PARA EL PROGRESO,,100.0,"2,608","2,608","32,698",00000004.jpg,6.56,5.412,14,03/10/2022,23:32 h,98.1558,LIMA,LIMA,ALIANZA PARA EL PROGRESO,CARLOS ALBERTO ALMERI VERAMENDI
97,3,RENOVACION POPULAR,,100.0,"2,608","2,608","49,564",00000003.jpg,9.943,8.203,14,03/10/2022,23:32 h,98.1558,LIMA,LIMA,RENOVACION POPULAR,RAFAEL GASTON TADEO MILAGROS SANTOS NORMAND
98,2,PARTIDO DEMOCRATICO SOMOS PERU,,100.0,"2,608","2,608","64,332",00000002.jpg,12.906,10.648,14,03/10/2022,23:32 h,98.1558,LIMA,LIMA,PARTIDO DEMOCRATICO SOMOS PERU,MARINO JUAN LLANOS COCA
99,73,CONCERTACION PARA EL DESARROLLO REGIONAL - LIMA,,100.0,"2,608","2,608","70,910",00000073.jpg,14.225,11.736,14,03/10/2022,23:32 h,98.1558,LIMA,LIMA,CONCERTACION PARA EL DESARROLLO REGIONAL - LIMA,NELSON OSWALDO CHUI MEJIA
100,72,PATRIA JOVEN,,100.0,"2,608","2,608","98,571",00000072.jpg,19.774,16.314,14,03/10/2022,23:32 h,98.1558,LIMA,LIMA,PATRIA JOVEN,JOSE CARLOS BAUTISTA RUBIO
101,74,MOVIMIENTO REGIONAL UNIDAD CIVICA LIMA,,100.0,"2,608","2,608","134,911",00000074.jpg,27.065,22.329,14,03/10/2022,23:32 h,98.1558,LIMA,LIMA,MOVIMIENTO REGIONAL UNIDAD CIVICA LIMA,ROSA GLORIA VASQUEZ CUADRADO
102,6,FUERZA POPULAR,,100.0,"2,114","2,114","2,799",00000006.jpg,0.779,0.674,15,03/10/2022,23:32 h,85.0020,LORETO,LORETO,FUERZA POPULAR,JUAN CARLOS DEL AGUILA CARDENAS
103,8,PARTIDO POLITICO NACIONAL PERU LIBRE,,100.0,"2,114","2,114","6,757",00000008.jpg,1.881,1.627,15,03/10/2022,23:32 h,85.0020,LORETO,LORETO,PARTIDO POLITICO NACIONAL PERU LIBRE,YOSHI LEVIS LAM ELESPURU
104,161,LORETO PARA TODOS,,100.0,"2,114","2,114","6,771",00000161.jpg,1.885,1.63,15,03/10/2022,23:32 h,85.0020,LORETO,LORETO,LORETO PARA TODOS,TITO EVIL FLORES PEREZ
105,77,MOVIMIENTO INDEPENDIENTE POLITICO VOLUNTAD GENERAL AMAZONICA - VOGA,,100.0,"2,114","2,114","6,894",00000077.jpg,1.919,1.66,15,03/10/2022,23:32 h,85.0020,LORETO,LORETO,MOVIMIENTO INDEPENDIENTE POLITICO VOLUNTAD GENERAL AMAZONICA - VOGA,FRANCK GERSSON MARREROS PEREZ
106,76,JUNTOS POR LORETO,,100.0,"2,114","2,114","7,556",00000076.jpg,2.103,1.819,15,03/10/2022,23:32 h,85.0020,LORETO,LORETO,JUNTOS POR LORETO,JORGE ENRIQUE MELENDEZ CELIS
107,10000080,MISION ORGANIZADA VIA INTEGRIDAD Y LIBERTAD,,100.0,"2,114","2,114","8,705",10000080.jpg,2.423,2.096,15,03/10/2022,23:32 h,85.0020,LORETO,LORETO,MISION ORGANIZADA VIA INTEGRIDAD Y LIBERTAD,WILFREDO MOISES MALPARTIDA GOMEZ
108,75,MOVIMIENTO INDEPENDIENTE LORETO - MI LORETO,,100.0,"2,114","2,114","23,924",00000075.jpg,6.66,5.759,15,03/10/2022,23:32 h,85.0020,LORETO,LORETO,MOVIMIENTO INDEPENDIENTE LORETO - MI LORETO,OSCAR ALEXANDER LLAPAPASCA SAMANIEGO
109,79,MOVIMIENTO INDEPENDIENTE REIVINDIQUEMOS LORETO,,100.0,"2,114","2,114","45,496",00000079.jpg,12.664,10.953,15,03/10/2022,23:32 h,85.0020,LORETO,LORETO,MOVIMIENTO INDEPENDIENTE REIVINDIQUEMOS LORETO,JUAN RAFAEL TORRES BALDEON
110,4,ALIANZA PARA EL PROGRESO,,100.0,"2,114","2,114","47,678",00000004.jpg,13.272,11.478,15,03/10/2022,23:32 h,85.0020,LORETO,LORETO,ALIANZA PARA EL PROGRESO,FERNANDO MELENDEZ CELIS
111,78,MOVIMIENTO ESPERANZA REGION AMAZONICA,,100.0,"2,114","2,114","85,816",00000078.jpg,23.888,20.659,15,03/10/2022,23:32 h,85.0020,LORETO,LORETO,MOVIMIENTO ESPERANZA REGION AMAZONICA,JORGE LUIS MERA RAMIREZ
112,2,PARTIDO DEMOCRATICO SOMOS PERU,,100.0,"2,114","2,114","116,849",00000002.jpg,32.526,28.13,15,03/10/2022,23:32 h,85.0020,LORETO,LORETO,PARTIDO DEMOCRATICO SOMOS PERU,JORGE RENE CHAVEZ SILVANO
113,2,PARTIDO DEMOCRATICO SOMOS PERU,,100.0,415,415,"1,771",00000002.jpg,2.307,1.971,16,03/10/2022,23:32 h,98.5748,MADRE DE DIOS,MADRE DE DIOS,PARTIDO DEMOCRATICO SOMOS PERU,ANGELA GABRIELA PEREA MONJE
114,4,ALIANZA PARA EL PROGRESO,,100.0,415,415,"2,337",00000004.jpg,3.045,2.6,16,03/10/2022,23:32 h,98.5748,MADRE DE DIOS,MADRE DE DIOS,ALIANZA PARA EL PROGRESO,FATIMA PIZANGO SALAZAR
115,9,PODEMOS PERU,,100.0,415,415,"4,858",00000009.jpg,6.329,5.406,16,03/10/2022,23:32 h,98.5748,MADRE DE DIOS,MADRE DE DIOS,PODEMOS PERU,ALEXANDER LOZANO INOSTROZA
116,8,PARTIDO POLITICO NACIONAL PERU LIBRE,,100.0,415,415,"6,000",00000008.jpg,7.817,6.676,16,03/10/2022,23:32 h,98.5748,MADRE DE DIOS,MADRE DE DIOS,PARTIDO POLITICO NACIONAL PERU LIBRE,MAYRA ELIZABETH HERMOZA SOVRINO
117,10000082,ALIANZA LIBERTAD MADREDIOSENSE,,100.0,415,415,"6,712",10000082.jpg,8.744,7.469,16,03/10/2022,23:32 h,98.5748,MADRE DE DIOS,MADRE DE DIOS,ALIANZA LIBERTAD MADREDIOSENSE,FREDDY ALVARO VRACKO METZGER
118,83,MOVIMIENTO REGIONAL FUERZA POR MADRE DE DIOS - MR FMDD,,100.0,415,415,"10,176",00000083.jpg,13.257,11.323,16,03/10/2022,23:32 h,98.5748,MADRE DE DIOS,MADRE DE DIOS,MOVIMIENTO REGIONAL FUERZA POR MADRE DE DIOS - MR FMDD,JUAN IMURA CJUNO
119,10000081,MOVIMIENTO INDEPENDIENTE AMOR POR MADRE DE DIOS,,100.0,415,415,"20,525",10000081.jpg,26.74,22.839,16,03/10/2022,23:32 h,98.5748,MADRE DE DIOS,MADRE DE DIOS,MOVIMIENTO INDEPENDIENTE AMOR POR MADRE DE DIOS,SIMON PEDRO HORNA ALPACA
120,7,AVANZA PAIS - PARTIDO DE INTEGRACION SOCIAL,,100.0,415,415,"24,380",00000007.jpg,31.762,27.129,16,03/10/2022,23:32 h,98.5748,MADRE DE DIOS,MADRE DE DIOS,AVANZA PAIS - PARTIDO DE INTEGRACION SOCIAL,LUIS OTSUKA SALAZAR
121,84,MOVIMIENTO REGIONAL SOMOS MAS,,100.0,516,516,"4,534",00000084.jpg,4.635,3.735,17,03/10/2022,23:32 h,99.0403,MOQUEGUA,MOQUEGUA,MOVIMIENTO REGIONAL SOMOS MAS,NERI FELIPE TORRES GUTIERREZ
122,88,NUESTRO ILO - MOQUEGUA - SANCHEZ CERRO,,100.0,516,516,"7,545",00000088.jpg,7.713,6.215,17,03/10/2022,23:32 h,99.0403,MOQUEGUA,MOQUEGUA,NUESTRO ILO - MOQUEGUA - SANCHEZ CERRO,JENCY CAVIEDES BEDREGAL
123,4,ALIANZA PARA EL PROGRESO,,100.0,516,516,"7,912",00000004.jpg,8.088,6.517,17,03/10/2022,23:32 h,99.0403,MOQUEGUA,MOQUEGUA,ALIANZA PARA EL PROGRESO,TEOFILA FRANCISCA ROMERO MAMANI
124,8,PARTIDO POLITICO NACIONAL PERU LIBRE,,100.0,516,516,"8,138",00000008.jpg,8.319,6.704,17,03/10/2022,23:32 h,99.0403,MOQUEGUA,MOQUEGUA,PARTIDO POLITICO NACIONAL PERU LIBRE,SALVADOR HUMPIRI CACERES
125,9,PODEMOS PERU,,100.0,516,516,"18,144",00000009.jpg,18.549,14.946,17,03/10/2022,23:32 h,99.0403,MOQUEGUA,MOQUEGUA,PODEMOS PERU,JOHAN FLORES VILLEGAS
126,2,PARTIDO DEMOCRATICO SOMOS PERU,,100.0,516,516,"24,105",00000002.jpg,24.642,19.856,17,03/10/2022,23:32 h,99.0403,MOQUEGUA,MOQUEGUA,PARTIDO DEMOCRATICO SOMOS PERU,GILIA NINFA GUTIERREZ AYALA
127,85,KAUSACHUN,,100.0,516,516,"27,441",00000085.jpg,28.053,22.604,17,03/10/2022,23:32 h,99.0403,MOQUEGUA,MOQUEGUA,KAUSACHUN,JAIME ALBERTO RODRIGUEZ VILLANUEVA
128,8,PARTIDO POLITICO NACIONAL PERU LIBRE,,100.0,720,720,"4,063",00000008.jpg,3.385,2.799,18,03/10/2022,23:32 h,98.6301,PASCO,PASCO,PARTIDO POLITICO NACIONAL PERU LIBRE,ALENI MAURICIO PALPAN
129,92,MOVIMIENTO REGIONAL JUVENTUD PASQUEÑA,,100.0,720,720,"6,229",00000092.jpg,5.189,4.291,18,03/10/2022,23:32 h,98.6301,PASCO,PASCO,MOVIMIENTO REGIONAL JUVENTUD PASQUEÑA,NEFTALI EUCLIDES MUÑOZ FERNANDEZ
