,C_CODI_AGP,AGRUPACION,IMAGENAGRUPACION,PORC_AVANCE_ACTA,ACTAS_COMPUTADA,TOTAL_MESAS,TOTAL_VOTOS,NLISTA,POR_VALIDOS,POR_EMITIDOS,cod_departamento,fecha,hora,avance,departamento,postulaDepartamento,organizacionPolitica,nombreCompleto
130,11,PARTIDO FRENTE DE LA ESPERANZA 2021,,100.0,661,661,"14,199",00000011.jpg,12.601,10.52,18,03/10/2022,16:35 h,90.5479,PASCO,PASCO,PARTIDO FRENTE DE LA ESPERANZA 2021,LUCIO ROJAS VITOR
131,94,PASCO DIGNIDAD,,100.0,661,661,"15,271",00000094.jpg,13.553,11.314,18,03/10/2022,16:35 h,90.5479,PASCO,PASCO,PASCO DIGNIDAD,CAYO CONDEZO MEZA
132,9,PODEMOS PERU,,100.0,661,661,"23,512",00000009.jpg,20.866,17.42,18,03/10/2022,16:35 h,90.5479,PASCO,PASCO,PODEMOS PERU,RUDY EDWIN CALLUPE GORA
133,2,PARTIDO DEMOCRATICO SOMOS PERU,,100.0,661,661,"24,191",00000002.jpg,21.469,17.923,18,03/10/2022,16:35 h,90.5479,PASCO,PASCO,PARTIDO DEMOCRATICO SOMOS PERU,JUAN LUIS CHOMBO HEREDIA
134,93,PASCO VERDE,,100.0,661,661,"25,786",00000093.jpg,22.884,19.105,18,03/10/2022,16:35 h,90.5479,PASCO,PASCO,PASCO VERDE,ZUMEL TRUJILLO BRAVO
135,141,PARTIDO PATRIOTICO DEL PERU,,100.0,"4,613","4,613","2,431",00000141.jpg,0.273,0.228,19,03/10/2022,16:35 h,95.0154,PIURA,PIURA,PARTIDO PATRIOTICO DEL PERU,GUILLERMO CHAVEZ TIMOTEO
136,8,PARTIDO POLITICO NACIONAL PERU LIBRE,,100.0,"4,613","4,613","16,410",00000008.jpg,1.844,1.538,19,03/10/2022,16:35 h,95.0154,PIURA,PIURA,PARTIDO POLITICO NACIONAL PERU LIBRE,DIANA CAROLINA MOSCOL MORE
137,11,PARTIDO FRENTE DE LA ESPERANZA 2021,,100.0,"4,613","4,613","20,118",00000011.jpg,2.261,1.885,19,03/10/2022,16:35 h,95.0154,PIURA,PIURA,PARTIDO FRENTE DE LA ESPERANZA 2021,CARLOS ALBERTO MONTERO VILLEGAS
138,6,FUERZA POPULAR,,100.0,"4,613","4,613","22,067",00000006.jpg,2.48,2.068,19,03/10/2022,16:35 h,95.0154,PIURA,PIURA,FUERZA POPULAR,MARVIN ALBERTO ALVAREZ ARECHAGA
139,9,PODEMOS PERU,,100.0,"4,613","4,613","22,478",00000009.jpg,2.526,2.106,19,03/10/2022,16:35 h,95.0154,PIURA,PIURA,PODEMOS PERU,SOFIANA DEL CARMEN GRACIANO GUERRA
140,99,PIURA RENACE,,100.0,"4,613","4,613","41,759",00000099.jpg,4.692,3.913,19,03/10/2022,16:35 h,95.0154,PIURA,PIURA,PIURA RENACE,ANGELICA MARIA PALOMINO SAAVEDRA
141,4,ALIANZA PARA EL PROGRESO,,100.0,"4,613","4,613","51,135",00000004.jpg,5.746,4.791,19,03/10/2022,16:35 h,95.0154,PIURA,PIURA,ALIANZA PARA EL PROGRESO,EDWARD ALEXANDER ZARATE ANTON
142,2,PARTIDO DEMOCRATICO SOMOS PERU,,100.0,"4,613","4,613","87,990",00000002.jpg,9.887,8.245,19,03/10/2022,16:35 h,95.0154,PIURA,PIURA,PARTIDO DEMOCRATICO SOMOS PERU,LUIS REYMUNDO DIOSES GUZMAN
143,95,MOVIMIENTO INDEPENDIENTE FUERZA REGIONAL,,100.0,"4,613","4,613","98,762",00000095.jpg,11.098,9.254,19,03/10/2022,16:35 h,95.0154,PIURA,PIURA,MOVIMIENTO INDEPENDIENTE FUERZA REGIONAL,MARIO JAVIER QUISPE SUAREZ
144,97,REGION PARA TODOS,,100.0,"4,613","4,613","146,812",00000097.jpg,16.497,13.756,19,03/10/2022,16:35 h,95.0154,PIURA,PIURA,REGION PARA TODOS,SANTIAGO ENRIQUE PAZ LOPEZ
145,96,CONTIGO REGION,,100.0,"4,613","4,613","160,431",00000096.jpg,18.028,15.032,19,03/10/2022,16:35 h,95.0154,PIURA,PIURA,CONTIGO REGION,LUIS ERNESTO NEYRA LEON
146,98,ORGANIZACION POLITICA UNIDAD REGIONAL,,100.0,"4,613","4,613","219,527",00000098.jpg,24.668,20.569,19,03/10/2022,16:35 h,95.0154,PIURA,PIURA,ORGANIZACION POLITICA UNIDAD REGIONAL,REYNALDO ADOLFO HILBCK GUZMAN
147,4,ALIANZA PARA EL PROGRESO,,100.0,"3,128","3,128","10,753",00000004.jpg,1.76,1.43,20,03/10/2022,16:35 h,96.9622,PUNO,PUNO,ALIANZA PARA EL PROGRESO,IRENE CARCAUSTO HUANCA
148,11,PARTIDO FRENTE DE LA ESPERANZA 2021,,100.0,"3,128","3,128","18,973",00000011.jpg,3.106,2.524,20,03/10/2022,16:35 h,96.9622,PUNO,PUNO,PARTIDO FRENTE DE LA ESPERANZA 2021,FERNANDO SALAS TAPIA
149,8,PARTIDO POLITICO NACIONAL PERU LIBRE,,100.0,"3,128","3,128","31,884",00000008.jpg,5.219,4.242,20,03/10/2022,16:35 h,96.9622,PUNO,PUNO,PARTIDO POLITICO NACIONAL PERU LIBRE,JULIO ADOLFO IRURI DAVILA
150,100,FRENTE AMPLIO PARA EL DESARROLLO DEL PUEBLO,,100.0,"3,128","3,128","44,852",00000100.jpg,7.342,5.967,20,03/10/2022,16:35 h,96.9622,PUNO,PUNO,FRENTE AMPLIO PARA EL DESARROLLO DEL PUEBLO,EDGAR HUGO SUPO TIPULA
151,107,GESTIONANDO OBRAS Y OPORTUNIDADES CON LIDERAZGO,,100.0,"3,128","3,128","46,903",00000107.jpg,7.678,6.24,20,03/10/2022,16:35 h,96.9622,PUNO,PUNO,GESTIONANDO OBRAS Y OPORTUNIDADES CON LIDERAZGO,HUGO RAUL TAPARA SAYA
152,104,SOMOS PUEBLO,,100.0,"3,128","3,128","54,944",00000104.jpg,8.994,7.309,20,03/10/2022,16:35 h,96.9622,PUNO,PUNO,SOMOS PUEBLO,WILBER CUTIPA ALEJO
153,103,MORAL Y DESARROLLO,,100.0,"3,128","3,128","88,499",00000103.jpg,14.487,11.773,20,03/10/2022,16:35 h,96.9622,PUNO,PUNO,MORAL Y DESARROLLO,HUGO CESAR QUINTO HUAMAN
154,102,MOVIMIENTO DE INTEGRACION Y REVOLUCION ANDINA,,100.0,"3,128","3,128","108,061",00000102.jpg,17.689,14.375,20,03/10/2022,16:35 h,96.9622,PUNO,PUNO,MOVIMIENTO DE INTEGRACION Y REVOLUCION ANDINA,JHOMAR MARCELINO TONCONI QUISPE
155,105,REFORMA Y HONRADEZ POR MAS OBRAS,,100.0,"3,128","3,128","206,017",00000105.jpg,33.724,27.407,20,03/10/2022,16:35 h,96.9622,PUNO,PUNO,REFORMA Y HONRADEZ POR MAS OBRAS,RICHARD HANCCO SONCCO
156,6,FUERZA POPULAR,,100.0,"2,222","2,222","3,991",00000006.jpg,0.967,0.81,21,03/10/2022,16:35 h,97.0306,SAN MARTÍN,SAN MARTÍN,FUERZA POPULAR,ALIBE CARDENAS RIOS
157,111,NUEVA AMAZONIA,,100.0,"2,222","2,222","11,034",00000111.jpg,2.673,2.239,21,03/10/2022,16:35 h,97.0306,SAN MARTÍN,SAN MARTÍN,NUEVA AMAZONIA,CARLOS JOB GOMEZ TORRES
158,1,ACCION POPULAR,,100.0,"2,222","2,222","32,811",00000001.jpg,7.947,6.657,21,03/10/2022,16:35 h,97.0306,SAN MARTÍN,SAN MARTÍN,ACCION POPULAR,TEDY DEL AGUILA GRONERTH
159,112,UNION REGIONAL,,100.0,"2,222","2,222","39,694",00000112.jpg,9.614,8.054,21,03/10/2022,16:35 h,97.0306,SAN MARTÍN,SAN MARTÍN,UNION REGIONAL,VICTOR HUGO DIAZ MEJIA
160,4,ALIANZA PARA EL PROGRESO,,100.0,"2,222","2,222","69,196",00000004.jpg,16.76,14.04,21,03/10/2022,16:35 h,97.0306,SAN MARTÍN,SAN MARTÍN,ALIANZA PARA EL PROGRESO,JORGE PANDURO RUIZ
161,7,AVANZA PAIS - PARTIDO DE INTEGRACION SOCIAL,,100.0,"2,222","2,222","87,061",00000007.jpg,21.087,17.664,21,03/10/2022,16:35 h,97.0306,SAN MARTÍN,SAN MARTÍN,AVANZA PAIS - PARTIDO DE INTEGRACION SOCIAL,MAXIMO OSCAR CABRERA CABRERA
162,2,PARTIDO DEMOCRATICO SOMOS PERU,,100.0,"2,222","2,222","169,076",00000002.jpg,40.952,34.305,21,03/10/2022,16:35 h,97.0306,SAN MARTÍN,SAN MARTÍN,PARTIDO DEMOCRATICO SOMOS PERU,WALTER GRUNDEL JIMENEZ
163,4,ALIANZA PARA EL PROGRESO,,100.0,954,954,"1,501",00000004.jpg,0.768,0.656,22,03/10/2022,16:35 h,97.9466,TACNA,TACNA,ALIANZA PARA EL PROGRESO,RUTH QUISPE APAZA
164,2,PARTIDO DEMOCRATICO SOMOS PERU,,100.0,954,954,"2,228",00000002.jpg,1.141,0.973,22,03/10/2022,16:35 h,97.9466,TACNA,TACNA,PARTIDO DEMOCRATICO SOMOS PERU,NORMA GEOVANA ANCHAPURI ADUVIRI
165,3,RENOVACION POPULAR,,100.0,954,954,"2,251",00000003.jpg,1.152,0.983,22,03/10/2022,16:35 h,97.9466,TACNA,TACNA,RENOVACION POPULAR,CARMEN JULIA RIVERA GUTIERREZ
166,118,IGUALDAD NACIONAL CRISTIANA AUTONOMA - INCA,,100.0,954,954,"2,636",00000118.jpg,1.35,1.152,22,03/10/2022,16:35 h,97.9466,TACNA,TACNA,IGUALDAD NACIONAL CRISTIANA AUTONOMA - INCA,WILLY MARCA LAYME
167,11,PARTIDO FRENTE DE LA ESPERANZA 2021,,100.0,954,954,"2,877",00000011.jpg,1.473,1.257,22,03/10/2022,16:35 h,97.9466,TACNA,TACNA,PARTIDO FRENTE DE LA ESPERANZA 2021,SONIA MATILDE HUAYLLA MARCOS
168,9,PODEMOS PERU,,100.0,954,954,"2,986",00000009.jpg,1.529,1.304,22,03/10/2022,16:35 h,97.9466,TACNA,TACNA,PODEMOS PERU,MILCA ROSARIO VASQUEZ MAMANI
169,8,PARTIDO POLITICO NACIONAL PERU LIBRE,,100.0,954,954,"4,961",00000008.jpg,2.54,2.167,22,03/10/2022,16:35 h,97.9466,TACNA,TACNA,PARTIDO POLITICO NACIONAL PERU LIBRE,HENRY EFRAIN GONZALES MAMANI
170,114,NUEVA ESPERANZA,,100.0,954,954,"17,298",00000114.jpg,8.856,7.557,22,03/10/2022,16:35 h,97.9466,TACNA,TACNA,NUEVA ESPERANZA,DAYAN WILSON JIMENEZ SALAS
171,116,FRENTE ESPERANZA POR TACNA,,100.0,954,954,"27,070",00000116.jpg,13.859,11.826,22,03/10/2022,16:35 h,97.9466,TACNA,TACNA,FRENTE ESPERANZA POR TACNA,MARCO ALVARO LIMACHI ALANOCA
172,113,BANDERAS TACNEÑISTAS,,100.0,954,954,"31,006",00000113.jpg,15.874,13.545,22,03/10/2022,16:35 h,97.9466,TACNA,TACNA,BANDERAS TACNEÑISTAS,FERNANDO PABLO MARTORELL SOBERO
173,119,SIEMPRE TACNA,,100.0,954,954,"40,715",00000119.jpg,20.845,17.787,22,03/10/2022,16:35 h,97.9466,TACNA,TACNA,SIEMPRE TACNA,SEGUNDO MARIO RUIZ RUBIO
174,115,MOVIMIENTO INDEPENDIENTE REGIONAL FUERZA TACNA,,100.0,954,954,"59,797",00000115.jpg,30.614,26.123,22,03/10/2022,16:35 h,97.9466,TACNA,TACNA,MOVIMIENTO INDEPENDIENTE REGIONAL FUERZA TACNA,LUIS RAMON TORRES ROBLEDO
175,2,PARTIDO DEMOCRATICO SOMOS PERU,,100.0,568,568,"2,797",00000002.jpg,2.965,2.091,23,03/10/2022,16:35 h,97.4271,TUMBES,TUMBES,PARTIDO DEMOCRATICO SOMOS PERU,CINTHIA TERESITA DIOS TINOCO
176,11,PARTIDO FRENTE DE LA ESPERANZA 2021,,100.0,568,568,"3,514",00000011.jpg,3.725,2.627,23,03/10/2022,16:35 h,97.4271,TUMBES,TUMBES,PARTIDO FRENTE DE LA ESPERANZA 2021,HILDA ANTONIETA CRESPO ARIAS
177,124,"UNIDAD, EXPERIENCIA Y TRABAJO CON ETICA",,100.0,568,568,"6,221",00000124.jpg,6.594,4.651,23,03/10/2022,16:35 h,97.4271,TUMBES,TUMBES,"UNIDAD, EXPERIENCIA Y TRABAJO CON ETICA",ELVIS ERKMAN MENDOZA AGUILAR
178,8,PARTIDO POLITICO NACIONAL PERU LIBRE,,100.0,568,568,"7,568",00000008.jpg,8.021,5.659,23,03/10/2022,16:35 h,97.4271,TUMBES,TUMBES,PARTIDO POLITICO NACIONAL PERU LIBRE,NATALIA NATALI JIMENEZ VELASQUEZ
179,6,FUERZA POPULAR,,100.0,568,568,"8,430",00000006.jpg,8.935,6.303,23,03/10/2022,16:35 h,97.4271,TUMBES,TUMBES,FUERZA POPULAR,JUAN CARLO YUYES MEZA
180,123,RENOVACION TUMBESINA,,100.0,568,568,"14,330",00000123.jpg,15.189,10.715,23,03/10/2022,16:35 h,97.4271,TUMBES,TUMBES,RENOVACION TUMBESINA,CARLOS MANUEL ROLANDO FEIJOO RUIZ
181,125,MOVIMIENTO POLITICO REGIONAL DIGNIDAD TUMBESINA,,100.0,568,568,"20,522",00000125.jpg,21.752,15.344,23,03/10/2022,16:35 h,97.4271,TUMBES,TUMBES,MOVIMIENTO POLITICO REGIONAL DIGNIDAD TUMBESINA,CARMEN ROSA VILLALOBOS GALLARDO
182,4,ALIANZA PARA EL PROGRESO,,100.0,568,568,"30,965",00000004.jpg,32.82,23.153,23,03/10/2022,16:35 h,97.4271,TUMBES,TUMBES,ALIANZA PARA EL PROGRESO,SEGISMUNDO CRUCES ORDINOLA
183,44,SI SE PUEDE CALLAO,,100.0,"2,634","2,634","9,955",00000044.jpg,2.047,1.619,24,03/10/2022,16:35 h,94.9189,CALLAO,CALLAO,SI SE PUEDE CALLAO,JOHN ISRAEL LEON CALIXTO
184,10,PARTIDO MORADO,,100.0,"2,634","2,634","10,660",00000010.jpg,2.191,1.734,24,03/10/2022,16:35 h,94.9189,CALLAO,CALLAO,PARTIDO MORADO,MIGUEL ANGEL GONZALES SANTOS
185,41,FUERZA CALLAO SEGURO,,100.0,"2,634","2,634","12,742",00000041.jpg,2.619,2.072,24,03/10/2022,16:35 h,94.9189,CALLAO,CALLAO,FUERZA CALLAO SEGURO,RICARDO ELOY BARRENECHEA MATURRANO
186,42,MOVIMIENTO REGIONAL VIVA EL CALLAO,,100.0,"2,634","2,634","14,628",00000042.jpg,3.007,2.379,24,03/10/2022,16:35 h,94.9189,CALLAO,CALLAO,MOVIMIENTO REGIONAL VIVA EL CALLAO,RICHARD POLL ANTON CARRILLO
187,45,POR TI CALLAO,,100.0,"2,634","2,634","16,671",00000045.jpg,3.427,2.711,24,03/10/2022,16:35 h,94.9189,CALLAO,CALLAO,POR TI CALLAO,MIGUEL ALFREDO MONTEVERDE GOSDINSKI
188,6,FUERZA POPULAR,,100.0,"2,634","2,634","21,151",00000006.jpg,4.348,3.44,24,03/10/2022,16:35 h,94.9189,CALLAO,CALLAO,FUERZA POPULAR,MARIA DEL PILAR SUAREZ NOLE
189,9,PODEMOS PERU,,100.0,"2,634","2,634","23,355",00000009.jpg,4.801,3.798,24,03/10/2022,16:35 h,94.9189,CALLAO,CALLAO,PODEMOS PERU,KAREN ELIZABETH RIVERA HUAMAN
190,3,RENOVACION POPULAR,,100.0,"2,634","2,634","27,133",00000003.jpg,5.578,4.413,24,03/10/2022,16:35 h,94.9189,CALLAO,CALLAO,RENOVACION POPULAR,BRUNO ALEXIS MENDOZA LEON
191,11,PARTIDO FRENTE DE LA ESPERANZA 2021,,100.0,"2,634","2,634","28,618",00000011.jpg,5.883,4.654,24,03/10/2022,16:35 h,94.9189,CALLAO,CALLAO,PARTIDO FRENTE DE LA ESPERANZA 2021,LUZ DEL CARMEN BAZALAR MIRANDA
192,2,PARTIDO DEMOCRATICO SOMOS PERU,,100.0,"2,634","2,634","32,067",00000002.jpg,6.592,5.215,24,03/10/2022,16:35 h,94.9189,CALLAO,CALLAO,PARTIDO DEMOCRATICO SOMOS PERU,EUGENIO ANGEL CORDOVA RODRIGUEZ
193,7,AVANZA PAIS - PARTIDO DE INTEGRACION SOCIAL,,100.0,"2,634","2,634","33,073",00000007.jpg,6.799,5.379,24,03/10/2022,16:35 h,94.9189,CALLAO,CALLAO,AVANZA PAIS - PARTIDO DE INTEGRACION SOCIAL,CLUBER FERNANDO ALIAGA LODTMANN
194,40,MOVIMIENTO REGIONAL MAS CALLAO,,100.0,"2,634","2,634","118,050",00000040.jpg,24.268,19.198,24,03/10/2022,16:35 h,94.9189,CALLAO,CALLAO,MOVIMIENTO REGIONAL MAS CALLAO,CIRO RONALD CASTILLO ROJO SALAS
195,43,CONTIGO CALLAO,,100.0,"2,634","2,634","138,337",00000043.jpg,28.439,22.498,24,03/10/2022,16:35 h,94.9189,CALLAO,CALLAO,CONTIGO CALLAO,MIGUEL FRANCISCO CORDANO RODRIGUEZ
196,4,ALIANZA PARA EL PROGRESO,,100.0,"1,232","1,232","5,461",00000004.jpg,3.141,2.126,25,03/10/2022,16:35 h,89.2754,UCAYALI,UCAYALI,ALIANZA PARA EL PROGRESO,DORIS MERCEDES MENDOZA FABABA
197,2,PARTIDO DEMOCRATICO SOMOS PERU,,100.0,"1,232","1,232","7,672",00000002.jpg,4.413,2.987,25,03/10/2022,16:35 h,89.2754,UCAYALI,UCAYALI,PARTIDO DEMOCRATICO SOMOS PERU,ELVA REATEGUI DAVILA
198,11,PARTIDO FRENTE DE LA ESPERANZA 2021,,100.0,"1,232","1,232","11,220",00000011.jpg,6.454,4.368,25,03/10/2022,16:35 h,89.2754,UCAYALI,UCAYALI,PARTIDO FRENTE DE LA ESPERANZA 2021,ZENAYDA EMILIA ESTRADA TUESTA
199,7,AVANZA PAIS - PARTIDO DE INTEGRACION SOCIAL,,100.0,"1,232","1,232","14,796",00000007.jpg,8.51,5.76,25,03/10/2022,16:35 h,89.2754,UCAYALI,UCAYALI,AVANZA PAIS - PARTIDO DE INTEGRACION SOCIAL,BROOKE DEL PILAR ROMERO MACEDO
200,8,PARTIDO POLITICO NACIONAL PERU LIBRE,,100.0,"1,232","1,232","28,543",00000008.jpg,16.417,11.111,25,03/10/2022,16:35 h,89.2754,UCAYALI,UCAYALI,PARTIDO POLITICO NACIONAL PERU LIBRE,ABEL VASQUEZ PANDURO
201,1,ACCION POPULAR,,100.0,"1,232","1,232","41,173",00000001.jpg,23.682,16.028,25,03/10/2022,16:35 h,89.2754,UCAYALI,UCAYALI,ACCION POPULAR,CELIA ISABEL PRADO SEIJAS
202,129,MOVIMIENTO INDEPENDIENTE REGIONAL CAMBIO UCAYALINO,,100.0,"1,232","1,232","64,993",00000129.jpg,37.383,25.3,25,03/10/2022,16:35 h,89.2754,UCAYALI,UCAYALI,MOVIMIENTO INDEPENDIENTE REGIONAL CAMBIO UCAYALINO,MANUEL GAMBINI RUPAY
